,title_pos,content_pos,hash_tag
198,이수역 백숙 맛집 가원 닭볶음탕 진짜 회식 밥집,사당동 백숙 맛집 가원 닭도리탕 밥집 햄찌 블로그 이수역 홍어 백숙 보쌈 맛집 가원 사당동 홍어 맛집 가원 백숙 육전 맛집 햄찌 오늘 친구 닭도리탕 이수역 골목 가원 사당동 이수역 출구 근처 회식 장소 점심식사 한식 밥집 주로 홍어 보쌈 백숙 육전 전골 해신 저녁 술안주 먹기 메뉴 이수역 회식 장소 점심식사 가원 평일 저녁 회식 테이블 몇개 가게 편이 단체 모임 이내 회식 점심 식사 오기 크기 매장 신발 입장 식당 참고 가원 닭볶음탕 요리 백숙 요리 미리 예약 둘이서 먹기 닭볶음탕 주문 닭볶음탕 조리 닭볶음탕 반찬 먼저 콩나물 도라지 볶음 오이 진짜 이수역 백숙 맛집 가원 회식 밥집 재생 접기 이수역 백숙 맛집 가원 회식 밥집 이수역 닭도리탕 맛집 가원 회식 장소 가족 한식 한식 반찬 콩나물 오이 도라지 볶음 기본 반찬 완전 닭볶음탕 싹싹 사장 반찬 계속 리필 살이 오른 닭도리탕 맛집 세상 닭볶음탕 국물 닭고기 감자 양파 생각 국물 감칠맛 마지막 볶음밥 최고 이수역 닭도리탕 맛집 가원 요리 개인 당근 닭도리탕 당근 닭고기 진짜 존맛 국물 술안주 완전 국물 닭다리 닭고기 자체 정말 먹기 저녁 친구 마시기 백숙 예약 친구 홍어 보쌈 다시 도전 이수 원조 서울특별시 동작구 동작대로 블로그 체크 장소 주소 서울 동작구 동작대로 예약 전화 영업 매일,
199,사당 맛집 사당동 홍어 백숙 맛집 가원,가게 정보 영업 월일 오후 저녁 정기 휴무 전화번호 특이 사항 사당동 홍어 맛집 사당동 백숙 맛집 이수역 홍어 맛집 이수역 백숙 맛집 이수역밥집 위치 서울 동작구 동작대로 이수 원조 서울특별시 동작구 동작대로 블로그 체크 장소 원래 막걸리 파전 홍어삼합 최고 오전 날씨 막걸리 홍어삼합 저녁 식사 장소 총신대입구역 이수역 출구 이수 원조 위치 간판 찾기 실내 생각 마루 바닥 스타일 신발 저녁 손님 역시 맛집 인정 메뉴 주로 보신 요리 차지 해신 오리 옻닭 홍어삼합 보쌈 닭볶음탕 불고기 전골 낙지 볶음 광주 육전 땡초 홍어 해물 김치전 골뱅이 소면 해물파전 감자전 두부김치 콩나물 황태 조개 메인 요리 이구 잔치국수 해물 순두부 차돌 된장 뚝배기 불고기 보쌈 정식 고기 김치찌개 점심 메뉴 홍어삼합 막걸리 주문 사실 광주 육전 땡초 홍어 전과 고민 오리 홍어삼합 먼저 고고싱 막걸리 먼저 밑반찬 반찬 직접 보쌈 마자 살짝 홍어 묵음 김치 와우 빛깔 미역국 소스 마늘 고추 마늘 고추 대한민국 고기 필수 홍어삼합 어벤져 상이 완성 막걸리 환상 조합 이제 삼겹살 홍어 묵은지 김치 정말 퀄리티 삼겹살 홍어 별도 정도 수준 정말 흥분 묵은지 묵혔다 정말 최고 김치찌개 대박 묵은지 보쌈 홍어 마늘 패키지 한번 상상 홍어 고기 묵은지 최고 조합 산전수전 순간 위로 홍어삼합 막걸리 정말 최고 대한민국 최고 음식 궁합 홍어삼합 막걸리 홍어삼합 재생 홍어삼합 홍어삼합 기본 고기 홍어 묵은지 내공 기본 반찬 요리 정말 정말 이집 테이블 백숙 해물파전 전등 정말 다시 종류 음식 한번 도전 사당동 홍어 맛집 사당동 백숙 맛집 이수역 홍어 맛집 이수역 백숙 맛집 이수역밥집 해신 오리 옻닭 홍어삼합 보쌈 닭볶음탕 불고기 전골 낙지 볶음 광주 육전 땡초 홍어 해물 김치전 골뱅이 소면 해물파전 감자전 두부김치 콩나물 황태 조개,사당동 사당동 이수역 이수역 이수역밥집 해신탕 옻오리 홍어삼합 보쌈 닭볶음탕 소불고기전골 낙지볶음 광주육전 땡초홍어전 해물김치전 골뱅이소면 해물파전 감자전 두부김치 콩나물황태탕 조개탕
200,이수역밥집 보쌈 해물 순두부 이수 원조,이수역밥집 보쌈 해물 순두부 이수 원조 비올 한식 이수역밥집 가원 방문 후기 계단 타고 가원 이미지 입구 슬리퍼 마련 신고 입장 우측 화장실 마련 외부 와이파이 와이파이 이수역밥집 최고 장안 동네 맛집 느낌 물씬 자리 여유 메뉴 본격 주문 보쌈 해물 순두부 주문 밑반찬 주문 밑반찬 초장 브로콜리 오이 시작 가지 볶음 소스류 가원 밑반찬 묵은지 말랭이 콩나물국 진짜 밑반찬 구성 깜짝 보쌈 준비 완료 비계 살코기 비율 진짜 황금비율 가원 생각 콩나물국 진짜 사장 서비스 말랭이 보쌈 아래 부추 보쌈 묵은지 고민 순간 고민 는걸 해물 순두부 조개 호박 야채 순두부 먹기 묵은지 강조 진짜 밑반찬 메인 메뉴 간의 조합 진짜 조화 이수역 와이파이 메뉴 밥집 술집 가원 방문 이수 원조 서울 동작구 동작대로 영업 매일 연락처 이수 원조 서울특별시 동작구 동작대로 블로그 체크 장소 건대 이색 분위기 가성 술집 건대 성비 술집 이색 분위기 정글 포차 건대 성비 술집 이색 분위기 정글 포차 저녁 안주 맛집 방문,
201,이수역 홍어 맛집 이수 원조 홍어 초보자 홍어삼합,초보자 이수역 홍어삼합 맛집 가격 합리 이수 술집 추천 홍어 남자친구 홍어 매우 홍어 노래 위해 방문 이수역 홍어 맛집 이수 원조 서울특별시 동작구 동작대로 블로그 체크 장소 위치 정보 이수역 출구 골목 도보 카카오 검색 이수 검색 동작대로 영업 정보 매일 오후 오후 사당동 홍어 맛집 건물 위치 신발 슬리퍼 신고 예전 맛집 감성 그대로 실제 가득 이수역 맛집 메인 요리 홍어 옻닭 홍어삼합 옻닭 오리 광주 육전 점심 메뉴 판매 잔치국수 해물 순두부 고기 김치찌개 인기 메뉴 저녁 점심 메뉴 순두부찌개 고기 김치찌개 홍어삼합 사이즈 주문 불구 생각 수육 장수 막걸리 추가 홍어 막걸리 찰떡 궁합 수육 상태 식지 계속 요리 주문 한지 수육 때깔 살코기 비계 부분 수육 나름 까탈레나 고기 비계 물컹 수육 쌈장 홍어 사이즈 이서 홍어 생각 음식 수육 홍어 묵은지 가성 비도 이수역 홍어 맛집 밑반찬 브로콜리 오이소박이 으른 입맛 밑반찬 대거 출격 사장 마늘 직접 국내 산이 홍어 홍어 묵은지 마늘 입속 다이브 쌈장 고추장 소스 홍어 초보자 이유 홍어 냄새 때문 보통 이유 사람 사당동 홍어 맛집 오도독 홍어 홍어 묵은지 추가 묵은지 추가 갓김치 주신 사장 묵은지 그냥 도둑 뚝딱 김치찌개 김치 주문 고기 김치찌개 기도 김치 김치찌개 자극 계속 김치 정말 고기 두부 회사 근처 자주 김치찌개 실제 이수역 홍어 백숙 옻닭 사당동 맛집 예약 분도 홍어삼합 막걸리 조합 이수 원조,
202,서울 이수 이수역 홍어 맛집 가원 보쌈 감자전 막걸리 생생 후기 동네 맛집 발견,오늘 막걸리 절로 막걸리 보쌈 감자전 오늘 포스팅 이수역 홍어 맛집 가원 소개 주소 서울 동작구 동작대로 이수 원조 서울특별시 동작구 동작대로 블로그 체크 장소 월일 번호 이수역 홍어 맛집 가원 이수역 출구 도보 소요 치킨 삼계탕 잔치국수 김치찌개 된장찌개 점심 메뉴 손맛 가원 간판 홍어 보쌈 메인 메뉴 가원 신발 정겨운 바이브 테이블 정도 이수역 홍어 맛집 가원 메뉴판 해신 오리 옻닭 홍어삼합 보쌈 메인 메뉴 홍어삼합 기회 보쌈 장수 막걸리 주문 밑반찬 클라스 도라지 콩나물국 콩나물 브로콜리 시작 수가 두둥 메인 메뉴 보쌈 등장 두께 양도 식지 고기 퍽퍽 새우젓 쌈장 기본 개인 이집 생각 묵은지 사장 피셜 묵은지 보쌈 뭔가 다시 메뉴판 기웃거렸 사장 추천 감자전 인생 감자전 주문 두께 겉바 제대로 감자전 정도 감자전 막걸리 자연 추가 묵은지 추가 비용 발생 참고 이수역 근처 손맛 맛집 식사 가원 추천 사당동 홍어 맛집 사당동 백숙 맛집 이수역 홍어 맛집 이수역 백숙 맛집 이수역밥집 맛집 추천 보쌈 맛집,사당동홍어맛집 사당동백숙맛집 이수역홍어맛집 이수역백숙맛집 이수역밥집 이수맛집추천 이수보쌈맛집
203,이수역 홍어 맛집 초보자 도전 홍어삼합 가원,이수 원조 총신대 입구 이수역 출구 서울 동작구 동작대로 매일 가게 주차 불가 남성 계시 주차장 매장 도보 예약 단체 이용 가능 포장 오늘 사당동 홍어 맛집 이자 한식 전문점 홍어삼합 오리 백숙 맛집 이수 원조 소개 가원 호선 총신대입구역 호선 이수역 위치 출구 도보 거리 대중교통 이용 근처 도보 거리 남성 계시 주차장 주차 매장 계단 정말 한식 전문점 느낌 물씬 할머니 느낌 매장 생각 단체 오기 사람 나이 중후 대부분 대표 메뉴인 홍어삼합 요즘 사람 먹기 요리 때문 언니 전라도 집안 명절 홍어 때문 환경 홍어 정말 서울 홍어 찾기 근처 홍어 맛집 이수역 백숙 맛집 홍어 백숙 추천 홍어 효능 언니 나나 지금 다이어트 홍어 다이어트 식품 위장 홍어 사람 반찬 아주 정겨운 버섯 볶음 부추 멸치 볶음 공기밥 추가 완전 도둑 워터파크 가야 정제 탄수화물 이수역 홍어 맛집 재생 이수역 홍어 맛집 언니 금방 홍어삼합 홍어 홍어 제일 묵은지 사장 묵은지 김치 묵은지 군침 갓김치 주르 르륵 홍어 나름 냄새 먹기 완전 홍어 가까이 가기 정도 냄새 가원 감안 초장 새우젓 홍어삼합 처음 사람 홍어 초장 듬뿍 나름 수육 수증기 언니 얘기 고기 식지 묵은지 초장 듬뿍 홍어 수육 아래 부추 존맛탱 홍어 성인 가끔 홍어 홍어 나름 김치 이수역 홍어 맛집 가원 추천 이수 원조 서울특별시 동작구 동작대로 블로그 체크 장소,
204,막걸리 사당동 백숙 맛집 이수역 홍어 맛집 이수 원조,이수역 홍어 맛집 이수역 백숙 맛집 이수역 밥집 이수 원조 서울 동작구 동작대로 예약 단체 이용 가능 포장 매일 오후 오픈 저녁 이수 원조 이수역 출구 다이소 골목 한번 골목 치킨 건물 이수역 홍어 맛집 이수역 백숙 맛집 이수역 밥집 이수 처음 홍어 맛집 홍어 냄새 살짝 걱정 내부 장소 회식 소로 가족 모임 친구 모임 모임 장소 이수 원조 메뉴판 계절 메뉴 생굴 전도 과메기 집밥 점심 홍어 홍어삼합 자리 적지 막걸리 미역국 한식 밑반찬 차림 밑반찬 이모 솜씨 홍어삼합 보쌈 포함 정말 홍어 보쌈 김치 홍어 보쌈 저절로 이모 막걸리 소리 오늘 다시 한번 가야 막걸리 막걸리 간만 장수 막걸리 만인 오늘 치얼스 달링 홍어 진짜 홍어 비기너 묵은지 매력 리필 주문 묵은지 추가 보쌈 보쌈김치 보쌈 묵은지 이수 원조 진국 모든 음식 진짜 김치 이수 원조 오리 옻닭 워낙 홍어 매력 생각 홍어 오늘 홍어 홍어 맛집 가로 막걸리 사당동 백숙 맛집 이수역 홍어 맛집 이수 원조 재생 접기 막걸리 사당동 백숙 맛집 이수역 홍어 맛집 이수 원조 사당동 홍어 맛집 사당동 백숙 맛집 이수역 홍어 맛집 이수역 백숙 맛집 이수역밥집,사당동홍어맛집 사당동백숙맛집 이수역홍어맛집 이수역백숙맛집 이수역밥집
205,서울 이수 홍어 초심자 사당동 홍어 맛집 이수 원조 홍어삼합,길거리 사우나 요즘 날씨 입맛 홍어삼합 외관 이수역 골목 위치 이수 원조 이수역 홍어 맛집 치킨 건물 위치 전라도 음식 광주 육전 판매 보장 느낌 기대 이수 원조 서울특별시 동작구 동작대로 블로그 체크 장소 영업 매일 위치 서울 동작구 동작대로 전화번호 내부 계단 가게 가정 분위기 시작 우측 화장실 식사 도중 화장실 이용 신발 실내 화로 신고 신고 신발 신발장 살포시 보관 통창 훤히 내부 좌석 단체 모임 회식 가게 분위기 원산지 앞치마 사용 메뉴 해신 홍어삼합 광주 육전 능이 백숙 녹두 삼계탕 음식 메뉴판 요즘 입맛 이수 원조 메뉴판 거나 금세 기력 홍어 효능 맛집 국룰 음식 주문 금세 음식 밑반찬 그냥 소리 정말 오이소박이 양념 최고 사진 순서 정말 다발 음식 덕분 흐름 주문 음식 홍어삼합 수육 등장 불판 수육 유지 고기 살이 영산포 홍어 갓김치 홍어삼합 묵은지 묵은지 직접 무려 양념 상태 간직 정말 서울 이수 홍어 초심자 사당동 홍어 맛집 이수 원조 재생 접기 서울 이수 홍어 초심자 사당동 홍어 맛집 이수 원조 음식 플레이 정말 보이지 보이 내용물 홍어삼합 메인 역시 홍어 수육 묵은지 홍어 초심자 입맛 홍어 이수역 홍어 맛집 이유 가지 콜라 홍어삼합 중간 중간 콜라 수육 새우젓 먹기 쪽파 마늘쫑 중간 중간 식감 홍어 초장 먹기 살이 쫀득 홍어 수육 묵은지 음식 이수 원조 이수역 홍어 맛집 얘기 영양 보충 메뉴 올여름 가기 다시 음식 보고,
206,이수역 밥집 홍어 백숙 맛집 가원,이수역 밥집 홍어 백숙 맛집 가원 이수 원조 서울특별시 동작구 동작대로 블로그 체크 장소 가원 서울특별시 동작구 동작대로 자주 이수역 방문 보신 홍어 백숙 이수역 밥집 가원 이수역 맛집 밥집 정말 사당 바리 이수역 매일 산책 추억 헛소리 쿄쿄 이수역 밥집 가원 내부 사진 내부 형태 내부 모임 장소 회식 장소 주말 여럿 모임 이수역 밥집 가원 메뉴판 안주 메뉴 해신 오리 옻닭 홍어삼합 보쌈 닭볶음탕 불고기 전골 낙지 볶음 광주 육전 땡초 홍어 해물 김치전 골뱅이 소면 해물파전 감자전 두부김치 콩나물 황태 조개 점심 메뉴 잔치국수 해물 순두부 차돌 된장 뚝배기 불고기 뚝배기 보쌈 정식 고기 김치찌개 이수역 가원 음식 홍어삼합 백숙 육전 포스팅 보이 닭도리탕 요리 특별 보양식 능이 백숙 홍어 녹두 삼계탕 먹기 삼계탕 판매 중이 혼술 혼밥 테라스 야장 느낌 통창 분위기 나름 이수역 가원 노포 느낌 술집 밥집 랍니 매장 신발 하니 양말 빵구 쿄쿄 기본 반찬 광주 육전 가격 사실 백숙 홍어삼합 날씨 음식 매운 음식 보신 음식 광주 육전 소고기 보신 음식 헤헤 육전 깻잎 더욱 헤헤 소주 음식 반주 필수 콩나물국 나중 육전 사진 반찬 츄릅 사진 육전 생각 간술 마무리 이수역밥집 이수역 이수 원조 가원 사당동 홍어 맛집 사당동 백숙 맛집 이수역 홍어 맛집 이수역 백숙 맛집,이수역밥집 이수역이수가원조 이수가원조 사당동홍어맛집 사당동백숙맛집 이수역홍어맛집 이수역백숙맛집 뿅
207,이수역밥집 이수 원조 불고기 전골 후기,사당동 홍어 맛집 사당동 백숙 맛집 이수역 홍어 맛집 이수역 백숙 맛집 이수역밥집 오늘 이수역밥집 수가 사당동 홍어 맛집 사당동 백숙 맛집 위치 이수 원조 서울특별시 동작구 동작대로 블로그 체크 장소 주소 서울특별시 동작구 동작대로 영업 매일 전화번호 이수역밥집 이수 원조 외관 이수 위치 이수역 출구 도보 수가 명칭 이수역 검색 이수 원조 치면 이수역밥집 이수 원조 내부 내부 느낌 신발 구조 신발 슬리퍼 신고 생각 자리 오기 아저씨 진짜 동네 맛집 아시 나름 단골 손님 메뉴 이수역밥집 이수 원조 메뉴 메뉴판 이수 원조 원래 사당동 홍어 맛집 백숙 맛집 홍어 한번 본적 용기 도전 원래 맛집 첫경험 한번 오늘 불고기 낙지 전골 주문 이수역밥집 이수 원조 메뉴 원래 닭볶음탕 주문 불고기 골로 주문 사장 추천 메뉴 광주 전이 식사 메뉴 주문 이수역밥집 이수 원조 밑반찬 사실 밑반찬 맛집 자반 콩나물 야채 먹음 비주 공기 뚝딱 느낌 포함 공기밥 주문 메인 반찬 한번 사장 손맛 불고기 전골 이수역밥집 이수 원조 불고기 전골 불고기 당면 버섯 야채 듬뿍 당면 이수역밥집 이수 원조 불고기 전골 야채 국물 느낌 불고기 전골 뚝배기 불고기 전골 느낌 국물 먹기 이수역밥집 이수 원조 불고기 전골 당면 당면 간이 고기 버섯 야채 집밥 느낌 오늘 저녁 거지 한잔 술안주 메뉴 이수 오늘 이수역밥집 가원 재생 접기 불고기 전골 맛집 이수역밥집 이수역맛집 이수 한번 방문,사당동홍어맛집 사당동백숙맛집 이수역홍어맛집 이수역백숙맛집 이수역밥집
208,이수역 홍어 맛집 이수 원조,위치 서울 동작구 동작대로 영업 매일 문의 전화 일주일 금요일 퇴근 엄마 저녁 약속 고민 평소 홍어삼합 엄마 위해 사당동 홍어 맛집 이수 원조 이수역 출구 골목 도보 정도 치킨 건물 위치 내부 신발 슬리퍼 신고 구조 테이블 정도 금요일 단체 예약 손님 미리 테이블 해신 오리 옻닭 홍어삼합 보쌈 닭볶음탕 육전 여러가지 메뉴 점심 메뉴 삼계탕 순두부 제육 차돌 된장 판매 점심시간 식사 오기 홍어삼합 특별 보양식 능이 백숙 홍어 전도 판매 홍어삼합 막걸리 맥주 주문 해신 미리 예약 주문 메뉴 당일 방문 주문 조리 하니 해신 미리 예약 방문 밑반찬 오이 감자 볶음 브로콜리 콩나물국 보쌈 홍어 반찬 반찬 반찬 홍어삼합 홍어 묵은지 갓김치 보쌈 고기 식지 향초 경우 가스 불로 덕분 마지막 고기 기름 지지도 뻑뻑 홍어 김치 가게 김치 김치 홍어 평소 홍어 정도 초보자 이수역 홍어 맛집 추천 이수역 홍어 맛집 이수 원조 재생 이수역 홍어 맛집 이수 원조 홍어삼합 김치전 육전 먹기 홍어 자도 반찬 백숙 요리 보신 음식 판매 가족 모임 방문 방문 실제 부모님 모시 가족 손님 단체 회식 예약 이수 원조 서울특별시 동작구 동작대로 블로그 체크 장소,
209,이수역 맛집 이수역 홍어 가원 사당 진짜 홍어 노포 감성 맛집,이수 원조 서울특별시 동작구 동작대로 블로그 체크 장소 이수 원조 영업 사당역 근처 노포 감성 맛집 홍어 감자전 김치전 강추 감자전 밑반찬 다가 화장실 실내 술맛 수가 슬슬 홍어 수육 김치 달달 막걸리 시작 홍어 난이도 음식 사람 도전 사당 이수 근처 이수 원조 홍어 정도 젓갈 명태 내부 야장 노포 감성 물씬 화장실 실내 노포 느낌 가지 마시기 사당 이수역 도착 입구 신발 사장 슬리퍼 위치 주심 메뉴판 모든 메뉴 수가 막걸리 안주 백숙 육전 갑자기 감자전 김치전 실내 느낌 옛날 느낌 물씬 의자 식당 자리 가게 이건 밑반찬 브로콜리 멸치 콩나물 멸치 꽈리 고추 수분 멸치 간간 계속 간다 완전 브로콜리 초록색 지금 화면 식감 밑반찬 콩나물 고춧가루 보기 생각 감자전 궁합 후기 밑반찬 막걸리 지평 시도 금방 홍어 마늘 갓김치 묵은지 계속 수육 막걸리 고기 부추 고기 두께 금방 금방 포만 갓김치 마늘쫑 합의 김치 마늘쫑 대부분 묵은지 마늘쫑 이건 고추 마늘 새우젓 된장 생각 새우젓 홍어 자체 새우젓 고기 묵은지 나름 은근 콩나물국 한국 에피타이저 마늘 국산 마늘 말씀 합의 정석 진짜 마늘 꼬숩기 수육 위로 묵은지 묵은지 산미 콤콤 홍어 마늘 부추 살짝 비염 명약 홍어 일지 갓김치 친구 새우젓 구경 시도 묵은지 갓김치 기본 조합 기본 조합 묵은지 갓김치 대체 기본 조합 새우젓 정도 마늘 최고 정도 어차피 콩나물 간이 기본 손맛 계속 열기 기도 마지막 유지 때문 마지막 욕심 갓김치 묵은지 포기 고기 부추 홍어회 초고추장 행복 노릇 노릇 감자전 이건 후기 감자 감자 전이 주문 수가 감자 전도 감자 입맛 간장 대충 쫑쫑쫑 쪽파 부분 간장 그냥 치즈 재료 감자 간장 쪽파 맛남 쫀득쫀득 부분 바삭 여러 식감 막걸리 안주 무조건 이건 자극 김치전 해물 김치 김치 볶음 대신 김치 매운 간직 김치 식감 칼칼 오징어 막걸리 뚝딱 끝내 술맛 식당 안주 술맛 식당 취향 차라 감자 자극 김치 가시 이수역 근처 노포 감성,
210,이수역 홍어 맛집 가원 사당동 홍어삼합 추천,홍어삼합 매력 이수역 홍어 맛집 가원 추천 이수역 근처 골목 위치 이수역 보석 사당동 홍어 맛집 명소 대표 메뉴 홍어삼합 매콤한 묵은지 돼지고기 보쌈 이수역밥집 가원 메뉴 합리 가격 손님 인기 이수역 골목 보석 가원 가원 이수역 골목 위치 치킨 건물 자리 매일 오후 오후 영업 매장 내부 분위기 조성 친구 동료 방문 홍어 처음 자랑 홍어삼합 처음 시도 안성맞춤 메뉴 준비 이수역 맛집 가원 홍어삼합 요리 제공 선택 저녁 메뉴 홍어삼합 비롯 보쌈 닭볶음탕 불고기 전골 친구 식사 점심 메뉴 해물 순두부 차돌 된장 뚝배기 불고기 준비 직장인 지역 주민 점심 장소 인기 이수역 중심 밥집 홍어 매력 제대로 요리 이수역 맛집 단골 보유 여러 메뉴 준비 이수역 홍어삼합 맛집 가원 재생 이수역 홍어삼합 맛집 가원 홍어삼합 제대로 홍어삼합 주문 예전 회사 회식 홍어 홍어삼합 재료 더욱 홍어 보쌈 김치 마늘 입안 가득 미가 가원 김치 매콤한 홍어 특유 자연 홍어 사람 홍어 보쌈 새우젓 추천 새우젓 보쌈 홍어 감칠맛 더욱 개인 새우젓 가장 사당동 홍어 맛집 가원 가원 사당동 이수역 인근 홍어 장소 홍어 경험 홍어 보쌈 묵은지 새우젓 조합 완성 합의 조화 정말 일품 지역 홍어삼합 달리 이수역 홍어 맛집 가원 서비스 부담 가격 인기 한국 홍어 합의 조화 이수역 이유 이수역 회식 장소 추천 가원 비교 분위기 식사 친구 소규모 모임 메뉴 구성 덕분 회식 단체 모임 장소 손색 사당동 홍어 맛집 이수역밥집 가원 추천 이수 원조 서울특별시 동작구 동작대로 블로그 체크 장소 이수역 홍어 맛집 가원 사당동 홍어 맛집 이수역밥집 이수역 맛집 홍어삼합 블로그 서이추 서이추 신청,이수역홍어맛집 이수가원조 사당동홍어맛집 이수역밥집 이수역삼합맛집 홍어삼합 블로그서이추 서이추신청
