,title_pos,content_pos,hash_tag
83,흑석역 맛집 중앙 대학교 병원 맛집 이생 고기 돼지갈비,이생 고기 돼지갈비 흑석역 출구 도보 오후 공휴일 휴무 유료 주차장 이용 당일 도축 고기 한우 등심 겹살 돼지갈비 오늘 중앙대 근처 중앙 대학교 병원 맛집 얼른 가게 외관 돼지갈비 크게 간판 내부 돼지갈비 초벌 연탄 초벌 주차 정보 주차 가게 맞은편 흑석 빗물 펌프 주차 차로 이동 흑석역 공영 주차장 가면 요금 주차 부담 주차장 위치 재생 주차장 위치 가게 내부 이생 고기 돼지갈비 이생 고기 돼지갈비 가게 내부 단체 회식 기도 테이블 테이블 흑석동고기집 회식 장소 강력 추천 가게 내부 재생 가게 내부 메뉴 이생 고기 돼지갈비 메뉴 가게 이름 고기랑 돼지갈비 주력 메뉴인 테이블 살이 돼지고기 겹살 생목 차돌 된장찌개 공기밥 탐스제 돼지갈비 단독 주문 추가 주문 가능 주류 음료 제로 콜라 탐스제로 차만 상차림 이생 고기 돼지갈비 상차림 이생 고기 돼지갈비 양파 절임 채소 샐러드 절임 나물 반찬 고기만 먹기 겹살 생목 겹살 생목 겹살 껍데기 쫀득쫀득 생목 차돌 된장찌개 국물 건더기 찌개 처음 판매 차돌 한우 판매 차돌 된장찌개 공기밥 포함 오늘 흑석동 맛집 리뷰 지리 메뉴 중앙대 근처 회식 강추 이생 고기 돼지갈비 서울특별시 동작구 흑석동 이생 고기 돼지갈비 블로그 체크 장소,
84,스위치 다이어트 주차 주간 일기,두둥 호기롭 시작 스위치 다이어트 생각 경과 주차 지나 주차 완료 원장 주차 가장 생각 무난 무난 주차 후기 스타트 먼저 아침 프로 점심 지난주 부당 볶음밥 그릭 요거트 당근 스틱 팽이버섯 파오 저녁 샤브샤브 배추 버섯 양배추 돼지 목심 운동 패스 주차 산소 비율 주차 공복 실행 저녁식사 마지막 아침 점심 간식 공복 저녁식사 샤브샤브 외식 아침 공복 산소 마이 마운틴 인터 성공 외식 경우 무가당 땅콩 버터 알룰 로스 마늘 식초 미리 소스 야채 고기 잔뜩 월남쌈 흡입 샤브샤브 어묵 마지막 김치 만두 김치 만두 속세 약속 집안일 엄마 이사 준비 돕기 구리 오전 프로 점심 오리고기 팽이버섯 양배추 볶음 동생 달걀 지난주 당근 두부 볶음밥 어게인 흰밥 파김치 배추김치 김치 점심 직후 남아 땅콩 땅콩 오후 잡일좀 엄마 고기 빗살 인분 이간 돼지갈비 고기 먹기 돼지갈비 식당 갈이 와사비 절임 밑반찬 그거 접시 먹음 절임 설탕 쌈장 대신 킥복싱 바타 산소 지기 성공 처음 킥복싱 바타 내용 운동화 도착 맨발 무릎 살짝 월요일 월요일 아침 개인 레슨 운동 출근 프로 점심 전날 토마토 달걀 두부 양배추 그냥 무가당 토마토 퓨레 여러 재료 생각 외로 존맛 이탈리아 식이섬유 스틱 간식 저녁 프로 저녁 양배추 강추 레시피 양배추 참치 볶음 급식 무화과 봉구 봉구 단백질 설탕 주차 과일 허용 무화과 산소 오전 패스 화요일 화요일 연수 왕복 전날 저녁 도시락 저녁 점심 메뉴 잡곡 공기 양배추 참치 볶음 어게인 양배추 달걀 점심 수원 산책로 걷기 산책로 그냥 등산로 중간 간식 필라테스 그룹 레슨 브랜드 버거 가슴 두부 샐러드 두부 후회 할라피뇨 드레싱 생각 타임스탬프 할라피뇨 방토 드레싱 샐러드 가성 닭찌 클리어 아침 프로 점심 전날 엄마 갈비탕 고기 다시 쿠팡 법랑 냄비 주문 마침 도착 먹음 고기 냄비 반정 브로콜리 정도 먹음 사진 비비고 동그랑땡 알도 먹음 유혹 달걀 단백질 간식 프로 다이소 밤맛 시도 시도 제로 입맛 바밤바 저녁 오리고기 양배추 볶음 양배추 오이 급식 안계 서서 저녁 메뉴 피자 선생님 당근 양배추 라페 저녁 당근 바가지 만듬 당근 페라페 퇴근 라페 저녁 소화 바타 클리어 두번째 동작 그냥 주차 마지막 지난번 프로 바닐라 초코 바나나 바닐라 살짝 렉스 프로 바나나 초코 바나나 존맛 초코 바나나킥 느낌 바나나 점심 토마토 그라탕 돼지고기 고기 토마토 퓨레 양파 양배추 새우 두부 잡탕 그라탕 돼지고기 살짝 냄새 끼니 분량 주차 라페 브로콜리 어게인 역시 간식 저녁식사 점심 메뉴 급식 너비아니 고추장 찌개 건더기 고추장 찌개 소고기 애호박 감자 양파 건더기 나름 먹음 사제 너비아니 존맛 점심 산책 그룹 레슨 운동 운동 생각 제법 운동 주차 후기 식단 스트레스 주차 후반 갈수록 식욕 피자 치킨 다한 차로 픽업 냄새 직격 두둥 주차 체중 변화 주차 아침 공복 인바디 결과 대비 아침 인바디 결과 체중 증가 근육 증가 체지방 감량 체중 근육 체지방 감격 인바디 유형 스위치 작전 주차 이후 주차 이후 변화 결과 바디 주차 마무리 이후 허리 둘레 센치 가장 허리 기준 스위치 시작 전과 비교 센치 결과 내장 지방 레벨 단계 스위치 시작 코어 내장 지방 신호 결과 숫자 결과 양상 주차 시작 주도 파이팅 스위치 다이어트 스위치 스위치 다이어트 주차 박용우 스위치 강주 일기 다이어트식단 스위치 다이어트 후기 다이어트 성공 스위치 다이어트 주차 스위치 다이어트 유산소운동,스위치온다이어트 스위치온 스위치온다이어트1주차 박용우의스위치온 동백강주간일기 다이어트식단 스위치온다이어트후기 다이어트성공 스위치온다이어트2주차 스위치온다이어트2주 유산소운동
85,흑석동 고기 팔이 고기 돼지갈비 방문 후기,오늘 오빠 흑석역 맛집 팔이 고기 돼지갈비 방문 보신 잘해야 공휴일 휴무 서울시 동작구 팔이 고기 돼지갈비 외부 내부 안쪽 위치 흑석역 중앙 대학교 병원 근처 주소 흑석동 단체 회식 정도 응대 해주시 이모 흑석역 고기 팔이 팔이 고기 돼지갈비 메뉴 흑석동 소고기 파네 뭉티기 흑석동 맛집 중앙 대학교 병원 맛집 흑석동 삼겹살 흑석동 고기 방문 후기 밑반찬 동치미 오뎅 볶음 김치 피클 오이 오이 뭔가 계속 국물 파프리카 상추 샐러드 마늘 양파 겹살 겹살 인분 보이 직접 먹기 군침 겹살 돌뼈 노릇 고깅 비계 바삭 고기 정말 비냉 냉면 고기 냉면 냉면 소스 살짝 초장 취향 갈릴 수도 육수 차돌 된장찌개 고기 국룰 냉면 사용 된장찌개 차돌 된장찌개 차돌 버섯 두부 재료 듬뿍 국물 아주 뻑뻑 국물 맑은 고기 아시 연탄 돼지갈비 냉면 연탄 돼지갈비 인분 초벌 역시 양념 먹기 돼지 후기 인분 개인 연탄 돼지갈비 제일 갈비 중앙 대학교 병원 맛집 흑석역 맛집 의료 학생 쌀밥 식사 연탄 돼지갈비 이생 고기 돼지갈비 서울특별시 동작구 흑석동 이생 고기 돼지갈비 블로그 체크 장소,
86,흑석동 회식 고기 이생 고기 돼지갈비,이제 무지막지 수해 날씨 저기압 오늘 흑석동 소개 이생 고기 돼지갈비 서울 동작구 매일 팔이 고기 돼지갈비 흑석역 출구 블럭 골목길 위치 중앙 대학교 병원 도착 연탄 냄새 돼지갈비 연탄 마당 마당 메뉴 한눈 보이 단체 무려 예약 하니 회식 장소 이만 내부 내부 정말 자리 자리 사이 누가 신경 정도 자리 덕트 구비 냄새 걱정 사장 취미 생활 신문 뭔가 정감 가지 메뉴 메뉴 한우 돼지고기 연탄 돼지갈비 냉면 된장찌개 도토리 사발 국내 고기 고민 연탄 돼지갈비 인분 인분 물냉면 음식 먼저 밑반찬 준비 오징어 젓갈 멸치 열무 밑반찬 동치미 고기 고기 초벌 고기 먼저 냉면 도착 냉면 고기 냉면 대망 고기 이생 고기 재생 접기 이생 고기 초벌 때문 아주 최고 여자 사장 냉면 나니 후식 수가 달달 커피 준비 마무리 자리 고기 질도 오늘 이생 고기 돼지갈비 서울특별시 동작구 흑석동 이생 고기 돼지갈비 블로그 체크 장소 서울 동작구 흑석동 화장실 내부 공용 주차 빗물 펌프 주차장 가능 예약 문의,
87,흑석역 맛집 흑석동 고기 이생 고기 돼지갈비,흑석역 위치 이생 고기 돼지갈비 겹살 후기 대해 이생 고기 돼지갈비 흑석역 근처 위치 소고기 삼겹살 고기 메뉴 제공 겹살 주문 가게 도착 인테리어 모던 분위기 테이블 사이 간격 분위기 주문 고객 중심 서비스 인상 전체 이생 고기 돼지갈비 겹살 퀄리티 서비스 측면 기회 다시 방문 추천 고기 주문 속도 서빙 고기 퀄리티 겹살 두께 식감 살코기 기름기 조화 고기 미가 그대로 고기 재미 숯불 조리 고기 입안 가득 일품 고기 제공 양념 반찬 매우 고기 소스 더욱 가격 대비 양도 주문 가격 합리 식사 서비스 응대 이생 고기 돼지갈비 제공 밑반찬 직접 밑반찬 한국 전통 음식 비롯 종류 양파 절임 상추 고추장 비롯 재료 밑반찬 제공 파김치 총각김치 직접 일품 나물 장아찌 제공 테이블 모든 밑반찬 고기 궁합 식사 더욱 고기 밑반찬 식사 즐거움 이처럼 이생 고기 돼지갈비 고기 퀄리티 밑반찬 제공 식사 경험 선사 이생 고기 돼지갈비 야외 테이블 마련 낭만 분위기 고기 야외 테이블 공기 자연 풍경 감상 공간 날씨 더욱 분위기,
88,흑석역 중앙대 맛집 흑석동 팔이 고기 돼지갈비,오늘 학교 주변 고기 학교 오니 절친 학교 흑석역 주변 소개 팔이 고기 돼지갈비 이름 정감 흑석역 팔이 고기 돼지갈비 오늘 후기 식당 정보 위치 서울 동작구 흑석동 팔이 고기 돼지갈비 흑석역 출구 영업 휴무 일요일 야외 날씨 야장 가능 믿음 글씨체 맛집 원조 느낌 식당 내부 내부 전통 고깃집 분위기 아빠 다리 자리 테이블 손님 취향 식이 매장 한쪽 한약재 통술 진열 흑석역 줏대 느낌 메뉴 메뉴 한우 한우 등심 한우 갈비살 돼지 겹살 생목 갈매기살 연탄 돼지갈비 식사 물냉면 비빔냉면 도토리묵 사발 차돌 된장찌개 아저씨 겹살 인분 공기밥 주문 음식 반찬 먼저 고사리 아주 양파 첨부 주심 양파 킬러 동치미 아주 고기 동치미 중간 중간 처음 먹기 가능 상차림 샐러드 고기 등장 고기 불판 고기 고기 양쪽 고기 제압 절친 손길 흑석동 삼겹살 고기 맛집 학교 아숩 친자 고기 고기 와사비 직원 와사비 공기밥 고기 비계 살의 조화 최고 흑석역 흑석동 중앙대 중앙대 병원 주변 삼겹살 고기 맛집 회식 장소 팔이 내부 아주 학교 눈빛 직장 보고 농담 안녕 위치 확인 이생 고기 돼지갈비 서울특별시 동작구 흑석동 이생 고기 돼지갈비 블로그 체크 장소,
89,이수역 고깃집 숯불 구이 무한리필 고기,이수역 고깃집 고기 평소 고기 지인 식당 고기 한번 가격 가격 부담 종류 먹기 닭갈비 삼겹살 가게 고민 한번 해결 숯불 구이 무한리필 고기 역점 런치 디너 가성 가격 수제 양념 돼지갈비 숙성 삼겹살 숯불 닭갈비 숙성 주먹 고기 돼지껍데기 샐러드 특선 메뉴 깃밥 무한 식당 이수역 골목 메인 거리 위치 모임 단체 회식 제격 이구 건물 분위기 인상 한쪽 손님 창가 사진 숯불 구이 무한리필 이용 기본 고기 모든 고기 매장 직접 양념 과정 거치 때문 셀프 코너 매장 상황 메뉴 변경 특선 메뉴 준비 재미 삼겹살 주먹 고기 돼지갈비 닭갈비 돼지껍데기 메뉴 굿굿 매장 중앙 위치 셀프 코너 특선 메뉴 고기 메뉴 소스 준비 공간 반찬 고기 이수역 고깃집 고기 비쥬 육질 보이시 고기 판이 고기 기본 코팅 판이 양념 고기 석쇠 불판 이용 불판 직원 말씀 교체 야채 가득 취향 재미 셀프 코너 음식 특선 메뉴 코너 꽃빵 고구마 튀김 야채 튀김 치킨 노릇 노릇 토마토 계속 야채 샐러드 대박 가지 튀김 정말 요리 특선 메뉴 코너 준비 소독 가위 집게 수저 앞치마 준비 이제 이수역 고깃집 무한리필 준비 완료 채소 반찬 소스 고기 테이블 숯불 고기 두툼 고기 육질 숙성 삼겹살 주먹 고기 소시지 먼저 삼겹살 불판 이수역 고깃집 숯불 구이 무한리필 고기 재생 접기 고기 역점 삼겹살 비쥬 고기 모습 영상 감상 삼겹살 채소 마늘 쌈장 크게 육즙 가득 진짜 고기 퀄리티 콩나물 삼겹살 굿굿 주먹 기도 노릇 삼겹살 사이 주먹 고기 덩이 투척 먹기 크기 순식간 겉바 제대로 식감 굿굿 고기 불판 양념 돼지갈비 껍데기 준비 닭갈비 갈매기살 간장 양념 매콤 양념 종류 별로 양념 갈비 평소 돼지갈비 식당가 서도 인분 무한리필 행복 노릇 노릇 돼지갈비 비쥬 정말 노릇 돼지갈비 먹기 크기 불판 사이드 진짜 간이 매력 이수역 고깃집 친구 고기 청량감 하이 생각 하이 판매 대박 얼그레이 하이 한잔 기분 내기 짱짱 중간 중간 야채 튀김 숯불 닭갈비 양념 갈매기살 고기 종류 고기 최고 최고 갈매기살 쫄깃 갈매기살 취향 저격 고기 마무리 노릇 돼지껍데기 콩가루 쫄깃 정말 부담 가격 고기 부위 무한리필 퀄리티 모임 회식 오늘 하루 고기 역점 서울특별시 동작구 동작대로 이수역 고깃집 숯불 구이 무한리필 고기 주소 서울 동작구 동작대로 전화 영업 매일 가격 무한리필 런치타임 무한리필 타임,
90,이생 고기 돼지갈비 퀄리티 고기 맛집 중앙대 병원 맛집,이생 고기 돼지고기 팔이 중앙대 맛집 흑석 맛집 흑석역 고기 중앙대 모임 데이트 돼지갈비 맛집 초벌 구이 흑석역맛집 흑석동고기집 흑석동삼겹살 중앙대학교병원맛집 흑석동소고기 중대 맛집 이생 고기 돼지갈비 중앙대 병원 맛집 이생 고기 돼지갈비 서울 동작구 맛집 서울 동작구 흑석동 이생 고기 돼지갈비 월토 일요일 정기 휴무 단체 이용 가능 유아 의자 예약 무선 인터넷 포장 간편 결제 주차 발렛파킹 단체 예약 완비 중앙대 병원 맛집 이생 고기 돼지갈비 흑석동 위치 한우 등심 갈매기살 겹살 생목 돼지갈비 고기 돼지갈비 한우 등심 전문점 이생 고기 돼지갈비 이생 고기 돼지갈비 서울특별시 동작구 흑석동 이생 고기 돼지갈비 블로그 체크 장소 사장 가게 내부 매우 반찬 고기랑 동치미 접시 여름날 비트 소스 샐러드 양파 절임 고기 인분 주문 냉동 고기 두툼 이생 고기 돼지갈비 중앙대 병원 맛집 줄줄 이생 고기 돼지갈비 중앙대 병원 맛집 사장 노릇 노릇 주심 삼겹살 삼겹살 더욱 이생 고기 돼지갈비 서울 동작구 맛집 삼겹 껍데기 쫀뜩쫀득 맛남 이생 고기 돼지갈비 서울 동작구 맛집 쌈장 반찬 돼지갈비 인분 인분 팔이 돼지갈비 초벌 불판 이건 소스 고기만 고기 육즙 간간 소스 소스 방해 비빔냉면 물냉면 동치미 베이스 국물 아주 한국인 고기 디저트 고기 하늘 찰캌 흑석역맛집 흑석동고기집 흑석동삼겹살 중앙대학교병원맛집 흑석동소고기,곰팔이생고기돼지고기 곰팔이 중앙대맛집 흑석맛집 흑석역고기집 중앙대모임 데이트 돼지갈비맛집 초벌구이 흑석역맛집 흑석동고기집 흑석동삼겹살 중앙대학교병원맛집 흑석동소고기 중대맛집
91,이수역 고기 가성 무한리필 분위기 고기,며칠 이수역 고기 가성 무한리필 분위기 고기 카페 분위기 엄지 이수역 인기 만점 주말 이면 기석 만석 이유 무한리필 셀프 운영 마음 제대로 식사 음식 친구 둘이서 식사 고기 종류 허기 진배 이수역 고기 가성 무한리필 분위기 고기 위치 정보 안내 서울 동작구 동작대로 고기 역점 영업 안내 매일 오전 오후 무한리필 런치타임 무한리필 타임 고기 종류 준비 이드 메뉴 준비 가성 이수역 고기 고해 수제 돼지 양념 갈비 숙성 삼겹살 숯불 닭갈비 숙성 주먹 고기 돼지껍데기 샐러드 특선 메뉴 공기밥 완벽 가격 정말 엘리베이터 타고 정리정돈 매장 분위기 고기 친구 일찍 오픈 오픈런 줄줄 손님 평일 점심시간 자리 가득 이수역 고기 가성 무한리필 분위기 고기 재생 이수역 고기 가성 무한리필 분위기 고기 종류 후라이드 치킨 양념치킨 스파게티 김말이 만두 튀김 먹거리 특선 메뉴 준비 이수역 고기 고기 뷔페 식당 생각 고기 롱답 고기 삼겹살 뭉텅 고기 돼지 양념 갈비 닭갈비 닭갈비 매콤 양념 간장 양념 고기 소세지 쫄깃 쫀득 돼지껍데기 준비 입맛 고기 양념 고기 판이 고기 먼저 양념 고기 불판 달라 말씀 고기 메뉴 양파 파채 파채 소스 쌈장 김치 돼지껍데기 콩가루 고기구 카레 가루 기름 소금 이제 노릇 바삭 치킨 치킨 장사 듯해 토마토소스 스파게티 전문점 스파게티 고기 김말이 고구마 튀김 바삭 토마토 수가 오징어 초무 콤달콤 입맛 제대로 고기구 보기 매장 전체 분위기 관리 요리 삼겹살 돼지 양념 갈비 닭갈비 야채 가득 요즘 야채 고공 행진 이수역 고기 가성 무한리필 맛집 고기 야채 셀프 가득 처음 테이블 상차림 숯불 구이 무한리필 국민 숙성 삼겹살 수제 돼지 양념 갈비 숙성 주먹 고기 매콤 숯불 닭갈비 쫄깃 쫄깃 돼지껍데기 종류 별로 준비 종류 별로 차려 그동안 야채 종류 별로 상추 깻잎 케일 매콤 고추 버섯 종류 별로 양파 파채 차려 믈론 고기 종류 별로 삼겹살 수제 돼지 양념 갈비 주먹 고기 매콤 양념 닭갈비 돼지껍데기 먼저 삼겹살 불판 앞뒤 노릇 숙성 삼겹살 고기 정말 언릉 삼겹살 먹기 친구 담당 친구 어쩜 노릇 삼겹살 절로 삼겹살 한잔 친구 한잔 그것 기름 그대로 카레 가루 상추 깻잎 한장 삼겹살 채도 고추 한쪽 크게 삼겹살 차로 숯불 구이 돼지 양념 갈비 매콤 양념 닭갈비 돼지껍데기 숯불 바베큐 소세지 고기 역시 숯불 랍니 돼지껍데기 콩가루 졸깃함 절로 숯불 양념 닭갈비 그대로 매콤 더욱 숯불 닭갈비 삼겹살 주먹 고기 양념 돼지갈비 숯불 닭갈비 덕분 종류 별로 마무리 식사 냉면 그것 물냉면 주문 살얼음 동동 국물 고기 입가심 쫄깃 면발 크게 젓가락 수제 양념 갈비 냉면 냉면 마무리 식사 이수역 가성 무한리필 고기 고기 평일 점심시간 사람 이유 매장 서비스 품질 고기 친구 선택 고기 방문 대기 석도 마련 식사 두꺼비 자리 이수역 고기 가성 무한리필 분위기 고기 고기 역점 서울특별시 동작구 동작대로 블로그 체크 장소,
92,중앙 대학교 병원 맛집 이생 고기 돼지갈비 리뷰,위드 오늘 서울 동작구 흑석동 위치 흑석역 맛집 이생 고기 돼지갈비 리뷰 지하철 이동 경우 흑석역 차로 이동 경우 흑석 빗물 펌프 공영 주차장 이용 흑석동고기집 이생 고기 돼지갈비 가면 흑석동 위치 한우 등심 갈매기살 겹살 생목 돼지갈비 고기 돼지갈비 한우 등심 전문점 내부 모습 이생 고기 돼지갈비 좌석 준비 단체 회식 정도 수용 좌석 마련 단체 회식 사전 예약 아기 의자 가족 외식 테이블 준비 고깃집 환기 구도 환기 구가 메뉴판 한우 돼지고기 국내 연탄 돼지갈비 연탄 초벌 화장실 식당 내부 이용 위드 연탄 돼지갈비 물냉면 반찬 기본 반찬 밑반찬 동치미 샐러드 양파 절임 채소 고기 먹기 반찬 식사 중간 직원 주시 매우 직원 고기 고기 걱정 대화 이생 고기 돼지갈비 재생 이생 고기 돼지갈비 이생 고기 돼지갈비 카라멜 색소 사용 연탄 돼지갈비 자극 갈비 양념 샐러드 드레싱 고기랑 이생 고기 돼지갈비 재생 이생 고기 돼지갈비 노릇 노릇 고기 냉면 조합 후루룩 면발 돼지갈비 물냉면 그릇 하니 힐링 기분 마무리 총총 중앙 대학교 병원 맛집 흑석동 소고기 가요 이생 고기 돼지갈비 이생 고기 돼지갈비 서울특별시 동작구 흑석동 이생 고기 돼지갈비 블로그 체크 장소 월토 공휴일 휴무,
93,흑석역맛집 이생 고기 돼지갈비,대학 근처 맛집 정도 흑석동 중앙 대학교 단체 모임 흑석역맛집 이생 고기 돼지갈비 소개 주소 서울 동작구 흑석동 이생 고기 돼지갈비 흑석역 출구 영업 월토 정기 휴무 브레이크 타임 전화번호 편의 단체 가능 예약 포장 무선인터넷 간편 결제 흑석역 출구 중앙 대학교 병원 골목 높이 돼지갈비 간판 간판 마당 분위기 공간 야외 고기 와우 식당 내부 글씨 식사 메뉴 정면 대학 근처 고깃집 식당 아주 테이블 뚜껑 벽면 메뉴판 오른쪽 여러 금주 미니어쳐 요새 유행 모던 인테리어 고깃집 전통 식당 신뢰 우린 소문 갈비살 연탄 돼지갈비 가지 주문 먼저 먹음 밑반찬 서빙 와우 반찬 묵은지 밑반찬 맛보기 반찬 묵은지 은근 식욕 밑반찬 메뉴 대감 인정 살얼음 동동 동치미 사발 고깃집 동치미 최고 사장 계속 밑반찬 동치미 재생 동치미 반찬 맛집 해도 손색 밑반찬 맛집 재생 밑반찬 맛집 갈매기살 먼저 등장 갈매기살 런가 보기 고기 탄력 사장 친철 갈매기살 런가 고기 뭔가 프레 느낌 갈매기살 노릇 노릇 식감 그대로 탱탱 먼저 연탄 불로 초벌 실내 다시 연탄 돼지갈비 달달 바삭 그냥 호불호 연탄 돼지갈비 마지막 갈비 재미 도토리묵 사발 추가 여러 가지 야채 살얼음 한여름 미네 팥빙수 빙수 느낌 고기 도토리묵 사발 재생 도토리묵 사발 고기 불리 차돌 된장찌개 물냉면 식사 주문 메뉴판 메뉴 후회 진짜 물냉면 차돌 된장찌개 취향 후회 물냉면 한여름 더위 입구 정감 달달 커피 자판기 것일 사장 정성 식당 건너편 공간 주차 토요일 오후 런가 주차공간 여유 주차 식사 주차장 차후 흑석동고기집 이생 고기 식당 식사 중앙대 근처 구경 식당 식사 주변 구경 공영 주차장 이생 고기 돼지갈비 서울특별시 동작구 흑석동 이생 고기 돼지갈비 블로그 체크 장소 흑석역맛집 흑석동고기집 흑석동삼겹살 중앙대학교병원맛집 흑석동소고기 중앙대 맛집 갈매기살 맛집 흑석동 맛집,흑석역맛집 흑석동고기집 흑석동삼겹살 중앙대학교병원맛집 흑석동소고기 중앙대맛집 갈매기살맛집 흑석동맛집
94,평범 비범 김치찌개 이수역 마루 고기 김치찌개,이수역 김치찌개 전문점 마루 고기 김치찌개 남성 장점 가맹 그다지 관심 가지 사실 이집 단골 선배 입맛 양푼 가득 김치찌개 근래 가장 김치찌개 사진 보이지 돼지고기 덩어리 가위 먹기 한번 팔팔 동네 고깃집 이기 단골 저녁 삼겹살 포함 갈비 오리 고기 저녁 모임 방문 김치찌개 김치찌개 인사동 간판 김치찌개 광화문 김치 기반 을지로 주정 서울 동작구 동작대로 이수역 출구 주차 불가 겉보기 생각 테이블 김치찌개 양푼 고기 김치찌개 인분 깃밥 양푼 가루 팔팔 김치찌개 돼지고기 어마 무시 마루 고기 김치찌개 남성 장점 서울특별시 동작구 동작대로,
95,흑석역 맛집 이생 고기 돼지갈비,빗살 그대로 사용 캐러멜 소스 사용 안심 식당 이생 고기 돼지갈비 서울특별시 동작구 흑석동 이생 고기 돼지갈비 블로그 체크 장소 위치 서울 동작구 흑석동 영업 브레이크 타임 일요일 휴무 오늘 흑석역 맛집 이생 고기 돼지갈비 리뷰 흑석역 숯불 생각 이제야 가게 연탄 초벌 숯불 단축 한우 돼지갈비 돼지갈비 돼지갈비 비빔냉면 가격 돼지갈비 인분 비빔냉면 메뉴판 기본 무게 제공 매장 회식 단체 오기 식사 밑반찬 종류 직접 보통 완제 사서 사용 곳도 직접 음식점 반찬 집밥 스타일 반찬 총각김치 사장 직접 고기랑 조합 연탄 초벌 생각 돼지갈비 캐러멜 색소 사용 은색 돼지갈비 캐러멜 색소 사용 모양 사각형 모양 의아 보통 모양 고기 사용 진짜 돼지갈비 손질 모양 설명 안심 초벌 고기 직원 직접 방법 설명 돼지갈비 대한 얘기 식사 먹음 비주 냄새 돼지갈비 정말 자극 자꾸 중독 돼지갈비 비빔냉면 질리 계속 흑석역 근처 안심 돼지갈비 맛집 이생 고기 돼지갈비 추천,
