,title_pos,content_pos,hash_tag
79,제기동맛집 고려대 국방 연구원 근처 짬뽕 중식 만루 후기,오늘 고려대 근처 이자 국방 연구원 중식 맛집 만루 혜화 종로 효제루 웨이 맛집 개인 거기 만루 서울 동대문구 회기로 중국인 사장 직접 운영 역사 중국집 위치 만루 서울특별시 동대문구 회기로 블로그 체크 장소 국방 연구원 버스 타고 호선 고려대역 출구 가장 영업 매일 라스트 주차 주차 가능 무료 가게 앞쪽 옆쪽 주차 자리 경우 가게 가게 외부 가게 외관 사용 실내 편이 단체 공간 마련 단체 평일 보지 메뉴판 가격 정보 짜장 짬뽕 딤섬 북경오리 팔고 메뉴 여자 이서 아래 주문 낙지 짬뽕 마레 딤섬 쇼룽뽀우 딤섬 제로 콜라 기본 반찬 중국집 기본 반찬 춘장 양파 대신 절임 추가 낙지 짬뽕 낙지 짬뽕 센스 이세 낙지 짬뽕 이름 낙지 그릇 마리 꽃게 다리 짬뽕 불맛 국물 아주 짬뽕 짬뽕 마레 마이 돼지고기 새우 마이 내용물 응축 느낌 쇼룽뽀우 소룡포 육즙 만두 듬뿍 소룡포 딤섬 종류 추천 추천 친구 인정 고려대 맛집 만루 거리 짜장면 짬뽕 필수 주문 짜장 짬뽕 딤섬,
80,고려대중식당 만루 중화요리 제기동맛집,요즘 가장 티비 프로그램 다행 다행 무인도 호텔 자연 재료 쉐프 손님 대접 큰아들 쉐프 홀딱 중식 노래 고려대중식당 맛집 만루 입구 전통 중화요리 맛집 포스 폴폴 동대문구중식당 위치 서울 동대문구 회기로 호선 고려대역 출구 영업 라스트 주차 주차 가능 매장 주차 공터 매장 주차 대로 위치 고려대 번화가 거리 편입 중화요리 북경오리 맛집 실내 요릿집 분위기 물씬 진짜 중국 느낌 인테리어 대감 더욱 상승 은색 계열 소품 분위기 장악 역시 중화 인테리어 홍등 한참 실랑이 분위기 깡패 장식 용이 중국 보기 만해 매장 곳곳 그림 액자 글씨 성적 보지 단체 공간 마련 규모 동대문구중식당 단체 모임 입구 메뉴 짜장면 대만 로우 판이 메뉴판 북경 요리 간판 크게 씌여져 북경 요리 직접 오늘 식사 사진 반사 관계 네이버 지도 메뉴 중화요리 간판 대만 로우 판이 메뉴 주문 육미 자장면 홍합 짬뽕 대만 로우 주문 스페셜 요리 요리 종류 직접 확인 추천 동파육 주문 주문 나니 양배추 샐러드 사이 단무지 먼저 식사 먼저 육미 자장면 가장 애정 메뉴 두번째 대만 로우 보더 자장면 그릇 메뉴 사실 동파육 싶었느데 아들 싹싹 메뉴 홍합 가득 오징어 해산물 잔뜩 짬뽕 홍합 해산물 제법 식사 먼저 서빙 요리 후다닥 사진 먹기 시작 형님픽 대만 로우 우리나라 족발 느낌 청경채 꿀맛 숟가락 형님 입속 해물 가득 국물 짬뽕 진짜 안해 해물 생각 고급 식사 도중 동파육 언급 주문 요리 느낌 워낙 고기 육식 가족 불만 더랬 동파육 고기 두툼 고기 입가 진짜 최고 족발 달달 양념 가족 먹기 신랑 양장 깐풍기 보기 화장실 문도 특색 제대로 남자 화장실 여자 화장실 역시 좌석 단체 완비 동대문구중식당 대학가 과회 동아리 회식 안성맞춤 기본 요리 중화요리 매력 중식 만루 대만 로우 홍합 짬뽕 중화요리 만루 서울특별시 동대문구 회기로 블로그 체크 장소 사랑 서로 공감 소통 이웃 환영,
81,고려대 중식 만루 고려대역 맛집 차이나 타운 영화 도둑,만루 기본 정보 주소 서울 동대문구 회기로 고려대역 출구 도보 영업 매일 라스트 주차 주차 가능 만루 서울특별시 동대문구 회기로 블로그 체크 장소 분위기 인테리어 웅장 외관 차이나 타운 대학시절 고려대 중식 여러 군데 외관 전혀 외관 순간 한국 중국 정도 분위기 제대 가게 초록색 외벽 중국 분위기 제대 도중 단체 손님 계단 단체 영화 세트 정말 중국 여행 고급 요릿집 고려대 식당 일반 식당 비주 가장 먼저 영화 도둑 식당 느낌 정말 영화 도둑 식당 전지현 일반 단체 프라이 마련 단체 회식 거나 지인 끼리 프라이 중식 제격 고려대 중식 만루 중국 분위기 차이나 재생 접기 고려대 중식 만루 중국 분위기 차이나 감상 대부분 식당 오후 방문 테이블 테이블 단체 손님 때문 아마 사이 피크 타임 가게 예상 방문 참고 메뉴 정리 식기 기본 반찬 사이 단무지 양배추 피클 제공 본인 중식 단무지 킬러 단무지 생각 단무지 달달 메뉴 접시 메뉴판 찍기 정도 메뉴 때문 중국요리 단체 방문 식당 추천 쌀국수 소고기 볶음 낙지 짬뽕 차이 새우 딤섬 주문 쌀국수 소고기 볶음 쌀국수 소고기 볶음 메뉴 추천 짜장면 팟타이 사이 어딘가 팟타이 중국 해석 느낌 고추기름 텁텁하 맵싹함 감칠맛 음식 청양고추 볶음 정도 걱정 항공 쌀국수 면발 쫀득하 숙주 양파 부추 피망 고추 채소 식감 소고기 소고기 양념 아주 쫀득쫀득 식감 쫀득 소고기 쫜득 쌀국수 채소 삼박자 도둑 양념 주문 공기밥 주문 반찬 보시 낙지 짬뽕 낙지 짬뽕 짬뽕 낙지 마리 꽃게 마리 오징어 잔뜩 양파 제대로 양배추 부추 느타리 버섯 재료 낙지 감상 가격 낙지 마리 낙지 야들야들 쫄깃 식감 낙지 짬뽕 국물 고기 짬뽕 달리 라면 치면 진라면 정도 어린이 손님 동반 추천 차이 쥬차이 차이 새우 딤섬 생각 새우 딤섬 쫄깃 자랑 감자 쫀득 쫄깃 새우 부추 조합 소가 간장 요약 인테리어 만루 중국 여행 중국 분위기 고려대 중식 맛집 만루,
82,고려대역 맛집 고려대중식당 중국 현지 스타일 맛집 만루,돌이 오늘 고려대 중식 맛집 만루 만루 연중 고려대역 도보 위치 버스 정류장 호선 버스 수도 건물 크기 고려대 졸업식 시즌 단체 손님 생각 크기 중식 가면 연말 송년회 아마 송년회 모임 장소 고려대 중식 만루 매장 내부 매장 보시 중식 인테리어 단체 손님 위해 완비 여러 좌석 정도 메뉴 소개 북경오리 전문점 소자 대자 사실 소자 북경오리 맛보기 의미 소자 판매 북경오리 참고 무조건 미리 예약 최소 하루 전날 예약 추천 당일 예약 메뉴 무려 여가 가지 여가 요리 주방 가게 맛집 메뉴 리뷰 차돌 짬뽕 오늘 국물 차돌 짬뽕 차돌 짬뽕 재생 차돌 짬뽕 불향 짬뽕 고요 국물 두번째 메뉴 로우 로우 북경 동북 팔고 한국 탕수육 뭔가 동북 로우 특이 간장 소스 특징 갑자기 생각 보통 간장 추천 로우 커팅 재생 로우 커팅 동북 로우 소스 뭔가 이전 그냥 탕수육 로우 전혀 달라 처가 로우 소스 계속 젓가락 정도 로우 바삭 후기 짬뽕 고요 보기 위해 간장 소스 계속 생각 고려대 중식 맛집 만루 리뷰 만루 서울특별시 동대문구 회기로 블로그 체크 장소 고려대 중국집 고려대중식당 제기동맛집 고려대역 맛집 대역 맛집 동대문구 맛집,고려대중국집 고려대중식당 제기동맛집 고려대역맛집 고대역맛집 동대문구맛집
83,제기동맛집 고대 근처 중식 만루,제기동맛집 중식 만루 대역 근처 규모 중식 만루 외부 인테리어 고오 중식 느낌 뿜뿜 규모 커서 회식 모임 소로 제기동맛집 접근성 중식 제격 만루 매장 등장 평일 저녁 손님 계단 매장 완전 제기동맛집 만루 고려 프라이 공간 테이블 가족 모임 인테리어 자체 인지 창가 계단 옆쪽 어항 관리 물고기 구경 재미 제기동맛집 만루 메뉴판 중식 메뉴판 정말 간판 에보니 북경오리 딤섬 메인 북경오리 딤섬 맛집 근처 북경오리 딤섬 홍콩 여행 헤헤 로우 러버 그냥 중식 로우 무조건 토마토소스 로우 주문 사장 간장 소스 추천 간장 소스 주문 딤섬 정말 메뉴 만루 딤섬 메뉴 조우 추가 부담 제기동맛집 중식 기본 메뉴인 짜장면 짜장면 주문 중식 짝꿍 짜장면 주문 짜장면 주문 완료 메뉴 쟈스민 벌써 중식 식전 느낌 쟈스민차 주문 메뉴 제기동맛집 중식 기본 제공 반찬 사이다 자스민 모금 사이다 모금 냉탕 메뉴 간장 소스 베이스 로우 넙적 로우 테이블 직접 주시 바삭 역시 중식 메뉴 포장 제대로 고대 로우 재생 고대 로우 바삭 소리 바삭 쫀득 우의 튀김 고기 간장 소스 듬뿍 고대 짜장면 재생 고대 짜장면 짜장면 면발 지지 비주 느낌 짜장 소스 야채 듬뿍 제기동맛집 만루 딤섬 살이 딤섬 비주 나오니 먹기 사이드 느낌 주문 새우 듬뿍 딤섬 만루 짜장면 제기동맛집 중식 만루 가요 만루 서울특별시 동대문구 회기로 블로그 체크 장소,
84,고려대 제기동 맛집 정통 중식 만루,주말 오전 일정 고려대 근처 방문 마침 점심시간 메뉴 검색 근처 정통 중식 소개 만루 서울특별시 동대문구 회기로 블로그 체크 장소 만루 매일 라스트 주차 가능 예약 단체 이용 가능 포장 가능 유아 의자 고려대 제기동 맛집 만루 호선 고려대역 출구 도보 거리 위치 만루 버스 정류장 정류장 국방 연구원 버스 하니 참고 고려대 제기동 맛집 만루 자차 이용 가게 주차 내부 분위기 입구 계단 길이 대부분 단체 손님 이용 방문 점심시간 단체 손님 좌석 분위기 일반 중국집 달라 처음 인테리어 테이블 아기 손님 의자 가족 동반 식사 형식 좌석 미리 예약 추천 이제 만루 메뉴 기본 메뉴인 짜장 짬뽕 볶음밥 비롯 코스 요리 북경 오리 딤섬 메뉴 정말 메인 요리 오늘 역시 기본 메뉴 주문 짜장면 게살 볶음밥 해물 볶음 쇼룽뽀우 기본 반찬 사이 단무지 양배추 피클 중식 단무지 배신 사이만 기본 짜장면 먼저 역시 짜장면 배달 간도 먹기 발도 게살 볶음밥 정말 게살 게살 때문 생각 전혀 간이 아주 합격 어른 짬뽕 국물 메뉴 해물 볶음 불맛나 양념 숙주 식감 대박 거기 듬뿍 굿굿 사이드 딤섬 주문 육즙 장난 만루 재생 만루 제대로 중식 오늘 불리 간도 세지 먹기 아주 직원 대부분 현지 현재 오픈 주년 기념 칭다오 연태 감사 이벤트 진행중 제기동 고려대 근처 방문 만루 추천 제기동맛집 고려대밥집 동대문구중식당 제기동밥집 고려대중식당 정통 중화요리 북경오리 만루,제기동맛집 고려대밥집 동대문구중식당 제기동밥집 고려대중식당 정통중화요리 북경오리 향만루
85,동대문구중식당 추천 차돌박이 짬뽕 맛집 제기동 만루,이불 구리 짝꿍 점심 데이트 반복 맛집 동대문구 정보화 도서관 홍릉수목원 고려대 버스 타고 출근길 짬뽕 만루 매일 라스트 일요일 영업 중식 주말 데이트 방문 가족 모임 외식 방문 굿굿 입구 맛집 스멜 진짜 현지 중식 느낌 뿜뿜 결론 진짜 맛집 내부 요런 느낌 홍콩 식당 국적 분위기 중식 러버 그동안 동대문구중식당 테이블 의자 정말 만루 메뉴판 북경오리 요즘 메뉴 북경오리 점심 중국 냉면 차돌박이 짬뽕 샤오롱바오 주문 만루 메뉴 동대문구중식당 중식 맛집 중국요리 식사 메뉴 편이 잡탕 킬러 잡탕 방문 예정 제기동 식당 메뉴판 코스 요리 여러 종류 국방 연구원 회사 회식 장소 분위기 진짜진짜 여느 한국 식당 두운 초록 벽지 인테리어 생각 만루 기본 사이 단무지 양배추 구리 중식 반찬 제기동맛집 사이 중국 냉면 짝꿍 중국 냉면 여러 채소 가득 얼음 동동 냉면 수라 조합 토마토 고기 양도 냉면 일반 냉면 여름 이면 가끔 샤오롱바오 자타공인 만두 귀신 역시 샤오롱바오 샤오롱바오 매우 매우 가격 대비 육즙 파바방 이란 차돌박이 짬뽕 구리 차돌박이 짬뽕 등장 비주 내적 비명 지름 토핑 차돌 제법 불맛 차돌 채소 요즘 중국집 짬뽕 대부분 국물 던데 만루 짬뽕 정말 청경채 짬뽕 동대문구 중식 근방 고려대중식당 중식 회식 장소 방문 테이블 테이블 단체 방문 좌석 예약 단체 방문 만루 만루 서울특별시 동대문구 회기로 블로그 체크 장소,
86,고려대역 중국집 만루 리뷰,제기동맛집 고려대밥집 동대문구중식당 제기동밥집 고려대중식당 고려대 맛집 북경오리 북경 탕수육 로우 볶음 짬뽕 맛집 홍합 짬뽕 소고기 볶음밥 중국집 볶음밥 중화요리 딤섬 맛집 루나 리스 오늘 고려대역 근처 중국집 만루 리뷰 전체 현지 느낌 물씬 식당 만루 국적 인테리어 딤섬 북경오리 요리 고려대역 중식 사이 가족 끼리 오기 정도 공간 서울 동대문구 회기로 영업 주말 가족 외식 장소 인테리어 현지 느낌 사진 모든 테이블 차서 식사 중이 포기 가족 단위 오기 이야기 사이 피클 단무지 제공 사이 정말 역대 거만 고민 정도 요리 북경오리 마라상궈 돼지고기 새우 날치 딤섬 볶음밥 종류 유산 기본 홍합 짬뽕 후기 로우 대요 토마토 소스 간장 소스 가지 존재 보기 해도 군침 깐풍기 조기 메뉴판 음식 사진 현지 느낌 차이 새우 부추 딤섬 딤섬 종류 메뉴판 주문 육즙 새우 육지 바다 동시 딤섬 식감 살살 만루 재생 만루 가족 딤섬 도중 슬슬 메인 요리 입장 쌀국수 소고기 볶음 볶음 쌀국수 중화요리 버전 보시 사실 사진 자극 편입 소고기 면발 역시 두툼 스타일 태국 베트남 식당 유물 쌀국수 볶음 중화요리 느낌 해석 짬뽕 홍합 국물 국물 보이 해산물 짬뽕 물가 상승 재료 홍합 짬뽕 감동 오늘 소고기 볶음밥 알록달록 색깔 짜장 소스 간이 자극 이지 편이 소화 소고기 야채 달걀 조합 수가 오늘 가족 고려대 중식 만루 중화요리 메뉴 국적 분위기 승부 고려대역 식사 가세 만루 서울특별시 동대문구 회기로 블로그 체크 장소,제기동맛집 고려대밥집 동대문구중식당 제기동밥집 고려대중식당 고려대맛집 북경오리 북경식탕수육 꿔바로우 볶음면 짬뽕맛집 홍합짬뽕 소고기볶음밥 중국집볶음밥 중화요리집 딤섬맛집
87,육즙 가득 샤오롱바오 강추 고려대 근처 중식 맛집 만루,오늘 성북구 위치 중식 맛집 후기 만루 주소 서울 동대문구 회기로 고려대역 출구 연락처 영업 매일 내부 사장 중국 사랑 의자 식탁 인테리어 전문 중식 진짜 중국 메뉴판 북경오리 마라샹궈 샤오롱바오 양장 오향 장육 해파리 냉채 오이 냉채 메뉴 처음 중국 음식 요리 소고기 요리 해물 요리 종류 신기 전복 요리 해물 요리 가지 요리 코스 요리 정도 가격 대접 코스 메뉴 진짜 어르신 모시 대접 먹기 주문 메뉴 짜장면 차돌박이 짬뽕 샤오롱바오 짜장면 춘장 짜장면 메뉴 호다닥 수타면 글해 짜장 소스 소스 돼지고기 양파 양배추 소스 진짜 짜장 보고 정도 차돌박이 짬뽕 비주 비주 차돌박이 짬뽕 그닥 신라면 매운 차돌박이 여러 오징어 짜장면 면발 역시 수타면 짜장면 샤오롱바오 건가 순간 가격 지불 아래 육즙 먹기 돼지 통실통 고기 통째 지금 고려대 근처 위치 중식 맛집 만루 방문 후기 오늘 결론 샤오롱바오 강추 만루 서울특별시 동대문구 회기로 블로그 체크 장소,
88,고려대 제기동 만루 중국 전통 느낌 그대로 고려대중식당,고려대 중식 만루 위치 서울 동대문구 회기로 영업 예약 주차 가게 가능 만루 서울특별시 동대문구 회기로 블로그 체크 장소 대학원생 시절 자주 중식 최근 모델링 간판 방문 고려대 중식 만루 고려대역 근처 홍릉수목원 위치 만루 영화 중국 길거리 분위기 외관 건물 통째 운영 내부 인테리어 뭔가 느낌 초록색 벽지 빨간색 포인트 인테리어 정말 중국 느낌 개별 좌석 단체룸 준비 좌석 회식 오거 가족 모임 분위기 자리 메뉴판 메뉴 정말 메뉴판 정독 재미 사이 양배추 피클 단무지 사이 정말 중식 태구 그거 보기 가장 주문 싸랑 칭따오 추리 탕수육 노래 시기 탕수육 주문 메뉴판 이름 추리 한국 탕수육 설명 추리 이름 일반 튀김 찹쌀 탕수육 보기 해도 폭신 쫀득 비주 소스 야채 한번 불맛 쪼온독 찹쌀 소스 찹쌀 반죽 바삭 쫀독 식감 예술 돼지고기 식감 튀김 자체 슴슴한데 소스 찰떡 궁합 기절 쇼룽뽀우 메뉴판 딤섬 추가 주문 육즙 금은 샤오룽 바오 육즙 국물 먼저 고기 감칠맛 최고 중국 대만 딤섬 요리 태구 주변 테이블 가족 식사 근처 중식 제기동 맛집 만루 추천,
89,고려대 중식 식사 만루,고려대 중식 식사 만루 나니 살짝 마지막 마지막 추위 아쉬움 방문 국물 쿄쿄 입구 포스 무진장 단체 석도 운영 매일 단체 이용 가능 포장 예약 유아 의자 주차 네이버 지도 공간 검색 생활 장소 버스 지하철 도로 모든 공간 정보 검색 지도 방문 저녁 주말 단체 고려대 중식 만루 메뉴판 중식 짜장면 짬뽕 종류 주류 음식 페어 자장면 차돌박이 짬뽕 쇼룽뽀우 음식 사진 기도 쉬움 기본 반찬 가지 단무지 사이 양배추 피클 먼저 차돌박이 짬뽕 한눈 국물 면도 하니 양은 인분 고기 전혀 정도 해장 먹기 차돌박이 자장면 검은색 요리 쿄쿄 소스 정도 단맛 어쩐지 고려대 중식 만루 아주 칭찬 사이드 쇼룽뽀우입니 샤오룽 바오 거임 위생 은박 정말 육즙 장난 쫀득합니 고려대 중식 식사 만루 후기 대학가 근처 브레이크 타임 손님 계속 쿄쿄 저녁 예약 주변 회사원 이용 식사 피크타임 사람 항상 하니 참고 방문 고려대 중식 식사 만루 재생 접기 고려대 중식 식사 만루 만루 서울특별시 동대문구 회기로 블로그 체크 장소 고려대중식당 고려대 만루 만루,고려대중식당 고려대향만루 향만루
90,제기동 고려대 고급 중식 만루 추천,고급 중식 만루 부부 제기동 위치 고급 중식 만루 중화요리 동대문구 중식 만루 영업 주차 주소 서울 동대문구 회기로 영업 주차 정보 무료 주차 가능 만루 제기동 정도 자리 제기동 맛집 인근 고려대학교 고려대 학생 고려대 밥집 단체 겸비 주차 가능 사실 주변 주차 식당 단체 모임 식당 별로 만루 주차 가량 가족 모임 제기동 가족 모임 맛집 만루 제격 제기동 밥집 만루 내부 분위기 그냥 중국집 인테리어 보고 이건 그냥 중국집 고급 중식 생각 어감 차이 실제 내부 인테리어 고풍 진짜 중국 느낌 직원 중국어 사용 이색 이기 고려대 중식 만루 제일 모임 만루 동대문구 중식 만루 청록색 은색 인테리어 손님 시기 중국 오픈 주년 이벤트 만루 제기동 오픈 한지 사이 제기동 고려대 맛집 자리 방문 손님 중식 맥주 고량주 이벤트 연태 고량주 정말 가성 고려대 중식 만루 메뉴 슬라이드 만루 정말 메뉴 요리 진짜 인터넷 검색 진짜 전문점 중식 해도 먹기 메뉴 북경오리 중국 새우 요리 송이 해삼 관자 요리 북경 로우 두부 단체 모임 코스 요리 코스 요리 인원 구성 코스 요리 가성 요리 스프 식사 코스 요리 양은 코스 고민 중식 주류 메뉴 제기동 밥집 만루 쌀국수 소고기 볶음 호펀 마침 호펀 쌀국수 호펀 주문 반장 달작 지근 제기동 맛집 만루 베이식 로우 로우 북경 베이식 베이식 간장 로우 항상 로우 웬걸 로우 쫀득쫀득 아시 고려대 밥집 만루 가지 부부 가지 가지 뭐합 가지 소스 합격 가지 짬뽕 국물 짬뽕 국물 짬뽕 이서 기기 나중 흔적 진짜 동대문구 중식 만루 추천 만루 서울특별시 동대문구 회기로 블로그 체크 장소,
91,고대 맛집 만루 제기동 중식 추천 삼선짜장 샹라샤 마이,제기동 고려대 모임 장소 만루 서울특별시 동대문구 회기로 블로그 체크 장소 만루 서울 동대문구 회기로 매일 주차 가능 아기 의자 고대 근처 중식 맛집 만루 중국 분위기 물씬 중식 점심 후기 포스팅 만루 호선 고려대역 출구 도보 정도 만루 매장 외관 중식 느낌 뿜뿜 만루 소품 중국 현지 분위기 만루 테이블 모임 가족 모임 장소 추천 친구 방문 벽쪽 초록색 벽지 빈티 분위기 원형 테이블 안쪽 형태 테이블 예약 오시 테이블 비롯 벽쪽 테이블 중국 전통 여성 그림 자리 준비 만루 메뉴판 중국 칭다오 여행 중국 식당 메뉴판 메뉴 이름 사진 샹라샤 마이 삼선짜장 주문 마이 삼선 짜장 해물 돼지고기 듬뿍 짜장 샹라샤 친구 추천 처음 메뉴 매콤 설명 새우 요리 처음 소스 감칠맛 매콤 새우 튀김 바삭 고추 조합 최고 만루 삼선짜장 마이 샹라샤 메뉴 가족 외식 모임 장소 추천 만향루 점심 후기 포스팅,
92,동대문 장안동 술집 장한평 술집 대구 뭉티기 주한,장한평 술집 장안동 술집 뭉티기 사시미 전문 주한 협찬 사진 파나소닉 믹스 처음 방문 장한평역 장안동 골목 골목 동네 감성 마장동 인접 한우 취급 식당 더러 동대문구 장안동 장안동 술집 장한평역 술집 주한 오늘 술집 주한 고이 메뉴 안내 한우 고기 대구 직송 뭉티기 소주 한잔 실내 분위기 한번 메뉴 주한 스페셜 세트 감성 멘트 동글동글 포차 느낌 테이블 정도 크기 요란 인테리어 정말 골목 술집 느낌 발견 사인 사장 야구 나라 대한민국 야구 로서 한잔 장안동 술집 장한평 술집 상의 메뉴판 전체 메뉴판 술집 특이 메뉴판 난리 코팅 메뉴판 센스 주한 스페셜 세트 뭉티기 세트 육육 우육 단우 육회 요즘 문어 새우등 메뉴 각기 콜라보 심플 메뉴 육회 사시미 오뎅 스팸후라이 사이드 메뉴 술밥 한우 육회 비빔밥 전복 버터 청어 취해 젓가락 방지 주문 히든 메뉴 라면 짜파게티 식사 메인 뭉티기 참이슬 주문 친구 한라산 주문 한라산 골목 술집 주류 리스트 추가 여분 준비 아이스 버킷 사장 센스 폭발 주방 멀티 보시 사장 재료 손질 장안동 술집 장한평 술집 주한 메인 메뉴 기본 팔팔 뚝배기 먼저 뭉티기 소고기 고기 뭉티기 한잔 안주 뭉티기 추가 기본 제공 안주 친구 도둑 간도 아주 주야장천 추가 소주 장안동 술집 장한평 술집 주한 재생 접기 뭉티기 한라산 오늘 메인 메뉴 상의 뭉티 기입 사시미 육회 틈틈이 뭉티기 정말 만이 인스타 유행 메뉴 짝꿍 역시 트렌드 뭉티기 사실 사시미 지역 뭉티기 고기 사시미 묵적 그냥 뭉텅뭉텅 뭉티기 고기 사시미 느낌 느낌 오늘 상이 양념장 기름 한우 고기 가격 대비 준수 짝꿍 모금 하니 순삭 소주 국룰 몰래 모가지 결제 나중 발견 메뉴 인근 거주 한번 주한 덕분 장안동 처음 방문 골목 골목 노포 한우 정감 동네 뭉티기 주한 서울특별시 동대문구 한천로 주한 블로그 체크 장소 주한 서울특별시 동대문구 한천로 주한 휴무 주차 도보 거리 주차 군데 부득이 유료 공영 주차장 이용 권장 주한 장안동 술집 장안동 사시미 장안동 육회 장한평 술집 장한평 사시미 장한평 육회 동대문 뭉티기 대구 뭉티기 장안동 뭉티기 장한평 뭉티기,주한상 장안동술집 장안동육사시미 장안동육회 장한평술집 장한평육사시미 장한평육회 동대문뭉티기 대구뭉티기 장안동뭉티기 장한평뭉티기
