,title_pos,content_pos,hash_tag
151,안주 한우 스페셜 투쁠 육회 장한평맛집 주한,주한 서울 동대문구 한천로 주한 일요일 정기 휴무 커플 장한평 안주 발견 몸소 하늘 구멍 상관 주한 서울특별시 동대문구 한천로 주한 장한평역 출구 거리 우리은행 사거리 위치 요리 주점 주한 한우 사시미 한우 육회 문어 숙회 계절 해산물 한우 육회 해산물 만남 벌써 원형 테이블 아기자기 분위기 벽화 부엉 오만원 한우 해산물 조합 여러 세트 메뉴 메인 메뉴 사이드 메뉴 준비 한우 육회 동계 메뉴 겨울 계절 메뉴 하니 참고 아래 스페셜 메뉴 주문 구성 내용 재료 수급 변동 주문 조리 정도 스페셜 메뉴 보고 커플 기본 안주 콩나물국 직접 멸치 육수 자극 국물 음식 진짜 기본 안주 참기름 직접 참기름 처음 비빔밥 커플 도착 주문 주한 주문 얼음 양동이 세트 계산 차감 우린 마심 한우 스페셜 등장 테이블 크게 차지 투쁠 사시미 육회 직접 수제 떡갈비 전복 버터 구이 통영 문어숙회 새우 숙회 때깔 비주 그냥 임금님 기분 먼저 투쁠 육회 계란 노른자 그냥 가끔 노른자 살짝 달달 그냥 살살 육회 입맛 이제 큰일 역시 투쁠 사시미 모든 사진 보정 원본 그대로 때깔 사장 말씀 와사비 살짝 수제 참기름 주한 소스 감칠맛 평생 사시미 처음 황송 식감 아주 전복 구이 떡갈비 직접 시장 수제 떡갈비 수제 떡갈비 건가 이제 떡갈비 정도 와사비 소스 살짝 와사비 때문 자꾸만 나중 추가 주문 문어 회랑 새우 회도 기지 글촉촉 갑자기 여보 뭐얔 요리 사이드 신경 오이 피클 말랭이 젓갈 시판 직접 초토화 육회 진짜 이서 한우 스페셜 뚝딱 안주 추가 주문 수제 떡갈비 주문 추가 주문 떡갈비 소스 와사비 마요네즈 조합 소스 때문 감칠맛 해물 라면 주문 새우 가운데 기도 신라면 정도 느낌 정말 안주 안주 꿀떡 꿀떡 주변 술꾼 소개 장한평맛집 주한 사장 동대문술집 장안동 술집 동대문 맛집 장한평역맛집 동대문 육회 맞팔 스타 그램 술집 육회 맛집 사시미 맛집 장안동 포차 장안동 회식 동대문 회식 동대문데이트 동대문 이자카야 장안동 데이트 문어 숙회 장한평역 술집 동대문 주한 서울특별시 동대문구 한천로 주한,장한평맛집 주한상 동대문술집 장안동술집 동대문맛집 장한평역맛집 동대문육회 먹팔맞팔 먹스타그램 천호술집 육회맛집 육사시미맛집 장안동포차 장안동회식 동대문회식 동대문데이트 동대문이자카야 장안동데이트 문어숙회 장한평역술집 동대문핫플
152,장안동맛집 작렬 곱창 본점 가성 동대문 곱창 맛집 추천,작렬 곱창 본점 서울특별시 동대문구 답십리로 동대문구 장한평역 작렬 곱창 본점 주소 서울 동대문구 답십리로 전화번호 영업 매일 특이 사항 포장 배달 예약 무선 인터넷 남녀 화장실 구분 밥줘 오늘 드릴 곱창 맛집 남자친구 동네 동네 맛집 인기 몇번 경험 토대 가성 비도 추천 보아 동대문구 장안동 위치 양도 가격 맛집 작렬 곱창 본점 리뷰 시작 작렬 곱창 동대문 곱창 추천 장안동 야채 곱창 장안동 돼지 곱창 장안동맛집 장안동 술집 장안동곱창 맛집 곱창 맛집 장안동 데이트 장한평역 곱창 장한평역맛집 장한평역 장안동 장안 맛집 장안 술집 야채 곱창 맛집 장안 곱창 장안동 닭발 위치 이동 수단 작렬 곱창 본점 서울특별시 동대문구 답십리로 작렬 곱창 본점 장한평역 답십리역 사이 위쪽 대중교통 이용 장한평역 출구 버스정류장 근처 도착 자차 이용 주차 지원 주변 주차장 추천 가게 외관 대중교통 이용 작렬 곱창 골목 가게 소개 종로 프라자 악국 편의점 사이 골목 초입 위치 장안 동사무소 근처 안내 지도 입력 가게 내부 작렬 곱창 지상 지하 사용 사진 반지하 내부 상층 신발 좌석 정도 가게 내부 협소하 인기 금방 경우 참고 메뉴판 작렬 곱창 본점 메뉴판 작렬 곱창 곱창 곱창 제일 곱창 곱창 인분 가격 손님 인기 편입 예전 방문 곱창 인분 오늘 보고 야채 곱창 인분 직화 무뼈닭 주문 상차림 주문 기본 상차림 버너 판이 곱창 조리 불판 조리 도구 정도 기본 메뉴 미역국 채소 양파 절임 양념 소스 마요네즈 무쌈 개인 기본 주시 미역국 리필 양념 곱창 마다 입가심 먹기 처음 서빙 수저 안보 미역국 메뉴 소개 직화 무뼈 닭발 처음 먼저 직화 무뼈 닭발 원래 닭발 무뼈 닭발 발라 가끔 메뉴 닭발 기억 사이드 개념 닭발 사진 닭발 라며 손가락 남치닠 닭발 무뼈 닭발 닭발 살부 아주 쫀득 곱창 직화 닭발 불향 살짝 매콤 매콤 야채 곱창 메인 메뉴인 곱창 깔깔 깔깔 진짜 마다 진짜 후기 인분 이서 정도 라면 아마 인분 술안주 먹기 생각 보이 야채 곱창 인분 클라스 남친 워후 인분 심보 야채 곱창 곱창 당면 사리 야채 사리 거기 제일 차지 곱창 마요네즈 곱창 양념 생각 찐하닥소 곱창 한번 당면 사리 한번 국수 진미 야채 곱창 양념 여진 당면 사리 다시 한번 진짜 많죠잉 이서 진짜 매우 식사 장담 사실 생각 인분 볶음밥 생각 닭발 중간 중간 요것 별미 무뼈 닭발 직화 조리 곱창 메인 사실 끝맛 살짝 맵칼칼 달짝찌 처음 야채 곱창 인분 커플 인분 뭔가 때문 아주 식사 곱창 몇번 닭발 처음 직화 닭발 기존 닭발 대화 주먹밥 주문 생각 야채 곱창 경우 곱창 야채 곱창 비슷 매콤한 저서 양도 기준 매우 평일 주말 인기 웨이팅 수도 참고 오늘 도움 밥줘 영은,작렬곱창 동대문곱창추천 장안동야채곱창 장안동돼지곱창 장안동맛집 장안동술집 장안동곱창맛집 곱창맛집 장안동데이트 장한평역곱창 장한평역맛집 장한평역가볼만한곳 장안동가볼만한곳 장안맛집 장안술집 야채곱창맛집 장안곱창 장안동닭발 작렬곱창본점 장한평역 답십리역
153,동대문 곱창 맛집 작렬 곱창 본점 포장 후기,베키 오늘 동대문 노포 곱창 맛집 작렬 곱창 본점 후기 작렬 곱창 본점 서울 동대문구 답십리로 매일 작렬 곱창 본점 서울특별시 동대문구 답십리로 블로그 체크 장소 동대문 노포 맛집 작렬 곱창 동대문 노포 동대문 곱창 맛집 클립 작렬 곱창 동대문 장안동 줏대 곱창 가게 흔적 보이 쟁쟁 연애 작렬 곱창 맛집 라며 한번 추억 근처 추억 포장 주문 메뉴 곱창 막창 종류 학생 끼리 할인 주시 정도 야채 곱창 고민 직화 곱창 직화 곱창 쟁쟁 막창 주문 베키 직화 곱창 양념 구이 막창 동대문 맛집 장안동맛집 작렬 곱창 동대문 작렬 곱창 동대문 곱창 맛집 동대문 막창 주문 방문 포장 손님 정도 구경 솜씨 정말 포장 직화 곱창 양념 막창구이 윤기 좌르륵 정말 보이 양념 구이 막창 쟁쟁 최애 기지 특징 곱창 파라 직화 곱창 주문 채소 직화 곱창 곱창 더욱 증폭 대박 특제 소스 상추 조합 더욱 꿀맛 정말 작렬 곱창 기지 평소 막창 동대문 장안동 작렬 곱창 분점 전국 배달 주변 추천 동대문 맛집 장안동맛집 작렬 곱창 동대문 작렬 곱창 동대문 곱창 맛집 동대문 막창,작렬곱창 동대문노포 동대문곱창맛집 동대문맛집 장안동맛집 작렬곱창 동대문작렬곱창 동대문곱창맛집 동대문막창 동대문맛집 장안동맛집 작렬곱창 동대문작렬곱창 동대문곱창맛집 동대문막창
154,동대문 장안동 작렬 곱창 본점 야채 곱창 맛집,동대문 장안동 작렬 곱창 본점 야채 곱창 맛집 언니 동대문 언니 회사 근처 근처 야채 곱창 맛집 거기 쇠주 한잔 오오오오 야채 곱창 야채 곱창 맛집 무려 본점 마음 언니 언니 야채 곱창 맛집 작렬 곱창 체인점 인터넷 배달 맛집 맛집 칭찬 일색 작렬 곱창 동대문 장안동 작렬 곱창 메뉴 야채 곱창 곱창 막창 돌뼈 판매 은근 메뉴 판매 돼지껍데기 파네 학생 끼리 손님 판매 학생 매장 손님 계서 부분 못햇음 의자 자리 입구 자리 매장 내부 손끝 라서 그냥 계속 기본 반찬 무쌈 메뉴 미역국 따뜼 야채 곱창 인분 막창 인분 주문 인분 주문 무조건 주문 동대문 장안동 작렬 곱창 인분 주문 막창 야채 곱창 먼저 인분 이양 생각 곱창 야채 곱창 그냥 매코롬 매운 자꾸 생각 양념 야채 곱창 대표 메뉴인 추천 막창 막창 파랑 마늘 마늘 가다리 다가 소금 막창 그냥 막창 쫀득 달걀찜 달걀찜 주문 생각 뚝배기 달걀찜 싹싹 볶음밥 생각 먹었넹 소주 맥주 아주 싹싹 볶음밥 싹싹 아주 싹싹 볶음밥 진리 볶음밥 생각 작렬 곱창 야채 곱창 양념 양념 생각 동대문 장안동 작렬 곱창 후기 야채 곱창 맛집 양념 메인 인분 주문 한번 취저 막창 간다 양념 막창 돌뼈 보고 작렬 곱창 본점 체인점 인터넷 배달 근처 입맛 개인 쟁의 개인 후기 작렬 곱창 본점 서울특별시 동대문구 답십리로,
155,장안동 맛집 전통 야채 곱창 맛집 작렬 곱창 본점,빼린 오늘 야식 장안동 곱창 맛집 작렬 곱창 본점 후기 작렬 곱창 본점 서울 동대문구 답십리로 영업 연락처 주차장 포장 배달 가능 예약 가능 단체 장안동 맛집 작렬 곱창 본점 종로 프라자 약국 편의점 사이 골목 초입 위치 장안 동사무소 근처 영업 오후 새벽 연중 운영 학생 할인 메뉴 학생 곱창 인분 단돈 매장 식사 입구 포장 손님 서서 대기 작렬 곱창 메뉴판 크게 포장 주문 곱창 막창 인분 포장 가능 장안동 맛집 작렬 곱창 본점 내부 작렬 곱창 본점 내부 노포 맛집 감성 낙서 세월 흔적 테이블 식당 내부 환기 테이블 간격 작렬 곱창 메뉴판 철판요리 야채 곱창 곱창 순대 인분 기준 이류 소금 막창 양념 막창 곱창 직화 무뼈 닭발 초반 곱창 창의 효능 곱창 콜레스테롤 불포화지방산 철분 비타민 콜라겐 작렬 곱창 본점 당일 도축 국내 곱창 사용 무뼈 닭발 튤립 닭발 술안주 먹기 테이블 구비 앞치마 곱창 조리 상태 상황 대비 앞치마 작렬 곱창 본점 기본 세팅 미역국 상추 마늘 당근 양파 쌈무 곱창 반찬 소스 종류 초장 마요네즈 가지 마요네즈 곱창 환상 궁합 랍니 미역국 간도 곱창 먹기 입가 심용 작렬 곱창 야채 곱창 인분 조리 상태 때문 불로 상태 그윽 불향 솔솔 군침 절로 야채 곱창 특유 매콤 입맛 당구 양념 매력 현기증 곱창 당면 야채 야채 곱창 깻잎 인분 인지 양도 둘이서 가장 먼저 곱창 매콤 맛깔 양념 쫄깃 당면 추가 작렬 곱창 야채 곱창 당면 당면 양념 가득 제대로 곱창 쌈무 상큼 쌈무 매콤한 곱창 입안 마요네즈 매운 중화 동시 계속 역시 야채 곱창 사랑 장안동 맛집 작렬 곱창 야채 곱창 후기 재생 장안동 맛집 작렬 곱창 야채 곱창 후기 야채 곱창 감칠맛 상추 곱창 야채 가득 작렬 곱창 상추 쌈무 조합 양념 사리 최강 술안주 제격 장안동 맛집 작렬 곱창 작렬 곱창 소금 닭똥집 소금 닭똥집 주문 양파 마늘 닭똥집 노릇 닭똥집 마니아 소리 질럿 쫄깃 근위 마늘 노릇 양파 소금 쫄깃 식감 일품 닭똥집 구이 가득 조리 불로 계속 상태 식감 계속 안주 맛집 인정 마지막 야채 곱창 볶음밥 추가 주문 볶음밥 야채 곱창 매콤한 양념 상추 김치 제대로 작렬 곱창 야채 곱창 볶음밥 마지막 화룡 점정 볶음밥 야곱 먹기 순간 위해 곱창 당면 착착 감기 감칠맛 곱창 당면 야채 동대문 맛집 작렬 곱창 볶음밥 사진 다시 비주 장안동맛집 곱창 맛집 작렬 곱창 본점 추천 국내 곱창 사용 쫄깃 식감 야채 곱창 매콤한 술안주 작렬 곱창 오늘 작렬 곱창 본점 위치 작렬 곱창 본점 서울특별시 동대문구 답십리로 야채 곱창 장안동맛집 장안동 야채 곱창 장안동 술집 장안동안주 맛집 장안동 야곱 작렬 곱창 곱창 맛집 서이추 환영,장안동맛집 곱창맛집 작렬곱창 야채곱창 장안동맛집 장안동야채곱창 장안동술집 장안동안주맛집 장안동야곱 작렬곱창 곱창맛집 서이추환영
156,추억 장안동맛집 작렬 곱창 본점,오늘 여자친구 방문 장안동곱창 맛집 작렬 곱창 본점 소개 작렬 곱창 본점 위치 서울 동대문구 답십리로 영업 매일 휴무 브레이크 타임 전화번호 네이버 지도 작렬 곱창 본점 서울특별시 동대문구 답십리로 블로그 체크 장소 매장 전경 장안동맛집 작렬 곱창 여자친구 주변 여자친구 고등학생 단골 맛집 방문 작렬 곱창 내년 이면 벌써 주년 매장 메뉴 가격 영업 곱창 막창 인분 포장 학생 할인 가격 사장 배려 정말 매장 내부 요즘 오픈 곱창 추억 장소 느낌 학생 표시 낙서 정말 고등학생 단골 가면 항상 표시 기억 무뼈 닭발 튤립 닭발 사진 돼지 곱창 창의 효능 영수증 리뷰 작성 서비스 설명 야채 곱창 보고 곱창 고민 치즈 야채 곱창 인분 소금 막창 인분 공기밥 주문 이류 인분 주문 기본 미역국 상추 가지 소스 양파 절임 미역국 국물 간도 입맛 얘기 소금 막창 먼저 소금 막창 버섯 양파 파가 여자친구 버섯 정말 여자친구 보기 막창 비주 노릇 노릇 그냥 양념 소스 정말 쫀득쫀득해 상추 사실 여자친구 상추 더욱 막창 치즈 야채 곱창 정말 인분 절대 인분 야채 곱창 치즈 잔뜩 깻잎 장안동곱창 맛집 냄새 전혀 남녀 노소 먹기 곱창 냄새 작렬 곱창 한번 추억 장안동맛집 작렬 곱창 본점 재생 추억 장안동맛집 작렬 곱창 본점 곱창 정말 아주 쫄깃 쫄깃 양념 먹기 매운 수도 당면 치즈 쭉쭉 보이시 야채 곱창 곱창 치즈 곱창 취향 치즈 치즈 곱창 강추 방문 작렬 곱창 오늘 볶음밥 방문 볶음밥 소개 장안동곱창 맛집 작렬 곱창 강추 방문 의사 장안동맛집 장안동곱창 장안동 돼지 곱창 작렬 곱창 동대문구 곱창 동대문 맛집 동대문구 맛집 장안동맛집 추천 장안동곱창 맛집 장안동 데이트 곱창 맛집 답십리맛집 답십리곱창 서이추 서이추 환영,장안동맛집 장안동곱창 장안동돼지곱창 작렬곱창 동대문구곱창 동대문맛집 동대문구맛집 장안동맛집추천 장안동곱창맛집 장안동데이트 곱창맛집 답십리맛집 답십리곱창 서이추 서이추환영
157,장안동 야채 곱창 작렬 곱창,작렬 곱창 본점 서울특별시 동대문구 답십리로 블로그 체크 장소 작렬 곱창 본점 매일 진짜 야채 곱창 볶음밥 역대 곱창 맛집 껍데기 궁금 밑반찬 미역국 살짝 매콤 맵진 야곱 인분 진짜 대박 양념 양도 인분 가야,
158,장안동 야채 곱창 작렬 곱창 본점,순대 야채 곱창 오빠 언니 이서 저녁 장안동 돼지 곱창 작렬 곱창 본점 방문 작렬 곱창 본점 시작 진짜 요리 직원 가격 정말 곱창 막창 인분 포장 학생 천원 정말 장사 낙서 분위기 물씬 의자 착석 테이블 신발 자리 마련 기본 상차림 미역국 상추 마늘 당근 소스 마요네즈 쌈무 양파 장아찌 미역국 스탈 짭쪼롬하 야채 곱창 인분 순대 곱창 인분 주문 야채 곱창 순대 곱창 야채 곱창 순대 곱창 요청 직원 말씀 주시 작렬 곱창 재생 접기 작렬 곱창 인분 진짜 순대 곱창 조리 계속 호일 타용 당면 호일 주의 당면 하니 소맥 술술 소스 마요네즈 소스 듬뿍 달라 요청 정도 상추 곱창 마늘 소스 당면 꿀맛 소맥 소주 닭발 주문 직화 매콤 튤립 닭발 인분 직화 매콤 튤립 닭발 주문 여윽시 불맛 튤립 닭발 정말 살짝 볶음밥 인분 추가 볶음밥 인분 인분 주문 오오 볶음밥 주문 마지막 볶음밥 양도 가격 이유 장안동 돼지 곱창 작렬 곱창 작렬 곱창 본점 서울특별시 동대문구 답십리로 작렬 곱창 본점 서울특별시 동대문구 답십리로 매일 포장 배달 예약 작렬 곱창 동대문 곱창 추천 장안동 야채 곱창 장안동 돼지 곱창,작렬곱창 동대문곱창추천 장안동야채곱창 장안동돼지곱창
159,동대문 숯불 제대로 장안동맛집 작렬 곱창,오늘 곱창 볶음 답십리맛집 작렬 곱창 곱창 볶음 진짜 숯불 기대 작렬 곱창 본점 서울 동대문구 답십리로 매일 작렬 곱창 본점 서울특별시 동대문구 답십리로 블로그 체크 장소 회기역 근처 버스 리자 마자 작렬 곱창 간판 외관 맛집 포스 줄줄 철판 보이 매장 내부 곱창 운영 정말 벽면 사람 세월 지랄 곱창 막창 닭발 메뉴 고민 야채 곱창 메인 야곱 데리야끼 막창 주문 야채 곱창 데리야끼 막창 주먹밥 볶음밥 기본 구성은 배추 당근 양파 장아찌 쌈무 마요네즈 매콤 소스 미역국 사장 진짜 센스 매콤한 곱창 마요네즈 진짜 아시 거기 다가 미역국 기본 반찬 구성 곱창 주먹밥 크게 대망 곱창 매콤 비주 깻잎 데코 숯불 곱창 꼬들 양념 살짝 매콤한 양념 진짜 철판 초벌 볏짚 직화 불맛 곱창 기지 꼬들해 완전 스타일 쌈무 배추 배추 배추 식감 배추 달달 장안동곱창 맛집 발견 야곱 데리야끼 막창 부추 소스 듬뿍 아시 창의 그냥 쫄깃 소스 부추 역시 야곱 살짝 매콤 데리야끼 막창 매운 중화 이건 최고 조합 양념 볶음밥 주문 김치 먼저 인분 진짜 바닥 노릇 소스 볶음밥 뭐해 답십리맛집 곱창 막창 역시 볶음밥 진짜 불향 지난 신당 곱창 거기 매운 고추 불맛 곱창 식감 곱창 기지 꼬들꼬들 야곱 양념 진짜 아시 양념 정말 장안동곱창 답십리 막창집 작렬 곱창 추천 작렬 곱창 본점 네이버 방문자 리뷰 블로그 리뷰,
160,장안동 야채 곱창 돼지 곱창 맛집 작렬 곱창 본점,작렬 곱창 오늘 장안동 야채 곱창 돼지 곱창 맛집 작렬 곱창 본점 포스팅 저번 블루 라이트 안경 짝꿍 저녁 고민 찰나 골목 냄새 범인 야채 곱창 사장 직접 모습 보고 내부 인테리어 벽면 가득 낙서 세월 흔적 안쪽 테이블 장안동 토박이 짝꿍 장안동 야채 곱창 맛집 이자 단골 이제 야채 곱창 곱창 순대 곱창 모듬 취향 내장 구성 주문 야채 곱창 인분 계란찜 볶음밥 카스 맥주 돼지 곱창 창의 효능 대해 서도 곱창 소화 무기질 칼로리 다이어트 효과 접수 완료 반찬 세팅 미역국 상추 당근 마늘 쌈무 양파 장아찌 마요네즈 고추장 소스 미역국 간도 한번 리필 야채 곱창 인분 야채 곱창 인분 테이블 대충 정말 야채 곱창 곱창 차이 야채 곱창 당면 곱창 당면 곱창 야채 곱창 당면 무조건 야채 곱창 인분 평소 당면 사리 별로 야채 곱창 당면 아래 잔뜩 다이어트 내일 유독 어쩜 곱창 중독 양념 인상 돼지 곱창 입문 마요네즈 고추장 소스 역시 돼지 곱창 마요네즈 소스 상추 마늘 필수 쌈무 상큼 질리 계란찜 매콤한 음식 계란찜 짝꿍 위해 건데 푸딩 곱창 중간 중간 속도 단백질 보충 볶음밥 곱창 돼지 곱창 후식 볶음밥 돼지 곱창 양념 거기 볶음밥 뭐해 김치 식감 화이트보드 판이 포장 주문 대박 실제 짝꿍 야채 곱창 작렬 곱창 포장 주문 맛집 작렬 곱창 본점 서울특별시 동대문구 답십리로 장안동 토박이 돼지 곱창 맛집 장안동 야채 곱창 작렬 곱창 작렬 곱창 작렬 곱창 본점 장안동맛집 장안동 돼지 곱창 장안동 야채 곱창 장안동곱창 장안동 야채 곱창 맛집 장안동 돼지 곱창 맛집 동대문구 곱창 추천 동대문구 야채 곱창 동대문구 돼지 곱창 동대문 야채 곱창 동대문 돼지 곱창 동대문 곱창 맛집 장안동곱창 맛집 장안동 배달 맛집 장안동 포장 맛집 장안동 술집 장안동 술집 추천,작렬곱창 작렬곱창본점 장안동맛집 장안동돼지곱창 장안동야채곱창 장안동곱창 장안동야채곱창맛집 장안동돼지곱창맛집 동대문구곱창추천 동대문구야채곱창 동대문구돼지곱창 동대문야채곱창 동대문돼지곱창 동대문곱창맛집 장안동곱창맛집 장안동배달맛집 장안동포장맛집 장안동술집 장안동술집추천
161,불금 장안동맛집 작렬 곱창 곱창 먹기,장안동맛집 장안동곱창 맛집 야채 곱창 맛집 장안동 닭발 작렬 곱창 주차 동대문 노포 맛집 동대문 맛집 내장 사랑 냇가 야채 곱창 짝꿍 오늘 야채 곱창 짝꿍 어제 작렬 곱창 본점 후기 장안동 운영 장안동곱창 맛집 작렬 곱창 장안 동점 본점 이후 맛집 가맹 동덕여대 근처 간판 보고 이름 처음 본점 본점 사실 작렬 곱창 본점 위치 지하철 살짝 가기 버스정류장 환승 한번 버스 다행 주차 가게 차량 정도 공간 곱창 주류 포장 공간 생각 외관 세월 보이지 한자리 계속 맛집 자리 잡고 장안 곱창 맛집 작렬 곱창 실내 세월 흔적 낙서 가신 흔적 대학생 진짜 낙서 흔적 유행 어머 유진 야곱 짝꿍 야채 곱창 인분 만원 역시 물가 진짜 이따 보시 행복 주문 한번 돼지 곱창 효능 다이어트 효과 양념 때문 영수증 리뷰 이벤트 서비스 리뷰 인지상정 작렬 곱창 재생 작렬 곱창 문후 화장실 사장 곱창 야곱 철판 차로 야곱 도착 소스 색감 곱창 돼지 곱창 효능 도축 국내 곱창 사용 흐물흐물 느낌 쫄깃 안나 소스 진짜 소스 진짜 매콤 기지역 곱창 소스 나중 소금 구이 막창 소스 마요네즈 소스 한번 양념 매콤 순화 위해 테이블 데리야끼 막창구이 그것 소금 구이 막창 불향 막창 일반 곱창 막창 막창 인분 야곱 인분 막창 살짝 후회 종목 야곱 인분 막창 인분 인분 인분 인분 인분 그것 작렬 곱창 사실 아라하 메뉴 곱창 단짝 오늘 닭발 등장 직화 무뼈 닭발 콜라겐 덩어리 가면 적랄 닭발 야곱 소스 닭발 소스 직화 구이 불향 매콤한 소스 소주 안주 오늘 맥주 퍼레이드 이서 진짜 인분 거기 맥주 도저히 허리띠 테이블 볶음밥 자꾸 볶음밥 가면 마무리 기분 탄수화물 식탐 탄수화물 언니 하트 만들기 볶음밥 하트 볶음밥 언니 중랑천 작렬 곱창 본점 서울특별시 동대문구 답십리로 블로그 체크 장소 작렬 곱창 장안 본점 서울 동대문구 답십리로 매일 배민 요기 쿠팡 주문 가능,장안동맛집 장안동곱창맛집 야채곱창맛집 장안동닭발 작렬곱창주차 동대문노포맛집 동대문맛집
162,장안동 맛집 추천 야채 곱창 작렬 곱창,오늘 장안동 맛집 추천 야채 곱창 작렬 곱창 리뷰 작렬 곱창 본점 서울특별시 동대문구 답십리로 블로그 체크 장소 장안동 맛집 추천 야채 곱창 작렬 곱창 진짜 최근 야채 곱창 공부 친구 밥약 잡고 가게 입구 야곱 스멜 사장 곱창 보고 영업 연중 메뉴판 가격 보고 진짜 학생 야채 곱창 인분 만원 가게 내부 모습 온돌방 식탁 온돌방 진짜 바닥 세상 메뉴판 야채 곱창 인분 볶음밥 소금 구이 막창 주문 밑반찬 미역국 소스 초장 소스 소스 진짜 분위기 학창시절 작렬 곱창 야채 곱창 인분 볶음밥 주문 야채 곱창 실화 진짜 양도 곱창 곱창 양념 진짜 존맛탱 당면 당면 진짜 세상 군침 초장 상추 경우 살짝 진짜 야채 곱창 마무리 무족 볶음밥 인분 진짜 볶음밥 곱창 양념 작렬 곱창 소금 구이 막창 막창 인분 테이블 막창 주문 막창 꼬치 와구쟉 와구쟉 쫄깃 정말 부추 소금 구이 막창 고추장 소스 정말 배달 정말 장안동 맛집 추천 야채 곱창 작렬 곱창 리뷰 작렬 곱창 작렬 곱창 본점 장안동맛집 장안동곱창 맛집 야채 곱창 맛집 장안동 야채 곱창 동대문 야채 곱창 막창 막창 맛집,작렬곱창 작렬곱창본점 장안동맛집 장안동곱창맛집 야채곱창맛집 장안동야채곱창 동대문야채곱창 막창 막창맛집
