,title_pos,content_pos,hash_tag
206,장안동 비법 양념 당면 곱창 조합 야채 곱창 맛집 작렬 곱창,작렬 곱창 본점 서울특별시 동대문구 답십리로 블로그 체크 장소 장안동 주민 맛집 작렬 곱창 오늘 정말 고등학교 자주 작렬 곱창 방문 장안동 사시 정도 정말 처음 뵀던 사장 지금 사장 학생 주머니 생각 곱창 양도 당면 야채 항상 고등학교 졸업식 친구 생일 시험 학교 일찍 축제 기간 항상 스페셜 기억 새록새록 지금 곱창 닭발 팔고 곱창 닭발 나이 작렬 곱창 방문 자리 학생 항상 테이블 결제 항상 학생 주머니 걱정 사장 대한 감사 표시 기본 반찬 미역국 쌈무 상추 당근 정말 반찬 기분 주문 시작 작렬 곱창 야채 곱창 정말 메인 금구 야채 곱창 배신 소금 막창 인분 주문 꿀팁 곱창 막창 인분 주문 소금 구이 막창 양념 막창 직화 무뼈 닭발 직화 튤립 닭발 직화 양념 스페셜 다리 직화 양념 스페셜 목살 정말 이름 가슴 주문 소금 막창구이 인분 사진 정말 아마 결론 정말 항상 가성 참고 소금 막창구이 이름 간이 처음 오잉 직원 초벌 원래 간이 소금 달라 양념 추천 간이 볶음밥 사발 추가 주문 볶음밥 곱창 양념 강추 인분 주문 공기밥 사발 처음 냉면 육수 바닥 후식 작렬 곱창 장안동 주민 라면 수가 맛집 고등학교 장님 기억 정도 자주 장안동 야채 곱창 야채 곱창 야채 곱창 곱창 돌뼈 내일 장안동 비법 양념 당면 곱창 조합 야채 곱창 맛집 작렬 곱창 재생 장안동 비법 양념 당면 곱창 조합 야채 곱창 맛집 작렬 곱창 식당 작렬 곱창 본점 음식 소금 막창구이 사발 볶음밥 위치 서울특별시 동대문구 답십리로 운영 매일 전화번호,
207,작렬 곱창 장안동 야채 곱창 맛집,설날 빠밤 이웃 새해 오늘 학창시절 자주 장안동 돼지 곱창 맛집 작렬 곱창 소개 솔직 후기 고고 작렬 곱창 본점 서울 동대문구 답십리로 영업 매일 새벽 포장 배달 예약 가능 가게 내부 외부 사가정역 회기역 지하철역 동네 학창시절 성인 자주 예전 닭갈비 집도 곱창 학생 이유 할인 때문 작렬 곱창 학생 할인 메뉴 학생 끼리 곱창 인분 학생 끼리 볶음밥 학생 끼리 음료수 할인 굿굿 실제 학생 은근 온돌 바닥 좌석 테이블 테이블 아래 자리 테이블 정도 간격 서로 예전 기억 아마 사람 식탁 추가 셋팅하 기도 사람 낙서 엄마 인테리어 메뉴 곱창 전문점 메뉴 야채 곱창 인분 소금 막창 인분 볶음밥 인분 레쉬 콜라 추가 야채 곱창 인분 포장 곱창 막창 인분 주문 가능 식탁 띵동벨 간혹 식당 띵동벨 당황 기본 셋팅 미역국 상추 당근 마늘 등쌈무 양파 장아찌 소스 곱창 소스 마요네즈 고추장 소스 주시 막창 소스 소금 후추 소스 주심 미역국 아빠 진리 소금 막창 인분 막창 처음 야채 곱창 돌뼈 기억 양은 편도 편도 불맛 꼬소 소금 후추 버섯 존맛임 막창 금방 야채 곱창 오금 이서 막창 인분 순삭 야채 곱창 인분 진짜 존맛 입맛 양념 동네 야채 곱창 곱창 살짝 된장 고추장 베이스 인위 양념 살짝 매콤한 신라면 정도 엽떡 매운 사람 기준 당면 야채 곱창 진짜 회사 동네 만이 진짜 추억 러시 볶음밥 막창 공기 역시 야채 곱창 볶음밥 포기 야채 김치 볶음밥 완전 볶음밥 맛집 인정 아빠 계속 꾹꾹 존맛 은박 지도 조심 진짜 맛집 인테리어 나름 분위기 야채 곱창 소스 진짜 근처 야채 곱창 오시 추천 볶음밥 필수 학생 곱창 오시 할인 소주 다했쥬 주류 가격 편임 위치 작렬 곱창 본점 서울특별시 동대문구 답십리로 작렬 곱창 장안동 야채 곱창 장안동 돼지 곱창,작렬곱창 장안동야채곱창 장안동돼지곱창
208,장안동 곱창 맛집 가성 작렬 곱창,이전 닭발 전문가 사실 야채 곱창 학위 가지 왕십리 곱창 근처 장안동 답십리 용답 돼지 곱창 성지 동대문구 토박이 동대문구 곱창 줄줄 자부 오늘 포스팅 명문 여중 휘경여고 학생 라면 장안동맛집 작렬 곱창 어른 방문 후기 작렬 곱창 장안동 곱창 맛집 야채 곱창 학위 야채 곱창 박사학위 아빠 방문 전과 차이 장안 본점 장안동 분점 친구 작렬 곱창 괜시리 작렬 곱창 본점 영업 매일 오후 새벽 연중 위치 서울특별시 동대문구 장안동 버스정류장 접근성 장난 휘경여고 수학학원 길목 학생 끼리 곱창 할인 고등학교 자주 학생 할인 학생 곱창 이서 인분 포장 손님 전화번호 노포 감성 테이블 안쪽 테이블 지하 지하 분위기 낙서 벽지 형광등 조명 분위기 노포 감성 작렬 곱창 메뉴 소개 장안동곱창 작렬 곱창 메뉴판 소개 철판요리 이류 투리 사이드 메뉴 손님 호다닥 체크 포인트 곱창 막창 인분 메뉴 경험 메인 사이드 메뉴 철판 구이 사이드 학생 곱창 요즘 야채 곱창 만원 휘경 후배 야채 곱창 인분 소금 막창 인분 계란찜 사발 맥주 볶음밥 나중 주문 양은 냄비 미역국 채소 소스 쌈무 양파 장아찌 미역국 횟집 미역국 미역국 절대 미역국 아시 배기 배추 요즘 상추 상태 배기 야채 곱창 어울림 야곱 소스 아래 소금 막창 소스 기름 소스 매콤 아빠 개인 생각 쌈무 야곱 존맛임 무주 야곱 기준 소금 막창 빠짝 올해 대구 체류 돼지 막창 기대 정말 기지 쫄깃 정말 작렬 곱창 야곱 소금 막창 합격 야채 곱창 작렬 곱창 주인공 인분 생각 진짜 츄베릅 양배추 당면 돼지 곱창 사리 금방 텃밭 깻잎 자극 거나 매운 감칠맛 매콤한 소스 협조 아빠 꺄앙 야곱 진짜 포장 철판 진짜 야들야들 당면 감기 난리 맥주 지금 곱창 채소 비율 정도 당면 남지 박사 곱창 곱창 석사 쌈무 마요네즈 무가 진짜 사이드 뿌셔보자 사발 정말 이서 그릇 요즘 진짜 최고 선택 개인 볶음밥 생각 계란찜 먹기 느낌 볶음밥 인분 이쯤 사장 인분 야곱 사발 볶음밥 작렬 곱창 가성 생각 설명 실제 테이블 인분 메인 메뉴 사이드 가격 이면 생각 박사 재료 정말 볶음밥 이유 마법 전멸 사진 완밥 전멸 광경 장안동곱창 맛집 작렬 곱창 인정 영수증 리뷰 이벤트 대요 볶음밥 사발 강력 추천 위생 슈도 가게 관리 사진 그냥 노포 감성 가성 좔좔 장안동곱창 맛집 쌈무 소스 가족 친구 가기 감성 메인 메뉴 사이드 소금 막창 직화 곱창 방문 예정 고등학교 박사 식사 장안동맛집 작렬 곱창 후기 장안동맛집 장안동곱창 작렬 곱창 답십리곱창 야채 곱창 존맛 휘경여고 곱창 휘경동 곱창 동대문구 곱창 장안동 돼지 곱창 야곱 존맛 작렬 곱창 본점 서울특별시 동대문구 답십리로 블로그 체크 장소,장안동맛집 장안동곱창 작렬곱창 답십리곱창 야채곱창존맛 휘경여고곱창 휘경동곱창 동대문구곱창 장안동돼지곱창 야곱존맛
209,장안동 야채 곱창 작렬 곱창 본점 곱창 막창 장안동맛집 리뷰 추천 후기,작렬 곱창 본점 장안동 야채 곱창 장안동 돼지 곱창 동대문구 곱창 추천 작렬 곱창 본점 서울특별시 동대문구 답십리로 서울 동대문구 답십리로 매일 포장 배달 지혜 오늘이 맛집 장안동 야채 곱창 장안동 돼지 곱창 맛집 작렬 곱창 본점 방문 후기 정말 애정 장안동 맛집 작렬 곱창 본점 장안동 야채 곱창 돼지 곱창 맛집 봉사 거리 인근 위치 작렬 곱창 본점 버스정류장 대중교통 타고 오기 버스 작렬 곱창 본점 내부 테이블 일반 의자 테이블 가지 평일 저녁 테이블 만석 이용 작렬 곱창 학생 만석 의자 테이블 이용 작렬 곱창 본점 내부 매장 갈수 작렬 곱창 포장 배달 동대문구 곱창 추천 이요 장안동 야채 곱창 전문점 작렬 곱창 본점 지금 돼지 곱창 가격 유지 야채 곱창 인분 막창 인분 가성 닭발 껍데기 돌뼈 순대볶음 작렬 곱창 학생 위해 학생 끼리 곱창 좀더 가격 판매 자주 소금 막창 인분 양념 막창 인분 계란찜 볶음밥 주문 작렬 곱창 본점 기본 밑반찬 소스 상추 제일 미역국 작렬 곱창 미역국 미역국 요청 리필 진짜 항상 쌈무 양파 상추 당근 마늘 짐해 작렬 곱창 본점 모든 밑반찬 계속 요청 리필 곱창 막창 소스 마요네즈 초고추장 양념 이색 동대문구 곱창 추천 작렬 곱창 본점 리뷰 재생 동대문구 곱창 추천 작렬 곱창 본점 리뷰 가장 먼저 계란찜 뚝배기 푸딩 계란찜 양념 막창 먹기 곧바로 등장 양념 막창 소금 막창 인분 작렬 곱창 본점 가장 모든 곱창 막창 메뉴 인분 장안동 돼지 곱창 장안동 야채 곱창 작렬 곱창 본점 장안동 맛집 추천 재생 장안동 돼지 곱창 장안동 야채 곱창 작렬 곱창 본점 장안동 맛집 추천 막창 인분 계란찜 상차림 이만원 중반 대의 가성 장안동 맛집 양념 막창 소금 막창 버섯 버섯 러버 버섯 취향 저격 버섯 추가 의향 먼저 양념 소금 막창 기름 아주 쫄깃 정도 간이 양념 막창 양념 소금 막창 자극 소금 막창 양념 막창 쫄깃 쫄깃 식감 상추 막창 조각 마요네즈 양념 범벅 버섯 존맛 상추 작렬 곱창 본점 수제 특색 양념 소스 양념 고추장 양념 뭔가 달달 첨가 달달 곱창 막창 마무리 볶음밥 절대 작렬 곱창 곱창 막창 맛집 볶음밥 맛집 도해 작렬 볶음밥 필수 인분 둘이서 볶음밥 양념 소스 존맛 장안동 주민 학생 자주 장안동 야채 곱창 맛집 작렬 곱창 본점 올해 처음 퀄리티 가성 가요 곱창 동대문구 곱창 맛집 장안동 맛집 추천,
210,장안동맛집 돼지 곱창 곱창 맛집 작렬 곱창 본점,햄밍입니 불금 아주 커플 저녁 식사 본격 돼지 파티 시작 예정 관심 사랑 사가정역 면목역 대중교통 내외 위치 장안동 맛집 장안동맛집 돼지 곱창 맛집 장안동 돼지 곱창 노포 맛집 장렬 곱창 본점 작렬 곱창 스타 주꾸미 가게 운영 중이 하니 참고 영업 휴무 가게 사정 주차장 별도 주차장 구비 가게 맞은편 편의점 근처 주차 골목 특성 주차 대중교통 도보 이용 권유 노포 맛집 가격 현재 영업 가격표 가게 크게 학생 끼리 할인 가게 벽면 메뉴판 크게 이서 중요 방문 때문 야채 곱창 인분 사발 주먹밥 계란찜 소주 병과 사이다 주문 추가 양념 돼지껍데기 인분 돌뼈 인분 볶음밥 소주 주문 가게 내부 한쪽 평상 식사 공간 곱창 주류 냉장고 그릇 선반 평상 공간 통로 통로 지나 공간 테이블 정도 비치 중간 접힌 테이블 공간 손님 테이블 세팅 수용 인원 매너 아주 얼굴 모자이크 메인 메뉴 기본 소스 마늘장아찌 채소 미역국 미역국 정말 처음 주문 야채 곱창 인분 사발 계란찜 주먹밥 사발 김치 상추 구성 양도 요즘 먹기 정말 주문 본격 곱창 흡입 입맛 애피타이저 정말 최고 주먹밥 셀프 장갑 비닐 장갑 남편 주먹밥 아주 솨놨 계란찜 표현 수가 간이 정말 계란찜 국물 입천장 호호 불어 야채 곱창 인분 돼지 파티 시작 재생 야채 곱창 인분 돼지 파티 시작 대망 돼지 야채 곱창 역시 동영상 기본 조리 당면 사리 야채 곱창 진짜 듬뿍 곱창 곱창 가득 역시 곱창 그냥 쌈무 주먹밥 제대로 아시 역시 곱창 소주 사이다 왜냐면 사이다 소주 여자 추가 주문 양념 돼지껍데기 인분 돌뼈 인분 역시 돼지껍데기 콩가루 쫄깃 쫄깃 돌뼈 그냥 아주 여자친구 분과 남편 자꾸 치킨 곱창 부작용 미각 한국인 디저트 볶음밥 탄수화물 탄수화물 진리 야채 곱창 기본 정량 주신 돼지 곱창 정말 돼지 당면 야채 사리 돼지 곱창 진짜 곱창 돼지 곱창 정말 양념 자체 매콤한 매콤 남녀 노소 양념 돼지껍데기 역시 돼지껍데기 사랑 양념 살짝 매콤 돼지껍데기 자칫하면 쫄깃 쫄깃 쫀득 쫀득해 입안 감기 장난 돌뼈 아주 여자친구 분과 남편 자꾸 치킨 한텐 그냥 돌뼈 돌뼈 구나 진짜 돌뼈 구나 오늘 돼지 파티 성공 인분 사이드 메뉴 계란찜 주먹밥 사발 볶음밥 소주 사이다 뿌셨습니 돼지 본점 본점 일반 체인점 방문 본점 방문 정말 이해 서비스 비교 정말 노포 맛집 벽면 낙서 돼지 곱창 편도 편도 돼지 해도 작렬 곱창 본점 야채 곱창 정말 돼지 사장 신경 재료 준비 손질 구나 돼지껍데기 숯불 거도 양념 거도 자꾸 매콤 중독 식감 쫀득쫀득 젤리 느낌 근처 이제 자주 방문 예정 오늘 볶음밥 중간 작렬 곱창 본점 서울특별시 동대문구 답십리로 블로그 체크 장소 장안동맛집 장안동곱창 장안동 돼지 곱창 작렬 곱창 동대문구 곱창 본점 야채 곱창 돼지껍데기 양념 돼지껍데기 돌뼈 저녁 추천 맛집 추천 곱창 맛집 동대문구 맛집,장안동맛집 돼지곱창맛집 장안동돼지곱창 노포맛집 장렬곱창 본점 야채곱창 4인분 엄청많다 돼지파티시작 야채곱창 4인분 엄청많다 돼지파티시작 양념돼지껍데기 오돌뼈 장안동맛집 장안동곱창 장안동돼지곱창 작렬곱창 동대문구곱창 본점 야채곱창 돼지껍데기 양념돼지껍데기 오돌뼈 저녁추천 맛집추천 곱창맛집 동대문구맛집
211,동대문구 장안동 곱창 야채 곱창 작렬 곱창 본점,동대문구 장안동 곱창 야채 곱창 작렬 곱창 본점 동네 산책 장안동 곱창 작렬 곱창 가게 작고 뭔가 낙서 가득 감성 분위기 아래 테이블 그냥 먹기 바닥 돼지 곱창 창의 효능 다이어트 효과 진짜 라면 작렬 곱창 본점 당일 도축 국내 곱창 매일 공급 동대문구 장안동 곱창 야채 곱창 작렬 곱창 본점 메뉴 메뉴 주문 야채 곱창 인분 주문 반찬 미역국 소스 야채 금방 야채 곱창 인분 깻잎 당면 곱창 가득 간이 감칠맛 양념 자체 기본 미역국 느낌 간도 곱창 계속 볶음밥 곱창 양념 볶음밥 장안동 작렬 곱창 영업 오후 새벽 장안동맛집 장안동곱창 장안동 야채 곱창 작렬 곱창 작렬 곱창 본점 동대문구 야채 곱창,장안동맛집 장안동곱창 장안동야채곱창 작렬곱창 작렬곱창본점 동대문구야채곱창 내돈내산
212,장한평역 대게 맛집 독도 장안 직영,독도 장안 직영 오빠 로안 살이 서울 장안 직영 독도 사장 정말 독도 린지 하이라이트 린지 클립 클립 크리에이터 꽃게 대게 킹크랩 서울맛집 추천 서울대 맛집 클립 코노 린지 먼저 포스팅 한번 악보 입맛 오빠 맛집 포스팅 장한평역 대게 맛집 안녕 제군 오빠 왔다잉 날씨 밤낮 오늘 소개 맛집 장안동 위치 독도 장안 직영 대게 주인 올해 가장 제군 소개 오빠 포스팅 독도 장안 직영 서울특별시 동대문구 천호대로 블로그 체크 장소 위치 한번 정말 최고 독도 장안 직영 주차 정보 서울 맛집 주차 고민 가게 주차 완전 무료 장한평역 대게 맛집 독도 영업 정보 영업 정보 매일 주차 정보 가게 무료 가능 오시 자차 장한평역 출구 미터 전화번호 편의 시설 서비스 단체 이용 가능 예약 포장 배달 주차 가능 와이파이 외부 전경 가게 주차 나이스 대게 해산물 크랩 오늘 뱃속 크랩 대게 러시아 대게 오늘 다짐 식당 입장 식당 내부 소개 식당 내부 모습 테이블 사람 만석 테이블 가득 사진 테이블 간격 장한평역 맛집 독도 메뉴판 주인 지인 대게 세트 세트 딱지 볶음밥 주문 금액 지금 크게 기본 상차림 주인 예약 미리 세팅 메뉴 등장 메뉴 광어 새우 다시마 샐러드 콘치 메뉴 착착 콘치즈 진짜 달달 하이 입맛 최고 스끼다시 가자미 구이 가오리 석화 조개찜 멍게 전복 대게 앞다리 튀김 훈제오리 대박 세팅 수준 광어 먼저 광어 지느러미 간장 쫄깃 나이스 간장 새우 별미 기본 새우 크기 박살 전복 멍게 해산물 킬러 전복 멍게 참기름 석화 석화 오늘 가장 샤르르 이건 말로 표현 가오리 올해 으뜸 가오리 간이 아주 샤르르 쾌감 나이스 가자미 구이 가자미 구이 양념 간도 겉바 소프트 입안 대게 튀김 튀김 가장 주인 숟가락 환상 사장 대게 튀김 정도 오리 훈제 조개찜 오리 훈제 조개찜 초장 순삭 스끼 다시 메인 대게 등장 밑찬 음식 박살 메인 요리 대게 등장 크기 해부 다리 다리 게살 요것 숟가락 내장 진짜 집게 다리 집게 다리 먹기 손질 그냥 입쾅 입맛 딱지 볶음밥 딱지 볶음밥 딱지 직접 딱지 볶음밥 제대로 딱지 볶음밥 제대로 게살 분류 내장 딱지 볶음밥 처럼 세팅 진짜 음식 마무리 해물 어묵 라면 마지막 해물 어묵 라면 마무리 마무리 아주 국물 아주 초토화 처음 밑찬 메뉴 메인 메뉴 아주 사장 직원 아주 빌리버 서울 장한평역 장안동 오시 한번 오빠 맛집 포스팅 주인 말로,독도게찜 하이라이트챌린지 클립 클립크리에이터 꽃게 대게 킹크랩 회 서울맛집추천 서울대게맛집 클립 코노챌린지
213,장한평역 대게 맛집 독도 장안 직영,오늘 포스팅 맛집 장한평역 대게 독도 장안 직영 독도 장안 직영 서울특별시 동대문구 천호대로 블로그 체크 장소 장안동 대게 맛집 독도 장안 본점 장한평역 출구 거리 위치 도보 정도 주차 가능 가게 공간 주차 수조 테이블 테이블 동네 인기 맛집 주말 예약 가면 독도 장안 직영 대게 세트 러시아 대게 세트 프리미엄 대게 세트 특선 실속 세트 독도 세트 킹크랩 세트 정도 크게 주문 대게 세트 마리 예약 식기 스끼다시 시작 꼬소 전복죽 상큼 샐러드 출발 정말 스끼다시 향연 광어 광어 회도 스끼다시 퀄리티 횟감 와사비 간장 지느러미 독도 장안 본점 짱짱 콘치 가오리 정말 간장 소스 가오리 처음 치아 멍게 전복 회도 식감 해산물 안주 가자미 구이 대게 튀김 대게 튀김 대게 살이 진짜 따끈따끈 가자미 구이 가리비 조개찜 굿굿 소라 간장 새우 시래기 다시마 정말 스끼 다시 천국 독도 장안 본점 대게 마리 정말 가득 대게 세트 대게 내장 생각 장한평역 대게 요기 세용 율도 정말 손질 먹기 집게 다리 빼기 만하 집게 말모 장안동 맛집 독도 장안 본점 몸통 내장 혼절 필수 딱지 볶음밥 주문 양도 꼬소함 대박 세트 포함 매운탕 홍합 콩나물 어묵 아주 라면 사리 투하 꼬들꼬들 장안동맛집 독도 장안 본점 재생 접기 장안동맛집 독도 장안 본점 장안동맛집 독도 장안 본점 사장 대게 스끼다시 장한평역 근처 모임 장소 방문 맛집 분위기 가족 외식 장소 근처 현지 맛집 독도 장안 본점 정말 방문 독도 장안 직영 서울 동대문구 천호대로 매일 연중 콜키 가능 단체 이용 가능 예약 포장 배달 무선 인터넷 주차 가능,
214,동대문구 장안동 맛집 독도 장안 직영 대게 세트,오늘 동대문구 장안동 맛집 독도 장안 직영 대게 세트 대게 모임 밑반찬 해산물 마카 처럼 포스팅 독도 장안 직영 독도 장안 직영 서울특별시 동대문구 천호대로 블로그 체크 장소 위치 서울 동대문구 천호대로 전화번호 영업 정오 오후 가게 정보 유료 콜키 단체 이용 예약 포장 배달 무선 인터넷 무료 주차 가게 위치 가게 위치 장한평역 출구 도보 위치 막상 간판 독도 매장 점심 세트 메뉴 메뉴판 매장 수조 광어 멍게 가리비 수산물 보기 해도 매장 내부 분위기 매장 내부 분위기 모습 테이블 가족 단체 손님 일반 손님 식사 구비 단체 회식 거나 식사 안내 대표 매장 메뉴 대게 세트 세트 마리 주문 메인 요리 전복죽 시작 오늘 코스 요리 시작 코스 요리 이유 메뉴 코스 때문 광어 갈치 해초 해초 갈치 식감 짭쪼름하 바다 자체 고추가 간장 새우 이소라 샐러드 지금 밑반찬 생각 아안 국내 멍게 전복 완전 술안주 제대로 해산물 옥수수 새우 가리비 훈제 오리 무쌈 가자미 양념 생선 튀김 튀김 계속 계속 벌써 테이블 거기 가득 밑반찬 정도 소요 금방 금방 거기 가오리 그릇 그릇 밑반찬 완전 마카 느낌 제대로 이제 오늘 메인 메뉴 대게 마리 먹기 손질 동대문구 장안동 맛집 독도 장안 직영 대게 발라 일품 율도 발라 감칠맛 가족 끼리 모임 정말 생각 방문 평일 저녁 불구 가족 단위 손님 이제 코스 마지막 육수 어묵 콩나물 고춧가루 홍합 해산물 라면 육수 콩나물 육수 시작 투하 탄수화물 등딲 볶음밥 추가 정도 추가 볶음밥 라면 솔직 후기 오늘 동대문구 장안동 맛집 독도 장안 직영 대게 세트 포스팅 대게 해산물 밑반찬 마지막 라면 딱지 볶음밥 고온 추천 부모님 모시 포스팅,
215,장안동맛집 가을 대게 독도 장안 직영 대게,장안동맛집 가을 대게 독도 장안 직영 마리 후기 서울 동대문구 장안동 위치 요리 전문점 해산물 활어회 대게 세트 구성 달달 대게 가족 식사 모임 추천 영업 매일 주차 무료 가능 가게 위치 서울 동대문구 천호대로 호선 장한평역 출구 예약 포장 배달 무선인터넷 단체 이용 콜키 가능 유료 가능 지난 주말 가을 대게 장안동 맛집 독도 장안 직영 대게 가격 대가 편이 가을 대게 장안동 대게 맛집 독도 대게 살이 달달 식사 장안동 맛집 독도 도착 대게 대게 킹크랩 전복 광어 해산물 수족관 준비 세트 메뉴 주문 사실 움직 그대로 독도 장안 직영 중랑천 근처 호선 장한평역 출구 위치 주차 매장 무료 주차 방문 독도 점심 메뉴 독도 정식 코스 스타 버터 치즈 구이 세트 러시아 대게 세트 새우 조개찜 전복 광어 낙지 해산물 장안동맛집 가을 대게 독도 매장 내부 장안 내부 구성 부모님 식사 모임 단체 회식 예약 방문 테이블 자리 대게 러시아 대게 스타 킹크랩 전문점 고객 최고 해산물 활어회 제공 위해 주문 동시 수족관 요리 소요 양해 독도 장안 평직 영점 장안동맛집 가을 대게 독도 메뉴 대게 마리 해초 샐러드 소라 다리 튀김 생선 튀김 가오리 대게 세트 마리 광어 소라 갈치 꼬시레기 다시마 소라 조개 생선 튀김 다리 튀김 전복 석화 멍게 가라 가오리 감자 튀김 러시아 대게 세트 광어 껍질 갈치 꼬시레기 다시마 소라 조개 열기 튀김 다리 튀김 전복 석화 멍게 대가 라면 가오리 실속 대게 세트 대게 러시아 대게 광어 소라 갈치 꼬시레기 다시마 소라 조개 생선 튀김 다리 튀김 전복 석화 멍게 가라 가오리 감자 튀김 세트 준비 모임 코스 요리 먹기 맛집 스끼 다시 밑반찬 대게 마리 딱지 볶음밥 추가 주문 성인 식사 세트 상품 실속 구성 참고 장안동맛집 독도 대게 식사 후기 먼저 에피타이저 전복 내장 해초 샐러드 콘치 이소라 다리 튀김 생선 튀김 가오리 주문 스끼다시 대게 양념장 가오리 정말 다리 튀김 바삭 생선 튀김 밑반찬 가자미 두툼 살이 조개찜 감칠맛 가득 쫄깃 쫄깃 손색 등장 장안동맛집 독도 가을 대게 대게 마리 그릇 비쥬 주문 동시 수족관 아주 부위 별로 스끼 다시 직원 먹기 손질 스스로 먹기 걱정 딱지 감칠맛 내장 보이 껍질 칼집 대게 집게발 쫄깃 대게 다리 다리 살이 먹기 아주 달달 게살 재미 감칠맛 집중 몸통 수저 몸통 게살 아주 마지막 딱지 짭쪼롬 아주 그냥 추가 딱지 볶음밥 수가 추가 딱지 내장 감칠맛 참기름 추가 마지막 추가 직원 달달 게살 식사 스끼다시 세트 메뉴 해산물 방문 장안 맛집 가족 외식 모임 단체 회식 독도 추천 장안동맛집 독도 안평역 재생 접기 장안동맛집 독도 안평역 독도 장안 직영 서울특별시 동대문구 천호대로 블로그 체크 장소,
