,title_pos,content_pos,hash_tag
0,동작 카페 아뜨레 인절미 팥빙수 신대방동카페,오늘 동작구 신대방동 위치 빙수 맛집 카페 아뜨레 카페 서울특별시 동작구 여의대방로 블로그 체크 장소 월금 토일 날씨 빙수 빙수 저번 행궁동 제과 정말 빙수 맛집 오늘 카페 아뜨레 빙수 맛집 빙수 맛집 빙수 돌이 신대방동카페 아뜨레 팥빙수 맛집 팥빙수 배너 카페 공간 공간 크리스마스 맞이 트리 장식 연말 분위기 뿜뿜하 신대방삼거리카페 카페 단호박 타르트 토요일 출연 음료 아뜨레 브륄레 아뜨레 슈페너 디카 페인 원두 준비 커피 오지 커피 케이크 쇼케이스 진열 단호박 타르트 흑임자 갸또 치즈 갸또 더티 초코 티라미수 고구마 케이크 케이크 종류 보고 케이크 동물성 서울 우유 생크림 서울 우유 버터 사용 재료 투자 재료 가장 팥빙수 인절미 팥빙수 인절미 일반 프랜차이즈 카페 빙수 달라 보이지 국산 팥빙수 래서 크기 빙수 단면 우유 얼음 원래 우유 빙수 제일 얼음 국산 더욱 마음 원래 대부분 빙수 인절미 가루 얼음 카페 아뜨레 인절미 빙수 인절미 가루 층층 우유 얼음 인절미 가루 인절미 가루 더욱 사장 테이블 빙수 방법 숟가락 접시 이유 우유 얼음 국산 인절미 가루 빙수 카페 아뜨레 인스타그램 세용 아뜨레 케이크 카페 레터 케이크 케이크 파티 대여 사진 동영상 팔로워 팔로잉 게시 아뜨레 케이크 카페 레터 케이크 케이크 파티 대여 사진 동영상 보기,빙수맛집
1,동작 신대방 주민 빙수 맛집 신대방삼거리역카페 카페 아뜨레,동작 신대방 주민 빙수 맛집 신대방삼거리역카페 카페 아뜨레 자취 시작 제일 디저트 빙수 작년 빙수 기억 올해 무더위 벌써 빙수 신대방동카페 빙수 맛집 카페 아뜨레 소개 아뜨레 케이크 카페 레터 케이크 케이크 파티 대여 사진 동영상 팔로워 팔로잉 게시 아뜨레 케이크 카페 레터 케이크 케이크 파티 대여 사진 동영상 보기 가게 정보 주소 서울 동작구 여의대방로 영업 월금 토일 전화번호 주차 불가 근처 구릉 주차장 이용 외관 신대방 삼거리 도보 보라매 포레스트 아파트 위치 벽돌 가게 카페 토요일 단호박 타르트 장면 방송 정말 최신 방영 원래 케이크 아주 메뉴판 카페 아뜨레 음료 메뉴판 먼저 케이크 쇼케이스 위쪽 보기 커피 커피 음료 종류 커피 금액 추가 디카 페인 변경 가능 방문 목적 빙수 국산 인절미 팥빙수 흑임자 빙수 주문 오른쪽 오스 토요일 장면 홍보 먼저 빙수 여러 종류 인기 인절미 흑임자 쇼케이스 메뉴 오스 사진 메뉴 고민 참고 케이크 맛집 케이크 종류 축하 용품 오스 구매 쇼케이스 여러 종류 케이크 메뉴 더티 초코 바스크 치즈 흑임자 절미 치즈 초코 바스크 치즈 가지 갸또 정말 단호박 타르트 토요일 방송 녀석 구황 작물 로서 비주 소리 타르트 기회 복숭아 블루베리 골드 키위 여러 종류 과일 생크림 케이크 마지막 이름 아마 레몬 치즈케이크 뽀로로 주스 실내 동작 신대방 신대방삼거리역카페 주민 빙수 맛집 재생 접기 동작 신대방 신대방삼거리역카페 주민 빙수 맛집 케이크 맛집 빙수 맛집 카페 아뜨레 내부 모습 가게 내부 느낌 공간 앞쪽 위치 인석 테이블 위치 인석 창가 위치 인석 인석 자리 카페 가장 안쪽 공간 이자 케이크 쇼케이스 오스 쇼케이스 케이크 주문 대한 내용 사진 조각 케이크 픽업 수요일 주문 하니 주문 참고 케이크 주문 한쪽 축하 용품 팔고 머리띠 고깔 왕관 팔고 사면 해결 서비스 테이블 냅킨 물티슈 반납 테이블 뽀로로 주스 유아 의자 구비 후기 인절미 팥빙수 인절미 정말 역시 빙수 인절미 팥빙수 주문 주문 메뉴 직접 빙수 요새 물가 크기 빙수 예상 테이블 빙수 방법 빙수 중간 가루 때문 접시 동작 신대방 신대방삼거리역카페 주민 빙수 맛집 재생 접기 동작 신대방 신대방삼거리역카페 주민 빙수 맛집 살포시 빙수 순간 빙수 맛집 인정 얼음 우유 얼음 듬뿍 콩가루 쫄깃 인절미 진짜 부족함 설명 중간 중간 콩가루 계속 정말 부족함 그릇 덕분 양도 물이 덕분 정말 정도 작년 빙수 서러움 빙수 맛집 정도 정말 동네 주민 정말 오시 데리 가족 위로 동네 주민 인정 신대방삼거리역맛집 카페 아뜨레 빙수 카페 서울특별시 동작구 여의대방로 블로그 체크 장소,
2,신대방삼거리카페 흑임자 빙수 맛집 카페,카페 주차 불가 평일 주말 여름 여름 빙수 저녁 후식 빙수 신대방 삼거리 맛집 카페 방문 카페 신대방 삼거리 아파트 맞은편 위치 항상 만석 저녁 사람 대체 빙수 맛집 카페 놀토 소개 여름 계절 팥빙수 홍보 빙수 카페 기대 케이크 전문 때문 사전 예약 케이크 주문 디자인 케이크 나중 이벤트 주문 메뉴판 음료 가격 편이 아메리카노 오늘 빙수 때문 음료 패스 빙수 인절미 흑임자 주문 오스 놀토 타르트 기도 진열 케이크 과일 케이 토끼 케이크 우유 케이크 케이크 설명 케이크 정말 재료 내부 케이크 전문 때문 벽면 케이크 생일 모자 이벤트 소품 판매 케이크 빙수 사장 솜씨 장난 여름 얼음 준비 센스 내부 대략 테이블 정도 걸터 계단 자리 마지막 자리 겟겟 인테리어 센스 걸이 아기 의자 흑임자 빙수 흑임자 빙수 빙수 오신 손님 흑임자 빙수 빙수 크기 듬뿍 담뿍 그릇 깊이 장난 흑임자 지금 눈꽃 얼음 우유 얼음 연유 테이블 빙수 방법 세상 국산 대요 방법 주신 그릇 흑임자 듬뿍 인절미 빙수 국산 가용 팥빙수 그릇 녹지 특수 제작 그릇 마지막 지속 다시 흑임자 가루 듬뿍 빙수 하나로 이서 인절미 흑임자 마지막 그릇 먹기 엄마 비빔 퍼먹어 그릇 존맛 신대방삼거리카페 카페 빙수 엄마 계속 역시 국산 빙수 카페 신대방 삼거리 빙수 맛집 카페 인스타 정보 보고 가세 아뜨레 케이크 카페 레터 케이크 케이크 파티 대여 사진 동영상 팔로워 팔로잉 게시 아뜨레 케이크 카페 레터 케이크 케이크 파티 대여 사진 동영상 보기 카페 서울특별시 동작구 여의대방로 블로그 체크 장소,
3,서울 동작 카페 아뜨레 신대방삼거리역카페 추천 크림 브륄레 커피 오레오 케익,저녁 디저트 지난번 흑임자 빙수 빙수 맛집 신대방삼거리역카페 카페 아뜨레 카페 아뜨레 신대방 삼거리 보라매 맞은편 전통 짬뽕 위치 카페 아뜨레 빙수 맛집 사람 빙수 카페 서울특별시 동작구 여의대방로 블로그 체크 장소 영업 평일 주말 단체 주차 포장 오늘 역시 분위기 신대방삼거리역카페 아뜨레 가장 애정 자리 마침 착석 신대방 삼거리 차로 주차 카페 아뜨레 건물 주차 방문 이전 빙수 음료 메뉴 관심 오늘 제일 먼저 아뜨레브륄레 이전 오스 케익 사장 주문 오스 주문 주문 제작 케이크 파티 용품 판매 카페 아뜨레 왕관 화장실 주자 안내 그림 표시 주차 화장실 참고 저녁 방문 케익 나기 일보 직전 고민 오레오 케이크 눈치 싸움 주문 메뉴 자리 가장 최애 자리 사진 아뜨레브륄레 비주 깜짝 비주 대감 뿜뿜 아뜨레브륄레 신대방삼거리역카페 카페 메뉴인 아뜨레브륄레 커피 메뉴 디카 페인 저녁 디카 페인 주문 스타 크림 카라멜 이징 아이스 라떼 카페 아뜨레 나무 스푼 설탕 코팅 나무 수저 토토 스타 크림 서울 동작 카페 아뜨레 재생 서울 동작 카페 아뜨레 재미 아뜨레브륄레 추천 커스타드 크림 라떼 유자 레몬 친구 유자 레몬 유자 레몬 듬뿍 달달 상콤 오레오 케이크 카페 아뜨레 케익 동물성 생크림 사용 크림 케이크 살르르 남녀 노소 진짜 오레오 케익 달달 달달 커피 정도 단맛 우유 생크림 케익 조각 서도 순삭 가능 빙수 맛집 음료 케익 신대방역 삼거리 맛집 카페 아뜨레 케이크 주문 아뜨레 자주 이용 신대방역 삼거리 카페 카페 아뜨레 방문 신대방삼거리역카페 신대방삼거리역맛집,신대방삼거리역카페 신대방삼거리역맛집
4,서울 동작 카페 흑임자 빙수 신대방동카페,카페 서울특별시 동작구 여의대방로 블로그 체크 장소 서울 동작구 여의대방로 매일 격주 화요일 정기 휴무 날씨 점점 빙수 빙수 맛집 아뜨레 방문 빙수 타르트 토요일 케이크 모양 간판 테이크아웃 판도 귀염 매장 내부 조명 느낌 인테리어 신발 좌석 오스 주문 메뉴인 아뜨레브륄레 아뜨레 슈패너 커피 커피 디카 페인 가능 이드 라테 메뉴 타르트 케이크 종류 별로 놀토 단호박 타르트 비주 시선 아뜨레 케이크 동물성 서울 우유 생크림 서울 우유 버터 사용 고해 아뜨레 케이크 디저트 추구 케이크 디자인 도안 카운터 문의 단체 주문 답례 생일케이크 기념일 케이크 아뜨레 주문 여름 대표 메뉴인 빙수 국산 인절미 팥빙수 흑임자 빙수 종류 생일 축하 머리띠 꼬깔콘 왕관 팔고 물이 휴지 물티슈 구비 빙수 숟가락 추천 흑임자 빙수 인절미 흑임자 비주 대박 인절미 흑임자 조심 퍼줍니 흑임자 인절미 쫀득 고소 흑임자 그릇 은근 국산 흑임자 인절미 쫄깃 빙수 타르트 신대방삼거리카페 신대방삼거리역카페 신대방동카페 신대방삼거리맛집 신대방삼거리역맛집,신대방삼거리카페 신대방삼거리역카페 신대방동카페 신대방삼거리맛집 신대방삼거리역맛집
5,동작 갈수 붕어빵 신대방 삼거리 카페 카페,날씨 계속 반복 비도 고요 독감 유행 소개 카페 신대방 삼거리 카페 겨울철 붕어빵 붕어빵 카페 시작 카페 서울특별시 동작구 여의대방로 블로그 체크 장소 카페 서울 동작구 여의대방로 평일 주말 단체 이용 가능 포장 유아 의자 간편 결제 카페 신대방 삼거리 인근 신대방 삼거리 출구 카페 멀리 붕어빵 판도 보이 외관 인테리어 언눙 붕어빵 아뜨레 글씨 안보 한눈 걱정 크리스마스 기분 물씬 이예 이제 정말 크리스마스 크리스마스트리 크리스마스트리 케이크 진열 케이크 종류 아래 케이크 직접 케이크 사장 솜씨 대부분 크리스마스 관련 케이크 케이크 종류 선물 주문 오스 붕어빵 실물 크기 프린팅 미니 붕어빵 진짜 붕어빵 크기 직원 흡연 아기 방문 믿음 사장 마인드 붕어빵 종류 주문 슈크림 고구마 크림 치즈 종류 디카 페인 디카 페인 아메리카노 구가 요청 뽀로로 음료수 주문 오스 옆쪽 케이크 관련 소품 진열 머리띠 왕관 초도 종류 별로 육아 육아 아기 카페 아기 의자 육아 매장 내부 의자 가세 요기 명당 종이 명당 주문 음료 붕어빵 사장 직접 뽀로로 음료 주문 붕어빵 진짜 신대방 삼거리 카페 그냥 아뜨레 붕어빵 진짜 길거리 붕어빵 개월 아기 슈크림붕어빵 고구마 크림 치즈 붕어빵 진짜 고구마 크림 치즈 붕어빵 왼쪽 슈크림붕어빵 오른쪽 고구마 크림 치즈 붕어빵 진짜 신대방 삼거리 거주 신분 붕세권이셔 길거리 붕어빵 카페 피자 붕어빵 애기 방문 피자 붕어빵 어분 사장 정말 세심 한번 동작 갈수 붕어빵 신대방 삼거리 카페 카페 재생 접기 동작 갈수 붕어빵 신대방 삼거리 카페 카페 트리 크리스마스 정말 이제 딸도 트리 예뿌 계속 얘기 래미 카페 데이트 요즘 키즈 카페 신분 아기 가기 카페인 듯해 붕어빵 커피 산미 커피 날씨 붕어빵 실내 신분 신대방 삼거리 붕어빵 카페 아뜨레 추천,
6,서울 동작 신대방 삼거리 카페 카페,오늘 신대방 삼거리 카페 카페 방문 서울 동작구 여의대방로 신대방 삼거리 출구 레터 케이크 카카오 플러스 주문 신대방 삼거리 출구 보라매 근처 카페 벌써 팥빙수 개시 빙수 가세 겨울 한시 붕어빵 판매 지금 겨울 다시 붕세권 붕어빵 레터 케이크 아뜨레 케이크 카페 사진 동영상 팔로워 팔로잉 게시 아뜨레 케이크 카페 사진 동영상 보기 인스타 구경 미니 도시락 케이크 레터 케이크 사진 케이크 와인 소주 케이크 종류 기념일 한번 주문 카페 내부 카페 내부 내부 우드 아기자기 의자 의자 힐링 자리 여럿 이서 동네 카페 진짜 신대방 삼거리 롱패딩 걸이 심해 카페 메뉴 아뜨레브륄레 아뜨레슈패너 메뉴 디카 페인 커피 종류 아메리카노 주변 개인 카페 물가 생각 국산 사용 빙수 케이크 맛집 케이크 딸기 더티 초코 치즈 우유 티라미수 바스크 치즈 흑임자 갸또 절미 갸또 케이크 메뉴 진짜 생각 조각 케이크 와우 선물 주기 문구 서비스 내년 생일 거닷 케이크 카페 카페 서울 우유 생크림 버터 사용 하니 케이크 수가 없쥬 주문 흑임자 갸또 조각 케이크 아뜨레브륄레 딸기 라떼 파티 용품 판매 파티 진심 구경 음료 딸기 카페 차별 마시멜로 마시멜로 마시멜로 장인 달달 충전 제대로 딸기 어서 구리 행복 메뉴인 아뜨레브륄레 커스터드 크림 캐러멜 이징 아이스 톡톡 부숴 크림 브륄레 라떼 달달 최고 조합 메뉴 이유 메뉴 강추 흑임자 갸또 케이크 케이크 엄마 역시 케이크 화이트 크림 조화 달달 흑임자 듬뿍 케이크 커피 먹기 디저트 커피 디저트 행복 엄마 수다 힐링 카페 서울특별시 동작구 여의대방로 블로그 체크 장소 분위기 커피 케이크 동네 카페 메뉴 건강 케이크 신대방 삼거리 카페 카페 방문 추천,붕세권 신삼붕어빵 카페아뜨레내부
7,서울 동작 신대방 삼거리 흑임자 빙수 맛집 카페 방문 후기,은뽀챠무에용 오늘 언니 신대방 삼거리 위치 신대방 삼거리 카페 카페 아뜨레 카페 서울특별시 동작구 여의대방로 블로그 체크 장소 카페 신대방 삼거리 신대방 삼거리 출구 위치 서울 동작구 여의대방로 영업 평일 주말 라스트 격주 화요일 정기 휴무 전화번호 건물 외관 건물 외관 토요일 비비 방영 광고 놀토 디저트 방영 보장 신대방 삼거리 역쪽 다이소 스벅 건물 가면 가게 내관 매장 내부 우디 인테리어 전구 신경 조명 완존 매장 테이블 사진 만석 손님 모자이크 고토 동네 유명 맛집 오스 주문 오스 놀토 보이 놀토 디저트 맛집 방문 인절미 빙수 흑임자 빙수 보고 디저트 디저트 한번 도전 메뉴판 오스 사진 메뉴 정보 보고 위해 메뉴판 사진 첨부 주문 메뉴 후기 흑임자 빙수 주문 우유 얼음 흑임자 가루 인절미 토핑되어 진짜 많죵 비줠 흑임자 돌이 기절 비줠이에용 흑임자 인절미 빙수 개인 흑임자 빙수 강추 인절미 쫜득 통실 고용 흑임자 가루 꼬소 흑임자 선호 입문 자도 부담 흑임자 단점 왕창 이빨 사람 이유 비밀 눈치 살짝 중간 흑임자 가루 한번 원래 빙수 중간 우유 얼음 남아 연유 구런데 사장 세심 흑임자 빙수 덕분 완뚝하 내내 흑임자 빙수 오늘 또또 신대방 삼거리 위치 카페 아뜨레 흑임자 빙수 개인 인절미 빙수 빙수 중간 흑임자 가루 한번 처음 그대로 빙수 특색 먹기 재료 얼음 퍼먹는 추천 신대방 삼거리 근처 카페 추천 빙수 추천 빙수 나중 내용물 얼음 추천 신대방 삼거리 디저트 맛집 카페 추천,
8,서울 동작 신대방 삼거리 디저트 맛집 카페 카페,도리 오늘 신대방 삼거리 위치 디저트 맛집 카페 그냥 커피 판매 케이크 빙수 디저트 디저트 맛집 소개 카페 서울특별시 동작구 여의대방로 블로그 체크 장소 주소 서울 동작구 여의대방로 전화번호 영업 월금 신대방 삼거리 출구 도보 가게 외부 카페 외관 부모님 생신 케이크 유치원 생일케이크 웨딩 프로포즈 케이크 여친남친 생일케이크 여러가지 디자인 케이크 사전예약 외관 인테리어 감성 않나욤 가게 내부 가게 내부 인석 테이블 개정 인석 테이블 평일 방문 빙수 맛집 소문 손님 빙수 디자인 케이크 기념일 소품 전시 아기 의자 얼음 배치 사장 센스 메뉴 카페 메뉴판 커피 음료 종류 빙수 맛집 소문 빙수 종류 인절미 팥빙수 흑임자 팥빙수 요러케 종류 포장 흑임자 팥빙수 주문 주문 오스 이용 오스 애플 페이도 참고 사용 타임 디저트 한번 단호박 타르트 토요일 태연 극찬 방문 케이크 종류 이중 흑임자 갸또 우유 케이크 카페 서울 우유 버터 서울 우유 생크림 이용 제조 조합 흑임자 팥빙수 등장 소리 절로 비주 완전 혜자 비주 빙수 준비 얼음 빙수 우유 빙수 밍밍 우유 퍼먹으 안쪽 흑임자 가루 진짜 양도 혜자 빙수 국내 사용 진짜 빙수 친구 먹기 이건 싹싹 갑자기 칭찬 나중 부모님 방문 부모님 등용 그릇 반납 테이블 셀프 가면 신대방 삼거리 카페나 디저트 맛집 한번 카페 방문 빙수 왕왕 강추 카페 분위기 인테리어 감성 데이트 코스 안성맞춤 신대방삼거리역카페 신대방삼거리카페 서이추 신대방 삼거리 디저트 서울 디저트 맛집 서울 데이트 서울 카페 추천 동작 카페 신대방 삼거리 데이트 서울 디자인 케이크 서울 빙수 맛집 서이추 환영 블로그 답방 답방 카페,신대방삼거리역카페 신대방삼거리카페 서이추 신대방삼거리디저트 서울디저트맛집 서울데이트 서울카페추천 동작카페 신대방삼거리데이트 서울디자인케이크 서울빙수맛집 서이추환영 블로그답방 답방 카페아뜨레
9,동작 카페 딸기 케이크 인상 신대방삼거리카페 카페 케이크,사르르 케이크 경험 카페 주소 서울 동작구 여의대방로 영업 평일 주말 주문 제작 케이크 가능 카페 서울특별시 동작구 여의대방로 블로그 체크 장소 카페 신대방 삼거리 도보 거리 위치 주문 제작 케이크 정말 더니 요즘 유행 왕관 케이크 소주 와인 케이크 주문 오스 해주시 요기 아뜨레뷔렐레 아뜨레슈페너 커피 메뉴 커피 메뉴 연령 대가 방문 쇼케이스 디저트 우유미니 케이크 구매 참고 생크림 케이크 갸또 맛집 랍니 평일 저녁 방문 품절 메뉴 참고 가게 내부 은근 자리 테이블 정도 모임 파티 용품 디저트 판매 커피 한잔 먹기 센스 걸이 주문 메뉴 딸기 우유 조각 말차 라떼 접기 동작 카페 딸기 케이크 인상 신대방삼거리카페 카페 주문 딸기 우유 시트 강의 부드러움 가지 생크림 꿀떡 꿀떡 동물성 생크림 남지 신대방삼거리카페 케이크 제일 딸기 크림 우유 크림 딸기 조화 쵝오 딸기 진짜 커서 행복 자체 접기 동작 카페 딸기 케이크 인상 신대방삼거리카페 카페 주문 말차 라떼 마시멜로우 주문 요즘 유행 마시멜로우 껍질 먹기 말차 라떼 말차 본연 라떼 휴지 물티슈 사장 센스 코스터 어쩜 하트 사장 음료 정말 케이크 케이크 도장 딸기 우유 조각 케이크 정말 쑥절미갸또 베스트 메뉴 추천 우드 인테리어 사진 분위기 카페 신대방삼거리카페 강츄 동작구 신대방삼거리카페 카페,
10,동작 신대방 삼거리 카페 아뜨레 케익 맛집 신대방 삼거리 카페,동작 신대방 삼거리 카페 케익 맛집 신대방 삼거리 카페 나노 케이크 레터 케이크 맛집 신대방 삼거리 카페 카페 리뷰 서울 동작구 여의대방로 영업 월금 토일 포장 단체 주차 제로 페이 네이버 페이 아뜨레 케이크 카페 사진 동영상 팔로워 팔로잉 게시 아뜨레 케이크 카페 사진 동영상 보기 케이크 카페 네이버 블로그 모든 문의 카카오 플러스 아뜨레 케이크 대화 아뜨레 레터 케이크 영상 카페 서울특별시 동작구 여의대방로 카페 신대방 삼거리 출구 벽돌 원래 주문 제작 케이크 맛집 영업 최근 카페 크게 확장 입구 계절 메뉴인 수박 쥬스 팥빙수 신대방 삼거리 카페 카페 메뉴 아뜨레브륄레 블라썸 비롯 커피 이드 주스 라떼 메뉴 계절 메뉴인 팥빙수 날씨 팥빙수 팥빙수 종류 인절미 팥빙수 흑임자 빙수 케이크 맛집 타르트 조각 케이크 미니 케이크 진열 종류 별로 방문 아래 라인업 타르트 단호박 타르트 레몬 타르트 얼그레이 타르트 조각 케이크 당근 케이크 민트 초코 케이크 고구마 케이크 바스크 치즈케이크 우유 케이크 미니 케이크 순수 우유미니 케이크 고구마 미니 케이크 미니 케이크 대형 케이크 케이크 쇼케이스 앞쪽 케이크 관련 안내 옆쪽 와이파이 안내 코드 와이파이 접속 카운터 우측 벽면 머랭 쿠키 비롯 생일 파티 소품 판매 케이크 주문 구매 하단 얼음 물티슈 휴지 비치 이용 카페 내부 인테리어 모습 우드 분위기 이용 좌석 아메리카노 고구마 케이크 주문 음식 자리 아메리카노 양도 원두 카페 재생 카페 역시 케이크 맛집 고구마 케이크 남녀 노소 추천 이유 신대방 삼거리 카페 케이크 탑인 레터 케이크 커피 케이크 자주 방문 아래 지도 첨부 리뷰 카페 서울특별시 동작구 여의대방로,
11,유명 이후 다시 방문 카페 신대방 삼거리 맛집,미국 스텔라 유명 이후 카페 다시 방문 원래 친구 정말 환상 커피 스텔라 커피 산미 고급 예전 카페 아뜨레 후기 한밤중 회수 깜놀 케이블 방송 영향 방송 호박 타르트 이태리 로간 고등어 화덕 이면 구이 순두부 찌게 카페 맞춤 케잌 전문 케잌 유명 이후 항상 만석 친구 분위기 마찬가지 오스 주문 현금 직원 유명 이후 맛집 신대방 삼거리 한번 적극 추천,
12,신대방동카페 카페 아뜨레,지유 오늘 신대방삼거리카페 카페 아뜨레 소개 신대방삼거리역카페 케이크 빙수 맛집 위치 서울 동작구 여의대방로 영업 문의 카페 서울특별시 동작구 여의대방로 블로그 체크 장소 외부 신대방동카페 카페 아뜨레 신대방 삼거리 출구 동작 우체국 방향 왼쪽 가시 케이크 모양 간판 배너 판이 카페 아뜨레 케이크 맛집 이벤트 케이크 사전예약 참고 토요일 방송 카페 창문 케이크 사진 내부 신대방삼거리맛집 케이크 빙수 카페 아뜨레 내부 벌써 크리스마스 분위기 물씬 자리 통창 외투 걸이 비치 아기 의자 메뉴 오스 주문 케이크 타르트 커피 이드 빙수 종류 일행 취향 선택 식후 디저트 인절미 팥빙수 주문 케이크 진열 벌써 크리스마스 케이크 모습 초코 치즈케이크 종류 곰돌이 케이크 디저트 과자류 파티 용품 파티 용품 구입 카페 사람 파티 보시 아뜨레 케이크 장점 서울 우유 생크림 서울 우유 버터 사용 부담 케이크 문의 미리 예약 화장실 위치 반납 테이블 참고 음식 신대방삼거리역카페 아뜨레 인절미 팥빙수 여름 생각 팥빙수 제대로 보지 팥빙수 그릇 고봉 인절미 팥빙수 인절미 가루 인절미 연상 모습 카페 아뜨레 재생 카페 아뜨레 인절미 팥빙수 분위기 신대방동카페 아뜨레 크리스마스 분위기 인절미 숟갈 생각 얼음 거치 눈꽃 얼음 테이블 빙수 방법 핵심 포인트 접시 처음 수가 식후 디저트 여유 가지 신대방삼거리카페 아뜨레 달달 인절미 팥빙수 흡입 진짜 빙수 방법 처럼 중간 한쪽 파서 모습 빙수 여유 카페 아뜨레 카페 아뜨레 재생 카페 아뜨레 종합 후기 요즘 동네 카페 정말 신대방삼거리카페 카페 아뜨레 분위기 케이크 빙수 커피 사람 케이크 선물 파티 신대방동 카페 아뜨레 추억 보시 추천 사장 직원 정말 기분 빙수 맛집 지유,
