,title_pos,content_pos,hash_tag
0,무한리필 장안동맛집 동대문 참치 장한평,참치 재생 접기 신조 참치 장한평역 무한리필 참치 전문점 참치 전문 매장 참치 참치 방문 서울 동대문구 장한로 지하철 호선 장한평역 출구 영업 라스트 휴무 일요일 단체 이용 가능 예약 가능 장안동맛집 장한평역맛집 장한평맛집 서울횟집 장안동횟집 장한평역 출구 스타벅스 오른쪽 파리바게트 코너 안쪽 참치 입구 장안동맛집 장한평역맛집 장한평맛집 서울횟집 장안동횟집 계단 장안동맛집 장한평역맛집 장한평맛집 서울횟집 장안동횟집 최고급 사시미 계절 스끼다시 특회 스폐셜 주문 내부 인테리어 참치 진수 회사 장한평 맛집 장안동맛집 참치 직원 안내 매장 프라이 공간 이야기 매장 더욱 인기 단체 모임 단체 회식 자리 점점 손님 장안동 맛집 던데 점심 메뉴 아주 저녁 치가 조참 무한리필 참치회 야채 오이 당근 양파 먹기 단무지 락교 생강 샐러드 시작 먹기 시작 그릇 미소 된장국 쫄깃 문어 다리 소라 새우 문어 숙회 소라 와사비 초고추장 순삭 참치 초밥 간장 달걀찜 음식 메인 음식 참치회 기도 쫄깃 참치 전문점 부위 제공 달라 차이 참치 라이스 참치회 자태 보기 참치회 먹기 먹기 제공 입안 참치회 냄새 참치회 참기름 소금 흡사 소고기 육회 참치 기름 와사비 간장 초고추장 와사비 무순 일식 참치 질리 참치 해도 매우 장안동 맛집 장한평역 맛집 고민 장한평 맛집 서울 횟집 장안동 횟집 그릇 가루 가득 비비 날치 알밥 탄수화물 보충 이만 아주 일품 국물 국물 입안 포만 참치 전문점 참치 쫄깃 쫄깃 참치 부위 기름 입안 살살 점도 질감 특수 부위 부위 최고 참치회 참치 나중 개인 취향 가장 한판 참치회 아무 걱정 다시 판이 무한리필 일식 스타일 참치 코스 요리 퀄리티 참치 장한평 맛집 가족 외식 데이트 맛집 단체 회식 공간 추천 장안동맛집 장한평역맛집 장한평맛집 서울횟집 장안동횟집 참치 장한평 서울특별시 동대문구 장한로 블로그 체크 장소,장안동맛집 장한평역맛집 장한평맛집 서울횟집 장안동횟집
1,서울 동대문 서울 참치 무한리필 장한평맛집 참치,참치 장한평 동대문구 장한로 영업 라스트 연락처 단체 예약 가능 참치 장한평역 출구 거리 위치 출구 스타벅스 골목 매장 식당 모범 음식점 영업 점심때 매장 손님 미리 예약 기본 식기 세트 식사 단체 방문 기념일 방문 참치 메뉴판 사시미 무한리필 기준 점심 식사 애피타이저 채소 장국 장안동 맛집 참치 참치초밥 문어 숙회 새우 소라 생선 계란찜 특회 스페셜 부위 설명 기억 기억 참치 이건 사케 사케 주문 진짜 부위 윤기 참치 기름 입안 가득 소고기 진짜 고기 참치 진짜 고기 초장 기름 예전 참치 냉동 아주 참치 진짜 쫀득 난리 난리 소담 조합 참치 무한 순삭 리필 음식 무한리필 음식 경우 전혀 처음 신선도 기본 한판 리필 해먹 사장 서비스 서비스 조개 정도 마지막 완벽 참치 점심 초밥 판매 근처 직장인 매장 회식 가족 모임 커플 데이트 참치 무제한 장안동맛집 추천 참치 장한평 서울특별시 동대문구 장한로 블로그 체크 장소 장한평역맛집 장안동횟집,장한평역맛집 장안동횟집
2,장한평역맛집 횟집 추천 퀄리티 가성 참치 무한리필,참치 전남 목포 고향 초등학생 자주 서울 자주 가성 퀄리티 사시미 무한리필 지금 리뷰 시작 참치 장한평 위치 서울 동대문구 장한로 장한평역 출구 영업 월토 오전 일요일 휴무 전화번호 대표 메뉴 회덮밥 알밥 대구 알탕 점심 메뉴 참치회 스페셜 특회 스페셜 사시미 추가 정보 무한리필 가능 주차 가능 단체 보유 장한평역맛집 참치 외관 장안동 횟집 사조 참치 장한평역 출구 근처 위치 건물 참치 장한평 서울특별시 동대문구 장한로 블로그 체크 장소 장안동횟집 참치 내부 인테리어 참치 장한평역 인석 단체 구비 점심 메뉴 방문 가족 끼리 외식 오기 프라이 모임 준비 매장 단체 모임 메뉴판 참치 장한평 메뉴판 사시미 무한 리필 주문 무한리필 감안 사시미 편이 점심 식사 정말 가성 메뉴 가기 리뷰 회덮밥 리만 기본 반찬 요리 아주 장한평역 회사원 점심 메뉴 주문 음식 메뉴 추천 주문 메뉴 특회 스페셜 무한리필 저녁 방문 특회 스페셜 주문 주문 슴슴 자극 입맛 친구 원샷 문어숙회 소라 새우 사이드 메뉴 문어숙회 소라 새우 혜자롭 사시미 무한 키시 그냥 공짜 주시 계란찜 생선 사시미 무한리필 그냥 기본 반찬 초밥 옥수수 콘도 사시미 무한리필 추가 주시 줄줄이 음식 메인 메뉴 때깔 가요 자체 선홍빛 사시미 녹음 참치 장한평 재생 접기 무한리필 그거 기름 좔좔 와사비 왕창 사실 기름 중화 와사비 단맛 더욱 감칠맛 무한리필 플레이 리필 그릇 리필 부족함 주시 무순 간장 회랑 개맛 마끼 새우 소라 문어 숙회 계란찜 대구 생선 샐러드 초밥 마끼 사시미 모든 무한리필 사시미 종종 모해 가격 구성 참치 장한평 매우 추천 점심 메뉴 회덮밥 석도 점심 혼밥 장소 매우 추천 장안동맛집 장한평역맛집 장한평맛집 서울횟집 장안동횟집 참치회 동대문 참치 안평역 점심 특선 동대문 참치 무한리필 동대문 횟집 안평역 무한리필 동대문 횟집,장안동맛집 장한평역맛집 장한평맛집 서울횟집 장안동횟집 사조참치회 동대문참치 장안평역점심특선 동대문참치무한리필 동대문횟집 장안평역회무한리필 동대문횟집
3,혼술 기행 서울 장안동 횟집 장한평역 맛집 참치 장한평,오늘 소개 스끼 다시 매우 장안동 횟집 장한평역 맛집 참치 평점 매장 위치 참치 장한평 서울특별시 동대문구 장한로 블로그 체크 장소 매장 정보 주소 장안동 영업 일요일 휴무 매장 번호 편의 시설 서비스 무한리필 단체 가능 예약 무선인터넷 주차 자체 주차공간 인근 장안 피존 주차장 이용 가능 위치 서울 동대문구 장한로 참치회 정말 장사 장한평역 맛집 내부 모습 바깥쪽 테이블 칸막이 프라이 먹기 회식 자리 데이트 모든 충족 근처 직장 점심 오기 한쪽 찌석 저녁 사시미 혼술 기도 미리 예약 피크타임 피해 덕분 식사 참치 메뉴판 서울 장안동 횟집 장한평역 맛집 조참 평점 메뉴판 스끼다시 사시미 스페셜 세트 점심식사 먹기 메뉴 사케 대중 참치 연어초밥 연어 팔고 특회 스페셜 특회 스페셜 라인업 미리보기 재생 특회 스페셜 라인업 미리보기 특회 스페셜 이제 스끼 다시 구성 입맛 식전 야채 스틱 먼저 사시미 맛김 락교 생강 단무지 초밥 에피타이저 먹기 아주 최고 초밥 광어 부위 해산물 모듬 소라 새우 문어 회로 벌써 쫄깃 문어 새우 지모 단맛 소라 사케 아주 그냥 극락 자체 사케 마시기 잔술 일반 잔술 소주 뒷맛 숙취 양념 생선 구이 생선 양념 생선 이의 조합 역시 술안주 횟집 국룰 콘치 계란찜 중간 입가심 장국 나중 그냥 미리 소개 새우 튀김 메인 사시미 술안주 상이 진짜 스끼 다시 장안동 횟집 그르치 오늘 메인 역시 사시미 가지 부위 사시미 비주 기전 짬뽕 곱빼기 부위 뇌피셜 수도 적신 카미 배꼽 메카 도로 황새치 뱃살 도로 뱃살 다랑어 목살 부위 육회 특수 부위 볼살 부분 다랑어 아시 댓글 짐함 자체 구성 가격 일부 리필 전체 퀄리티 입안 가득 참치 배꼽 부위 매력 식감 뱃살 부위 역시 새싹 방어 먹듯 원래 나중 마끼 스끼다시 거절 퀄리티 의미 장한평역 맛집 장안동 횟집 참치 협찬 장한평역맛집 장안동맛집 장안동횟집 동대문 참치 참치 서울횟집 추천 맛집 추천 덕분 혼술 한바탕 지인 소개 퀄리티 서울 장안동 횟집 장한평역 맛집 참치 포스팅,협찬 장한평역맛집 장안동맛집 장안동횟집 동대문참치 사조참치 서울횟집추천 맛집추천
4,장한평 참치 무한리필 참치회 장안동 맛집,오늘 장한평역 위치 참치회 무한리필 맛집 참치 장한평 리뷰 참치 장한평 서울특별시 동대문구 장한로 블로그 체크 장소 참치회 노래 퇴근 접선 저녁 근처 참치 군데 해물 알탕 맛집 건물 맛집 출구 도보 저녁 출구 도착 참치 참치 이름 익숙 잡채 장안동 장한평 맛집 참치 무한리필 참치 실내 좌석 라락 테이블 정도 준비 신발 단체 이서 프라이 센스 천장 말소리 테이블 시야 만족 무한리필 여러 종류 고민 자주 실장 스페셜 픽픽 점심 메뉴 근처 직장인 점심 회덮밥 아주 기본 셋팅 락교 생강 혜자 무한리필 달라 눈치 처음 주시 스끼 다시 참치회 초밥 문어 숙회 우소 양념 생선 튀김 계란 입맛 메뉴 수다 스끼 다시 금방 참치회 비쥬 부위 장안동 장한평 맛집 참치 무한리필 참치 참치 컨디션 부분 살코기 계란찜 부위 접사 무순 기름 완벽 조합 소주 한잔 참치 둘이서 한판 순삭 실장 리필 바루 라곸 필로 접시 참치 퀄리티 가마 살이 진짜 장안동 장한평 맛집 참치 무한리필 참치 새우 튀김 마끼 탕안 생선 토막 자꾸 주심 참치 수도 대구 자구 메뉴 무한리필 참치 상태 별로 걱정 부위 만족 참치 장한평 재생 접기 참치 무한리필 참치 장한평 참치 퀄리티 영상 보고 가세 오늘 장안동 참치 맛집 조참 장한평 리뷰,
5,참치 장한평 장안동 횟집 장안동 맛집,전국 맛집 소개 벼랑 오늘 장안동 위치 무한리필 참치 전문점 참치 평점 프라이 참치 무한 참치 소개 참치 장한평 주소 서울 동대문구 장한로 영업 매일 라스트 대표 번호 무한리필 단체 이용 가능 예약 무선인터넷 참치 평점 장안동 위치 전통 참다랑어 전문점 장한평역 출구 도보 거리 위치 찾기 특회 스페셜 예약 당일 방문 프라이 세팅 기분 매우 특회 스페셜 최고급 사시미 계절 스끼다시 사시미 스페셜 참치 평점 추천 메뉴 자리 직원 설명 본격 스끼다시 시작 쌈장 오이 당근 스틱 양파 락교 처음 국물 제공 본격 식사 입맛 국물 문어숙회 쫄깃 재미 고추냉이 초고추장 살짝 양념 생선 조림 짭쪼름한 침샘 자극 쌈장 야채 스틱 참치 스페셜 참치 때깔 종류 참치 부위 부위 먹기 기대 보기 만해 쫀득 식감 참치 부위 쫀득 매력 무순 제공 가까이 지금 군침 폭발 비주 식감 쫀득하 부위 부위 자리 고추냉이 감칠맛 기름 살짝 직행 사진 참치 스끼다시 초밥 참치 클리어 해나 참치 살짝 초장 락교 입안 다시 참치 사시미 제공 계란찜 계란찜 무순 듬뿍 참치 사시미 방법 참치 초장 간장 느낌 매력 달라 당근 오이도 쌈장 기름기 참치 사시미 계속 자칫 중간 중간 야채 스틱 입안 사시미 꼬들 쫀득해 재미 참치 뱃살 부위 기름기 쫀득 일품 참치 생선 다시 하루 직원 정말 식사 참치 장한평 개별룸 식사 테이블 직원 호출 소규모 단체 수용 모임 아래 지도 장한평 맛집 참치 참치 장한평 서울특별시 동대문구 장한로 블로그 체크 장소,
6,장한평역맛집 참치 장한평 특회 스페셜,참치 장한평 장한평역맛집 특회 스페셜 주소 서울 동대문구 장한로 영업 매일 전화번호 전통 참치 맛집 장한평역맛집 참치 평점 소개 외관 참치 평점 장한평역 출구 골목 초입 부근 위치 건물 내부 좌석 마련 프라이 예약 방문 안내 신발 이용 메뉴 장한평역맛집 참치 전체 메뉴 런치 메뉴 엄마 이모 저녁 방문 특회 스페셜 인과 스페셜 초밥 주문 상차림 스끼 다시 주문 상이 기름 간장 된장국 밑반찬 인원 새우 정말 락교 단무지 듬뿍 사장 인심 특회 스페셜 스페셜 초밥 메인 메뉴 특회 스페셜 부위 다채롭 여러가지 실화 무한리필 참치 장한평 재생 접기 특회 스페셜 장한평역맛집 참치 오늘 장안동횟집 인정 동영상 역시 참치 냉동 참치 정말 좔좔 윤기 간장 기름 와사비 제일 스페셜 초밥 초밥 코다리 제일 참치 부위 초밥 회랑 정말 맥주 한잔 셀프 부메랑 가족 생각 생각 무지 계란찜 마끼 여자 장한평역맛집 장안동횟집 참치 장한평 추천 참치 장한평 서울특별시 동대문구 장한로 블로그 체크 장소 장안동맛집 장한평역맛집 장한평맛집 서울횟집 장안동횟집 참치 참치 장한평 참치 평점 장한평역 횟집,장안동맛집 장한평역맛집 장한평맛집 서울횟집 장안동횟집 사조참치 사조참치장한평 사조참치장한평점 장한평역횟집
7,장한평역 무한리필 참치 맛집 장안동 참치,날짜 토요일 날씨 맑음 제목 장한평역 무한리필 맛집 장안동 참치 장한평역 무한리필 참치 맛집 장안동 참치 회식 가족 외식 오늘 가정 방문 장한평역 맛집 포스팅 회중 참치회 느낌 부모님 식사 거나 친구 한잔 종종 참치회 맛집 장안동 참치 만족 후기 지금 시작 구성 참치 초밥 문어 새우 옥수수 생선 구이 계란찜 진짜 다리 옥수수 감자 샐러드 톡톡 식감 도리 제일 메인 디쉬 참치 상태 장안동 참치회 추천 세상 감동 장국 락교 채소 기본 장국 생각 참치 궁합 계란찜 먹기 넘김 식전 모락모락 상태 먹기 모든 음식 참치 장한평 해산물 소주 안주 끝판 새우 문어 전복 술술 해산물 사이드 해산물 만취 포장 와사비 원피스 해산물 꼬득꼬득 식감 전복 초장 바다 일품 문어 윤기 자르르 비주 영상 글함 참치초밥 반칙 소고기 육회 참치 초밥 진짜 피스 횟감 자체 사르르 계속 감탄 달달 짭쪼롬 생선 진짜 음식 혼란 무한리필 참치 맛집 이제 정기 기름 듬뿍 와사비 무순 참치 폭발 극락 참치 간장 소스 조합 모말 감칠맛 참치 기름 원래 이제 기름 연어 대화 조합 참치 자체 음식 도리 참치 참치 장한평 만족 후기 거기 구성 기념일 데이트 부모님 외식 모임 회식 식당 신분 추천 장안동 맛집 부모님 외식 술집 추천 참치 장한평 횟집 재생 장안동 맛집 부모님 외식 술집 추천 참치 장한평 횟집 오늘 참치 장한평 서울특별시 동대문구 장한로 블로그 체크 장소 영업 문의 전화 주소 서울 동대문구 장한로 휴무 연중 블린 답방 장한평역맛집 장한평역 술집 장한평역 참치 장한평역 횟집 장안동횟집 장안동 참치 장안동맛집 장안동 술집 참치 맛집 장안동 외식 장안동 술집 장안동 회식,블린이 답방 장한평역맛집 장한평역술집 장한평역참치 장한평역횟집 장안동횟집 장안동참치 장안동맛집 장안동술집 참치맛집 장안동외식 장안동룸술집 장안동회식
8,장한평역맛집 참치 장한평 참치 무한리필,맹짱 자격증 시험 요즘 이직 자기계발 뭔가 공부 신청 시험 신청 벼락치기 어쨌든 시험 보고 때문 축하 멍맹네 뭔가 기념일 음식 참치 생각 때문 오늘 참치 요즘 생활비 하루 정도 가기 장한평역맛집 참치 장한평 참치 무한리필 퀄리티 아주 참치 참치 장한평 서울특별시 동대문구 장한로 블로그 체크 장소 장한평역맛집 칭할 장한평역 출구 위치 회식 데이트 아주 조회 참치 장한평역 내공 참치회 맛집 장한평역 근처 회식 무조건 추천 얘기 완비 거기 다가 공간 전혀 부담 요즘 여름 개별 에어컨 아주 공간 참치 참치 여름철 최고 장한평역 근처 술집 찾기 때문 추추추 추천 처음 에피타이저 오이 당근 마늘 요즘 마늘쫑철 입맛 최고 때문 참치 달리기 위해 달래 죽도 점심 살짝 걱정 세상 정말 맹멍 리필 몇번 초밥 오매 부위 초밥 입맛 두번째 해산물 해산물 야들야들 문어 새우 새우 소라 새우 초장 미미 두번째 계란찜 이건 어쩜 진짜 속도 리필 멍맹 부부 오늘 리필 장한평역맛집 참치 계란찜 맹멍 참치 계란 잔뜩 코다리 조림 간장 감칠맛 대박 비법 맹짱 해체 코다리 정말 싹싹 처음 스끼 멍맹 파서 걱정 군용 비주 놀란 멍맹 저번 참치 참치 해동 잘못 완전 참치 멍맹 역시 전문점 연어 참치 진짜 전문점 사실 설명 맹멍네 친구 이건 완전 육회 초장 고기랑 식감 맹짱 최애 식감 아주 기름기 별로 부위 서로 부위 잔뜩 먹기 합의 부분 사르르 고급 부위 생각 정말 역시 참치 참치 부위 맹짱 부위 부위 멍맹 부위 부분 식감 부위 아주 이건 장한평 참치 맛집 종류 별로 녹음 정도 아주 그냥 기름기 부위 무순 군용 장국도 무한 흡입 기름기 부위 맹짱 술술 시험 기분 데이트 아주 멍맹 두번째 리필 모나 부위 역시 부위 처음 부위 리필 눈치 주지 걱정 그릇 주시 다시 부위 양도 아주 역시 부위 멍맹 참치 기분 상태 장한평역 맛집 참치 참치 멍맹 계란찜 추가 리필 계란찜 맛집 저걸 진짜 공기 뚝딱 살살 참치 계란찜 쑤욱 케케 지리 거기 마끼 아주 멍맹 한번 참치 런가 사장 덕분 아주 장한평역맛집 참치 장한평 무한리필 제대로 리필 해도 부위 살살 부위 멍맹 참치 무한리필 성공 서울횟집 추천 약속 정말 참치 방문 퀄리티 아주 마끼 빵빵 케케 맹멍네 특회 스페셜 식사 메뉴 식사 보고 군용 부담 메뉴 주류 참치 서비스 참치 퀄리티 매우 식사 참치 맛집 재생 접기 참치 장한평역맛집 발견 멍맹 오늘 방문 의사,
9,장안동 맛집 무한리필 참치 전문점 참치 장한평,안녕 오늘 포스팅 장한평역 맛집 참치 장한평 참치 장한평 네이버 방문자 리뷰 블로그 리뷰 서울 동대문구 장한로 매일 호선 장한평역 출구 출구 스타벅스 농협 은행 건물 사이 직진 삼거리 좌회전 매장 실내 모습 매장 테이블 테이블 프라이 공간 미닫이 자리 걸이 각룸 에어컨 독립 공간 방해 메뉴 메뉴 무한리필 무한리필 실장 스페셜 마늘 술안주 당근 요리 로만 와사비 역시 와사비 듬뿍 무순 간장 참치 간장 간장 무순 꿀팁 꿀팁 기름 장도 음식물 음식물 생강 절임 이용 발라 역시 사조 참치 사조 참치 소주 애피타이저 초밥 생선 초밥 계란찜 보슬보슬 계란찜 코스 주시 메인 샐러드 샐러드 숟가락 듬뿍 메인 실장 스페셜 와우 메인 실장 스페셜 특수 부위 주시 참치 정말 장안동 맛집 무한리필 참치 전문점 참치 장한평 재생 접기 장안동 맛집 무한리필 참치 전문점 참치 장한평 참치 음소 리가 절로 그냥 기름 간장 부위 간장 부위 기름 술술 문어 새우 코스 문어숙회 새우 식감 해산물 참치 중간 중간 감초 대구 취기 조개 맑은 국물 감칠맛 진국 장안동 맛집 무한리필 참치 전문점 참치 장한평 재생 접기 장안동 맛집 무한리필 참치 전문점 참치 장한평 마끼 마지막 입가심 날치 톡톡 마끼 반주 한잔 취해 최애 안주 참치 장한평역 맛집 참치 사장 실장 영향력 기억 장안동 횟집 참치 참치 장한평 고고씽 참치 장한평 서울특별시 동대문구 장한로 블로그 체크 장소 장안동맛집 장한평역맛집 장한평맛집 서울횟집 장안동횟집,장안동맛집 장한평역맛집 장한평맛집 서울횟집 장안동횟집
10,장안동 맛집 참치 장한평 장한평역 참치 실장 스페셜,푸드파이터 참치 러버 벌써 정도 작년 크리스마스 장한평 대한 추억 장한평역 참치 맛집 참치 평점 참치 장한평 서울특별시 동대문구 장한로 블로그 체크 장소 참치 장한평 주소 서울 동대문구 장한로 번호 영업 단체 이용 가능 예약 무선 인터넷 식사 인석 인석 프라이 이용 혼술 장한평 맛집 참치 단체 방문 부모님 모시 방문 아주 장한평 맛집 참치 참치 무한리필 기본 정도 리필 점심 식사 회사원 방문 실장 스페셜 주문 실장 스페셜 장한평역 맛집 참치 기본 세팅 배정 식사 장한평역 맛집 참치 애피타이저 등장 장국 장국 진짜 자꾸 직원 센스 계속 리필 장한평역 참치 참치 참치 필수 아시 백김치 사조 포인트 계속 주시 기분 식사 장한평역 참치 참치 기본 구성 참치 단무지 락교 생강 간장 기름 참치 방문 전날 마음 장한평역 참치 장안동 맛집 참치 참치 참치 초밥 문어 숙회 새우 소라 와사비 초장 와사비 애초 완전 고요 초밥 참치 초밥 아주 행복 장한평역 참치 장안동 맛집 참치 초장 본식 두둥 장한평역 참치 장안동 맛집 참치 참치 등장 사실 자주 이름 기억 리필 안해 장안동 참치 장안동 맛집 참치 안나 냉동 정말 먹기 부분 참치 평점 먹기 먹기 소금 와사비 백김치 장안동 참치 장안동 맛집 참치 참치 사케 소주 가끔 배달 역시 참치 최고 생강 장어 먹기 시작 면서 생강 초밥 생강 이용 간장 소스 생강 나중 참치 간장 필요 생강 조합 장안동 참치 장안동 맛집 참치 무순 무순 요청 드릴 필요 무순 가득 원래 리지 김이랑 참치 정도 장안동 참치 장안동 맛집 참치 리필 생각 참치 구만 슬슬 참치 리필 요청 아주 완전 지리 지리 지리 처음 완전 고기 양도 깜짝 콩나물 가득 정말 고기 완뚝했어 장안동 맛집 참치 장한평 장한평 참치 실장 스페셜 재생 접기 장안동 맛집 참치 장한평 장한평 참치 실장 스페셜 마끼 날치 알도 역시 마무리 마끼 양도 퀄리티 참치 장한평 후기 장안동 참치 장안동 맛집 참치 나오니 군자역 날씨 정말 환상 완전 봄날 계속 정거장 호선 골목 골목 동네 구경 분위기 기분 음식 기분 아주,
11,맛집 장한평역 근처 참치 참치,회식 장소 장한평역 참치 입구 계산 지나 세팅된 테이블 자꾸 사진 깜박 대리 참치 장한평 서울특별시 동대문구 장한로 블로그 체크 장소,
12,직장인 점심 사조 참치 특정,참치 장한평 서울특별시 동대문구 장한로 블로그 체크 장소 장한평역 참치 본의 투어 지하가 지하 냄새 퀘퀘 메뉴판 보통 점심 메뉴 메뉴판 오늘 먹기 특정 가격 점심 먹기 내부 생선 구이 코다리 그냥 코다리 참치초밥 비빔국수 나름 문어 소라 참치 해동 먹기 느낌 도로 부위 부위 나름 괜춘 가격 때문 대감 계란찜 깜빡 마지막 알밥 매운탕 생각 참치 가격 워낙 그냥 코스 요리 가격 점심 먹기 부담 저녁 제대로 보고 참치회 가장 테이블 보나 알밥 알탕 보고,
