,title_pos,content_pos,hash_tag
0,강북 수유 수유역맛집 갈비 맛집 추천 갈비 유점,오늘 강북구 위치 갈비 유점 후기 갈비 유점 서울특별시 강북구 수유로 예약 블로그 체크 장소 갈비 유점 영업 매일 라스트 주차 가능 네이버 예약 가능 오늘 회사 근처 위치 갈비 직장 동료 자주 방문 갈비 맛집 갈비 유점 우이 신설 화계역 수유역 중간 위치 체크 체크 내부 분위기 포장마차 테이블 갈비 먹기 분위기 직원 뭔가 열정 느낌 방문 기분 갈비 유점 메뉴 소금 구이 갈비 간장 양념 갈비 매운 양념 갈비 주먹밥 잔치국수 물냉면 비빔냉면 누룽지 메뉴 아시 맛집 보통 단일 메뉴인 경우 금요일 주말 손님 가득 정도 맛집 모든 양념 소스 육수 직접 정성 단골 비결 갈비 고기 초벌 뼈쪽 정도 먹기 갈비 주문 정도 초벌 추가 주문 미리 미리 계란찜 돼지껍데기 서비스 리필 가능 매일 인분 갈비 준비 때문 진시 마감 실제 방문 재고 소진 조기 마감 처음 갈비 백김치 장아찌 껍데기 콩가루 갈비 양념 소스 껍데기 무제한 주시 갈비 장점 쫄깃 껍데기 콩가루 착착 껍데기 기본 주시 계란찜 라면 계란찜 갈비 무제한 건더기 해장국 바람 요즘 날씨 호호 중간 중간 입맛 느낌 소금 구이 갈비 간장 양념 갈비 도착 갈비 갈비 미리 초벌 뼈쪽 정도 분리 갈비 살이 장갑 비닐 장갑 본격 갈비 먹기 시작 예전 비닐 장갑 먼저 장갑 는걸 장갑 먼저 갈비 비쥬 매운 양념 갈비 양념 소스 매콤한 완성 주먹밥 갈비 동글동글 주먹밥 주문 주먹밥 호호 낳을 마지막 마무리 야구르트 주시 사장 감동 남자친구 야구르트 고자질 수유역 근처 갈비 갈비 유점 방문 적극 추천 갈비 수유역맛집 화계역 맛집 수유맛집 수유역 갈비,와와쪽갈비 수유역맛집 화계역맛집 수유맛집 수유역쪽갈비
1,강북 수유역맛집 갈비 유점,오늘 매일 만석 웨이팅 수유역맛집 갈비 유점 근처 웨이 오늘 방문 감격 갈비 유점 서울특별시 강북구 수유로 예약 블로그 체크 장소 갈비 유점 서울 강북구 수유로 수유역 출구 매일 영업 종료 라스트 포장 예약 단체 이용 가능 배달 주차 가능 내부 테이블 단체 모임 지금 사진 손님 별로 보이 사진 만석 수유고기집 갈비 유점 대표 메뉴 소금 구이 갈비 간장 양념 갈비 매운 양념 갈비 단계 단계 사이드 주먹밥 잔치국수 물냉면 비빔냉면 누룽지 정말 따땃 숯불 미리 예약 세팅 준비 양념장 콩가루 양파 절임 백김치 수유역맛집 갈비 유점 서비스 껍데기 계란찜 해장국 수유역맛집 갈비 유점 가장 매력 계란찜 껍데기 무한 서비스 소리 팬티 주문 수유역 고기 갈비 유점 메인 간장 양념 갈비 매운 양념 갈비 단계 먼저 간장 양념 갈비 수유역맛집 갈비 유점 고기 초벌 정도 돼지껍데기 정말 쏙쏙 껍데기 쫀득쫀득해 이름 양념 완전 구리 갈비 짝꿍 주먹밥 등장 비비고 숟가락 주먹밥 날치 간이 매운 양념 갈비 단계 달달 매콤한 양념 매운 껍데기 갈비 양념 중독 매콤 숯불 직화 구이 전문점 갈비 모든 양념 소스 육수 직접 양념 비법 정말 껍데기 계란찜 매운 양념 갈비 단계 추가 갈비 초벌 정도 미리 추가 주문 매운 양념 갈비 제일 살이 정말 갈비 이유 고기 별로 살이 발라 가게 편견 다시 한번 갈비 유점 수유역맛집 갈비 유점 갈비 매일 정량 준비 판매 소진 조기 마감 사람 갈비 갈비 갈비 유점 정말 항상 만석 이유 이제 가족 갈비 부시 정말 갈비 대박 서비스 무한 수유역 고기 갈비 유점 추천 강북 강북구 수유 수유역 수유동 유리 맛집 고기 밥집 수유역맛집 수유리맛집 수유고기집 수유밥집 수유역밥집 맛집 고기 단체 모임 서비스 친구 연인 커플 가족 외식 회식 추천 갈비 유점,강북 강북구 수유 수유역 수유동 수유리 맛집 고기집 밥집 수유역맛집 수유리맛집 수유고기집 수유밥집 수유역밥집 화계맛집 화계고기집 단체 모임 서비스 친구 연인 커플 가족 외식 회식 추천 와와쪽갈비 수유점
2,수유 갈비 맛집 갈비 유점 방문 후기,수유 갈비 맛집 갈비 유점 방문 후기 가족 외식 갈비 맛집 요즘 수유 갈비 평일 퇴근 갈비 유점 주차 음주 예정 갈비 사장 문의 주차 안내 대한민국 갈비 수유 갈비 갈비 메뉴 원래 웨이팅 정도 수유 갈비 맛집 평일 조기 퇴근 방문 러키 웨이 갈비 매일 인분 판매 재료 소진 갈비 보고 수유 갈비 가장 매력 계란찜 돼지 껍데기 무한 서비스 술안주 안성맞춤 일렬 분위기 주문 기본 갈비 숯불 무한리필 돼지껍데기 먼저 안주 갈비 돼지껍데기 안주 콩가루 듬뿍 쫄깃 쫄깃 소금 갈비 인분 매운 양념 갈비 인분 주문 갈비 초벌 주문 정도 소요 무한리필 계란찜 해장국 계란찜 때문 갈비 폭신 부들부들 갈비 궁합 반찬 서비스 나오니 아주 상이 수유 갈비 주먹밥 사진 군침 또르르 이제 갈비 소금 구이 매운 양념 초벌 정도 살짝 갈비 셀프 주먹밥 불판 노릇 노릇 그냥 양념 꼬치 먹기 취향 저격 갈비 유점 소금 단백 갈비 특유 본연 양념 갈비 매콤하니 입맛 자극 정말 계속 중간 중간 서비스 해장국 계란찜 페어리 쭉쭉 갈비 가면 계란찜 리필 번은 필수 식사 대중교통 타고 가야 섬유 탈취 비치 걱정 입가심 요구르트 만족도 갈비 유점 서울특별시 강북구 수유로 예약 블로그 체크 장소,
3,계란찜 돼지껍데기 무한리필 수유 갈비 맛집 갈비 유점,주말 수유 방문 정말 갈비 발견 갈비 유점 방문 손님 가격 메뉴 갈비 대기 판이 대기 기본 반찬 먼저 갈비 유점 메뉴 갈비 계란찜 돼지껍데기 서비스 대박 갈비 방법 단체 예약 자리 장갑 목장 비닐 장갑 숯불 돼지껍데기 해장국 계란찜 계란찜 진짜 계란찜 돼지껍데기 무한리필 수유 갈비 맛집 갈비 재생 계란찜 돼지껍데기 무한리필 수유 갈비 맛집 갈비 국도 먹기 건더기 돼지껍데기 먼저 주문 날치 주먹밥 간장 갈비 양념 갈비 인분 초벌 돼지껍데기 갈비 껍데기 진짜 쫀득 계란찜 돼지껍데기 무한리필 수유 갈비 맛집 갈비 재생 계란찜 돼지껍데기 무한리필 수유 갈비 맛집 갈비 콩가루 진짜 갈비 계란찜 돼지껍데기 무한리필 수유 갈비 맛집 갈비 재생 계란찜 돼지껍데기 무한리필 수유 갈비 맛집 갈비 고기 손질 먹기 개인 양념 계란찜 돼지껍데기 무한리필 수유 갈비 맛집 갈비 재생 계란찜 돼지껍데기 무한리필 수유 갈비 맛집 갈비 먹기 갈비 양념 단계 진짜 잔치국수 냉면 양도 갈비 일요일 저녁 방문 일요일 저녁 사람 방문 진짜 갈비 유점 수유 갈비 수유역 갈비 강북구 갈비 수유 동쪽 갈비 수유 회식 수유역 회식 강북구 회식 수유동 회식 수유역맛집 수유리맛집 수유고기집 수유밥집 수유역밥집 수유 갈비 수유역 갈비 갈비 유점 강북구 갈비 강북 갈비 수유 고기 맛집 수유 갈비 맛집 수유고기집 추천 수유 고깃집 추천,와와쪽갈비수유점 수유쪽갈비 수유역쪽갈비 강북구쪽갈비 수유동쪽갈비 수유회식 수유역회식 강북구회식 수유동회식 수유역맛집 수유리맛집 수유고기집 수유밥집 수유역밥집 수유와와쪽갈비 수유역와와쪽갈비 와와쪽갈비수유점 강북구와와쪽갈비 강북와와쪽갈비 수유고기맛집 수유쪽갈비맛집 수유고기집추천 수유고깃집추천
4,수유역 화계역 낮술 갈비 맛집 갈비 돼지껍데기 무한리필,갈비 수유 갈비 맛집 강북 갈비 맛집 수유 갈비 수유역 갈비 강북구 갈비 우동 갈비 수유 회식 수유역 회식 강북구 회식 수유동 회식 우이동 맛집 우이 동쪽 갈비 맛집 우이동 저녁 화계역 갈비 맛집 화계역 맛집 짜장 오늘 수유역 맛집 갈비 후기 고합 창동역 수유역 우이동 마음 창동 맛집 호평 숯불 직화 구이 초벌 금방 냄새 베일 수유역 맛집 갈비 후기 갈비 유점 상호 갈비 유점 주소 서울 강북구 수유로 영업 매일 전화번호 포장 단체 주차 오픈 수유역 화계역 낮술 식당 갈비 유점 서울특별시 강북구 수유로 예약 블로그 체크 장소 수유역 출구 도보 위치 자주 거리 추억 길이 가게 소개 주차 카운터 문의 주차장 자리 외관 사람 식당 정감 테이블 보유 숯불 화구 갈비 갈비 유점 네이버 방문자 리뷰 블로그 리뷰 예약 예약 방문 메뉴 소개 짜장 간장 양념 주먹밥 콜라 맥주 갈비 냄새 음식 소개 기본 구성 기본 껍데기 양파 절임 백김치 소스 계란찜 서비스 한잔 콩나물국 기절 구성 수유역 화계역 사시 고기 껍데기 먼저 맥주 콩가루 야들야들 쫀득쫀득 리필 진짜 도리 간장 양념 살이 오늘 주인공 등장 고해 정렬 사이 장갑 준비 완료 완전 갈비 소스 간장 짭쪼름한 입맛 진짜 양념 정도 이분 가능 주먹밥 궁합 최고 낮술 주먹밥 비주 듬뿍 가루 듬뿍 날치 듬뿍 기분 공기 주먹 주먹 비주 절반 무조건 소스 간장 갈비 양념 갈비 짜장 갈비 창동 맛집 정도 수유역 화계역 맛집 초벌 주차 서비스 수유 회식 수유역 회식 화계역 회식 장소 수유역 낮술 수유 낮술 낮술 화계역 낮술 수유리맛집 갈비 유점 수유역맛집 화계역 맛집 수유역 특수 부위 고기 수유역 고기 수유 회식 수유 저녁 수유맛집 수유 데이트,와와쪽갈비 수유쪽갈비맛집 강북쪽갈비맛집 수유쪽갈비 수유역쪽갈비 강북구쪽갈비 수우동쪽갈비 수유회식 수유역회식 강북구회식 수유동회식 우이동맛집 우이동쪽갈비맛집 우이동저녁 화계역쪽갈비맛집 화계역맛집 수유회식 수유역회식 화계역회식 수유역낮술 수유낮술 화계낮술 화계역낮술 수유리맛집 와와쪽갈비수유점 수유역맛집 화계역맛집 수유역특수부위고기집 수유역고기집 수유회식 수유저녁 수유맛집 수유데이트
5,수유역 맛집 갈비 유점,갈비 간혹 곳도 오늘 수유역 맛집 양도 강력 추천 갈비 소개 가게 외관 수유역 맛집 갈비 수유역 출구 도보 도착 맛집 랍니 화계역 가게 초벌 모습 군침 아아 가게 내부 가게 초벌 갈비 손질 모습 냄새 후각 자극 내부 외부 좌석 준비 한참 저녁 방문 수유역 갈비 맛집 사람 맛집 식사 시작 한쪽 스프레이 충전기 준비 매일 인분 준비 판매 방문 법도 크게 벽면 메뉴판 갈비 전문점 단일 메뉴 소금 간장 양념 단계 별로 준비 후식 먹기 사이드 메뉴 준비 주문 메뉴 가격 간장 갈비 인분 양념 단계 인분 주먹밥 주문 메뉴 후기 먼저 먼저 양념장 백김치 장아찌 준비 녀석 고기 반찬 시원 우거지 먼저 녀석 진짜 한지 공기 녀석 공기 뚝딱 갈비 초벌 먹기 돼지 껍데기 계란찜 인원 준비 정말 정도 깜짝 사장 가요 추가 주문 주먹밥 공기 초벌 고기 쫀득 돼지 껍데기 콩가루 돼지 껍데기 고소 쫀득 결코 초벌 갈비 간장 인분 양념 단계 인분 갈비 살이 별로 생각 계시 사실 갈비 살이 생각 한적 수유역 맛집 갈비 유점 그동안 편견 완전 트리 보이시 통통 살코기 가족 이서 인분 숯불 장갑 간장 감칠맛 매운 단계 절대 매콤한 소스 계속 매운 먹기 마지막 후식 주신 요구르트 식사 방문 갈비 편견 완전 수유역 맛집 갈비 재미 고기 양념 준비 질리 사장 알바생 서비스 식사 갈비 유점 추천 위치 정보 갈비 유점 서울특별시 강북구 수유로 예약 블로그 체크 장소 운영 안내 상호 갈비 유점 서울시 강북구 수유로 영업 매일 휴무 전화번호 예약 단체 이용 포장 배달 주차,
6,수유역맛집 갈비 숯불 직화 구이 맛집,요즘 갈비 갈비 맛집 숯불 직화 구이 초벌 방문 수유역 맛집 갈비 유점 리뷰 갈비 유점 영업 매일 전화번호 갈비 유점 외관 도착 냄새 솔솔 보기 침샘 폭발 갈비 유점 수유역 출구 거리 위치 위치 포스팅 아래 지도 참고 갈비 메뉴판 소금 구이 간장 양념 매콤한 매운 양념 추천 사이드 주먹밥 잔치국수 왕왕 추천 초벌 정도 소요 불판 아래 정도 가끔 두툼 살코기 살짝 밑반찬 매운 양념 콩가루 돼지껍데기 백김치 양파 장아찌 계란찜 찌개 찌개 소고기 국밥 선지 해장국 계란찜 무한리필 초벌 돼지껍데기 금방 돼지껍데기 무한리필 돼지껍데기 양념 쫀득 달달 콩가루 계속 매운 양념 갈비 단계 매운 보통 살이 한쪽 마련 갈비 유점 갈빗대 양쪽 살코기 참숯 먼저 초벌 육즙 가득 살이 쫄깃 양념 입맛 매콤 정도 물리 양념 매운 양념 갈비 완전 강력 추천 주먹밥 공기 양으로 주먹밥 정도 날치 단무지 가루 참기름 주먹밥 정석 소주 맥주 음식 주류 필수 아래 재미 맥주잔 후식 요구르트 갈비 유점 숯불 초벌 육즙 가득 쫄깃 갈비 맛집 추천 연말 회식 데이트 가족 외식 갈비 유점 갈비 유점 위치 갈비 유점 서울특별시 강북구 수유로 예약 블로그 체크 장소,
7,수유역맛집 로컬 맛집 갈비 유점,갈비 유점 서울 강북구 수유로 매일 라스트 주차 포장 예약 단체 이용 가능 배달 갈비 유점 서울특별시 강북구 수유로 예약 블로그 체크 장소 오늘 갈비 갈비 수유고기집 동네 맛집 동네 친구 예정 지하철 이용 수유역 출구 도보 거리 접근성 월요일 퇴근 손님 주말 방문 만석 매장 진짜 테이블 끼리 간격 회식 장소 추천 실제 회식 대표 메뉴인 갈비 소금 구이 갈비 간장 양념 갈비 매운 양념 갈비 단계 단계 외로 주먹밥 물냉면 비빔냉면 잔치국수 비빔국수 간장 양념 갈비 매운 양념 갈비 잔치국수 주먹밥 주문 주문 나니 기본 기본 제공 쫀득 돼지 껍데기 양념장 콩가루 백김치 양파 절임 초벌 구이 그동안 돼지껍데기 계속 서비스 기본 생각 기본 신한 계란찜 해장국 갈비 가득 갈비 재생 갈비 갈비 주먹밥 양도 매운 갈비 조합 동글동글 먹기 두기 메인 메뉴인 갈비 등장 초벌 불판 정도 한눈 보아 살이 갈비 고기 때깔 진짜 장갑 갈비 달달 짭쪼름 간장 양념 숯불 제대로 정말 고기 살이 쏙쏙 먹기 메뉴 잔치국수 주문 양은 냄비 더욱 느낌 잔치국수 육수 유부 가득 식사 한잔 기도 메뉴 날씨 더욱 메뉴 후식 사장 후식 요구르트 기분 식사 느낌 추천 생각 갈비 고기 생각 갈비 유점 방문 수유역맛집 수유리맛집 수유고기집 수유밥집 수유역밥집 갈비 유점 갈비 수유역 갈비 수유역 갈비 갈비 맛집,수유역맛집 수유리맛집 수유고기집 수유밥집 수유역밥집 와와쪽갈비수유점 와와쪽갈비 수유역갈비 수유역쪽갈비 화계쪽갈비 화계맛집
8,수유역 맛집 추천 갈비 도리 갈비 유점,수유역 방문 소요 가지 오빠 외식 점심 갈비 유점 방문 오픈 방문 초벌 메뉴 방문 사장 전화 문의 오시 갈비 유점 위치 갈비 유점 서울특별시 강북구 수유로 예약 블로그 체크 장소 운영 라스트 연중 번호 가격 주차 포장 예약 단체 이용 가능 배달 갈비 유점 수유역 출구 도보 거리 위치 주차 확인 카운터 문의 방문 매장 미리 연락 위치 보시 서로 매장 편쪽 주차 공간 마련 오픈 본인 방문 확인 예약 퇴근 사람 가득 외관 내부 갈비 언뜻 초벌 기계 갈비 유점 재생 접기 갈비 유점 부공 테이블 정도 마련 구비 살짝 옛날 포차 성의 테이블 갈비 유점 재생 접기 갈비 유점 충전기 아기 의자 마련 가족 끼리 외식 오픈 테이블 가족 외식 테이블 어르신 테이블 아기 가족 남매 안쪽 냉장고 주류 구비 냉장고 원산지 표시 메뉴 주문 메뉴판 벽면 갈비 리지 가지 종류 양념 갈비 사이드 메뉴 음료 준비 매운 양념 소스 단계 선택 걱정 간장 양념 갈비 소금 구이 갈비 인분 주먹밥 잔치국수 주문 메뉴 벽면 기본 세팅 음식 기본 밑반찬 서비스 콩가루 양파 절임 백김치 양념 소스 돼지껍데기 장갑 비닐 장갑 집게 가위 접시 장갑 비닐 장갑 접시 제공 대망 주문 음식 서비스 돼지껍데기 계란찜 기본 밑반찬 제외 돼지껍데기 계란찜 서비스 진짜 덜덜 진짜 제공 사장 갈비 유점 재생 접기 갈비 유점 갈비 초벌 마무리 돼지껍데기 먼저 여러 양념장 돼지껍데기 때쯔음 초벌 갈비 껍데기 기름기 탁탁 튀어 매운 양념 한번 콩가루 듬뿍 정말 도리 사이사이 매콤 달콤 쫀득쫀득 쫄깃 쫄깃 쪽쪽 식감 껍떼기 더욱 감칠맛 요즘 음식 오빠 최애 껍데기 서비스 주시 방문 껍데기 떔시 강도 불로 쫄깃 아주 입천장 입술 입천장 국물 국물 아주 계란찜 아주 계란찜 식감 갈비 금구 초벌 나오니 직화 양념 갈비 설명 갈비 유점 재생 접기 갈비 유점 사장 매운 양념장 한번 감동 양념 소금 구이 갈비 간장 양념 달콤 매콤 진짜 갈비 기름기 좔좔 양념 구이 크기 비주 피부 느낌 냄새 안나 자체 한번 보고 갈비 매력 소금 구이 살짝 간이 매력 간장 양념 구이 간장 양념 구이 간장 양념 쪽쪽 장갑 가위 집게 갈비 가위 집게 그냥 젓가락 아주 발라 지네 소금 구이 양념 구이 갈비 살이 주먹밥 정말 주먹밥 지름 대충 정도 주먹밥 담당 오빠 고기 담당 주먹밥 손맛 가미 갈비 유점 재생 접기 갈비 유점 사장 말씀 주먹밥 숯불 겉바 천상 참기름 고소 달달 단무지 갈비 정말 주먹밥 겉바 아삭뽀독 날치 단무지 식감 주먹밥 갈비 궁합 최고 기본 세팅되 서비스 리필 주문 음식 완전 가성 최고 초벌 정도 소요 음식 추가 주문 경우 미리 주문 먹기 에이 사실 숯불 직화 태운 갈비 갈비 처음 숯불 직화 조리 경우 보지 경우 초벌 갈비 수유역 주변 단체 모임 회식 장소 갈비 갈비 사이드 메뉴 면도 회식 모임 외식 느낌 메뉴 하니 하루 정말 기분 시작 마무리 오빠 정말 갈비 유점 추천 화장실 건물 위치 사장 서비스,
9,수유고기집 갈비 유점,수유고기집 갈비 유점 중순 정도 날씨 지난 주말 기온 바람 불면 감기 유의 생각 간만 고기 생각 아내 한번 얘기 갈비 영접 오늘 수유고기집 갈비 유점 소개 갈비 유점 갈비 유점 서울특별시 강북구 수유로 예약 블로그 체크 장소 주소 서울 강북구 수유로 수유역 출구 영업 매일 라스트 매장 외관 내부 수유고기집 갈비 유점 외관 활짝 야장 분위기 하필 야외 테이블 살짝 한쪽 갈비 풍경 사람 발걸음 도착 매장 내부 사람 차서 매일 인분 판매 진시 조기 마감 하니 가면 느낌 느낌 주말 저녁 가족 친구 갈비 주류 메뉴판 수유고기집 갈비 유점 메뉴판 소금 구이 간장 양념 매운 양념 가지 갈비 먹기 주먹밥 냉면 누룽지 사이드 메뉴 도갱 부부 소금 구이 인분 단계 매운 양념 인분 주먹밥 고기 맥주 주문 후기 시래기 된장국 백김치 양파 장아찌 반찬 먼저 갈비 유점 계란찜 돼지껍데기 무한리필 제공 콩가루 매운 소스 갈비 주문 초벌 정도 소요 때문 돼지껍데기 가래떡 돼지껍데기 진짜 아내 돼지껍데기 재료 주먹밥 돼지껍데기 콩가루 매운 소스 쫄깃 쫄깃 동시 입맛 돋궈줍니 오늘 주인공 갈비 등장 갈비 갈비 센스 준비 장갑 먼저 착용 위생 장갑 젓가락 갈비 소금 구이 먼저 초벌 뼈쪽 정도 숯불 가득 금은 쫄깃 쫄깃 매운 양념 구이 차례 양쪽 살이 가득 두툼 녀석 보기 만해 마음 양념 때문 자주 포인트 고기 두툼 입맛 맥주 아내 사실 생각 껍질 갈비 조합 맥주 생각 메뉴 구성 돼지껍데기 주먹밥 갈비 양도 둘이서 정말 갈비 식감 수유고기집 갈비 유점 기억 주말 마무리 갈비 유점 재생 갈비 유점 갈비 유점 네이버 방문자 리뷰 블로그 리뷰,
10,갈비 노원 직원 정말,갈비 노원 직원 정말 갈비 갈비 노원 친절 돼지껍데기 맛남 노원 볼일 식사 노원 곳도 생각 매력 갈비 노원 서울특별시 노원구 상계로 예약 블로그 체크 장소 지도 강북 지역 창동 점도 수유 점도 동네 냄새 진동 갈비 경우 노원역 아래 굴다리 냄새 홀려 술술 초벌 진짜 가족 부분 과감 타지 가면 양념 고기 타지 스킬 사진 자리 소금 구이 갈비 간장 양념 갈비 매운 갈비 가격 인분 인분 주문 국룰 테이블 인분 주문 사이드 메뉴 주먹밥 잔치국수 누룽지 물냉비 냉이 갈비 아래 직원 크게 갈비 소주 국룰 다운 기본 소스 주목 콩가루 이건 갈비 돼지껍데기 조합 금구 매운 소스 소스 밑반찬 매력 오기 돼지 껍데기 돼지껍데기 일어나서 이야기 무려 기본 반찬 돼지껍데기 갈비 초벌 껍데기 돼지껍데기 무려 무한리필 대박 돼지껍데기 사람 진짜 소주 안주 무한 돼지껍데기 추가 리필 사실 돼지껍데기 사람 리필 직원 수도 생각 리필 직원 말씀 라며 테이블 대체 사장 알바 비용 요즘 시대 저런 직원 생각 정도 갈비 노원 직원 정말 갈비 갈비 노원 친절 돼지껍데기 맛남 돼지껍데기 살짝 과자 살짝 꼬들할 더욱 중요 사실 돼지껍데기 타지 메인 소금 구이 갈비 매운 양념 갈비 대한 사진 발라 비닐 장갑 장갑 때문 크게 호호 중요 장갑 사진 찍기 요즘 블로그 대한 애정 일수 마지막 입가심 고민 냉면 돼지껍데기 물냉면 주문 국수 주문 국수 어마 무시 냉면 평범 이야기 달걀찜 무한리필 요청 주시 혜자 가게 이야기 절로 서비스 서비스 친절 이면 친절 도심지 기분 식사 느낌 속초 사진 여자 사이 모습 기분 사진 카톡 프로필 사진 그냥 개인 사진 마음속 핸드폰 블로그 작성 기록 와이프 재미 액션 동작 보고 엄마 동작 지수 초등학생 저학년 요즘 저녁 와이프 맥주 생각 컨트롤 고민 시기 대한 정답 대답 갈비 노원 직원 정말 갈비 갈비 노원 친절 돼지껍데기 맛남 지수 갈비 조만간 데리 가면 가게 지수 가게 친절 녀석 요즘 정말 친절 음식 장사 생각 주도,와와쪽갈비 와와쪽갈비노원점 친절 돼지껍데기 맛남 와와쪽갈비 와와쪽갈비노원점 친절 돼지껍데기 맛남 와와쪽갈비 와와쪽갈비노원점 친절 돼지껍데기 맛남
