,title_pos,content_pos,hash_tag
63,서울 수유 이자카야 이자카야 토라 가성 이자카야 추천,본가 수유 타지 생활 다시 본가 본가 가장 사랑 가족 친구 아주 가까이 일요일 저녁 약속 부담 전혀 가격 수유역 이자카야 고딩칭구 그동안 이야기 잔뜩 일요일 저녁 이자카야 토라 유점 소개 이자카야 토라 유점 평일 주말 주차 어려움 위치 이자카야 토라 유점 서울특별시 강북구 노해로 블로그 체크 장소 수유역 골목 맛집 도보 대중교통 이용 추천 외관 뭔가 엄근진 가게 간판 고등학생 일본어 지금 내부 이자카야 토라 유점 엘리베이터 타고 가게 시작 복도 은근 엄근진 느낌 곳곳 용맹 호랑이 그림 잔뜩 토라 호랑이 가게 내부 회식 모임 장소 느낌 창가 자리 스크린 노래 프로그램 아마 비긴 어게인 분위기 야구 축구 스포츠 경기 생각 화장실 내부 하마 만족 메뉴판 테이블 오스 주문 이자카야 가성 메뉴 설명 직원 호출 요청 노래 신청 기능 기본 안주 기본 안주 뻥튀기 과자 사실 안주 친구 그릇 이건 토리 오뎅 갑작스레 날씨 오늘 무조건 오뎅 토라 오뎅 가격 정말 어묵 친구 하튜 오뎅 오뎅 와사비 간장 간장 상큼 이건 느낌 어묵 이건 유부 만두 야채 튀김 국물 잔뜩 머금 찌리 이자카야 자꾸 메뉴 찌리 진짜 사랑 아래 소스 간장 느낌 단맛 찌리 와사비 살짝 소스 무조건 찌리 룰루 친구 머쓱 토리 한참 튀김 토라 안주 잔뜩 인정 진로골드 오늘 주종 역시 소주 일요일 자제 친구 소주 스타일 소주 마시기 퇴사 이야기 이직 이야기 하니 쭉쭉 술술 콜라 근처 가성 이자카야 자주 느낌 서울 수유 이자카야 이자카야 토라 가성 이자카야 추천 재생 접기 서울 수유 이자카야 이자카야 토라 가성 이자카야 추천 클립 영상 수유 술집 수유맛집 수유이자카야 이자카야 토라 유점 찌리,수유술집 수유맛집 수유이자카야 이자카야토라수유점 모찌리도후
64,수유역 이자카야 토라 안주 가성 술집,이자카야 토라 수유역가성비술집 수유역이자카야 퇴근 수유역 이자카야 토라 위치 이자카야 토라 주소 서울 강북구 노해로 영업 마감 전화 이자카야 토라 유점 서울특별시 강북구 노해로 블로그 체크 장소 메뉴판 이자카야 토라 건물 입구 메뉴판 안주 종류 정말 가격 수유역 가성 술집 추천 내부 음악 마시기 아주 분위기 테이블 오스 메뉴 보기 주문 메뉴판 정독 주문 주문 메뉴 샤브 전골 베이컨 감자전 소주 생맥주 샤브 전골 베가 먼저 비주 대박 가격 원대 요즘 제격 전골 안주 고기 불판 두루 고기 숙주 가득 팽이버섯 송이버섯 표고버섯 버섯 육수 샤브샤브 먹듯 사진 집게 이용 고기 숙주 육수 고기 해주시 야채 고기 육수 육수 왤케 살짝 소주 안주 제격 칠리소스 안주 원대 가성 가쓰오부시 가득 베이컨 감자전 가격 무색 베이컨 감자전 계란 노른자 먹기 남자친구 진짜 종류 감자 바닥 감자 가득 식감 베이컨 생맥 남자친구 안주 소주 가게 분위기 술술 나베 감자전 안주 양도 가성 수유역 이자카야 토라 강추,
65,수유역이자카야 가성 토라 솔직 리뷰,박사 규딩입니 오늘 규딩이 소개 드릴 수유역 위치 초초 가성 이자카야 안주 원대 가기 소개 이자카야 토라 유점 서울 강북구 노해로 월금 토일 수유역이자카야 이자카야 토라 유점 수유역 출구 도보 거리 위치 술집 오기 가기 가게 외관 수유역이자카야 토라 가게 외관 보이 이자카야 느낌 물씬 분위기 가게 내부 가게 내부 앞쪽 메뉴 미리 가게 내부 무척 손님 곳곳 부분 단체 모임 프라이 데이트 술집 메뉴판 수유역이자카야 토라 메뉴판 메뉴 주류 노미 샤브 전골 꼬치 구이 탕류 바나 정말 메뉴 메뉴 가격 메뉴 정말 차로 오기 과일 규딩이 메뉴 선택 소고기 큐브 수박 기린 생맥주 메뉴 사진 기본 안주 뻥튀기 안주 먹기 국룰 먼저 큐브 수박 큐브 수박 수박 연유 듬뿍 달달 입가심 메뉴 식사 오신 정말 메뉴 수유역이자카야 토라 메뉴 소고기 소고기 규딩이 안주 소주 안주 맥주 안주 제격 메뉴 단백질 메뉴 아주 간장 베이스 소스 무순 깻잎 수유역이자카야 토라 차로 방문 보이 술안주 손색 안주 토라 상이 여행 이야기 다가 후쿠오카 비행기 티켓 은근 프라이 느낌 술집 대화 여행 수유역이자카야 토라 수유역 술집 가성 술집 토라 추천 이자카야 토라 유점 서울특별시 강북구 노해로 블로그 체크 장소,
66,수유역맛집 술집 이자카야 토라 수유 메뉴판,수유역맛집 술집 이자카야 토라 수유 메뉴판 서울 강북구 노해로 이자카야 토라 유점 서울특별시 강북구 노해로 블로그 체크 장소 리리 한번 회식 회식 점심식사 저녁 건너 술집 고고씽 위치 안주 검색 결정 위치 수유역 정말 안주 종류 이자카야 계단 용해도 엘리베이터 이용 엘리베이터 가게 내부 가게 내부 여러 설치 축구 경기 수유역맛집 술집 이자카야 토라 수유 메뉴판 실제 태블릿 메뉴 방문 우유부단 결정 선택 장애 사람 안주 한나절 주문 고추장 육회 소고기 불고기 깻잎 타코 바지락 술찜 연어 사시미 껍질 꼬치 파산 꼬치 은행 꼬치 베이컨 감자전 주문 화장실 남자 여자 공용 화장실 여서 맥주 먼저 안주 한잔 껍질 꼬치 파산 꼬치 은행 꼬치 먹기 꼬치 안주 기본 보장 안주 맥주 안주 고추장 육회 사실 고추장 양념 시킴 날씨 육회 소고기 소고기 와사비 소고기 바닥 파슬리 이스 깻잎 와사비 살짝 가득 베이컨 감자전 철판 노미 계란노른자 컷팅 주문 안주 무늬 몸빼바지 무늬 조끼 진주 목걸이 남자 공짜 런가 안주 이자카야 토라 노미 맛집 의도 방문 노미 추천 불고기 깻잎 타코 매장 내부 조명 살짝 플래시 플래시 차이 불고기 깻잎 타코 바지락 술찜 분명 날씨 시리 코끝 바지락 술찜 추가 주문 살짝 매콤한 국물 매력 바지락 술찜 파스타 면도 바지락 재미 연어 사시미 일행 연어 사시미 추가 주문 완전 연어 사시미 주류 이자카야 토라 오늘 샤브전골 하이 친구 모임 연말 모임 회식 소로 가성 분위기 술집 추천,
67,수유역가성비술집 이자카야 토라 유점 소고기,이자카야 토라 유점 서울특별시 강북구 노해로 블로그 체크 장소 영업 월금 토일 전화번호 최근 술집 발견 강북구 제일 쌈뽕 술집 이자카야 토라 유점 방문 가성 수유역 출구 도보 거리 메인 스트리트 매장 손님 대부분 창가 입구 근처 화장실 모로 수유역가성비술집 이자카야 토라 유점 메뉴 재생 수유역가성비술집 이자카야 토라 유점 메뉴 수유리먹자골목맛집 이자카야 토라 메뉴판 한라 감귤 빙수 레인보우 빙수 안주 메뉴 꼬치 나베 튀김 멕시칸 요리 안주 가성 오코노미야키 야끼소바 철판요리 꼬치 꼬치 연어 사시미 타코야끼 밀푀유 고추장 육회 바나 디저트 안주 눈길 간다 하이 역시 종류 하이 알콜 하이 수도 데킬라 슬래머 데킬라 탄산 칵테일 식전주 주문 기본 안주 강냉이 대형 티브이 딩고 킬링 벌스 노을 편이 빵빵 사운드 공연장 기분 오늘 수유역가성비술집 이자카야 토라 꼬치 주문 옵션 선택 링클 청양 꼬치 꼬치 파우더 갈릭 소스 갈릭 디핑 링클 청양 소스 깻잎 청양 닭다리 느낌 갈릭 디핑 꼬치 이름 뿌링가루 디핑소스 호불호 청양 마요 깻잎 요가 밸런스 조절 입안 매운 폭풍 흡입 등장 안주 겉면 살짝 쇠고기 드레싱 소고기 먹기 크기 소스 와사비 찡긋 가격 고기 소스 생강 와사비 깻잎 이건 양파 제일 정도 꼬치 냄비 우동 가쓰오부시 우려 육수 간장 감칠맛 국물 냄비 우동 파산 꼬치 사실 설명 보고 주문 어묵 꼬치 어묵 설명 생각 느낌 면도 유부 안주 뭔가 무난 수유역이자카야 토라 유점 청곡 한번 신청 이자카야 토라 청곡 신청 버튼 화면 모짜렐라 기본 그냥 설정 성별 선택 메시지 입력 수도 이자카야 토라 유점 청곡 재생 이자카야 토라 유점 청곡 의상 찰떡 청곡 마음 달달 스푼 찌리 보기 한술 푸딩 두부 중간 특유 식감 우유 미가 플레이 신경 사람 중장 년층 손님 오시 단체 이용 술자리 수유역가성비술집 이자카야 토라 유점 수유역이자카야 수유역가성비술집 수유리먹자골목맛집 수유이자카야토라 강북구이자카야 수유역 술집 수유역 단체 이자카야 유신 청곡 술집,수유역이자카야 수유역가성비술집 수유리먹자골목맛집 수유이자카야토라 강북구이자카야 수유역저렴한술집 수유역단체이자카야 수유신청곡술집
68,수유역 가성 술집 추천 이자카야 토라 후기,뜐뜐 오늘 수유역 이자카야 수유역 가성 술집 토라 후기 서울 강북구 노해로 평일 주말 단체 이용 가능 예약 남녀 화장실 구분 수유이자카야 토라 수유역 출구 소요 정말 위치 토라 위치 누가 토라 호랑이 그림 토라 이자카야 느낌 뿜뿜 실제 수유이자카야 토라 이자카야 느낌 정말 이자카야 가장 이자카야 분위기 정말 창문 폴딩도어 여름 창문 개방 더욱 분위기 내부 생각 기존 이자카야 규모 수유이자카야 토라 안쪽 자리 단체 이용 정도 수유역이자카야 토라 실물 신분증 출입 불가능 하니 참고 실물 신분증 필수 메뉴 주문 주문 진짜 메뉴 가격 대의 술안주 이자카야 토라 출처 이자카야 토라 일품 요리 출처 이자카야 토라 나베 철판요리 출처 이자카야 토라 연어 요리 타코야끼 노미 닭꼬치 메뉴 출처 이자카야 토라 종류 한눈 메뉴 정말 메뉴 밀푀유 차돌 야끼소바 베이컨 감자전 소주 주문 안주 마카로니 과자 테이블 수저 젓가락 각인 수저 젓가락 토라 이자카야 수유역 가성 술집 추천 이자카야 토라 후기 재생 수유역 가성 술집 추천 이자카야 토라 후기 제일 먼저 차돌 야끼소바 밀푀유 나베 밀푀유 겹겹이 야채 고기랑 이자카야 대표 메뉴 비주 밀푀유 나베 이건 밀푀유 나베 소스 칠리소스 간장 베이스 레몬 소스 수유역 가성 술집 추천 이자카야 토라 후기 재생 접기 수유역 가성 술집 추천 이자카야 토라 후기 배추 야채 국물 정말 인정 육수 정말 차돌 야끼소바 수유역 가성 술집 추천 이자카야 토라 후기 재생 접기 수유역 가성 술집 추천 이자카야 토라 후기 생각 차돌 은근 야끼소바 야채 간이 계속 술안주 메뉴 마지막 베이컨 감자전 메뉴 가지 가장 메뉴 메뉴 베이컨 감자전 생소 감자전 노미 가쓰오부시 생각 제일 서비스 주신 아스 크림 약과 마무 으리 역시 마지막 아이스크림 체고 비운 수유역 가성 술집 이자카야 토라 안주 장점 베이컨 감자전 가도 정말 수유역이자카야 술집 새벽 이자카야 토라 유일 이인 싸람 수유역 토라 이자카야 토라 유점 서울특별시 강북구 노해로 블로그 체크 장소 수유역이자카야 수유역가성비술집 수유리먹자골목맛집 수유이자카야토라 강북구이자카야 수유역맛집 수유역술집,수유역이자카야 수유역가성비술집 수유리먹자골목맛집 수유이자카야토라 강북구이자카야 수유역맛집 수유역술집
69,수유역가성비술집 이자카야 토라 대형 스크린 술집 단체 모임 추천,수유역술집 토라 존맛 안주 뿌시 가성 푸파 대형 스크린 사방 팔방 축구 야구 응원 야장 테라스 느낌 낭낭 이자카야 토라 유점 서울 강북구 노해로 월금 토일 이자카야 토라 유점 서울특별시 강북구 노해로 블로그 체크 장소 수유역술집 이자카야 토라 위치 수유역 출구 수유역 골목 엘베 타고 가면 오늘 만취 등장 입장 토라 직원 창문 화알짝 테라스 술집 야장 느낌 낭낭 단체 모임 매장 온갖 벽면 대형 스크린 대형 티비 압도 월드컵 야구 응원 창가 자리 잡고 메뉴 블로거 디방 메뉴판 진짜 모든 안주 원대 물가 정도 가성 메뉴 위주 주문 시작 오늘 술자리 주문 금방 오늘 메인 파스 로제 파스타 정도 조화 파스타 낭낭 파스타 추가 크리미 제의 감칠맛 노미 주문 가성 비도 바삭 쫀득 진심 가성 술집 수유역이자카야 토라 한참 붕어싸만코 서비스 최애 아이스크림 아시 진짜 존맛 소주 안주 제격 아시 화장실 매장 안쪽 남녀 구분 여자 화장실 깔꼼함 세면대 바깥 공용 만취 요즘 둘이서 디방 만취,
70,수유역 가성 술집 추천 꼬치 이자카야 토라,수유역 가성 술집 추천 꼬치 이자카야 토라 라미 오늘 수유역 가성 술집 꼬치 이자카야 토라 이자카야 토라 위치 공간 내부 테이블 깔꼼해 인석 다인 자리 메뉴 정말 꼬치 진짜 진탕 마시기 구성 오뎅 오뎅 진짜 가격 대비 구성 오뎅 종류 최소 종류 구성 양도 가득 친구 한잔 오뎅 무한 파티 가넝할 정도 오뎅 친구 야채 국물 제대로 오뎅 정말 야채 얼매 간장 코옥 꼬치 종류 진짜 어마 무시 주문 종류 양도 생각 종류 꼬치 나열 진짜 종류 구성 완전 만족 베이컨 떡말 닭목 구성 바베큐 소스 진짜 만족 하나로 꼬치 기절 마음 호호 꼬지 해물 야채 조합 호호 꼬치 취향 저격 완전 가능 안주 가격 생각 산더미 기절 샐러드 가라 구성 진짜 안주 구성 조쿤 사장 센스 양념 치킨 소스 칠리 소스 가지 도리 진짜 바삭 육즙 가득 안주 친구 위치 이자카야 토라 유점 서울특별시 강북구 노해로 블로그 체크 장소 이자카야 토라 수유역 출구 근처 영업 새벽 새벽 오늘 수유역 위치 이자카야 맛집 이자카야 토라 진짜 메뉴 양도 친구 가기 수유 맛집 라미 이자카야 토라 제일,
71,수유역가성비술집 이자카야 토라 방문 후기,수유역가성비술집 이자카야 토라 방문 후기 유리 골목 술집 좌석 가성 술집 친구 방문 이자카야 토라 영업 평일 익일 주말 익일 수유역 골목 용용 선생 건물 위치 매장 입구 메뉴판 게시 한눈 확인 메인 메뉴 금액 가짓수 주머니 학생 방문 주머니 직장인 방문 눈물 매장 내부 엘리베이터 타고 매장 부로 도착 살짝 계단 추천 매장 워낙 단체 방문 대화 집중 일본어 토라 호랑이 매장 곳곳 호랑이 이자카야 화장실 소하 거나 매장 외부 마련 매장 내부 남녀 구분 화장실 제일 구석 자리 오스 통해 청곡 접수 옛날 헌팅 포차 느낌 자리 그릇 전설 마약 과자 메인 메뉴 기도 수유역가성비술집 메인 메뉴 부담 가격 원산지 표지판 오스 한쪽 구석 상대 테이블 대화 거나 단체 참여 단체 아무 메뉴 샤브 전골 베가 메인 메뉴인 주문 사이드 전골 야채 가운데 야채 그릇 테이블 수유역가성비술집 이자카야 토라 방문 후기 재생 수유역가성비술집 이자카야 토라 방문 후기 수유역가성비술집 이자카야 토라 방문 후기 재생 수유역가성비술집 이자카야 토라 방문 후기 고추장 회도 고추장 육회 깻잎 치즈 수유역가성비술집 이자카야 토라 방문 후기 재생 수유역가성비술집 이자카야 토라 방문 후기 수유역가성비술집 이자카야 토라 유점 방문 후기 안주 단체 친구 한잔 가기 방문 의사 이자카야 토라 유점 서울특별시 강북구 노해로 블로그 체크 장소,
72,수유역 가성 술집 아침 이자카야 토라,누나 친절 가성 비도 요즘 자주 이자카야 토라 양도 가격 분위기 이자 토라 자주 가게 자주 술집 토라 후기 시작 이자카야 토라 유점 서울특별시 강북구 노해로 블로그 체크 장소 영업 월금 토일 전화번호 주차 화장실 장내 남녀 구분 인스타 사진 동영상 팔로워 팔로잉 게시 사진 동영상 보기 수유역 출구 우측 사거리 좌측 용용 선생 건물 사장 마중 주신 입구 건물 왼쪽 계단 엘리베이터 계단 입구 엘리베이터 매장 환영 매장 사장 할머니 조끼 바지 환영 매장 마음 지점 방문 분위기 예상 창문 야장 느낌 창가 파티션 좌석 조명 먹기 분위기 대형 스크린 경기 보기 노래 청곡 가능 화장실 매장 남녀 구분 테이블 태블릿 주문 편리 이유 경기 운동경기 한잔 경기 대형 스크린 축구 야구 경기 기억 이자카야 토라 유점 대형 스크린 경기 메모 수유 대형 스크린 수유 야구 수유 축구 화장실 매장 남녀 구분 화장실 거울 역시 한장 토라 실문 신분증 토라 손님 닉네임 설정 단체 노래 신청 토라 추억 태그 스토리 서비스 출동 이자카야 토라 유점 수유 술집 수유역술집 강북 술집 사진 동영상 팔로워 팔로잉 게시 이자카야 토라 유점 수유 술집 수유역술집 강북 술집 사진 동영상 보기 직원 호출 수유역 가성 술집 아침 이자카야 토라 재생 수유역 가성 술집 아침 이자카야 토라 메뉴 종류 동영상 첨부 진짜 메뉴 이도 알콜 러버 이유 하이 알콜 잔술 소주 맥주 맥주 종류 별로 모든 제일 돈까스 김치 찰떡 주문 친구 최애 간장 계란 주문 벌써 가성 돈까스 김치 수유역 가성 술집 아침 이자카야 토라 재생 수유역 가성 술집 아침 이자카야 토라 돈까스 유부 포인트 체리 어묵 국물 김치 양파 숙주 쑥갓 잔뜩 야장 느낌 뿜뿜 노래 안주 한잔 아주 환상 수유역 가성 술집 아침 이자카야 토라 재생 수유역 가성 술집 아침 이자카야 토라 계란 안주 준비 완료 소주 준비 완료 국물 돈까스 야채 두번째 안주 등장 테바 사키 후라이드 마늘 날개 나고야 날개 튀김 메뉴 교차 주문 메뉴 선택 옵션 반도 선택 후라이드 마늘 주문 바삭 후라이드 먼저 달달 마늘 아주 수유역 가성 술집 아침 이자카야 토라 재생 수유역 가성 술집 아침 이자카야 토라 이건 맥주 안주 맥주 찰떡 소주 한잔 날개 양쪽 잡고 한번 발라 먹기 그다음 달달 마늘 간장 계란 마늘 테바 사키 아주 간장 계란 사람 수유역 가성 술집 아침 이자카야 토라 재생 수유역 가성 술집 아침 이자카야 토라 왜인 공기밥 계란 가루 간장 참기름 환상 꼬소 아시 테이블 손님 주문 마법 메뉴 간장 계란 비어 안주 뭔가 잘못 된거 가격 차로 추천 학생 추천 사람 추천 볼때 추천 수유 분위기 술집 추천 수유 가성 술집 추천 수유역이자카야 수유역가성비술집 수유리먹자골목맛집 수유이자카야토라 강북구이자카야 수유 성비 술집 수유 분위기 술집 수유 술집 수유 성비 이자카야 수유이자카야 이자카야 토라 수유,수유대형스크린 수유야구 수유축구 수유역이자카야 수유역가성비술집 수유리먹자골목맛집 수유이자카야토라 강북구이자카야 수유가성비술집 수유분위기술집 수유술집 수유가성비이자카야 수유이자카야 이자카야토라 수유2차
73,수유역 가성 술집 퀄리티 이자카야 토라 유점,저번 남자친구 남친 친구 커플 수유역 가성 술집 이자카야 토라 유점 차로 안주 음식 남자친구 다시 방문 이자카야 토라 유점 서울특별시 강북구 노해로 블로그 체크 장소 주소 서울 강북구 노해로 영업 오후 새벽 전화번호 단체 이용 최대 예약 가능 매장 단체 가기 완전 안주 종류 고민 이자카야 야끼소바 국물 기본 토라 오뎅 차돌 야끼소바 가지 주문 수유역 가성 술집 이자카야 토라 유점 기본 물이 보리 보리차 러버 완전 최고 기본 안주 국민 간식 가격 대비 가성 갑인 어묵 종류 여러가지 음식 야채 유부도 듬뿍 야채 음식 야끼소바 고기 반숙 라이 거기 생강 야끼소바 생강 역시 퀄리티 이제 흡입 시작 수유역 가성 술집 이자카야 토라 유점 음식 비주 다시 한번 감동 어묵 투성이 그냥 술술 정신 불닭 야끼소바 추가 주문 수유 가성 술집 이자카야 토라 유점 음식 퀄리티 한참 치즈 듬뿍 치즈 추가 이제 안주 크류 샤베트 추가 안주 기억 안주 부어 기억 잔뜩 정도 안주 분위기 완전 수유 가성 술집 이자카야 토라 유점,
74,수유역 가성 술집 이자카야 토라 간단 후기,수유역 술집 이자카야 토라 방문 후기 차로 고집 삼겹살 차로 진짜 아무 생각 눈앞 수유역 술집 이자카야 토라 외부 모습 사람 사진 찍기 미션임파서블 수유역 술집 이자카야 토라 내부 모습 전체 두운 조명 빨간색 포인트 조명등 수유 이자카야 토라 흡연실 내부 흡연실 술집 추천 토요일 저녁 사람 안쪽 테이블 사용 민폐 안주 자리 태블릿 주문 방식 국민 안주 강냉이 인간 사료 원샷 한번 분명 얼떨결 점점 매장 곳곳 화면 뮤비 대화 가능 바사 키라 치킨 해물짬뽕 간장 계란 주문 먼저 간장 계란 차만 수가 보통 절대 한국인 테바 사키 가지 정도 후추 짬뽕 아이스크림 서비스 하이 주문 슬슬 이자카야 토라 유점 서울특별시 강북구 노해로 블로그 체크 장소 위치 수유역 술집 이자카야 추천 안주 생각 가격 편이 가성 술집 수유역 가성 술집 이자카야 토라 간단 후기 수유역술집 수유역가성비술집 수유역이자카야 이자카야 토라 유점 수유 이자카야 토라 안주 맛집 흡연실 수유역 가성 술집 이자카야 토라 간단 후기 재생 수유역 가성 술집 이자카야 토라 간단 후기,수유역술집 수유역가성비술집 수유역이자카야 이자카야토라수유점 수유내돈내산 이자카야토라 안주맛집 흡연실
75,수유역 술집 수유 가성 술집 이자카야 토라,하이 오늘 수유역 가성 술집 이자카야 토라 포스팅 주소 서울 강북구 노해로 영업 전화번호 수유 메인 거리 위치 이자카야 토라 유점 용용 선생 건물 내부 옆쪽 야장 느낌 스크린 월드컵 축구 오기 술집 수유 이자카야 토라 메뉴판 하이 메뉴 노미 샤브 전골 감귤 주문 주문 테블릿 해주시 테블릿 청곡 이자카야 토라 인스타 스토리 서비스 기본 뻥튀기 보기 해도 상콤 감귤 끝맛 감귤 껍질 살짝 메인 안주 등장 샤브 전골 베가 정말 고기 아래 숙주 비주 마음 야채 투하 고기랑 숙주 추가 육수 간장 소스 매콤한 나베 칠리소스 간장 소스 꿀맛 고기 이자카야 나베 표현 노미 생각 가운데 노른자 냠냠냠 가쓰오부시 오징어 추가 수유역 가성 술집 이자카야 토라 재생 수유역 가성 술집 이자카야 토라 이자카야 토라 유점 서울특별시 강북구 노해로 블로그 체크 장소 수유역 술집 이자카야 토라 유점 술집 안주 일반 음식점 이자카야 토라 가성 메뉴 하이 종류 퀄리티 술집 방문 추천,
