,title_pos,content_pos,hash_tag
89,,갑자기 부대 휴무 결정 수유역 출발 이자카야 토라 유점 서울특별시 강북구 노해로 블로그 체크 장소 이자카야 토라 유점 분위기 스크린 뮤비 노래 주심 연어 사시미 나가사키 해물짬뽕 가성 나가사키 해물짬뽕 부어 점심 회전초밥집 스시 노칸 유점 방문 스시 노칸 유점 서울특별시 강북구 한천로 블로그 체크 장소 모든 접시 가격 점심 카페 상회 상회 로스 터스 수유 서울특별시 강북구 한천로 상회 로스 터스 블로그 체크 장소 커피 원샷 교보 문고 서로 교환 싸인 생각 싸인 빌런 서울특별시 강북구 한천로 블로그 체크 장소 저녁 빌런 칵테일 아일랜드 아이스티 도화 피치 크러쉬 개인 도화 제일 사진 이틀 내내 돼지 내일 다시 운동 시작,
90,수유 이자카야 토라,서울 강북구 노해로 월목 금일 이자카야 토라 유점 서울특별시 강북구 노해로 블로그 체크 장소 친구 추천 방문 이자카야 토라 술집 테바 사키 마늘 후추 기본 양념 추가 가격 친구 쓰랬어 날개 마늘 양념 아주 도리 서비스 아이스크림 고깃집 후식 퍼먹는 아이스크림 바지락 술찜 존맛 버터 매콤 존맛 소주 술술 기본 과자 안주 가격 화장실 노래 소리 커서 수유 술집 수유 토라 이자카야 토라 이자카야 토라 수유 수유맛집 토라 테바 사키 바지락 술찜 토라 맛집 이자카야 맛집 수유이자카야,수유술집 수유토라 이자카야토라 이자카야토라수유 수유맛집 토라 테바사키 바지락술찜 토라맛집 이자카야맛집 수유이자카야
91,서울 수유 방금 신상 가성 이자카야 수유 술집 단체 모임 헌팅 술집 이자카야 토라,원래 운영 달토 요기 발견 술집 이자카야 원래 요런 느낌 대기 수도 손님 위해 난로 대기 내부 예전 테이블 사람 만석 역시 오픈 원래 이자카야 느낌 가격 일식 술집 느낌 가성 사람 내부 인테리어 그냥 전형 프렌 이즈 술집 느낌 오스 주문 가능 소주 가격 물가 축구 경기 축구 티비 여럿 이서 오기 책상 단체 모임 가능 수유 단체 모임 술집 수유이자카야 술집 수유 성비 술집 수유 축구 술집 수유 축구 술집 모츠 차로 나름 사실 간간 가성 모츠 기본 새우 튀김 기름 느낌 가격 토라 오뎅 메뉴 가성 승부 느낌 사실 분위기 전반 일식 가격 오기 오뎅 관계 오늘 요정 에이 커브 기도 하루 이자카야 토라 유점 서울특별시 강북구 노해로 블로그 체크 장소 가성 이자카야 느낌 분위기 사람 장통 이자카야 사람 가지 이자카야 보급 버젼 차로 가기 가성 술집,수유단체모임술집 수유이자카야술집 수유가성비술집 수유축구술집 수유축구볼만한술집
92,수유역이자카야 토라 노미 감자전 굿굿,저번 토요일 한잔 슝슝 리터 하이 하이 한잔 금방 일반 볼보 얼음 노미 감자전 너므맛있슴 샤브 어제 두번째 방문 저번 솔드아웃 실패 저번 감자전 존맛 미아사거리 케이크 주문 링크 네이버 예약 케이크 미아사거리 부근 위치 앙금 플라워 떡케이크 케이크 미아사거리역 미아사거리 방향 직진 건너 숭곡 중학교 골목 정도 숭곡 중학교 위치 카카오 채널 케이크 문의 픽업 스케줄 영업 픽업 주소 서울시 성북구 종암로 하월곡동 좌측 미아사거리역 미아사거리 부근 위치 케이크 도보 차량 미아사거리 오시 차량 오시 일방 통행 이기 때문 아래 사진 쌀찜 즈란 당일 신한 쌀찜제누 냉장 냉동 보관 가능 당일 미아사거리 부근 하월곡동 위치 앙금 플라워 케이크 케이크 밀가루 용돈 케이크 반전 케이크 가능 용돈 케이크 반전 최대 가능 케이크 요즘 용돈 케이크 최근 색깔 별로 레드 숫자 케이크 숫자 케이크 디자인 주의 사항 케이크 최근 숫자 케이크 디자인 색상 예전 디자인 가격 안내 디자인 가격 안내 강북구 하월곡동 미아사거리역 위치 앙금 플라워 떡케이크 케이크 케이크 문의 카카오 채널 케이크 케이크 서울시 성북구 하월곡동 좌측,
93,수유역 이자카야 토라 모츠 판다,용용 선생 이자카야 토라 호랭이 일본말 토라 여기저기 용맹 호랑이 귀신 원래 토끼 술집 차로 홍콩 차로 일본 가기 코스 신상 수유역 술집 진짜 도장 기세 요새 아주 그냥 강북구 가성 이자카야 토라 광고 진짜 안주 가격 남아 정도 가격 대의 안주 눈길 이유 모츠 오케 오늘 이자카야 토라 고고 거임 토라 입구 엘리베이터 타고 매장 부잣집 느낌 주문 방식 메뉴판 찍기 가기 메뉴판 블로거 정신 셀프 칭찬 모츠 매장 분위기 어두컴컴 분위기 조명 음악 소리 노래 선곡 젊은이 만하 알바생 직원 금복주 철길 부산집 마주 보고 건물 건물 이자카야 시선 자리 잡고 시선 처음 두번째 음식 엉망 진창 수유역 이자카야 전쟁 모츠 품절 그냥 고민 대창 두부 부추 시판 육수 텐데 장사 그냥 한참 고민 바지락 술찜 노미 주문 다시 안주 가격 가게 안주 마카로니 과자 소주 한잔 먼저 홀짝 바지락 술찜 가격 생각 파스타 면도 바지락 크기 오동통 조개 안주 해감 때문 이자카야 토라 바지락 술찜 모래 버터 솔솔 국물 안주 먹기 바지락 독사진 세상 이어도 가격 손바닥 오코노미야끼 크기 제법 노른자 토핑 먹음 베니 지랄 한국말 생강 대파 요게 오코노미야끼 오사카 사람 생강 사랑 생강 닥알 노른자 닥알 추가 이자카야 토라 재생 접기 수유역술집 오사카 오코노미야끼 식감 기억 노미 괜츈한데 가격 노른자 닥알 추가 장님 생강 대파 우린 생강 십사 부탁 알바 바지락 이건 추가 주문 꼬치 꼬치 껍데기 꼬치 헤헤 먹기 꼬치 소주 새벽 영업 수유역 술집 모츠 품절 이기만 아주 그냥 이자카야 토라 유점 서울특별시 강북구 노해로 블로그 체크 장소 수유역 이자카야 이자카야 토라 서울시 강북구 노해로,
94,수유역 술집 이자카야 토라 후기,수유역 이자카야 한번 신상 컬렉션 수집 이름 이자카야 토라 이자카야 토라 유점 서울특별시 강북구 노해로 블로그 체크 장소 운영 월화 수목 금토 위치 용용 선생 건물 토라 유점 경우 원래 이자카야 평균 가격 가격 대가 가성 이자카야 컨셉 가성 토라 입구 메뉴 가격 개인 모든 가게 입구 메뉴판 매장 입구 계단 신분증 검사 자리 안내 해주시 입구 메뉴 메뉴 가격 요청 사항 음식 블로그 메뉴 음식 블로그 꼬치 새우 노미 알콜 레몬 하이 감귤 하이 하이 가격 기린 생맥주 용량 가격 종합 전체 가성 이자카야 술집 맛집 동네 마시기 음식점 직원 더욱 이자카야 일본 짬바 유명 이자카야 입장 퀄리티 가격 모든 이해 가능 맥주 홀짝 마시기 꼬치 노미 일본 식이 한국 가격 나베 기름 우러난맛 사골 육수 나베 감자 튀김 무난 무난 가성 이자카야 한잔 가요,
95,쵸코 쵸코,구월 시작 차장 서브웨이 엄마 자꾸 노래방 노래방 재생 노래방 현자 급발진 회사 면접 마감 출근 현자 먹음 도중 현자 언니 오늘 가은 약속 이자카야 토라 유점 서울특별시 강북구 노해로 블로그 체크 장소 수유 토라 오뎅 야끼소바 서비스 코노 갑자기 사가정 마심 인쌩 맥주 짱구 친구 짱구 지호야 현자 교육 집중 현자 원래 아침 먹음 기절 현자 기절 고생 우석 포카 사전 예약 사람 존잘 이상형 부천 밍구 다리 제보 발목 일자 아빠 오전 딸램 픽업 회원 주신 추석 선물 쿸킼 부차 젤리 나눔 그녀 뾰루 발생 현자 마지막 점심 아이파크몰 슈가슈가룬 카페 사진 포기 실용 마그넷 듀크 캔디 현지 필통 딸기 실장 마침 김밥 주심 베테 개봉일 엄빠 개인 정해 안보 시즌 왜냐면 쿠키 저녁 먹음 외식 묵은지 싸가지 김치 돌이 다해핑 동화 서울특별시 종로구 대명 동화 예약 블로그 체크 장소 혜화 진짜 간도 한라산 한라 토닉 조개찜 조개찜 파스타 추가 앞머리 재생 앞머리 앞머리 우린 옌이 합류 압구정 편의점 나베 스타일 아가 빠이 신가 동네 친구 만남 지호야 얼른 양동이 노잼 마무리 노래방 체력 절임 먼저 집감 주말 휴무 오픈 전무 주신 송편 낙원 타코 용산 아이파크몰 서울특별시 용산구 한강대로 용산 아이파크몰 이스트 파크 블로그 체크 장소 낙원 타코 캐릭터 만남 엄마 햅피 추석,
96,,오늘 일기 과거 저번 친구 저번 오픈 가성 일찍 생각 이자카야 토라 유점 서울특별시 강북구 노해로 블로그 체크 장소 무제한 칵테일 메뉴 칵테일 퀄리티 매장 인테리어 기본 안주 오트밀 진짜 도리 둘이서 마지막 하늘색 민트 칵테일 민트 초코 완전 민트 추천 저스트 라운지 수유 사진 동영상 팔로워 팔로잉 게시 저스트 라운지 수유 사진 동영상 보기 맥도날드 어플 쿠폰 발급 알바 간식 햄버거 집들이 어플 은근 쿠폰 가끔 햄버거 쓰기 좋았슘 칭구 카페 홍시 주스 홍시 주스 히히히 어무 염색 오늘 미용사 카톡 기능 안녕 그대 감성 비교 프로그램 취업 강의 카페 소개 서도 이제 학기 근로 신청 토스 행운 카드 아리 보구 행운 가득 노원 와플 가게 딸기 와플 완전 플로레스 테이블 서울특별시 노원구 상계로 동양메이저 상가 블로그 체크 장소 처음 라반 메뉴 도리 증말 마라샹궈 중간 느낌 땅콩 소스 매운 살짝 중화 완전 도리 공기 서비스 후식 롯데리아 소프트 그냥 주신 호점 서울특별시 노원구 상계로 롯데리아 노원 역점 서울특별시 노원구 상계로 블로그 체크 볼펜 진짜 알바 볼펜 여러 진짜 알바 볼펜 알바생 어무니 주신 오렌지 친구 손바닥 껍질 완전 도리 카톡 생일 축하 칭구 아베베 생일 축하 보기 닭강정 보쌈 막국수 초록 이파리 아이스크림 케이크 생일 셀프 사진관 만인 인쇄 오류 사장 전화 연장 연락 완전 의자 머리띠 소품 내부 탈의 공간 오늘 사진관 대학로 서울특별시 종로구 대학로 예약 블로그 체크 장소 저녁 먹기 간식 포장마차 닭꼬치 카페 소금 우유 아이스크림 칭구들 브알 대학로 서울특별시 종로구 대학로 예스 스테이지 브알 예약 블로그 체크 장소 요기 태도 쫀맛 정말 바삭 음식점 수가 쪼구 육회 서비스 메뉴 입가 심용 먹기 치치 대학로 서울특별시 종로구 대학로 블로그 체크 장소 아이스크림 친구 증말 방구 와중 노래방 기부 코인 노래 연습장 서울특별시 종로구 대명 블로그 체크 장소 쿠폰 사이즈 글쎄 캐시 그냥 공짜 사이즈 럭키 비키 현대 흐업 구경 스벅 낫밷 현대 백화점 현대 서울 서울특별시 영등포구 여의대로 현대 서울 예약 블로그 체크 장소 멀리 불빛 등대 선선 바람 마포대교 노래 마포대교 서울특별시 영등포구 여의도동 블로그 체크 장소 홍시 방법 모습 마늘 레이크 싹싹 설빙 하겐다즈 딸기 빙수 미니미 달구 취향 굳이 다시 혜화 소품 구경 눈데 귀요미 사고 진짜 칭구 용용 용용 죠아죠 도리도 리세 버터 깐풍기 증말 칭구 선물 꽃병 컴활 시험 보구 서울역 친구 먹기 카페 가기 콜렉 티보 소금 베이글 피치 얼그레이 리더 궁용 홍대 돈부리 상공회의소 지점 서울특별시 중구 세종 상공회의소 지하 콜렉 티보 그랜드센트럴 서울특별시 중구 세종 그랜드센트럴 콜렉 티보 그랜드센트럴 블로그 체크 다이어리 스티커 활용 진짜 다이소 가격 완전 추천 팝콘 지퍼 형태 남아도 영화 먹기 영화 참고 롯데 시네마 팝콘 이구 캬라멜 가격 기본 캬라멜 호떡 식사 단백질 쉐이크 처음 만난 그대 사랑 알럽휴 요즘 서울시 진짜 캐릭터 우산 도자기 트럼프 카드 일러스트 퀄리티 진짜 도랏맨 사고 요기 디즈니 전시 규모 디테 디즈니 진짜 규어 디테일 차마 굿즈들 종류 티켓 키드 로우 포함 가격 완전 동대문 디자인 플라자 서울특별시 중구 을지로 동대문 디자인 플라자 지엄 서울특별시 중구 을지로 동대문 디자인 플라자 지엄 블로그 체크 노원 가성 소고기 샐러드 파스타 인분 정도 진짜 아이스크림 셀프 커피 셀프 셀프 아포가토 대박 파스타 스테이크 서울특별시 노원구 노해로 민진 빌딩 예약 블로그 체크 장소 보아 목도리 와중 베이글 블루베리 크림 치즈 발라 먹기 알바 간식 브랜드 샐러드 가성 마싰 진짜 추천 어무니 어무니 보고 럼마 리마 노원 역점 서울특별시 노원구 상계로 블로그 체크 장소 오빠 생일 미역국 케이 쿠도 당구 케이크 동물성 크림 확행 베이커리 서울특별시 도봉구 도봉로 블로그 체크 장소 볼로냐 일러스트 화전 볼로냐 지역 대해 서도 알구 여러 동화 일러스트 보구 동화 영상 보구 보구 아트 지엄 서울특별시 광진구 아차산로 롯데 시네마 블로그 체크 장소 백화점 마감 간식 민트 초코 봉봉 간식 이건 진짜 롯데 백화점 건대 스타 시티 서울특별시 광진구 능동 블로그 체크 장소 사진 프레임 비비드 지엄 건대 서울특별시 광진구 동일로 블로그 체크 장소 이제 일기 꾹꾹 기록,
97,뒤죽박죽,이자카야 토라 유점 서울특별시 강북구 노해로 블로그 체크 장소 혜정 육회 존맛 소주 이후 계속 탬포 저년 취함 소주 혜정 사랑 몸무게 최고 와중 소금 요즘 세상 닌텐도 주문 취소 찌발 마리오카트 전기충격기 사랑 중요시 아빠 사람 최고 발음 요즘 아나운서 발음 연습 기미 안보 소하리 원조 두루치기 삼겹 경기도 광명시 일직 효성 해링턴 타워 빌딩 예약 블로그 체크 장소 광명 두루치기 먹고왔슈 두루치기 광명 개존맛 구리 소화 두루치기 운전 감샤합니 염색 태웅 묭실가 블루 블랙 이상은 사람 머리 금발 로즈데이 삼겹살 양념 갈비 굽기 왜케 깝숑 소금쉐끼 규어 간식 서련 데이 오라 자기야 먹쟈 진짜 돼지 사진 충격 충격 소금 달리기 요즘 날씨 그냥 계세 열사병 바이 블로그 일상 일기 맛집,블로그 일상 일기 맛집
98,수유 곱창전골 임실 대국 점심 먹기,순이 김뀨잉입니 친구 점심 동네 맛집 친구 대국 이제 피순대 직접 대서 점심 곱창전골 고온 후기 시작 임실 대국 기본 정보 임실 대국 서울특별시 강북구 노해로 예약 블로그 체크 장소 수유역 화계역 중간 월토 브레이크 타임 일요일 정기 휴무 메뉴 대국 오소리 감투 순대 돼지 곱창 전골 고기 종류 김치 국내 점심 식당 느낌 내부 한시 만석 친구 처음 해도 사람 별루 지금 점심 사실 엄마 직장 엄마 몇번 포장 한국인 소울푸드 대국 메뉴 소문 금방 친구 피순대 서울 피순대 셀프 깍두기 겉절이 포함 고추 양파 마늘 부추 점심 식사 돌입 테이블 들깨 가루 양념 새우젓 김치 깍두기 존맛 일수 내공 곱창전골 볶음밥 국물 순간 공기밥 추가 금방 시작 들깨 가루 왕창 먹기 합의 공기밥 상큼 돼지 피순대 당면 순대 알도 국물 채소 곱창 납작 대박 존맛 녹말 국물 좀더 육수 쫄아 육수 추가 잔뜩 다시 시작 된거 셀프 부추 움큼 퍼다 들깨 추가 한번 친구 대국 국물 돼지 곱창 계속 깃밥 마무리 유리 근방 아마 대국 맛집 동네 대국 이제 곱창전골 가성 친구 소주 모양 우린 점심 테이블 아저씨 소주 대국 수유곱창전골 수유역곱창전골 수유곱창 수유순대국 수유국밥,수유곱창전골 수유역곱창전골 수유곱창 수유순대국 수유국밥
99,수유 곱창전골 임실 대국 서울 피순대,부모님 대국 투어 동네 시장 피순대 홀딱 서울 피순대 투어 변경 돼지 곱창 전골 피순대 지게 임실 대국 위치 우이신설선 화계역 호선 수유역 기준 도보 화계역 수유역 호선 타고 화계역 맛집 수유 곱창전골 임실 대국 메뉴판 돼지 곱창전골 피순대 접시 주문 매장 테이블 개정 혼밥 좌석 혼밥 혼술 손님 계속 순식간 만석 오픈 주방 정말 주방 안쪽 마늘 모습 매일 마장동 시장 돼지 소뼈 공수 메인 메뉴 임실 대국 깍두기 겉절이 완전 도리 어무이 인정 김치 사장 손맛 장난 추가 반찬 셀프 부추 양파 마늘 땡초 깍두기 번은 먹음 돼지 곱창전골 먹기 한양 당면 사리 기본 추가 라면 리나 볶음밥 술국 메뉴 술국 술안주 돼지 곱창전골 손질 돼지 곱창 토종 순대 피순대 오늘 수유 곱창전골 목적 추가 주문 피순대 서울 피순대 찾기 임실 대국 선지 야채 듬뿍 피순대 처음 사람 부담 수유 곱창전골 맛집 임실 대국 재생 수유 곱창전골 맛집 임실 대국 다시 따흐 돼지 곱창전골 뭐해 전골 국물 국물 새우젓 반찬 지금 가안 다이닝 고영 땡초 새우젓 토핑 볶음밥 공기밥 라면 사리 추가 수유 곱창전골 깜짝 공기밥 수저 세상 가득 쫀덕쫀덕 쌀밥 반찬 겉절이 깍두기 라면 사리 육수 육수 고영 반찬 메인 메뉴 공기밥 완벽 자체 주식 대국 수유 곱창전골 맛집 임실 대국 매장 주변 주택가 손님 이유 식후땡 커피 한잔 아부지 마심 수유역 빵빵 기분 다시 피순대 부모님 나중 대국 맛집 인증 임실 대국 서울특별시 강북구 노해로 예약 블로그 체크 장소 수유역 임실 대국 서울 특별시 강북구 노해로 영업 오전 오후 오후 브레이크 타임 일요일 휴무 매장 주차 가능 인수동 공영 주차장 주차 권장,
100,수유순대국 수제 피순대 수유 임실 대국,전라도 수제 피순대 수유 수유맛집 임실 대국 가족 외식 후기 임실 대국 서울특별시 강북구 노해로 화계역 우이신설선 서울특별시 강북구 수유동 블로그 체크 수유동 맛집 임실 대국 수유 화계역 근처 위치 네이버 지도 검색 임실 대국 치면 가게 수유밥집 임실 대국 검색 임실 대국 수유 검색 찾기 쉬움 임실 대국 수유 주소 서울시 강북구 노해로 운영 오전 저녁 휴무 일요일 문의 지하철 화계역 출구 미터 화계역 기점 미터 거리 위치 가게 입구 눈길 수제 피순대 정성껏 직접 문구 신뢰 가게 내부 분위기 벽체 부분 도배지 분위기 반찬 셀프 이용 기본 대국 오소리 대국 가게 벽면 오소리 감투 대해 설명 문후 휴대폰 보지 오소리 감투 유래 대해 보통 순대 국밥집 가면 대국 오소리 감투 라든지 순대 대국 기본 대국 오소리 대국 이득 가게 내부 사이즈 테이블 혼밥 기도 단체 먹기 매우 가게 내부 에어컨 진짜 춥다 에어컨 바람 구석 테이블 상단 기본 후추 들깨 가루 비치 테이블 하단 서랍 수저 통과 냅킨 이용 기본 반찬 셋팅 직접 김치 부추 부추 셀프 추가 셀프 접시 유아 수저 사람 이용 대국 취향 첨가 새우젓 다대기 먼저 전라도 피순대 비주 먹음 피순대 새우젓 매운 고추가 물리 비주 공장 순대 수제 순대 국밥 엄마 딸도 국밥집 기본 국밥 국물 이제 나이 순대 척척 딸내미 이상은 거나 냄새 거나 손님 피순대 처음 먹음 한식 교육 제대로 역시 한식 전라도 음식 아빠 경상도 사람 아빠 매운 새우젓 피순대 매력 와이프 와중 국밥 국밥 부추 듬뿍 사장 부추 진짜 국물 건더기 느낌 고기 진짜 비주 보고 질깃질깃 생각 매우 부드러움 으잉 그동안 대국 대국 내장 순대 대국 오소리 대국 수제 전라도 피순대 임실 대국 수유 재생 접기 수제 전라도 피순대 임실 대국 수유 국밥 피순대 환상 조합 수유순대국 맛집 제대로 국밥 피순대 비주 동영상 확인 순대 순대 국도 장난 피순대 야채 대가 순대 사람 진짜 맛집 뚝배기 매우 먹기 위해 순대 비주 수유국밥 맛집 진짜 오늘 제대로 순대 파티 피순대 매운 고추 김치 셀프 한번 리필 셀프 반찬 부추 와이프 오소리 국밥 와이프 도저히 진짜 수유밥집 피순대 진짜 식감 치즈 사람 진짜 수제 직접 피순대 멀리 전라도 수유 양도 주인 진짜 오픈 한지 진짜 사람 수유동 맛집 순대 국밥 사람 리스트 순대 국밥 도장,
101,수유맛집 국물 대국 피순대 임실 대국,점점 겨울 날씨 요즘 날씨 국물 오늘 수유맛집 이자 병원 근처 대국 맛집 임실 대국 소개 임실 대국 네이버 방문자 리뷰 블로그 리뷰 피순대 국물 일품 주차 길가 주차 임실 대국 위치 서울 강북구 노해로 영업 브레이크 타임 일요일 정기 휴무 전화 화계역 화계역 출구 인수동 자치 회관 오시 수유역 출구 병원 간다 골목 임실 대국 서울특별시 강북구 노해로 예약 블로그 체크 장소 매장 실내 테이블 오픈 방문 식사 분도 계시 점심시간 주변 직장인 테이블 대기 모습 창가 좌석 부담 혼밥 기도 대국 오소리 감투 대한 설명 크게 한번 국내 최상급 돼지 사골 소뼈 직접 고아 우려 멘트 메뉴판 식사 안주 접시 크게 접시 피순대 대창 임실 대국 피순대 가게 정성껏 직접 피순대 고해 피순대 하니 주문 순대 대국 곱창 대국 요기 피순대 주문 테이블 기본 후추 들깨 가루 다대기 새우젓 비치 대국 취향 반찬 깍두기 셀프 깍두기 겉절이 포함 고추 양파 마늘 부추 준비 추가 반찬 셀프 이용 드이어 오늘 주인공 등장 모락모락 대국 피순대 가득 비주 평소 순대 수제 피순대 수제 피순대 순대 소가 입안 사르르 매운 새우젓 고추 한층 업업 술안주 제격 순대 곱창 곱창 대국 국물 곱창 쫄깃 순대 대국 국물 야채 순대 피순대 점심 방문 국물 생각 절로 안나 정말 국물 점심 포장 포장 포장 정말 수유맛집 임실 대국 피순대 전라도 가지 서비스 국물 남녀 노소 돼지 곱창전골 임실 대국 임실 대국 계동 화계역 대국 수유동 순대 맛집 수제 피순대 강북구 대국 맛집 강북구 오소리 감투 강북구 머릿 고기 강북구 대국 맛집 수유동 대국 맛집 수유맛집,임실순대국 임실순대국화계동 화계역순대국 수유동순대맛집 수제피순대 강북구순대국맛집 강북구오소리감투 강북구머릿고기 강북구순대국맛집 수유동순대국맛집 수유맛집
102,수유 곱창전골 맛집 임실 대국 추천,해피 오늘 수유 곱창전골 맛집 임실 대국 대해 소개 매장 곱창전골 정말 한번 추천 임실 대국 위치 서울 강북구 노해로 영업 브레이크 타임 일요일 정기 휴무 전화번호 화계역 출구 도보 정도 수유역 출구 도보 정도 위치 자리 잡고 수유역 위치 자리 잡고 정말 대국 곱창 전골 맛집 이기 방문 외부 사진 보아 정말 먹음 더욱 기대 내부 내부 매장 내부 화장실 식사 내부 때문 식사 석도 준비 혼밥 정말 수유 맛집 인지 저녁 시간대 사람 방문 오소리 감투 정말 오소리 주문 방문 한번 계획 메뉴판 메뉴판 맛집 이기 때문 종류 준비 취향 선택 돼지 곱창전골 대로 사이즈 인원 주문 정말 추가 반찬 셀프 셀프 준비 반찬 비주 보아 정말 맛집 직접 김치 하니 더욱 반찬 테이블 후추 들깨 가루 준비 취향 돼지 곱창 전골 가격 돼지 곱창 전골 사이즈 주문 가격 가격 사이즈 이서 먹기 정말 팽이버섯 크게 듬뿍 식감 고추 국물 정말 국물 살짝 더욱 비주 보이지 비주 보아 수유 곱창 전골 맛집 살짝 돼지 냄새 전혀 수유 곱창전골 맛집 임실 대국 추천 재생 수유 곱창전골 맛집 임실 대국 추천 개인 피순대 피순대 곱창 정말 가성 당면 더욱 곱창 정말 냄새 쫄깃 쫄깃 피순대 경우 때문 추천 피순대 내용물 임실 대국 서울특별시 강북구 노해로 예약 블로그 체크 장소 수유역 화계역 부근 위치 임실 대국 곱창전골 맛집 방문 맛집 이기 저녁 시간대 식사 사람 실제 정말 맛집 수유역 부근 피순대 곱창전골 맛집 임실 적극 추천 수유곱창전골 수유역곱창전골 수유곱창 수유순대국 수유국밥 수유역맛집 추천,수유곱창전골 수유역곱창전골 수유곱창 수유순대국 수유국밥 수유역맛집추천
