,title_pos,content_pos,hash_tag
24,갈비 유점 수유역 맛집 맛집 슴둥,수유역맛집 수유리맛집 수유고기집 수유밥집 수유역밥집 수유역 맛집 갈비 갈비 진짜 수유역 맛집 갈비 뿌셨자나 수유역 맛집 공유 시작 계란찜 껍데기 무한 리필 갈비 보신 진짜 반찬 퀄리티 최고 수유역 맛집 갈비 후기 갈비 유점 서울특별시 강북구 수유로 예약 블로그 체크 장소 수유역 출구 거리 길이 맛집 거리 저녁 갈비 웨이 하니 예약 추천 식당 정보 영업 매일 라스트 위치 서울 강북구 수유로 수유역 출구 도보 전화번호 배달 포장 가능 포장 포장 고고 메뉴 간장 양념 갈비 인분 매운 양념 인분 갈비 주먹밥 주문 매운 양념 단계 주문 단계 매콤하니 간장 양념 추천 갈비 주문 동시 초벌 그동안 미리 주신 껍데기 껍데기 마지막 사장 껍데기 분위기 예약 예약 미리 준비 셋팅 반찬 양파 킬러 양파 진짜 소스 콩가루 매콤한 소스 껍데기 왔듭니 주먹밥 진짜 주먹밥 탄수화물 러버 진짜 불리 믹스 믹스 숟가락 꼬기 주먹밥 계란찜 계란찜 진짜 맛집 인정 계란찜 사람 나야 찌개 콩나물 야채 해장국 느낌 꼬기 주먹밥 국물 갈비 초벌 초벌 냄새 안배 고이 비쥬 매운 양념 간장 양념 장갑 장갑 비닐 장갑 장갑 마술 주먹밥 양파 진짜 먹기 양념 소스 간장 소스 고기 중간 중간 주먹밥 조합 진짜 정도 진짜 고기 보이 간장 매운 양념 진짜 불리 수유역 맛집 인정 껍데기 껍데기 감상 기름 좔좔 호호 불어 핵맛 수유역 갈비 갈비 갈비 유점 수유역 맛집 맛집 재생 갈비 유점 수유역 맛집 맛집,수유역맛집 수유리맛집 수유고기집 수유밥집 수유역밥집
25,수유 갈비 갈비 유점,수유 갈비 수유역 갈비 강북구 갈비 우동 갈비 수유 회식 수유역 회식 강북구 회식 우동 회식 갈비 유점 부엉 오늘 부엉 가족 외식 고민 차로 수유 갈비 갈비 유점 맛집 항상 사람 한번 그게 오늘 갈비 유점 주소 서울 강북구 수유로 오후 새벽 주차 가능 포장 배달 단체 이용 가능 주말 일찍 도착 사람 갈비 남녀 노소 주말 가족 단위 손님 갈비 유점 수유 갈비 갈비 유점 소금 갈비 간장 양념 갈비 매운 양념 갈비 단계 단계 사이드 메뉴 주먹밥 물냉면 비빔냉면 잔치국수 누룽지 서비스 메뉴 해장국 계란찜 쫄깃 끝판 돼지껍데기 갈비 느낌 사이드 메뉴 주먹밥 어마 무시 사장 주시 사람 이유 수유 갈비 갈비 유점 재생 수유 갈비 갈비 유점 수유 갈비 갈비 유점 식당 가면 추구 부엉 가족 취향 주문 소금 갈비 인분 간장 양념 갈비 인분 매운 양념 갈비 인분 수유 갈비 갈비 유점 가장 간장 양념 갈비 환상 조합 쫄깃 쫄깃 갈비 해도 초벌 구이 숯불 먹기 갈비 매일 정량 준비 판매 소진 조기 마감 하니 수유 갈비 갈비 유점 갈비 초벌 소요 하니 추가 주문 미리 미리 수유 갈비 갈비 유점 갈비 방법 아래쪽 정도 식사 장갑 순서도 설명 참고 수유 갈비 갈비 유점 건물 뒤편 주차장 입가심 요구르트 이제 연말 연시로 행사 송년모임 남녀 노소 가성 비도 수유 갈비 갈비 유점 추천 오늘 갈비 유점 서울특별시 강북구 수유로 예약 블로그 체크 장소,수유쪽갈비 수유역쪽갈비 강북구쪽갈비 수우동쪽갈비 수유회식 수유역회식 강북구회식 수우동회식 와와쪽갈비수유점
26,수유역맛집 갈비 유점 계란찜 돼지껍데기 무한,수유역맛집 갈비 유점 계란찜 돼지껍데기 무한 수유역맛집 숯불 직화 구이 초벌 냄새 갈비 맛집 돼지껍데기 계란찜 무한 가성 수유역맛집 갈비 유점 소개 수유역 갈비 맛집 갈비 수유역맛집 수유역 고기 수유역 돼지껍데기 수유역 갈비 수유맛집 수유 술집 하이라이트 린지 갈비 돼지껍데기 갈비 갈비 유점 영업 정보 매장 위치 서울 강북구 수유로 영업 매일 전화번호 주차 가능 포장 배달 예약 단체 이용 가능 매장 외관 수유역맛집 갈비 유점 지하철역 출구 거리 골목 위치 접기 수유역 갈비 맛집 갈비 유점 매장 앞쪽 숯불 직화 고기 숯불 직화 구이 매장 내부 테이블 가족 식사 보통 갈비 연기 정말 오기 메뉴판 수유역맛집 갈비 유점 갈비 전문 전문점 사이드 메뉴 주먹밥 비빔냉면 잔치국수 누룽지 간장 양념 매운 양념 단계 주먹밥 주문 돼지껍데기 계란찜 무한리필 기본 돼지껍데기 해장국 계란찜 무한리필 거만 소주 그냥 진심 가성 콩나물 해장국 국물 퐁신 계란찜 갈비 초벌 껍데기 안주 사실 생각 센스 주먹밥 필수 아시 크기 준비 갈비 간장 매운 양념 갈비 본적 사람 부분 살이 뼈쪽 불판 장갑 위생 장갑 그냥 발골 진심 존맛 매운 양념 인분 추가 초벌 껍데기 계란찜 리필 리필 일반 음식점 필요 마지막 결제 야쿠 루트 후식 수유역맛집 갈비 유점 숯불 직화 초벌 냄새 걱정 돼지껍데기 껍데기 무한리필 모든 소스 양념 육수 직접 갈비 유점 서울특별시 강북구 수유로 예약 블로그 체크 장소 수유역맛집 수유맛집 수유 갈비 수유고기집 수유 껍데기 갈비,수유역맛집 수유역고기집 수유역돼지껍데기 수유역쪽갈비 수유맛집 수유술집 하이라이트챌린지 쪽갈비 돼지껍데기 와와쪽갈비 와와쪽갈비수유점 수유역맛집 수유맛집 수유쪽갈비 수유고기집 수유껍데기 와와쪽갈비
27,수유역맛집 숯불 직화 구이 더욱 갈비 유점,수유역맛집 숯불 직화 구이 더욱 갈비 유점 주소 서울 강북구 수유로 영업 매일 라스트 전화번호 편의 시설 주차 포장 예약 단체 이용 가능 배달 수유역맛집 숯불 직화 구이 더욱 갈비 유점 역시 고기 숯불 화계역 가오리 위치 수유역 화계역 가오리 중심 식당 접근성 매우 고기 수유역맛집 숯불 직화 구이 갈비 유점 가게 진로 개구리 개구리 가방 모습 정말 가게 내부 메뉴판 한눈 보기 가게 외관 메뉴판 정말 마음 사장 갈비 초벌 셨습 초벌 갈비 모습 정말 먹음 주류 냉장고 가득 음료 가득 접근성 수유역맛집 인지 테이블 손님 가득 주말 방문 손님 더욱 가게 항상 손님 주말 유독 간혹 웨이팅 갈비 유점 수유역맛집 숯불 직화 구이 더욱 갈비 유점 재생 접기 수유역맛집 숯불 직화 구이 더욱 갈비 유점 기본 세팅 돼지껍데기 서비스 확인 껍데기 서비스 정말 혜자 갈비 갈비 주문 초벌 갈비 인원 일회용 장갑 장갑 아이시스 정말 마음 정말 사용 기도 비주 정말 물티슈 매운 간장 양념 금구 주문 주먹밥 주먹밥 처음 가루 더욱 콩나물국 살짝 갈비 정말 재료 계란찜 서비스 제공 계란찜 무한리필 간장 양념 갈비 갈비 인분 소금 구이 갈비 소금 구이 갈비 매운 비주 숯불 직화 구이 더욱 갈비 살짝 갈비 살이 정말 살이 주먹밥 비빔냉면 밑반찬 금방 콩가루 콩가루 보고 양념 소스 노릇 노릇 소금 구이 갈비 서비스 돼지껍데기 숯불 구이판 자태 정말 먹음 돼지껍데기 무한리필 숯불 직화 구이 더욱 갈비 사르르 비빔냉면 냉면 양도 정말 수유역맛집 갈비 유점 체적 음식 제공 제공 사이드 가지 정말 가성 맛집 장갑 숯불 금구 껍데기 노릇 노릇 콩가루 왕창 고기 주먹밥 보기 갈비 식사 출입문 갈비 유점 명함 치실 탈취 준비 결제 사장 서비스 요구르트 빨대 빨대 구비 요구르트 사장 직원 기본 제공 사이드 다가 음식 양도 갈비 갈비 유점 방문 갈비 유점 서울특별시 강북구 수유로 예약 블로그 체크 장소,
28,강북 수유고기집 갈비 리뷰,갈비 수유역맛집 수유고기집 수유역밥집 대한민국 갈비 남자친구 밥겸 근처 갈비 맛집 수유역 출구 간판 커서 매장 찾기 갈비 주소 서울 강북구 수유로 영업 매일 전화 갈비 유점 서울특별시 강북구 수유로 예약 블로그 체크 장소 갈비 갈비 매장 입구 초벌 필요 내부 내부 손님 금방 가족 손님 밥술 가게 메뉴판 소금 구이 갈비 간장 양념 갈비 매운 양념 갈비 단계 단계 주먹밥 잔치국수 물냉면 비빔냉면 누룽지 갈비 매일 인분 판매 초벌 정도 추가 주문 참고 기본 양파 절임 백김치 껍데기 소스 소스 매운 콩고 물이 갈비 장점 껍데기 무한리필 껍데기 양념 참숯 원래 껍데기 껍데기 갈비 껍데기 먼저 한잔 노릇 노릇 껍데기 사이즈 소스 안주 최고 고물 플러스 무한리필 껍데기 거기 해장국 계란찜 기본 해장국 소주 클리어 해장국 건더기 국밥 계란찜 진짜 계란찜 서비스 주시 사랑 주문 갈비 매운 양념 단계 인분 간장 양념 인분 초벌 때문 불판 갈비 순간 양념 냄새 얼른 양도 갈비 중간 중간 가위 커팅 먹기 고기 가위 필요 남자친구 장갑 갈비 진짜 보이시 정도 주먹밥 필수 주문 날치 가루 단무지 듬뿍 정도 라면 가성 날치 주먹밥 갈비 갈비 수유맛집 껍데기 무한리필 기도 갈비 자체 남자친구 갈비 소주 순삭 아주 양념 술술 식사 후식 요구르트 치실 센스 아주 갈비 갈비 만족,
29,수유역맛집 갈비 저녁 먹기,갈비 영업 매일 자주 수유역 갈비 갈비 사실 주말 저녁 방문 일찍 오니 웨이 창가 이후 만석 방문 추천 수유 갈비 메뉴판 소금 구이 인분 간장 인분 주먹밥 주문 갈비 기본 초벌 준비 정도 초벌 아주 기본 반찬 양념 콩가루 양파 절임 백김치 반찬 직접 엄마 최애 양파 절임 준비 아보 서비스 돼지껍데기 서비스 제대로 돼지껍데기 서비스 계란찜 콩나물 해장국 계란찜 리필 눈치 사람 정말 마음껏 감동 자체 사장 주문 주먹밥 가루 듬뿍 가장 먼저 소금 구이 인분 이제 사실 고기 수유역맛집 갈비 저녁 먹기 재생 접기 수유역맛집 갈비 저녁 먹기 고기 부분 살짝 기본 주시 매운 양념 소스 양념 소스 사람 가능 고기 정말 교정 편린 사람 주먹밥 아주 조화 소금 구이 간장 기대 역시 고기 정말 갈비 정도 돼지껍데기 먹기 통통 조심 조심 노릇 노릇 콩가루 돼지껍데기 쫀득하 아주 완벽 자체 복불복 고기 생각 라면 진짜 모든 고기 계산 갈비 초벌 수유역맛집 갈비 저녁 먹기 재생 접기 수유역맛집 갈비 저녁 먹기 전통 타지 반찬 갈비 모든 갈비 마무리 요구르트 수유역 갈비 무조건 가야 갈비 유점 서울특별시 강북구 수유로 예약 블로그 체크 장소 수유역맛집 수유리맛집 수유고기집 수유밥집 수유역밥집 수유 갈비,수유 와와쪽갈비 메뉴판 수유역맛집 수유리맛집 수유고기집 수유밥집 수유역밥집 수유쪽갈비
30,갈비 유점 간첩,갈비 유점 서울특별시 강북구 수유로 예약 블로그 체크 장소 수유맛집 수유 갈비 수유 매운 갈비 수유맛집 갈비 수유 갈비 갈비 한번 인생 끝발 어제 친구 동네 놀러와 한잔 친구 근처 맛집 고해 친구 갈비 유점 방문 갈비 부위 갈비 갈비 생각 갈비 갈비뼈 정도 나머지 갈비뼈 삼겹살 부위 갈비 갈비 외한 정도 부위 갈비 분리 머리 가까이 위치 부위 보시 돼지갈비 돼지 갈비 랍니 결론 사실 서론 제대로 설명 껍데기 무한리필 제공 계란찜 해장국 친구 갈비 방문 정도 운영 매일 이용 참고 아기 의자 는걸 보아 키즈 참고,수유맛집 수유쪽갈비 수유매운쪽갈비 수유맛집쪽갈비 수유갈비 와와쪽갈비
31,수유역맛집 수유역 회식 갈비,오늘 비도 고기 고민 수유역맛집 갈비 소개 수유역맛집 갈비 수유역 갈비 위치 서울 강북구 수유로 영업 매일 라스트 연락처 주차 가능 배달 예약 포장 가능 갈비 매장 주차장 수유역맛집 갈비 인테리어 수유리맛집 숯불 직화 구이 수유역맛집 갈비 남녀 노소 갈비 갈비 갈비 초벌 제공 먼저 장갑 착용 일회용 장갑 착용 뼈쪽 정도 갈비 누룽지 잔치국수 메뉴 소요 예약 미리 미리 입구 맛집 장내 원형 테이블 단체 모임 수용 정도 저녁 사람 주말 대기 양파 절임 소스 백김치 돼지껍데기 세팅 갈비 필수 장갑 준비 양파 진짜 입맛 문후 계란찜 돼지껍데기 서비스 혜자 갈비 수유역맛집 갈비 메뉴 수유리맛집 소금 구이 갈비 간장 양념 갈비 매운 양념 갈비 신라면 열라면 단계 주먹밥 잔치국수 누룽지 냉면 주문 간장 양념 갈비 인분 주먹밥 비빔냉면 주먹밥 진짜 인정 서비스 계란찜 정도 맛있엇어 갈비 돼지껍데기 먹기 초벌 간장 양념 갈비 그냥 비주 초벌 때문 진짜 갈비 친구 장갑 이제 준비 주먹 고기 먹기 살코기 소스 사이 냉면 냉면 진짜 마지막 돼지껍데기 클리어 완료 수유역맛집 갈비 추천 수유고기집 수유역맛집 갈비 주차 공간 최애 직접 초벌 살짝 진짜 사장 직원 돼지껍데기 계란찜 서비스 혜자 갈비 매장 회식 계산 요구르트 센스 근처 갈비 자주 갈비 유점 서울특별시 강북구 수유로 예약 블로그 체크 장소 수유역맛집 수유리맛집 수유고기집 수유밥집 수유역밥집 수유맛집 수유 갈비 갈비,수유역맛집 수유리맛집 수유고기집 수유밥집 수유역밥집 수유맛집 수유쪽갈비 와와쪽갈비
32,수유역 갈비 맛집 껍데기 무한리필 갈비,오늘 수유역 위치 갈비 맛집 갈비 요기 갈비 주문 껍데기 계란찜 해장국 무한리필 제공 갈비 이외 구성 지금 갈비 소개 서울 강북구 수유로 매일 주차 포장 예약 배달 가능 위치 수유역 출구 정도 수유역 화계역 사이 위치 주차 매장 오시 갈비 어차피 한잔 테이블 원형 테이블 정도 생각 모임 갈비 메뉴 소금 간장 양념 매운 양념 종류 인분 주문 사이드 메뉴 주먹밥 물냉면 비빔냉면 잔치국수 누룽지 간장 양념 갈비 인분 매운 양념 갈비 인분 주먹밥 참이슬 주문 불과 밑반찬 소스류 백김치 양파 장아찌 껍데기 갈비 초벌 주기 때문 주문 소요 갈비 껍데기 먼저 곧바로 계란찜 해장국 해장국 원래 갈비 주문 해장국 껍데기 노릇 노릇 콩가루 쫀맛 껍데기 진짜 무한리필 제공 맥주잔 파란색 파란색 맥주 파랑 노랑 소맥 매운 양념 갈비 간장 양념 갈비 인분 이구 갈비 아래쪽 가게 정도 어차피 타도 상관 살이 간장 양념 달달 완전 취향 소금 간장 매운 양념 원픽 간장 자극 주신 매운 소스 남자친구 매운 소스 간장 매운 양념 갈비 정도 자극 매운 양념 이분 정도 남자친구 원픽 매운 양념 매운 양념 단계 단계 조절 매운 단계 사이드 주먹밥 주문 바가지 보고 김이랑 단무지 날치 듬뿍 가성 취향 저격 주먹밥 야쿠르트 인원 마지막 입가심 갈비 유점 후기 커플 보통 고깃집 가면 인분 요기 갈비 이외 계란찜 껍데기 해장국 무한리필 제공 갈비 인분 맛집 배달 주문 계속 근처 사시 배달 매장 무지 최대 단점 매장 모임 직원 기분 갈비 유점 서울특별시 강북구 수유로 예약 블로그 체크 장소,
33,수유동 화계역 갈비 유점,수유역 화계역 사이 어딘가 위치 갈비 다가 한번 이사 이후 거리 돼지 택시 타고 택시 짜증 런런 불금 웨이팅 당일 한정 수량 판매 사실 매운 갈비 잔치국수 소주 맥주 백김치 양파 장아찌 밑반찬 콩나물 김칫국 계란찜 서비스 돼지껍데기 서비스 완전 갈비 돼껍 맛집 갈비 초벌 껍데기 순삭 돼껍 먹음 갈비 타지 살짝 매운 전혀 박사 회사 동생 데블 소스 소스 고기 조화 아주 덩생 국수 귀신 라스트 잔치국수 국수 사실 핵노맛 추천 껍데기 갈비 젭알 갈비 유점 서울특별시 강북구 수유로 예약 블로그 체크 장소,
34,수유 갈비 맛집 추천 갈비 돼지껍데기 무한리필,애갱 고기 해산물 처음 갈비 갈비 수유 맛집 가지 수유 갈비 맛집 갈비 갈비 쫄깃 불향 사악 서비스 국도 판매 정도 갈비 인생 손해 후기 아래 참고 갈비 유점 서울특별시 강북구 수유로 예약 블로그 체크 장소 주소 서울특별시 강북구 수유로 영업 매일 오후 목차 외부 메뉴 내부 외부 수유역 출구 도보 거리 수유역 대중교통 가기 금요일 저녁 방문 정도 웨이팅 정도 원래 웨이 메뉴 메뉴 수유 맛집 갈비 갈비 판매 금구 간장 양념 매운 양념 매운 양념 단계 단계 신라면 열라면 정도 사이드 메뉴 주먹밥 잔치국수 냉면 누룽지 내부 내부 깡통 테이블 위주 가운데 회식 단체 사람 가게 내부 연기 살짝 직원 환풍기 위치 조정 식사 자리 직원 위생 진심 신지 정말 기억 남아 화장실 검정 남녀 공용 구조 세면대 소변기 앞쪽 남자 여자 수유 갈비 경우 초벌 간장 양념 주문 갈비 돼지껍데기 소스 돼지껍데기 리필 반찬 백김치 양파 절임 소스 인절미 가루 매콤 소스 갈비 초벌 직화 구이 바삭 쫀득해 평소 껍데기 요건 해장국 계란찜 해장국 해장국 장사 정도 국물 계란 도리 참고 계란찜 리필 살코기 보이시 간장 양념 달달 무난 간장 조림 매운 양념 진좌 단계 단계 보고 주먹밥 날치 그득 톡톡 공간 냉면 갈비 살이 그른 기약 서비스 요구르트 감동 수유역 도보 거리 평일 저녁 웨이 돼지껍데기 리필 가능 계란찜 해장국 리필 가능 매운 양념 갈비 추천 은근 방문 의사 요구르트 써비 스까 수유 갈비 갈비 갈비 맛집 인정 갈비 사이드 메뉴 포스팅,
35,광고 수유 매운 갈비 갈비 유점 반한,오늘 최근 갈비 유점 대한 후기 날씨 고기 친구 갈비 껍데기 계란찜 해장국 무한리필 제공 맛집 상상 해도 군침 먼저 주차 차로 가기 주차 걱정 마음껏 정말 기분 가게 내부 금세 주문 고기 대감 갈비 향기 유혹 고기 어물 이건 진짜 외치 갈비 정말 양념 껍데기 정말 쫄깃 식감 매력 껍데기 무한 진짜 기분 계란찜 고기랑 완전 찰떡 궁합 해장국 진짜 해장 아침 숙취 무한리필 직원 고기 체크 주시 서비스 결론 갈비 유점 고기 가야 맛집 껍데기 계란찜 해장국 무한리필 완전 고기 갈비 유점 서울특별시 강북구 수유로 예약 블로그 체크 장소,
36,수유역 맛집 갈비 숯불 직화 구이,숯불 직화 구이 갈비 소개 모든 양념 소스 육수 직접 대표 메뉴 정석 자랑 갈비 숯불 초벌 갈비 살이 계란찜 돼지껍질 서비스 영업 매일 라스트 위치 수유역 출구 남동생 누나 생일 호텔 뷔페 생각 자고 거리 수유역 숯불 직화 구이 갈비 선택 입구 카운터 갈비 초벌 항상 사람 서비스 계란찜 돼지껍질 기본 반찬 소스 갈비 소금 구이 간장 양념 매운 양념 가지 정석 간장 양념 매운 양념 주문 초벌 갈비 다시 한번 아주 먹음 장갑 본격 시동 쭈욱 콩가루 돼지껍질 올케 술잔 소주 사진 재생 잔치국수 누룽지 누룽지 입가심 갈비 유점 서울특별시 강북구 수유로 예약 블로그 체크 장소 수유역 갈비 간만,
37,수유맛집 갈비,수유 미팅 미팅 친구 한잔 수유 맛집 친구 갈비 서울 강북구 수유로 생각 자리 단체 모임 시기 메뉴 소금 갈비 간장 양념 갈비 매운 양념 갈비 가지 준비 생각 자리 단체 모임 시기 반찬 계란찜 해장국 껍데기 모든 무한리필 가성 반찬 소주 한잔 시작 갈비 기지 재미 직원 그냥 먹기 두께 살이 간장 양념 아주 짭쪼롬 갈비 매운 갈비 주문 양념 단계 단계 단계 매운 양념 단계 정도 매콤 마무리 껍데기 완벽 기본 주시 껍데기 기대 별로 쫀득 주먹밥 주문 사이드 메뉴 잔치국수 물냉면 냉면 누룽지 취향 선택 갈비 유점 서울특별시 강북구 수유로 예약 블로그 체크 장소 수유맛집 수유 갈비 수유 매운 갈비 수유맛집 갈비 수유 갈비 갈비,수유맛집 수유쪽갈비 수유매운쪽갈비 수유맛집쪽갈비 수유갈비 와와쪽갈비
38,수유역 맛집 갈비 초벌 갈비,갈비 유점 초벌 쫄깃 갈비 맛집 소금 구이 간장 양념 매운 양념 가지 영업 매일 요즘 갈비 남자친구 수유 갈비 갈비 유점 오늘 오픈 날씨 벌써 폴딩도어 활짝 가게 날씨 바짝 착석 봄바람 솔솔 분위기 냄새 사람 내부 테이블 정말 고깃집 냄새 바닥 첫인상 가게 사장 갈비 먹기 신뢰 상승 메뉴 소금 구이 갈비 간장 양념 갈비 매운 양념 갈비 갈비 가지 갈비 준비 금구 인분 이상만 주문 매운 양념 단계 조절 가능 간장 양념 인분 주문 갈비 사이드 메뉴 주먹밥 냉면 잔치국수 누룽지 역시 단백질 탄수화물 고민 주먹밥 주문 갈비 매일 인분 판매 조기 소진 마감 대량 왕창 신뢰 느낌 초벌 때문 정도 소요 흐름 돼지 주문 날씨 여름 겨울 이유 테라스 자리 가능 공복 초벌 갈비 방법 정독 어차피 한번 초벌 갈비 아래쪽 정도 밑반찬 백김치 양파 장아찌 크게 기대 반찬 가든 밑반찬 메인 메뉴 생각 간장 장아찌 리필 해먹 정도 상큼 서비스 무려 돼지껍데기 돼껍 달라 헤헤 먼저 돼지갈비 갈비 역시 숯불 불향 솔솔 서비스 선지국 찌개 콩나물 배추 시원 분명 선짓국 선지 주파 갈비 안주 되겄어 사레 주의 서비스 계란찜 사이드 메뉴 서비스 자꾸 사장 떼돈 버세 송송 계란찜 정석 갈비 등장 살코기 비주 초벌 아래쪽 가게 은근 숯불 양념 요리조리 인분 갈비 정도 갈비 이서 인분 사이드 메뉴 라면 인분 장갑 비닐 장갑 비닐 장갑 한참 장갑 본격 갈비 타임 갈비 사리 노릇 노릇 예전 갈비 숯불 고기 실내 연기 가득 차서 기억 환기 시스템 폴딩도어 생각 갈비 살코기 부분 칼집 고기 쫄깃 불향 간장 양념 입맛 불고기 주먹밥 날치 후리 가루 단무지 간이 간장 양념 매운 양념 갈비 초벌 갈비 속도 갈비 계산 나오니 후식 요구르트 추억 요구르트 입가심 수유역 근처 갈비 갈비 유점 갈비 유점 서울특별시 강북구 수유로 예약 블로그 체크 장소,
39,수유 갈비 맛집 껍데기 계란찜 무한리필 갈비 맛집 갈비 유점,이제 금요일 오후 마무리 이웃 한주 체력 멘탈 오늘이 퇴근 꼬심 동료 수유역 갈비 맛집 포스팅 마무리 포스팅 보신 요즘 갈비 수유역 맛집 지사 근무 꼬셔 방문 서울 강북구 수유로 갈비 유점 매장 앞쪽 진로 금뚜 계란찜 껍데기 무한리필 땅땅 앞치마 준비 센스 주문 밑반찬 계란찜 엄마 해주시 해장국 번갈아 먹기 갈비 초벌 불판 셋팅 무한리필 나중 살짝 양념 건강 도리 포기 수가 동료 사진 소주잔 컬러 사진 양념 갈비 주먹밥 갈비 양념 기도 조절 주먹밥 요즘 잔뜩 탄수화물 당일 준비 고기 소진 솔드아웃 주말 참고 장소 아래 지도 첨부 갈비 유점 서울특별시 강북구 수유로 예약 블로그 체크 장소 체인점 서울 오늘 불금 이웃 불금 공유 주도 정말 고생,
40,갈비 유점,젤루죠은 달뭉 최근 갈비 무척 수유 맛집 미가 추천 갈비 거기 거기 생각 완전 리뷰 총총 메뉴 메인 소금 갈비 양념 갈비 매운 갈비 사이드 물냉 비냉 잔치국수 누룽지 매운 주먹밥 달뭉이 양념 갈비 소금 갈비 주문 인분 적기 기분 뭔가 조기 마감 기분 원래 달뭉 기분 밑반찬 돼지껍데기 백김치 양파 짱아찌 양념장 콩가루 숯불 껍데기 껍데기 사이드 갈비 돼지껍데기 완전 서비스 계란찜 원래 계란찜 미가 매운 주먹밥 완전 추천 매운 주먹밥 양념 소스 완전 추천 매운 강도 조절 감칠맛 완전 장갑 가위 집게 수저 장갑 비닐 장갑 갈비 초벌 먹기 칼집 이빨 달뭉이 미가 양념장 완전 이건 양념 갈비 미가 의문 갈비 제일 추가 양념 갈비 주문 고기 살이 개인 담번 가면 매운 갈비 보고 위장 컨디션 별로 집중 사진 방문 의사 직원 오늘 갈비 유점 서울특별시 강북구 수유로 블로그 체크 장소 수유역 출구 우측 수유동 약국 보이시 우회 직진 갈비,
