,title_pos,content_pos,hash_tag
85,면목역 맛집 중랑구 소고기 번지 마리,번지 마리 서울특별시 중랑구 상봉 예약 블로그 체크 장소 요즘 기력 소고기 기력 충전 중랑구 소고기 면목역 출구 도보 정도 위치 번지 마리 대로 위치 단번 가게 보기 해도 이벤트 소주 맥주 요즘 친구 가기 가격 내부 테이블 진짜 내부 고기 연기 냄새 전혀 환기 빵빵 무조건 이구 메뉴판 마리 주문 이외 삼겹살 돼지갈비 양념 불고기 메뉴 걱정 기본 사발 요즘 사발 사이드 메뉴 손색 정도 파절 깻잎 장아찌 김치 마늘 소금 접시 아주 주문 마리 등심 우삼겹 갈비살 살로 고기 빛깔 이서 시작 우삼겹 시작 판이 가득 가운데 된장찌개 무한리필 찌개 깃밥 추가 양파 절임 양파 우삼겹 커서 가득 고기 면목역맛집 번지 마리 재생 접기 중랑구소고기 번지 마리 고기 빛깔 지방 아주 분포 고기 아주 윤기 육즙 내내 정말 고기 냄새 전혀 진짜 사장 중간 중간 된장찌개 주시 고기 계속 엄마 외식 경우 정말 된장찌개 양파 절임 고기 마무리 고기 면서 물냉면 비빔냉면 냉면 방울토마토 메추리 무채 이서 거리 리뷰 평이 완전 맛집 어른 어르신 오기 소주 맥주 친구 강추 가족 외식 면목동맛집 번지 마리,
86,면목동맛집 면목역 근처 가성 소고기 번지 마리,요긴 레전드 가성 소고기 글쎄 소주 맥주 정유미 진심 벼르다 저번 댕겨 읍니 로코 심금 면목동맛집 면목역 근처 가성 소고기 번지 마리 소개 번지 마리 서울특별시 중랑구 상봉 예약 블로그 체크 장소 번지 마리 주소 서울특별시 중랑구 상봉 영업 시작 종료 라스트 전화번호 예약 포장 주차 단체 이용 가능 무선인터넷 면목동맛집 면목역 근처 가성 소고기 번지 마리 면목역 출구 도보 소요 면목역 출구 직진 사거리 우회 전해 로코 등장 간판 아래 소주 맥주 현수막 함박 웃음 면서 입장 내부 단체 모임 아주 매우 에어컨 빵빵 메뉴판 맞춤 마리 등심 우삼겹 갈비 살살 치살 구성 오늘 메뉴 마리 공기밥 물냉면 소주 소주 불판 금방 취하 진짜 밑반찬 양파 파채 진짜 바가지 사장 인심 레전드 마리 때깔 등심 우삼겹 갈비살 구성 가운데 된장찌개 우삼겹 박사 인정 우삼겹 읍니 우삼겹 공기밥 근본 박수 빡빡 우삼겹 금방 우삼겹 양파 깻잎 상추 가도 읍니 맛나쟈 팔팔 소주 진심 진심 개맛 도리 나중 국물 달라 그냥 보궁 버섯 소금 보궁 갈비살 갈비살 마늘 냐미 오늘 원픽 갈비살 이쯤 냉면 냉면 살얼음 아주 겨자 식초 도리 중랑구소고기 면목동맛집 번지 마리 재생 접기 중랑구소고기 면목동맛집 번지 마리 이제 대망 마지막 등심 영상 등심 레전드 진짜 불판 크기 요것 읍니 꽃등 말모 냐미쟈나 마지막 제격 청량고추 소고기 리필 어번 로코 소고기 소주 맥주 아주 가성 면목동맛집 면목역 근처 가성 소고기 번지 마리 병각 별안간 쪼끔 가면 뿌시러 오늘 번창,
87,중랑구 소고기 무조건 번지 마리,소고기 물리 번지 마리 무려 소주 맥주 소고기 곱창전골 갈비탕 메뉴 판매 육회 판매 마리 마리 참고 참고 마리 일찍 대기 역시 맛집 점심 저녁 피해 대기 경우 기자 명단 인원 이름 참고 번지 마리 오전 영업 모양 메뉴판 소고기 돼지고기 판매 주문 가능 테이블 자리 걱정 해도 테이블 자리 사람 이야기 마음 식당 행복 소리 멘트 사장 친절 덕분 기본 제공 된장찌개 국물 최고 기본 일인 먼저 앞치마 주시 센스 사장 소주 맥주 무조건 더웅 맥주 기본 밑반찬 채소 듬뿍 절이도 듬뿍 양파 가득 양파 처음 빵문 소스 보고 보리차 보리차 스임 주문 마리 적당 먹기 소가 마리 등심 우삼겹 갈비살 살로 구성 고기 시작 우삼겹 우삼겹 이제 원래 소금 제공 사장 참기름 네네 네네 참기름 듬뿍 소금 와사비 와사비 킬러 주심 와사비 요청 주심 비주 소고기 사랑 중랑구 소고기 진짜 무조건 번지 마리 여야 우삼겹 양파 소스 소고기 돼지고기 무조건 와사비 중랑구 번지 마리 재생 접기 중랑구 번지 마리 소고기 갈비살 살살 단독 그냥 도리 요즘 된장찌개 된장 먹기 중랑구 번지 마리 방문 된장 된장찌개 마지막 마무리 등심 살짝 등심 와사비 살짝 양파 그냥 고기 헤엄 거지 육즙 커피 머신 믹스 커피 번지 마리 서울특별시 중랑구 상봉 예약 블로그 체크 장소 사장 소고기 인기 부위 구성 기준 살살 소고기 맛집 무조건 번지 마리 마리 가성 추천 주류 행복 번지 마리 중랑구 번지 마리 마리 소고기 소고기 맛집 중랑구맛집 면목동맛집 면목역맛집 면목맛집 중랑구 고기,일번지소한마리 중랑구일번지소한마리 작은소한마리 소고기 소고기맛집 중랑구맛집 면목동맛집 면목역맛집 면목맛집 중랑구고기
88,면목역 맛집 번지 마리 퀄리티 고기,퀄리티 고기 면목역 맛집 번지 마리 번지 마리 서울 중랑구 상봉 매일 예약 주차 포장 무선인터넷 단체 이용 가능 번지 마리 서울특별시 중랑구 상봉 예약 블로그 체크 장소 내부 테이블 수도 단체 모임 회식 소로 아주 식당 번지 마리 메뉴판 돼지고기 소고기 부위 메뉴 팔고 마리 주문 주문 김치 양파 절임 사발 채소 밑반찬 사발 고기 먹기 아주 고기 퀄리티 아주 사가정 맛집 재생 사가정 맛집 진짜 양도 퀄리티 진짜 고기 사진 보이지 고기 살살 전혀 정말 소금 고기 진짜 고기 아시 고기 고기 부위 퀄리티 정말 아예 반찬 간이 고기랑 채소 된장찌개 기본 기본 건더기 정말 국물 고기 기름기 고기 부위 기대 역시 제대로 전혀 부위 부위 별로 전혀 직원 기분 식사 번지 마리 퀄리티 고기 면목역 맛집 내부 좌석 수도 단체 모임 회식 소로 아주 고기 정말 모든 부위 전혀 정말 반찬 간이 고기랑 정말 직원 정말 기분 식사,
89,면목동맛집 번지 마리 가성 소고기 소주 맥주,면목동맛집 번지 마리 가성 소고기 소주 맥주 면목역맛집 면목동맛집 면목동 소고기 조이 오늘 단백질 보충 면목역맛집 번지 마리 후기 번지 마리 서울특별시 중랑구 상봉 영업 라스트 단체 가능 예약 가능 외관 사진 마리 정육 식당 옛날 가족 끼리 외식 자주 인분 인분 아주 방문 외관 식물 사장 손길 오픈 벌써 주년 시라 대박 이벤트 소주 맥주 무려 번지 마리 서울특별시 중랑구 상봉 예약 블로그 체크 장소 위치 면목역 출구 도보 위치 장동 사거리 내부 테이블 아기 의자 준비 가족 모임 친구 끼리 소고기 오기 메뉴 정보 마리 마리 한우 육회 한우 차돌 메뉴판 요청 맥주 요즘 물가 대비 실화 세명 마리 주문 등심 우삼겹 빗살 반찬 사발 파파 절임 상추 마늘 쌈장 김치 양파 절임 소금 된장찌개 제공 무한리필 가능 사실 소고기 소금 존맛탱 주문 마리 보기 얼른 번지 마리 재생 접기 번지 마리 마리 방법 드림 옛날 우삼겹 먼저 마지막 등심 등심 진짜 퍽퍽 사장 주심 나보이 된장찌개 우삼겹 살짝 주시 감칠맛 된장찌개 멸치 면서 도리 사장 비법 뭔가 몇번 리필 언니 원샷 쭉쭉쭉쭉 안취할수 소고기 그냥 단백질 섭취 제대로 해도 살이 제일 나용 양파 절임 콤달콤 양념 진짜 이집 맛집 거리 만석 주민 물냉비냉 고기 마무리 비냉 파라 비냉 주문 친구 물냉 이집 냉면 완전 고기랑 완전 면목동맛집 번지 마리 강추,면목역맛집 면목동맛집 면목동소고기
90,면목동맛집 중랑구고기집 번지 마리,면목역맛집 중랑구소고기 중랑구고기집 민공 요즈음 기력 고기 원래 강경 돼지고기 가끔 소고기 오늘 면목역 소고기 번지 마리 서울 중랑구 상봉 매일 라스트 예약 가능 단체 가능 번지 마리 서울특별시 중랑구 상봉 예약 블로그 체크 장소 외관 번지 마리 면목역 출구 도보 위치 매장 간판 메뉴 대표 메뉴 번지 마리 지금 소주 맥주 이벤트 중이 내부 번지 마리 내부 내부 정말 단체 손님 수용 전혀 무리 저녁 방문 손님 메뉴 번지 마리 메뉴판 미국 가성 주문 메뉴 마리 삼겹살 물냉면 맥주 공기밥 고기 메뉴 주문 준비 밑반찬 기본 된장찌개 사발 김치 고추 절임 상추 깻잎 쌈장 마늘 양파 절임 대접 그릇 마음 고깃집 가면 항상 파리 무한 한번 주시 맘껏 기본 고기 메뉴 주문 고기 삼겹살 등심 우삼겹 갈비살 고기 런가 고기 기전 오늘 고생 남편 요즈음 가장 위해 맥주 돼지 그냥 한판 돼지 삼겹살 우삼겹 리기 고기 역시 고기 처음 기름 가야 그냥 고추 절임 우삼겹 그냥 양파 절임 쌈장 먹기 남편 상추 우삼겹 갈비살 소고기 모든 부위 그냥 이제 삼겹살 갈비살 자태 거기 크흐 삼겹살 가야 김치 양파 절임 버섯 갈비살 소금 주문 물냉면 메추리 동동 냉면 삼겹 마지막 등심 등심 소금 돼지 냉면 가성 소고기 먹기 면목동 맛집 고기 냄새 안나 사장 회식 단체 모임 매장 추천 번지 마리 후기,면목역맛집 중랑구소고기 중랑구고기집
91,면목동맛집 중랑구소고기 번지 마리,면목동맛집 번지 마리 중랑구소고기 먹기 이만 구성 가격 부담 소고기 반찬 만족 후기 시작 면목동맛집 중랑구소고기 번지 마리 위치 면목역 출구 도보 정도 지하철역 화살표 방향 우회 위치 가게 면목동맛집 중랑구소고기 번지 마리 영업 영업 마리 가격 소주 맥주 가격 깜놀 매장 면목동 회식 장소 모임 소로 격일 부담 가격 소고기 정말 마음 식당 면목동맛집 중랑구소고기 번지 마리 메뉴판 마리 마리 메뉴 부위 가지가지 수도 부위 별로 체크 체크 삼겹살 돼지갈비 돼지고기 메뉴 주문 금방 기본 반찬 고기 도착 된장찌개 마지막 싹싹 고기랑 먹기 채소 깻잎 절임 입맛 돋궈주 사발 양파 절임 먹기 양파 리필 필요 양념 예술 요런 소스 느낌 마리 등심 우삼겹 갈비살 메뉴 깜놀 면목동맛집 중랑구소고기 번지 마리 재생 접기 면목동맛집 중랑구소고기 번지 마리 먹기 우삼겹 맥주 얼른 주문 여름 문제 가격 과음 자제 그냥 소금 부위 얼른 육즙 좔좔 어쩜 느낌 반찬 부위 금방 금방 와사비 소금 살짝 고기 싹싹 간만 소고기 중랑구소고기 번지 마리 면목동맛집 이제 고민 고기 이만 반찬 고기 육질 최고 면서 가격 느낌 매장 사장 이용 식구 관심 얼른 방문 번지 마리 서울특별시 중랑구 상봉 예약 블로그 체크 장소 도로명 주소 서울 중랑구 상봉 지번 주소 서울 중랑구 면목동 전화번호 면목동맛집 면목역맛집 면목맛집 중랑구소고기 중랑구고기집,면목동맛집 면목역맛집 면목맛집 중랑구소고기 중랑구고기집
92,면목역맛집 소고기 번지 마리 후기,가성 무척 면목역맛집 소고기 번지 마리 저녁 내부 분위기 매장 테이블 단체 방문 사람 피해 매장 전체 단체 가격 부담 소주 맥주 가격 무려 보통 충격 소주 맥주 주문 테이블 정도 메뉴 가격 마리 마리 한우 육회 한우 차돌 갈비살 등심 우삼겹 소고기 주문 요즘 돼지고기 물가 차이 정말 부담 소고기 주문 거기 소주 맥주 필요 테이블 세팅 사장 앞치마 준비 불판 된장찌개 고기 된장찌개 불판 최고 상차림 사발 상추 깻잎 파절 제공 쌈장 마늘 김치 소금 그냥 소금 기름 부어 고추 장아찌 양파 양파 소스 양파 가득 양파 소스 부어 준비 완료 고기 상차림 정말 상이 테이블 세팅 마리 구성 면목역맛집 소고기 번지 마리 후기 재생 면목역맛집 소고기 번지 마리 후기 주문 마리 이서 먹기 영상 고기 순서대로 갈비살 우삼겹 등심 구성 후기 판이 완전 우삼겹 때문 우삼겹 기름 편이 먼저 불판 기름 효과 지인 먹음 우삼겹 불판 자연 불판 가득 된장찌개 우삼겹 기름기 우삼겹 된장찌개 우삼겹 소금 간장 소스 원래 부위 기름 소금 그냥 일반 소금 상추 파절 노릇 우삼겹 먹기 면목역맛집 소고기 부위 우삼겹 부위 소고기 포인트 빼주 갈비살 어쩜 때깔 갈비살 먹기 사이즈 먹기 기대 착착 양파 소스 쫄깃 갈비살 특징 소고기 갈비살 클리어 무척 기대 보통 소고기 부위 경우 부채살 경우 살이 구성 포함 사진 상태 지방질 좌르르 정도 테이블 추가 면목역맛집 번지 마리 가격 고민 처음 모든 부위 메뉴 주문 추가 새송이 버섯 노릇 찰떡 궁합 사이즈 등심 어째 고기 사진 깜박 노릇 지방질 부위 향가 요즘 물가 가성 소고기 가게 사장 테이블 계속 체크 리필 해주시 단체 모임 회식 방문 만족도 매장 매장 정보 번지 마리 서울특별시 중랑구 상봉 예약 블로그 체크 장소 영업 라스트 전화번호 편의 시설 예약 주차 포장 단체,
93,중랑구소고기 맛집 번지 마리,잇님들 꽁띠드 운동 단백질 충전 중랑구소고기 근처 번지 마리 면목 번지 마리 위치 서울 중랑구 상봉 면목역 출구 라스트 번지 마리 서울특별시 중랑구 상봉 예약 블로그 체크 장소 메뉴 번지 마리 부위 마리 마리 세트 메뉴 한우 육회 한우 차돌 갈비살 등심 우삼겹 삼겹살 돼지갈비 곱창전골 양념 불고기 갈비탕 된장찌개 판매 주류 소주 맥주 복분자 막걸리 판매 중이 현재 소주 맥주 제공 이벤트 진행 중이 혜장 소고기 맥주 소주 더욱 식사 매장 내부 인테리어 분위기 실내 테이블 간격 프라이버시 보장 가족 단위 방문객 소규모 모임 조명 좌석 배치 부담 분위기 제공 기본 상차림 기본 상차림 사발 야채 파채 양파 된장찌개 양파 대접 가득 양파 소스 주니 마리 중랑구소고기 맛집 먹기 마리 주문 소고기 세트 메뉴 부위 등심 우삼겹 갈비살 네가지 부위 우삼겹 지방 살코기 조합 영상 중랑구소고기 번지 마리 마리 재생 마리 우삼겹 갈비살 등심 원래 등심 부위 별로 선호 등심 원래 호들갑 한우 차돌박이 마리 고기 차돌박이 추가 지방 차돌박이 입안 살살 일품 지방 살코기 조화 소고기 매력 번지 마리 중랑구 소고기 최고 장소 소고기 부위 합리 가격 현재 진행 중인 소주 맥주 이벤트 아주 매력 고기 식사 번지 마리 방문,
94,중랑구소고기 번지 마리 소고기 한판,중랑구소고기 번지 마리 소고기 한판 아내 소고기 가끔 소고기 최근 중랑구소고기 번지 마리 번지 마리 소고기 전문 가격 소고기 마리 소주 맥주 대박 성비 한우 육회 육회 초이스 매장 번지 마리 단체 식사 번지 마리 메뉴판 마리 메뉴 주문 부위 가성 뽀인트 한우 차돌 갈비살 등심 우삼겹 삼겹살 돼지갈비 부위 주문 수도 판이 마음 불판 중앙 된장찌개 된장찌개 존맛 반찬 여러가지 양파 파채 고기 필수 선택 마리 완전 가성 중랑구소고기 번지 마리 소고기 한판 재생 중랑구소고기 번지 마리 소고기 한판 부위 대해 설명 사실 부위 먼저 갈비살 갈비살 부위 쫄깃 갈비살 최고 부위 마블링 우삼겹 시작 우삼겹 시작 마지막 등심 등심 등심 사장 말씀 부위 별로 한번 여러 부위 질리 가장 먼저 역시 우삼겹 특징 고기 부위 소고기 알럽잇 양파 소스 소고기 환상 조합 랍니 쌈장 마늘 김치 버섯 가지 조합 등심 대박 역시 등심 김치 리얼 쫀맛탱 구리 크킄 김치 구우 소고기 된장찌개 우삼겹 국물 더욱 쫀맛탱 완죤 된장 쫀맛 소고기 중랑구소고기 번지 마리 번지 마리 서울특별시 중랑구 상봉 예약 블로그 체크 장소 면목동맛집 면목맛집 면목역맛집 중랑구고기집 중랑구소고기,면목동맛집 면목맛집 면목역맛집 중랑구고기집 중랑구소고기
95,번지 마리 면목역맛집 면목동 소고기 번지 마리,퇴근길 오빠 소고기 소주 고깃집 번지 마리 서울 중랑구 면목동 월토 영업 일요일 휴무 예약 포장 가능 단체 이용 가능 주차장 면목역 출구 사거리 중화 중학교 방향 번지 마리 사거리 한촌 설렁탕 방향 번지 마리 서울특별시 중랑구 상봉 예약 블로그 체크 장소 대박 소주 맥주 소주 맥주 이벤트 거기 소고기 전문점 역시 마리 소고기 취급 전문점 크아 메뉴판 보임 가성 모임 육식 회원 최고 장소 가격 실화 고기 가격 번지 마리 불판 중앙 일케 된장찌개 전용 그릇 국물 일케 무한 리필 나위 만족 글구 여름 런가 살이 지난번 반찬 기억 계절 별로 밑반찬 면목역 소고기 번지 마리 마리 등심 우삼겹 갈비 살살 살로 구성 세트 메뉴 가격 세트 구성 가격 고기 때깔 마블링 마리 특유 육질 중랑구소고기 번지 마리 테이블 고기 리필 예상 퇴근길 자리 필옵 황금비율 소맥 부산 휴가 필옵 일주일 완전 면목맛집 번지 마리 스타트 부위 우삼겹 된장찌개 불판 우삼겹 송이버섯 앞뒤 양파 상추 우삼겹 간다 갈비살 굽굽 육즙 금은 갈비살 그냥 소금 소고기 특유 소고기 느낌 글구 등심 불판 본가 제사 소고기 산적 느낌 가격 고기 번지 마리 그대로 가성 최고 인정 먹기 크기 소주 등심 소금 살짝 글구 마지막 굽굽 부위 살이 번지 마리 마지막 상태 추가 시작 추가 엄두 글구 고기 냉면 오빠 동시 주문 비빔냉면 비냉 평범 깜놀 여름 역시 냉면 마무리 소고기 매콤 상큼 냉면 역시 테이블 마지막 모습 소고기 구성 가격 술값 감동 사장 불판 중앙 비어 간다 리필 간만 소고기 포식 면목역 주변 고깃집 진짜 번지 마리 모임 장소 최고다 다시 사장 자체 면목역맛집 면목동 소고기 번지 마리 재생 접기 크아 면목역 인근 고깃집 역시 소고기 번지 마리 최고 식당 더더 이용 한자리 장사 소고기 부위 구성 가격 완전 가성 최고,
96,중랑구 고기 면목역 맛집 마리 번지 마리,면목동맛집 면목역맛집 면목맛집 중랑구소고기 중랑구고기집 무더위 여름 보신 위해 소고기 접시 가격 가성 면목동 위치 면목역맛집 중랑구 소고기 번지 마리 철분 마리 선물 위해 번지 마리 영업 주소 서울 중랑구 상봉 전화번호 번지 마리 위치 면목역 출구 쭈욱 직진 한촌 설렁탕 우회 전해 만날 동원 전통 시장 입구 농협 정류장 현재 마리 번지 마리 소주 맥주 이벤트 중이 랍니 웨이 명단 실내 단체 회식 공간 테이블 쫘악 인용 테이블 메뉴 마리 마리 부위 고기 이외 돼지고기 고기 메뉴 후식 냉면 밑반찬 완전 상추 고추 마늘 쌈장 김치 사발 고추 짱아찌 파채 양파 간장 가득 주문 마리 출동 마리 먹기 양으로 부위 한판 갈비살 우삼겹 등심 가지 부위 마리 고기 뭉근 된장찌개 완전 번지 마리 면목역 맛집 재생 번지 마리 면목역 맛집 부위 우삼겹 시작 우삼겹 주먹밥 추가 우삼겹 냉면 보고 파채 보고 강인 우삼겹 차례 등심 자체 마블링 등심 소금 제일 면목동 맛집 번지 마리 재생 면목동 맛집 번지 마리 타자 갈비살 갈비 사르르 식감 감동 눈물 이루 갈비살 쫄깃 사르르 사르르 클리어 밑반찬 고기 면목역 맛집 번지 마리 가족 소고기 보양 거나 단체 회식 가성 완전 강추 보아 번지 마리 서울특별시 중랑구 상봉 예약 블로그 체크 장소 면목동맛집 면목역맛집 면목맛집 중랑구소고기 중랑구고기집,면목동맛집 면목역맛집 면목맛집 중랑구소고기 중랑구고기집 면목동맛집 면목역맛집 면목맛집 중랑구소고기 중랑구고기집
97,면목 맛집 번지 마리 가성 소고기,슈니 면목역 근처 가성 마리 소고기 번지 마리 서울특별시 중랑구 상봉 예약 블로그 체크 장소 주소 서울시 중랑구 상봉 전화번호 영업 월일 라스트 면목역 출구 위치 곱창전골 갈비탕 불고기 요즘 물가 합리 가격 소고기 무척 인분 인분 인분 가족 가족 외식 부담 내부 석도 석도 테이블 붙이 명도 가격 실내 공간 단체 모임 회식 가격 가성 좋쥬 성인 마리 느무 마리 등심 우삼겹 갈비 살살 치살 판이 가운데 된장찌개 사장 크시 양파 냉면 대접 냉면 대접 양상추 샐러드 채소 미나리 미나리 리필 고기 등심 우삼겹 갈비살 새송이 버섯 가장 우삼겹 상추 양파 절임 고기 맥주 된장찌개 숟가락 살이 갈비살 갈비살 소금 와사비 소금 와사비 느무 마지막 꽃등 성인 둘이서 소고기 맥주 소주,
98,면목동 소고기 중랑구 면목동 소고기 맛집 번지 마리 가성 비끝,땅콩 땅콩 오늘 면목동 망우동 소고기 맛집 번지 마리 소개 면목역 시기 거리 코앞 거리 소고기 내부 폴딩도어 어서 기분 고기 먹기 날씨 행복 소리 지금 마리 주문 주문 동시 밑반찬 세팅쓰 피클 반찬 돼지감자 콩나물 양파 사랑 기본 세팅되 묵도 세팅 요즘 시국 굿굿 마리 등장 가격 대비 고기 상태 우삼겹 갈비살 등심 우삼겹 냠냐미 우삼겹 차돌박이 고기 제일 역시 우삼겹 불판 국룰 등심 등심 사장 무한리필 된장찌개 완벽 조합 소고기 돼지고기 라면 환영 환영 면목동 소고기 중랑구 면목동 소고기 맛집 번지 마리 가성 비끝 재생 접기 면목동 소고기 중랑구 면목동 소고기 맛집 번지 마리 가성 비끝 치익 굿굿 맛있쨔 오늘 사장 가성 번지 마리 면목동 소고기 강추 번지 마리 서울특별시 중랑구 상봉 예약 번지 마리 면목동 소고기 면목동 번지 마리 중랑구소고기 맛집 중랑구맛집 면목동맛집 면목동 고기 소고기 소고기 맛집,일번지소한마리 면목동소고기 면목동일번지소한마리 중랑구소고기 맛집 중랑구맛집 면목동맛집 면목동고기집 소고기 소고기맛집
99,면목동 곱창전골 번지 마리,곱창전골 면목동 번지 마리 동원 시장 사거리 인근 위치 번지 마리 소고기 전문점 소고기 취급 곱창전골 판매 번지 마리 배너 곱창전골 곱창전골 번지 마리 메뉴판 사진 소고기 전문점 마리 마리 육회 차돌 삼겹살 곱창전골 준비 번지 마리 면목동 곱창전골 번지 마리 내부 곱창 주문 밑반찬 멸치 양파 피클 김치 시금치 김치 우동 사리 곱창전골 사리 곱창전골 맛집 전혀 손색 볶음밥 주문 사장 직접 한국인 최애 메뉴 볶음밥 비쥬 곱창전골 볶음밥 번지 마리 서울특별시 중랑구 상봉 예약 동원 시장 맛집 번지 마리 면목동 곱창전골 곱창전골 곱창전골,동원시장맛집 일번지소한마리 면목동소곱창전골 소곱창전골 곱창전골
100,면목역맛집 번지 마리 소고기 맛집,면목동맛집 면목역맛집 번지 마리 번지 마리 서울특별시 중랑구 상봉 예약 블로그 체크 장소 번지 마리 위치 면목역 출구 매일 라스트 번호 외부 내부 주차 면목역맛집 발견 번지 마리 단백질 한잔 주년 이벤트 소주 맥주 한번 방문 주차 가게 빨간색 라인 군데 웨이 명단 입장 내부 단체 안쪽 메뉴 가격 번지 마리 마리 메뉴판 센스 방문 마리 주문 소주 맥주 주문 마리 마리 소주 맥주 공기밥 반찬 절임 상추 깻잎 마늘 쌈장 조림 김치 된장찌개 사발 검정색 양파 간장 소스 마리 금방 마리 그람 가격 대비 마리 마리 등심 우삼겹 갈비살 마리 등심 우삼겹 갈비살 미국 고기 퀄리티 아보 왼쪽 갈비살 우삼겹 등심 버섯 제일 우삼겹 우삼겹 금방 파간 소스 참이슬 카스 번지 마리 주년 이벤트 맥주 안해 번지 마리 한잔 우삼겹 등심 최애 소고기 부의 살이 진짜 국내 한우 소고기 육즙 장난 갈비살 꽃등 고기 진짜 아버님 면목맛집 인정 넷이 마리 깜짝 그램 세명 마리 추가 주문 그냥 마리 추가 주문 진짜 처음 구성 진짜 누가 먹방 두번째 마리 우삼겹 몇개 된장찌개 살짝 차돌 된장찌개 고기 청양고추 입맛 마지막 판이 김치 고기 마리 정말 가성 번지 마리 면목역 가까이 소고기 추천 보통 마리 고기 질겨 별로 번지 마리 고기 전체 면목맛집 추천 화장실 서울 페이 번지 마리 화장실 가게 번지 마리 서울 페이,면목동맛집 면목역맛집
