,title_pos,content_pos,hash_tag
128,상봉 와인 베코 블루스,오늘 간만 정말 만족 상봉 와인 베코 블루스 소개 취향 저격 친구 방문 재고 고고 베코 블루스 분위기 상봉 와인 위치 서울 중랑구 면목로 영업 매일 라스트 일요일 정기 휴무 주차 주차 가게 정도 주차 시기 전화 문의 인스타 베코 블루스 사진 동영상 팔로워 팔로잉 게시 베코 블루스 사진 동영상 보기 가게 외관 베코 블루스 외관 블루 가게 명과 간판 파란색 멀리 서도 아주 찾기 베코 블루스 커피타임 타임 커피 와인 동시 운영 카페 이용 가게 바깥 메뉴판 상봉 와인 처음 아주 기대 이제 가게 내부 인테리어 분위기 사르르 기분 가게 느낌 테이블 전등 액자 장식 곳곳 구경 거리 베코 블루스 미술 작품 작품 생각 안나 프로젝터 친구 미드 오피스 메뉴판 베코 블루스 메뉴판 주류 안주 한참 아래 주문 소고기 스테이크 림프 알리오 리오 까망베르 버터 갈릭 구이 셜리 템플 스텔라 생맥주 하우스 와인 레드 둘이서 사실 계속 추가 주문 소고기 스테이크 가장 먼저 소고기 스테이크 버섯 파프리카 양파 샐러드 스테이크 재료 잔뜩 버섯 거짓말 친구 보통 스테이크 살짝 기지 지금 대부분 베코 블루스 찹스테키 소고기 먹듯 다시 주문 알콜 칵테일 셜리템플 자몽 라임 오렌지 주스 진저에일 음료 자몽 입맛 가게 분위기 림프 알리오 리오 스테이크 흡입 림프 알리오 친구 완전 알리오 오광 냄새 기대 메뉴 표시 살짝 매콤 오일 파스타 고추 마늘 정도 중요시 흑백 요리사 성재 빙의 베코 블루스 알료 안주 요건 까망베르 버터 갈릭 비주 까망베르 치즈 버터 갈릭 소스 견과류 요리 알러지 말씀 홀린 듯이 하우스 와인 주문 원래 까망베르 특유 쓴맛 견과류 크래커 까망베르 와인 안주 아주 제격 인절미 아이스크림 서비스 사장 요건 서비스 스윗 메뉴 메뉴판 인절미 아이스크림 프레첼 쿠키 아이스크림 이면 뭐해 싹싹 서비스 안주 세잔 계산 자리 프로젝터 분위기 분위기 상봉 와인 베코 블루스 인정 상봉 안주 식사 안주 상봉 와인 베코 블루스 강력 추천 사장 친구 다시 방문 예정 위치 베코 블루스 서울특별시 중랑구 면목로 블로그 체크 장소 상봉 와인 상봉 술집 상봉 맛집 상봉 파스타 상봉 안주 상봉역 맛집 상봉동 맛집 베코 블루스,상봉와인 상봉술집 상봉맛집 상봉파스타 상봉안주 상봉역맛집 상봉동맛집 베코블루스
129,베코 블루스 분위기 상봉역 칵테일 맛집,상봉 중랑구 칵테일 와인 맛집 발견 상황 기분 진짜 베코 블루스 서울특별시 중랑구 면목로 블로그 체크 장소 베코 블루스 중랑구 면목로 월토 라스트 정기 휴무 예약 무선 인터넷 단체 이용 가능 반려동물 동반 주차 상봉역 출구 아주 가게 발길 베코 블루스 입구 커피타임 타임 저녁 방문 타임 자리 고민 바깥 자리 돌멩이 지금 시야 모습 여러 종류 와인 칵테일 하이 맥주 판매 술병 자리 잡고 모습 상봉역 칵테일 와인 커튼 조명도 나무 예브 신경 느낌 내부 왜냐면 느낌 자리 날씨 마음 핑구 이야기 사랑 생각 누군가 꼬시 데리 의자 기여 분위기 취해 술집 주문 소고기 스테이크 림프 알리오 리오 스텔라 아르투아 생맥주 알콜 선샤인 먼저 과자 맥주 알콜 칵테일 한잔 운전 이슈 오빠 알콜 스텔라 스텔라 생맥 조아욤 위치 맥주 일본 맥주 한국 느낌 처음 진심 정말 신기 일본 선샤인 설명 오렌지 주스 오빠 느낌 사진 소고기 스테이크 등장 등장 냄새 장난 미국 등심 여러 가지 야채 새싹 채소 소스 양도 야호 이제 진자 버섯 고기랑 양파 림프 알리오 리오 메뉴 매운 살짝 매콤 래야 마늘 사장 음식 새우 진자 취하 늑김 헤엑 맥주 한잔 외모 화장실 방문 화장실 냄새 핸드 워시 머리 이쑤시개 그린 핸드 로션 페이퍼타올 숙취 소제 부스 판매 플러팅용 방문 이건 비밀 셀카 맛집 사진 진짜 조명 이건 어케 셀카 메뉴 참고 와인 중랑구 와인 맛집 느낌 와인 와인 상봉역 와인 베코 블루스 메모 베코 블루스 재생 베코 블루스 이건 음식 맥주 먹기 간접 체험 동영상 가세 베코 블루스 서울특별시 중랑구 면목로 블로그 체크 장소,
130,상봉역 술집 추천 베코 블루스,중랑 구민 등장 이오 멀리 가기 낡은이 중랑구 오늘 중랑구 술집 베코 블루스 베코 블루스 서울특별시 중랑구 면목로 블로그 체크 장소 상봉역 출구 오금 결론 대애 만족 오전 오후 카페 오후 오전 저녁 변신 안주 가성 중랑구 칵테일 맛집 안전 제일 사장 센스 인테리어 완전 따숩당 조명 뚜껑 놀람 가짜 조명 조심 걸이 아가 의자 구비 부분 감동 알죵 중랑구 칵테일 맛집 베코 블루스 단체 석도 자리 연말 연초 모임 장소 친구 칵테일 한잔 수다 떨기 인테리어 인생 기도 구경 족족 어우 에뻐 성적 단체 안쪽 테이블 정도 바깥쪽 테이블 정도 히터 빵빵 히터 껐듬 웨이팅석 카페 커피 맛집 저녁 커피 테이크아웃 오시 몇몇 메뉴 칵테일 가성 나유 그냥 만원 통일 집도 사이드 메뉴 기본 셋팅 찬물 드릴 센스 프레첼 왜케 한우 스테이크 피자 고기 고민 기대 고기 야채 가득 칵테일 영롱 피치 크러쉬 모해 여성 무조건 알콜 술맛 안나 존맛 그냥 음료수 임니둥 중랑구 칵테일 맛집 잭콕 다니엘 콜라 칵티일 술맛 알콜 술맛 남자친구 한잔 순삭 양송이 타파스 양송이 베이컨 버섯 요리 잡채 채소 먹기 스테이크 채소 슴슴 양송이 스테이크 소스 이로 단면 안주 칵테일 상봉역 술집 추천 카페 커피 메뉴 저녁 커피 오시 커피 맛집 인감 상봉역 술집 완전 추천 소개팅 데이트 장소 피자 피맥 해도 참고 무난 소주 참이슬 처음처럼 한라산 토끼 소주 하이 소주 식사 간단 술집 추천 위치 애매 정말 상봉 간다,
131,상봉 베코 블루스 상봉 데이트 상봉역 칵테일 중랑구 코젤 다크 맥주 중랑구 연말 모임 추천,상봉 분위기 상봉역 칵테일 금요일 데이트 인테리어 직원 음식 모든 상봉 베코 블루스 후기 상봉 베코 블루스 베코 블루스 서울특별시 중랑구 면목로 블로그 체크 장소 서울특별시 중랑구 면목로 정기 휴무 가게 내부 가게 외부 인테리어 외관 힙함 간판 초록 식물 외국 느낌 상봉 가게 내부 내부 조명 감각 소품 로맨틱 분위기 물씬 데이트 장소 추천 커플 테라스 자리 선택 유리 요즘 날씨 전혀 소파 메뉴 베코 블루스 상봉역 칵테일 맛집 종류 진짜 와인 레드 화이트 스파클링 칵테일 종류 칵테일 종류 안주 치즈 저녁 파스타 림프 알리오 리오 코젤 다크 생맥주 우린 만난 파스타 선택 테이블 칵테일 칵테일 코젤 다크 맥주 다크 맥주 시나몬 프레즐 등장 저번 처음 끝맛 크리미 시나몬 코젤 다크 맥주 림프 알리오 리오 맥주 모금 등장 알리오 리오 마늘 올리브 조화 발도 매콤 맥주 아주 도리 상봉 베코 블루스 재생 접기 상봉 베코 블루스 직원 후식 초콜릿 감동 단골 왜인 손님 상봉 베코 블루스 분위기 친절 삼박자 최고 상봉 베코 블루스 소파 데이트 연말 모임 친구 오기 칵테일 여지 상봉역 칵테일 맛집 상봉 베코 블루스 후기,
132,베코 블루스 분위기 상봉역 와인 추천 베코 블루스 상봉역 술집,안녕 드림 블로그 작성 술기 생활 원재 유럽 여행 생각 동네 공간 술집 주요 상권 주택가 지역 존재 식당 유리창 안쪽 동네 사람 삼삼오오 장면 술집 상봉역 위치 와인 베코 블루스 베코 블루스 서울특별시 중랑구 면목로 블로그 체크 장소 베코 블루스 조도 엔틱 인테리어 술자리 존재 인테리어 소품 분위기 치즈 플레이 계절 과일 프로슈토 브라운 치즈 가지 주문 정말 준비 정답 온전 취향 영역 주문 안주 분위기 주문 거나 사장 추천 추천 계절 과일 프로슈토 브라운 치즈 사진 정말 안주 치즈 와인 안주 최고 주문 와인 우르 네타 샤르도네 설명 복숭아 파인애플 바닐라 감귤 균형 산도 와인 상봉역 와인 베코 블루스 가장 숙취 소제 나볼 상복 와인 베코 블루스 추천 분위기 가격 정말 가게 애견 동반 소식 사진 동영상 팔로워 팔로잉 게시 사진 동영상 보기,
133,상봉 분위기 데이트 술집 베코 블루스 칵테일 코젤 맥주 와인 후기,상봉역 근처 분위기 술집 베코 블루스 소개 칵테일 코젤 다크 맥주 나위 베코 블루스 주소 서울 중랑구 면목로 영업 일요일 휴무 전화 상봉역 출구 도보 위치 베코 블루스 파란 간판 문구 베코 블루스 분위기 매장 그림 정말 예술 감성 가득 인테리어 무드 엔틱 인테리어 감각 은근 힙했어 소품 공간 음악 조명 조화로 공간 나쵸 치스 소스 타파스 소세지 구이 치즈 플레이 파스타 스테이크 칵테일 와인 맥주 메뉴 커피 음료 디저트 주문 알콜 베이컨 수제 파스타 코젤 다크 두둥 등장 창가 인석 맥주 한잔 코젤 생맥주 진짜 아시 거기 시나몬 맥주 계피 조합 달달 캐러멜 맥주 코젤 다크 베이컨 수제 파스타 비주 베이컨 듬뿍 토마토 소스 고기 조화로 파스타 마산 치즈 고소 상봉 분위기 데이트 술집 베코 블루스 칵테일 재생 접기 상봉 분위기 데이트 술집 베코 블루스 칵테일 상봉 분위기 데이트 술집 베코 블루스 칵테일 재생 접기 상봉 분위기 데이트 술집 베코 블루스 칵테일 베코 블루스 분위기 기분 코젤 맥주 파스타 기분 식사 맥주 한잔 데이트 맛집 최고 상봉역 분위기 맛집 칵테일 코젤 맥주 베코 블루스 추천 베코 블루스 서울특별시 중랑구 면목로 블로그 체크 장소 상봉 베코 블루스 후기 상봉 술집 상봉 맛집 상봉 술집 추천 상봉 베코 블루스 베코 블루스 상봉 파스타 상봉 칵테일 상봉 코젤 맥주 상봉 데이트 추천 상봉 데이트 맛집 상봉 분위기 술집 상봉역 맛집 상봉역 술집 상봉 맥주 상봉 와인 상봉역 와인 상봉 코젤 시나몬 상봉역 코젤 시나몬,상봉술집 상봉맛집 상봉술집추천 상봉베코블루스 베코블루스 상봉파스타 상봉칵테일 상봉코젤맥주 상봉데이트추천 상봉데이트맛집 상봉분위기좋은술집 상봉역맛집 상봉역술집 상봉맥주 상봉와인 상봉역와인 상봉코젤시나몬 상봉역코젤시나몬
134,상봉역 술집 베코 블루스 반려동물 동반 분위기 맛집,나름 상봉역 술집 베코 블루스 무려 반려동물 동반 가능 금액 이제야 발견 뽀물 데리 방문 딥슬립 애견 동반 안고 전용 가방 베코 블루스 서울 중랑구 면목로 월토 라스트 일요일 정기 휴무 예약 무선 인터넷 단체 이용 가능 반려동물 동반 테이크아웃 할인 포장 위치 베코 블루스 서울특별시 중랑구 면목로 블로그 체크 장소 상봉역 술집 베코 블루스 상봉역 출구 도보 거리 위치 가게 외부 감성 외관 거리 위치 매장 내부 통해 외부 공간 여름 선풍기 내부 소품 장식품 분위기 인테리어 내부 테이블 정도 수용 창가 혼술 좌석 메뉴판 안주 가짓수 안주 식사 대용 파스타 피자 금액 대도 평균 중반 편이 기본 상차림 추천 메뉴 기본 안주 프레 과자 소고기 스테이크 달달 소스 야채 스테이크 기지 정도 훈제 연어 샐러드 연어 디쉬 오이 레몬 샐러드 채소 드레싱 후추 오이 별미 베이컨 파스타 토마토 소스 바싹 베이컨 치즈 양도 편이 소시지 구이 모듬 소시지 야채 바싹 노릇 맥주 안주 도장 필스너 우르 코젤 다크 생맥주 코젤 시나몬 가루 생맥주 맥주 위스키 하이 사과 하이 과일 하이 기본 하이 사과 하이 로즈마리 체리 라임 레몬 줄평 애견 동반 분위기 모임 장소 데이트 장소 상봉역 술집 베코 블루스,
135,상봉역 술집 베코 블루스 호강 안주 파티,오늘 동동 고등학교 친구 모임 진짜 분위기 술집 발견 모에 이름 하야 베블 베코 블루스 서울 중랑구 면목로 월요일 토요일 라스트 일요일 정기 휴무 주차 불가 테이크아웃 할인 예약 가능 단체 이용 가능 반려동물 동반 가능 포장 가능 내부 외부 모습 외관 분위기 맛집 있쬬 야외 테라스 조명 난리 내부 진짜 센스 플랜 테리어 조명 친구 자리 조명 내부 인테리어 그림 곳곳 카운터 아저씨 인상 잭콕 박하 베코 블루스 메뉴판 코젤 다크 필스너 생맥 이벤트 주문 에코 백도 안주 금액 매우 나머지 만원 매우 흡족 하이 토닉 워터 탄산수 선택 알콜 칵테일 화이트 레드 와인 얼그레이 하이 하와 이안 하이 안주 하프 하프 피자 치즈 피자 페퍼로니 피자 주문 베코 블루스 메뉴 리뷰 먼저 하이 세잔 얼그레이 하이 시럽 살짝 달달 탄산수 선택 주문 매우 선택 달달 얼그레이 하이 탄산수 조합 추천 피자 정도 눈데 친구 수다 하이 모금 금방 방금 피자 피자 피클 핫소스 고민 고민 치즈 피자 진짜 치즈 듬뿍 버섯 토핑 건강 식감 버섯 페퍼로니 피자 모해 없쟈나 사실 친구 베코 블루스 술집 과식 이건 안주 잘못 분위기 상봉역 술집 베코 블루스 방문 오늘 하루 베코 블루스 서울특별시 중랑구 면목로 블로그 체크 장소,
136,중랑구 술집 분위기 깡패 베블 리뉴얼 메뉴,지난 주말 중랑구 술집 베블 외관 마음 듭니 위치 중랑역 상봉역 사이 중랑역 근처 분만 도착 외관 마음 듭니 카페 운영 저녁 칵테일 맥주 판매 저녁 대형 스크린 두운 분위기 칵테일 하이 종류 마음 맥주 알콜 칵테일 참고 가장 메뉴 참고 메뉴판 리뉴얼 가게 가기 미리 메뉴 후기 메뉴 가격 달라 의아 당황 편이 메뉴 단촐해 가격 계획 일이 원래 픽했던 양송이 타파스 다행 원래 인절미 아이스크림 기존 메뉴판 아이스크림 치즈 타르트 디저트 알코올 흡수 켈리 주문 양송이 타파스 아이스크림 치즈 타르트 켈리 기본 안주 프레 먹음 서도 구석 테이블 자리 분위기 데이트 제격 인테리어 감각 중랑구 술집 거주 동네 발견 예정 날씨 야외 테라스 해지 다시 날씨 별로 음식 손님 오기 시작 사장 대해 주문 아이스크림 치즈 타르트 비주 비주 합격 다시 접시 구성은 치즈 타르트 아이스크림 스쿱 오레오 소스 브라운 치즈 디저트 박사 재료 분석 디저트 먼저 인내심 양송이 타파스 등장 양송이 타파스 메뉴 처음 처음 비주 역시 합격 사전 블로그 메뉴 가격 통일 다시 비주 고급 레스토랑 비주 비주 가격 실화 양송이 타파스 내부 그냥 인기 메뉴 양송이 치즈 야채 베이컨 고기 모든 조화 이건 접시 중랑구 술집 베블 양송이 타파스 정말 강추 스트림 치즈 타르트 디저트 이건 아이스크림 스쿱 소스 브라운 치즈 정말 치트키 디저트 냠쪄비 마무리 구리 후식 식사 오늘 디저트 타파스 타르트 번갈아 맥주 홀짝 홀짝 피자 제외 안주 처럼 여러 진쨔 나머지 에그인헬 파스타 분위기 인테리어 깡패 나중 친구 델꼬오 중랑구 술집 위치 서울 중랑구 면목로 영업 월토 라스트 라스트 전화번호 예약 무선 인터넷 단체 이용 가능 반려동물 동반 포장 베코 블루스 서울특별시 중랑구 면목로 블로그 체크 장소 베코 블루스 중랑구 술집 상봉 칵테일 가성 맛집 사진 동영상 팔로워 팔로잉 게시 베코 블루스 중랑구 술집 상봉 칵테일 가성 맛집 사진 동영상 보기,
137,중랑구 상봉역 카페 술집 커피 칵테일 공존 베코 블루스,퇴근 방문 분위기 술집 상봉역 베코 블루스 소개 커피 디저트 저녁 매력 위치 서울특별시 중랑구 면목로 베코 블루스 상봉역 출구 도보 거리 위치 파란 네온사인 간판 발견 영업 일요일 휴무 오후 커피 디저트 판매 이후 안주 카페 저녁 방문 영업 마감 수다 한잔 분위기 셔터 자리 분위기 조명도 달라 느낌 빈티 느낌 자리 우드 자리 카페 술집 데이트 소개팅 장소 안쪽 테라스 좌석 요즘 날씨 마시기 강쥐 반려동물 동반 상주견 인사 카페 영업 매장 영업 간다 카페 운영 주문 음료 디저트 메뉴판 카운터 비치 한번 방문 보고 매장 곳곳 위치 술병 소품 가게 분위기 더욱 느낌 느낌 인테리어 취향 메뉴판 페이지 안내 사항 베코 블루스 메뉴판 여러 가지 메뉴 준비 식사 후식 해결 파스타 피자 스테이크 양식 요리 속초 오징어 순대 한식 메뉴 보이 안주 태구 나초 입맛 선택 하프 하프 피자 주문 칵테일 판매 메뉴 동그라미 도수 표시 사장 칵테일 맛집 와인 판매 와인 칵테일 하이 소주 맥주 정도 종류 고민 애플 샤워 칵테일 하이 주문 주문 음료 기본 안주 프레첼 인테리어 감각 칵테일 하이 비주 사진 애플 샤워 칵테일 주변 설탕 처음 달달 분명 동그라미 반개 살짝 알딸딸 맥주 칵테일 하프 하프 피자 치즈 피자 페퍼로니 피자 가지 주문 메뉴 하프 하프 피자 애플 샤워 칵테일 진저 하이 치즈 치즈 정말 피자 버섯 야채 파프리카 식감 치즈 피자 페퍼로니 피자 낫다 안주 스텔라 맥주 추가 주문 전용 기분 내부 프로젝터 영상 분위기 장난 해외 느낌 테라스 분위기 카페 술집 분위기 베코 블루스 분위기 상봉역 맛집 한번 베코 블루스 서울특별시 중랑구 면목로 블로그 체크 장소,
138,중랑구 분위기 상봉역 술집 추천 안주 술집 베코 블루스,중랑구 술집 베코 블루스 위치 서울 중랑구 면목로 매일 일요일 휴무 전화번호 동물 동반 가능 베코 블루스 서울특별시 중랑구 면목로 블로그 체크 장소 베코 블루스 상봉역 출구 거리 위치 상봉역 근처 이색 술집 베코 블루스 추천 베코 블루스 인테리어 감각 메뉴 눈길 술집 상봉 분위기 맛집 무드 포토 중랑구 술집 베코 블루스 내부 내부 선호 분위기 스크린 옛날 영화 감성 매장 분위기 분위기 상봉역 술집 추천 테이블 모야 소품 야외 좌석 구들 조화 개인 가장 마음 좌석 좌석 미니미니 책상 모형 창밖 먹기 베코 블루스 사장 직접 그린 그림 장식 예술 분위기 뿜뿜한데욧 그림 감상 중랑구 칵테일 맛집 베코 블루스 매장 내부 재생 중랑구 칵테일 맛집 베코 블루스 매장 내부 매장 테이블 소품 매력 공간 분위기 사장 직접 인테리어 매장 곳곳 사장 손길 중랑구 술집 베코 블루스 메뉴 술집 방문 안주 양송이 타파스 인절미 아이스크림 주류 모히또 코젤 다크 생맥주 기본 테이블 세팅 과자 접시 포크 과자 빳빳 바삭 기본 안주 숩니 사장 받침 상봉 맛집 센스 코젤 다크 생맥주 코젤 다크 생맥주 특징 맥주 입안 감칠맛 매력 시나몬 맥주 감칠맛 더욱 좋숩니 중랑구 칵테일 맛집 베코 블루스 코젤 다크 재생 중랑구 칵테일 맛집 베코 블루스 코젤 다크 맥주 타파스 디저트 모히또 모히또 상큼 라임 민트 조화 칵테일 여름철 인기 베코 블루스 모히또 재료 사용 일품 역시 상봉역 술집 추천 중랑구 칵테일 맛집 베코 블루스 모히또 재생 중랑구 칵테일 맛집 베코 블루스 모히또 라임 상큼 민트 모금 입안 기분 양송이 타파스 베코 블루스 양송이 타파스 양송이버섯 사용 메뉴 양송이 쫄깃 식감 입안 가득 일품 상봉역 술집 베코 블루스 양송이 타파스 재생 상봉역 술집 베코 블루스 양송이 타파스 타파스 안주 로서 주류 버섯 치즈 조합 입안 살살 식감 취향 저격 인절미 초코 아이스크림 인절미 초코 아이스크림 초콜릿 아이스크림 인절미 디저트 상봉역 술집 베코 블루스 인절미 초코 아이스크림 재생 상봉역 술집 베코 블루스 인절미 초코 아이스크림 그릇 스푼 아이스크림 식감 인절미 쫄깃 식감 조화 입안 계속 디저트 로서 만족도 매우 강력 추천 상봉역 술집 추천 상봉역 술집 베코 블루스 초코 시럽 투하 재생 상봉역 술집 베코 블루스 초코 시럽 투하 원래 시럽 시럽 초코 시럽 조합 오늘 상봉 위치 상봉 술집 베코 블루스 안주 분위기 매장 인근 사시 방문 상봉 맛집 베코 블루스 이용 분위기 마시기 동네 맛집 분위기 인근 주민 맛집 차로 마시기 술집 안주 기본 편임 칵테일 배합,
139,일상 일기 일상,연극 오빠 송곤 벌써 훌쩍 지나 만남 재작년 롯데 월드 스케이트 연극 가기 대학로 연극 연극 남사 여사 오빠 역시 사진 매력 연기 배우 정선 감정 연기 배우 덕분 몰입 연극 보고 낮술 추억 돈까스 사람 난리 비탄 기도 굉장힌 감자탕 집도 마무리 피맥 언니 온도계 베코 블루스 지은 온도계 서울특별시 중랑구 블로그 체크 장소 온도계 누룽지 통닭 지으니 위시 리스트 온도계 역시 맥주 누룽 통닭 부추 추가 메추리 알도 옛날 학겨앞 차로 와인 베코 블루스 베코 블루스 서울특별시 중랑구 면목로 블로그 체크 장소 진짜 최고 분위기 칵테일 글래스 와인 치즈 최고 수다 매경 친구 집들이 주희 현주 집들이 현주 음식 진짜진짜 진짜 계란찜 덕분 술술 현주 만두 마무리 맥주 과일 수다 수산 지은 지으니 횟집 수산 서울특별시 중랑구 상봉 리스 블로그 체크 장소 가을 야장 개시 광어 시킴 기본 안주 등장 지으니 지느러미 부분 지은이 매운탕 편의점 맥주 편맥 최고 자주 가든 포차 오빠 주희 커플 주희 커플 방학동 놀러와 가든 포차 하늘 야장 가든 포차 서울특별시 도봉구 방학로 가든 포차 고려 가든 블로그 체크 장소 웨이 정도 기본 셋팅 처음 감자전 호박 당황 예상 백숙 진보 분위기 때문 인기 가성 비도 인기 도도 돌뼈 라면 떡볶이 김말이 클리어 완료 놀러와 회사 사람 스트레스 퇴근 회사 맥주 고고 사람 일상 일기 일상 재생 일상 일기 일상 소맥 요새 스트레스 중랑역 할머니 떡볶이 지은 옛날 할머니 분식 서울특별시 중랑구 중랑역 블로그 체크 장소 중랑구 유명 떡볶이 꼬마 김밥 달걀 추가 사장 설명 추가 보케 요새 업뮤 일기 원래 밀림 년도 화이,남사친여사친 온도계 누룽지통닭 베코블루스
140,상봉 개인 카페 추천 베코 블루스 분위기 카페,최근 상봉 개인 카페 베코 블루스 사실 커피 회사 사람 분위기 커피 가격 추천 포스팅 베코 블루스 서울특별시 중랑구 면목로 블로그 체크 장소 영업 오전 오후 카페 오후 운영 술집 등록 위치 상봉역 출구 예전 자리 삼겹 헤헤 건물 허물 신축 건물 구조 입구 뭔가 베란다 스탈 내부 분위기 테라스 부분 좌석 아침 커피 우린 카페 칵테일 카운터 베코 블루스 메뉴판 아메리카노 전체 크게 가격 매장 디저트 쿠키 헤이즐넛 아메리카노 커피 텀블러 처음 사르르 버터 쿠키 달기 사브 쿠키 느낌 먹기 상봉 베코 블루스,
141,상봉역 술집 베코 블루스 가성 술집 칵테일 와인,마글론 상봉역 술집 베코 블루스 주소 서울 중랑구 면목로 전화번호 영업 월목 휴무 일요일 정기 휴무 화장실 화장실 남녀 구분 주차공간 대중교통 상봉역 출구 호선 경의 중앙 상봉역 술집 베코 블루스 메뉴 스테이크 베이컨 파스타 얼그레이 독도 소주 메뉴 하단 사진 참고 오후 막국수 저녁식사 해결 생각 아내 뭘좀 부시장 와인 와인 한우 곱창 해도 그것 하이 칵테일 판매 주점 칵테일 하이 와인 판매 카페 운영 저녁 주점 야외 테라스 분위기 야외 테라스 안쪽 자리 주무 독도 소주 처음 증류주 검색 편의점 판매 아내 얼그레이 하이 토닉 워터 탄산수 달달 탄산수 기본 안주 프리 안주 독도 소주 도수 소주 한번 항공 한장 베이컨 파스타 가격 이건 스테이크 가성 안주 한잔 분위기 한잔 상봉역 술집 베코 블루스 메뉴판 참고 카페 운영 아메리카노 카페라떼 베코 블루스 서울특별시 중랑구 면목로 블로그 체크 장소,
