,title_pos,content_pos,hash_tag
43,중랑 구청 맛집 신내동 김치찌개 맛집 골짝 마을 마리,중랑 구청 맛집 신내동 김치찌개 맛집 골짝 마을 마리 아침 점심 저녁 엄마 매일 차려 이제 차려 불금 저녁 먹기 중랑 구청 맛집 신내동 김치찌개 맛집 골짝 마을 마리 우림 시장 망우 사거리 동쪽 가면 골짝 마을 마리 겹살 차돌박이 찜닭 마리 삼계탕 묵은지 김치찌개 건물 외부 계단 통해 신내동 김치찌개 맛집 골짝 마을 마리 주차 골짝 마을 주차 골짝 마을 마리 주차 건물 지하 주차장 길이 지하 주차 주차 골짝 마을 마리 계산 준비 도장 대신 주차 장문 주차 확인 주차장 외부 계단 중랑 구청 김치찌개 맛집 골짝 마을 마리 영업 월요일 영업 오전 오후 예약 식당 탁자 의자 반찬 앞치마 준비 골짝 마을 마리 메뉴 가격 신내동 맛집 골짝 마을 마리 메뉴 크게 가지 김치찌개 찜닭 닭볶음탕 마리 오늘 김치찌개 사장 직접 김치 김치찌개 김치 숙성 거기 국내 돼지고기 고기 송송 국내 생닭 사용 골짝 마을 마리 찜닭 마리 직접 묵은지 김치찌개 인분 주문 가능 추가 반찬 셀프 김치 양파 절임 백김치 보리차 준비 김치찌개 인분 주문 백김치 배추김치 양파 절임 상추 반찬 그릇 정말 집밥 기분 그릇 김치찌개 김치찌개 두부 파랑 국내 산돼지 고기 고기랑 묵은지 듬뿍 다시 생각 정말 회사 근처 김치찌개 점심 장사 집밥 감칠맛 김치찌개 쌀밥 묵은지 김치 돼지고기 접시 가득 퍼다 김치찌개 정말 나야 요리왕 그날 접시 고기랑 김치 가득 김치찌개 반찬 싹싹 외식 음식 외식 이정 나야 신내동 중랑 구청 근처 김치찌개 신내동 맛집 중랑 구청 맛집 골짝 마을 마리 추천 골짝 마을 마리 서울특별시 중랑구 신내 해성 빌딩 신내동 맛집 중랑 구청 맛집 골짝 마을 마리 신내동 김치찌개,골짝마을주차 골짝마을닭한마리주차 신내동맛집 중랑구청맛집 골짝마을닭한마리 신내동김치찌개
44,중랑 구청 맛집 신내동 맛집 골짝 마을 마리 닭볶음탕 맛집,중랑 구청 맛집 신내동 맛집 중랑 구청 닭볶음탕 맛집 중랑 구청 마리 맛집 중랑 구청 삼계탕 맛집 신내동 볶음 시크 닭볶음탕 요리 단골 복날 즈음 삼계탕 신내동 맛집 삼계탕 닭볶음탕 마리 요리 맛집 이예 인테리어 때문 방문 연령 대가 래서 음식 사진 미리보기 감상 국물 좀더 국물 가장 골짝 마을 마리 서울특별시 중랑구 신내 해성 빌딩 블로그 체크 장소 서울시 중랑구 신내 해성 빌딩 영업 브레이크 타임 신내동 맛집 골짝 마을 마리 수도 신내 지하차도 주차 주차장 근처 주차 신내동 맛집 골짝 마을 마리 단골 평소 마리나 닭볶음탕 주로 복날 즈음 녹두 삼계탕 녹두 삼계탕 녹두 신내동 삼계탕 여기저기 이집 골짝 마을 마리 메뉴 가격 편이 회식 인기 테이블 제외 회사 친구 모임 대부분 단체 모임 주문 닭볶음탕 진짜 닭볶음탕 이집 음식 질리 특징 손님 연령 대가 편이 음식 그게 완전 입맛 뚝배기 처음 국물 사진 리보 실제 국물 그게 시작 금방 완전 사실 닭볶음탕 공기밥 국물 개인 볶음밥 공기밥 감자 양념 가슴 완전 대박 국물 떡볶이 에피타이저 밀떡 아주 크기 가슴 야들야들 하니 마리 사진 몇장 아주 매콤 한번 수가 고기 완전 역시 고기 고기 백김치 양념 공기밥 아주 뚝딱 쌀밥 감자 가슴 아주 진짜 기도 뚝딱 역시 항상 신내동 맛집 골짝 마을 마리,중랑구청맛집 신내동맛집 중랑구청닭볶음탕맛집 중랑구청닭한마리맛집 중랑구청삼계탕맛집 신내동닭볶음
45,신내동 맛집 묵은지 김치찌개 골짝 마을 마리,와이프 점심 데이트 골짝 마을 마리 서울특별시 중랑구 신내 해성 빌딩 서울 중랑구 신내 해성 빌딩 영업 휴무 예약 문의 주차 가능 포장 배달 가능 조카 점심 데이트 바람 점심 데이트 점심 메뉴 묵은지 김치찌개 선택 맵콤 위치 신혼 생활 신내동 가게 자주 마리 이참 생각 후닥닥 장안 고고 위치 매장 넒었답니 한쪽 벽면 유리 매장 안이 점심시간 손님 묵은지 김치찌개 녹두 삼계탕 손님 묵은지 김치찌개 소리 기대 자리 지채 주문 고고 달리 벽면 메뉴판 개인 반찬 세팅 반찬 백김치 모든 김치 직접 런가 사장 나이스 묵은지 김치 골짝 마을 김치 직접 묵은지 김치찌개 감칠맛 보통 사서 김치찌개 조미료 골짝 마을 전혀 청양고추 맵콤 쌀밥 묵은지 김치 공기 그냥 공기 순식간 밥그릇 뚤렸는 고기 라면 사리 국룰 방문 라면 사리 추가 묵은지 김치찌개 재생 묵은지 김치찌개 요즘 부대찌개 여보 데이트 기분 오늘 하루 잇님들 하루 가지 주차장 길이 주차 식사 중랑 구청 맛집 신내동 맛집 중랑구맛집 신내 맛집 묵은지 맛집 김치찌개 맛집 마리 찌개 맛집 맛집 추천 중랑구맛집 추천 신내동 맛집 추천,중랑구청맛집 신내동맛집 중랑구맛집 신내맛집 묵은지맛집 김치찌개맛집 닭한마리 찌개맛집 맛집추천 중랑구맛집추천 신내동맛집추천
46,신내동 골짝 마을 마리 솔직 후기,마리 검색 아보 방문 신내동 마리 골짝 마을 위치 골짝 마을 마리 서울특별시 중랑구 신내 해성 빌딩 블로그 체크 장소 영업 영업 매일 첫째 월요일 휴무 메뉴 가격 야채 마리 마리 마리 주차 가능 건물 지하 주차장 연락처 계단 휠체어 유모차 방문 내부 테이블 간격 김치 직접 김치 기대 메뉴 마리 고기 사람 마리 예약 상태 밑반찬 야채 양파 절임 양념장 물김치 김치 접시 고춧가루 상큼 반찬 셀프 접시 다시 야채 양념장 양념장 기호 다대기 간장 야채 개인 다대기 마리 등장 생각 느낌 시작 야채 먼저 국물 자극 필수 칼국수 사리 달라 처음 이모 건가 다시 얘기 찰나 사리 황스 칼국수 김치 후루룩 종업원 방문 신내동 골짝 마을 후기,
47,신내 맛집 골짝 마을 마리 마리 후기,신내 마리 맛집 골짝 마을 마리 골짝 마을 마리 서울 중랑구 신내 해성 빌딩 목금 토일 월요일 정기 휴무 예약 주차 배달 포장 무선 인터넷 단체 이용 가능 골짝 마을 마리 서울특별시 중랑구 신내 해성 빌딩 블로그 체크 장소 내부 좌석 정말 회식 모임 김치찌개 찜닭 닭볶음탕 마리 메뉴 팔고 마리 주문 반찬 양념 김치 정도 가짓수 사장 김치 직접 마리 부추 듬뿍 비주 원래 근처 마리 체인점 자주 채소 국물 정말 칼국수 추가 역시 마리 칼국수 필수 골짝 마을 마리 신내 마리 맛집 내부 좌석 모임 회식 반찬 가짓수 김치 직접 마리 부추 포함 채소 국물,
48,신내동 맛집 포장 맛집 골짝 마을 마리,포장 신내동 맛집 골짝 마을 마리 골짝 마을 마리 서울특별시 중랑구 신내 해성 빌딩 서울시 중랑구 신내 해신 빌딩 오전 오후 월요일 휴무 브레이크 타임 오후 오후 건물 지하 주차장 이용 가능 요즘 정말 으드드 날씨 음식 매콤 마리 신내동 맛집 골짝 마을 마리 포장 후기 포장 후기 작성 골짝 마을 마리 신내동 능산 지하차도 중화 초등학교 아파트 옹기 공원 상가 입구 바깥 골짝 마을 마리 마리 찜닭 닭볶음탕 삼계탕 냄비 메뉴 입맛 계속 닭볶음탕 주문 미리 전화 포장 주문 준비 방문 요리 골짝 마을 마리 찜닭 마리 닭볶음탕 마리 야채 마리 김치찌개 신내동 맛집 골짝 마을 마리 메뉴판 찜닭 닭볶음탕 마리 식사 메뉴 김치찌개 불고기 가격 장사 마리 정도 편이 요즘 외식 물가 가족 끼리 부담 정도 가게 내부 스타일 신발 요런 제일 어머니 아버지 모시 다시 정도 곧바로 음식 사장 기분 포장 신내동 맛집 골짝 마을 중랑구 모범 음식점 이제 모범 음식점 제도 마크 신뢰 고기 포장 용기 그릇 마리 포장 밑반찬 대신 사리 사리 새삼 뿌듯 신건 살이 정도 역시 입맛 음식 최고 닭볶음탕 설레설렝 얼른 신랑 성화 밥상 반찬 뚝딱 닭다리 닭다리 사람 임자 살이 기지 식감 먹기 사리 원래 사리 간이 양념 양념 보기 어른 넷이 대용 매운 매직 뻘뻘 신랑 어머니 아부지 평안 원래 퍽퍽살 골짝 마을 마리 닭볶음탕 가슴 양념 완전 도둑 가족 넷이 뻘뻘 신내동 맛집 이제 역시 중랑구 이제 다행 중랑구 신내동 맛집 골짝 마을 마리 배민 주문 화로 포장 동네 주민 라면 신내동 맛집 골짝 마을 마리 주소 서울시 중랑구 신내 해신 빌딩 운영 오전 오후 브레이크 타임 오후 오후 월요일 휴무 문의 건물 지하 주차장 이용 가능 골짝 마을 마리 서울특별시 중랑구 신내 해성 빌딩,
49,골짝 마을 마리 신내동 맛집 녹두 삼계탕 보신,벌써 유월 절반 요즘 장마 시작 해지 자매 더위 기전 보신 신내동 중랑 구청 맛집 골짝 마을 마리 녹두 삼계탕 가게 외관 신내동 옹기 마을 마당 위치 나무 사이 간판 금방 계단 입장 중랑구 모범 음식점 중랑구 맛집 골짝 마을 마리 가게 내부 전경 가게 내부 내부 테이블 정말 단체 모임 회식 기두 가게 개끗하 정돈 창가 창밖 나무 잔뜩 보이 가게 화분 자연 산장 기분 벌레 퇴치 기구 벌레 메뉴판 메뉴 정말 김치찌개 정말 직접 묵은지 대박 먹음 정말 친구 마음 진정 녹두 삼계탕 주문 통위 깨알 메뉴판 귀욤 사장 정말 위생 이심 수저 젓가락 포장 포장 안해 그냥 비치 사람 계속 세균 깨알 위생 중랑 구청 삼계탕 녹두 삼계탕 등장 츄릅 골짝 마을 마리 신내동 맛집 녹두 삼계탕 보신 재생 골짝 마을 마리 신내동 맛집 녹두 삼계탕 보신 신내동 삼계탕 맛집 뚝배기 소리 한지 대도 뿌셔져 고기 먹기 정말 밑반찬 상추 겉절이 백김치 배추김치 짱아찌 반찬 삼계탕 총사 느낌 집밥 처럼 상추 겉절이 소스 대박 이건 세번 첨부 달라 인심 덕이 흡입 됫답니 닭고기 완전 부들부들 삼계탕 총사 국물 완전 국물 후루룩 음식 국물 안해 완전 백숙 동생 신내동 맛집 국물 살이 계속 녹두 닭살 인삼 그게 별미 녹두 삼계탕 에너지 악도 느낌 일전 숙취 기분 도나 완전 삼계탕 동생 두리 동네 바퀴 오빠 보신 신내동 삼계탕 골짝 마을 마리 추천 잇님들 여름날 건강 골짝 마을 마리 영업 월일 매달 월요일 정기 휴무 골짝 마을 마리 서울특별시 중랑구 신내 해성 빌딩 삼계탕 녹두 삼계탕 골짝 마을 마리 복날 삼계탕 맛집 보신 삼계탕 도리 신내동 맛집 중랑 구청 맛집 중랑 구청 중랑구 신내동 중랑구 삼계탕 신내동 삼계탕 서이추 서이추 환영 소통,삼계탕 녹두삼계탕 골짝마을닭한마리 복날 삼계탕맛집 몸보신 삼계탕맛도리 신내동맛집 중랑구청맛집 중랑구청 중랑구 신내동 중랑구삼계탕 신내동삼계탕 서이추 서이추환영 소통
50,골짝 마을 마리,위치 서울 중랑구 신내 해성 빌딩 영업 브레이크 타임 휴무 월요일 예약 주차 배달 포장 단체 이용 가능 점심때 방문 골짝 마을 마리 예전 김치찌개 오늘 처음 마리 주문 점심때 런가 손님 단체 손님 실내 마리 밑반찬 상추 양파 절임 백김치 김치 반찬 셀프 시작 야채 국물 자극 개인 그냥 김치찌개 마리 방문 골짝 마을 마리 서울특별시 중랑구 신내 해성 빌딩 블로그 체크 장소,
51,골짝 마을 마리 신내동 중랑 구청 맛집,골짝 마을 마리 신내동 중랑 구청 맛집 점심 선배 단골 식당 골짝 마을 마리 점심 식사 마리 메인 식당 오늘 김치찌개 골짝 마을 마리 주차 포장 망우역 출구 신내동 성원 아파트 아파트 입구 찾기 신내 지하차도 어린이집 위치 건물 지하 주차 주차장 내부 주차장 별도 매일 월요일 식당 내부 비교 편이 근처 중랑구 청과 회사 점심시간 손님 편이 손님 대거 모습 사진 가족 단위 손님 직장인 점심 찜닭 닭볶음탕 야채 마리 녹두 삼계탕 차돌박이 겹살 직접 묵은지 김치찌개 판매 주문 김치찌개 인분 참고 자주 메뉴 칼국수 사리 마리 마리 마리 판매 인원 주문 사리 가격 라면 만두 메뉴 사리 주문 묵은지 찌개 라면 두부 만두 추가 반찬 라면 사리 밑반찬 상추 양파 장아찌 쌀밥 최고 짝꿍 백김치 상추 콤달콤 백김치 양파 장아찌 반찬 직접 묵은지 김치찌개 인분 전골 냄비 모습 모습 먹음 돼지 고기 가득 육식 파기 때문 고기 듬뿍 두부 돼지고기 김치찌개 재료 사장 인심 생각 고기 고기 양보 선배 아주 사장 직접 묵은지 믿음 쌀밥 국물 역시 한국인 최고 메뉴 생각 돼지고기 상추 겉절이 골짝 마을 마리 묵은지 김치찌개 재생 접기 골짝 마을 마리 묵은지 김치찌개 점심 외식 회사 기분 하루 단골 식당 다시 회사 골짝 마을 마리 서울특별시 중랑구 신내 해성 빌딩 존재 이미지,
52,중랑 구청 맛집 미리 초복 보양음식 골짝 마을 마리 녹두 삼계탕,신내동 맛집 골짝 마을 마리 녹두 삼계탕 달도 훌쩍 달이 복날 미리 복날 신내동 맛집 골짝 마을 마리 출동 중랑 구청 사거리 도보 도착 골짝 마을 마리 묵은지 김치찌개 저걸 계단 오픈 오픈 중랑 구청 맛집 골짝 마을 마리 매장 생각 오픈 매장 사진 창밖 푸릇푸릇 나무 기분 야외 자리 회식 모임 신내동 맛집 골짝 마을 마리 직접 김치 제공 후기 김치 김치 사람 마음 메뉴판 복날 음식 최고봉 삼계탕 그냥 삼계탕 녹두 삼계탕 마리 닭볶음탕 찜닭 식사 메뉴 여러 가지 주차장 지하 참고 추가 반찬 셀프 마음껏 녹두 삼계탕 주문 포장 으룽 점심시간 김치찌개 반찬 셀프 코너 식기 후식 커피 머신 화장실 매장 안쪽 사장 직접 관리 화장실 미리 예약 생각 상추 겉절이 백김치 골짝 마을 마리 기대 김치 양파 장아찌 밑반찬 녹두 삼계탕 나왔따릿 뚝배기 녹두 삼계탕 그냥 보기 해도 느낌 국물 신내동 골짝 마을 마리 재생 접기 중랑 구청 맛집 신내동 맛집 영상 확인 그냥 분리 어르신 느낌 사실 어르신 연령 불문 김치 녹두 역시 김치 젓갈 느낌 나중 닭다리 꺄오 그냥 분리 다리 소금 역시 백김치 백김치 다시 겉절이 양파 진짜 천재 천재 양파 장아찌 삼계 다시 김치 연발 백김치 싹싹 녹두 삼계탕 여사 일루 국물 완탕하셨뚬 호호 기분 효도 골짝 마을 마리 녹두 삼계탕 제대로 보양 기분 골짝 마을 마리 서울특별시 중랑구 신내 해성 빌딩 매일 오전 오후 매달 월요일 정기 휴무,
53,신내동 맛집 골짝 마을 마리 찜닭,신내동 맛집 중랑 구청 맛집 골짝 마을 마리 프레 소입 미용실 머리 기분 전환 남편 외식 머리 오늘 신내동 맛집 소개 골짝 마을 마리 서울 중랑구 신내 해성 빌딩 중랑 구청 근처 신내동 맛집 골짝 마을 마리 고고 단골 분위기 분위기 김치 직접 김치 김치 국내 국내 생닭 사용 고해 은근 중요 포인트 마리 닭도리탕 찜닭 녹두 삼계탕 녹두 반계 점심 식사 오기 차돌박이 겹살 고기 메뉴 신내동 회식 골짝 마을 마리 고민 찜닭 고고 찜닭 처음 비주 센세이션 부분 진짜 포인트 사이드 상추 샐러드 겉절이 계속 추가 반찬 셀프 리필 참고 신내동 맛집 골짝 마을 마리 찜닭 재생 접기 신내동 맛집 골짝 마을 마리 찜닭 찜닭 요즘 날씨 진심 양도 정말 일반 찜닭 접시 골짝 마을 마리 간장 닭도리탕 비주 일반 닭도리탕 함정 찜닭 자극 찜닭 사실 고기 질리 골짝 마을 마리 찜닭 부담 계속 계속 전혀 질리 진짜 닭고기 살이 정말 국내 생닭 사용 전혀 당면 찜닭 당면 당면 킬러 양념 국물 양념 당면 진짜 감자 진짜 완벽 단골 테이블 손님 찜닭 단골 사장 할머니 기분 선택 매운 진짜 간도 아주 살짝 불향 자극 살짝 자극 남편 닭다리 가슴 살파 가슴 국물 찜닭 양념 계속 참고 볶음밥 으루 역시 디저트 볶음밥 김치 볶음밥 김치 꿀맛 진짜 싹싹 테이블 어른 마리 찜닭 주문 입맛 부부 일반 찜닭 느낌 고기 감칠맛 가득 신내동 맛집 단골 예정 골짝 마을 마리 서울특별시 중랑구 신내 해성 빌딩,
54,중랑 구청 맛집 신내동 맛집 녹두 삼계탕 망우역 맛집 골짝 마을 마리,동글이 망우역 인근 요리 맛집 골짝 마을 마리 골짝 마을 마리 망우역 식당 출처 네이버 지도 신내동 맛집 골짝 마을 마리 경의 중앙 망우역 출구 정도 출구 버스 환승 방법 환승 때문 망우역 맛집 녹두 삼계탕 주차장 표시 승용차 이용 식당 건물 지하 주차 가다가 그냥 승용차 이용 사진 입구 골짝 마을 주차장 노랑 표시 지하 주차장 지하 주차장 길이 협소하 주차 공간 지하 주차장 안내 주시 안내 주차 엘리베이터 지하 주차장 엘리베이터 위로 그냥 계단 총총 안내 문구 가야 요런 문구 발견 중랑 구청 맛집 골짝 마을 마리 경우 공원 외부 계단 설명 입구 오른쪽 식당 외부 계단 분위기 식당 입구 신내동 맛집 골짝 마을 마리 외부 계단 가기 때문 부모님 동반 추천 계단 위로 입구 인증 문구 입구 모범 음식점 프로덕션 추천 맛집 서울 안심 식당 여러 인증 문구 믿음 망우역 맛집 식당 내부 중랑 구청 맛집 골짝 마을 마리 내부 테이블 인석 위주 셀프 커피 여러 반찬 구비 셀프 위치 커피 머신 기도 준비 인테리어 신내동 맛집 골짝 마을 마리 내부 내부 인테리어 정말 초록 초록 내부 종류 화분 나무 느낌 문구 곳곳 문구 닭고기 생닭 배추김치 국내 산이 라거 앞치마 화장실 앞치마 걸이 비치 화장실 내부 남녀 공용 음식 메뉴판 중랑 구청 맛집 골짝 마을 마리 메뉴 구성은 찜닭 닭볶음탕 삼계탕 기류 메뉴판 와이파이 아이디 비밀번호 녹두 삼계탕 주문 망우역 맛집 녹두 삼계탕 테이블 테이블 냅킨 수저 셋팅돼 젓가락 숟가락 개별 포장 위생 테이블 셋팅 음식 셋팅 완료 밑반찬 먼저 밑반찬 상추 양파 배추 김치 백김치 양파 절임 제공 사장 한번 모든 밑반찬 직접 배추김치 경우 새우젓 멸치젓 매콤한 진짜 녹두 삼계탕 실물 재생 접기 녹두 삼계탕 실물 녹두 삼계탕 오늘 메인 음식 녹두 삼계탕 사실 여러 삼계탕 녹두 삼계탕 녹두 빈대떡 국물 국물 한번 녹두 초록 망우역 맛집 녹두 삼계탕 닭다리 고기 한번 먼저 다리 잡고 쭈욱 닭다리 자태 아주 크기 나름 그다음 한번 갈라 보통 삼계탕 안이 녹두 바닥 녹두 닭고기 고기 먼저 닭고기 닭다리 날개 가슴 살이 퍽퍽 부위 생각 외로 입맛 고기 분리 그냥 숭숭 발라 기도 정말 녹두 녹두 일반 쌀밥 녹두 식감 재미 신내동 맛집 골짝 마을 마리 배추김치 배추김치 정말 인삼 요건 기호 삼계탕 인삼 먹기 일전 인삼 먹기 망우역 맛집 주차 마지막 중랑 구청 맛집 골짝 마을 마리 승용차 식사 도장 차비 물어 서비스 신내동 맛집 중랑 구청 맛집 골짝 마을 마리 사장 부부 운영 인사 서빙 설명 서비스 식당 정보 골짝 마을 마리 영업 매일 매달 세번 월요일 휴무 주차 메뉴 포장 연락처 골짝 마을 마리 서울특별시 중랑구 신내 해성 빌딩 골짝 마을 마리 개인 분위기 음식 서비스 골짝 마을 마리 중랑 구청 맛집 신내동 맛집 망우역 맛집 녹두 삼계탕 삼계탕 맛집,골짝마을닭한마리 중랑구청맛집 신내동맛집 망우역맛집 녹두삼계탕 삼계탕맛집
55,신내동 맛집 여름 맞이 삼계탕 골짝 마을 마리,골짝 마을 마리 서울특별시 중랑구 신내 해성 빌딩 매일 매월 월요일 휴무 오늘 신내동 맛집 골짝 마을 마리 녹두 삼계탕 리뷰 중랑 구청 맛집 골짝 마을 마리 중화 초등학교 성원 아파트 이내 거리 위치 신내동 맛집 골짝 마을 라인 건물 건물 자체 옆면 곡선 전면 통창 매장 자체 신내동 맛집 골짝 마을 마리 공원 위치 정말 요즘 가든 푸르른 신록 계절 초록 초록 신내동 맛집 골짝 마을 마리 국내 생닭 사용 찜닭 닭볶음탕 마리 삼계탕 요리 모든 닭고기 차돌박이 겹살 직접 묵은지 김치찌개 주문 가능 동무 녹두 삼계탕 주문 개별 포장 수저 밑반찬 삼계탕 보통 김치 정도 골짝 마을 마리 샐러드 백김치 장아찌 샐러드 야채 백김치 김치 리필 추가 반찬 셀프 셀프 코너 관리 김치 김치냉장고 보관 김치 신내동 맛집 골짝 마을 녹두 삼계탕 영계백숙 오오오 영계백숙 오오오 찹쌀 녹두 젓가락 스윽스윽하 닭고기 살이 자동 분리 푸욱 영계백숙 닭고기 살이 정말 가슴 녹두 듬뿍 녹두 삼계탕 국물 살짝 초록 녹두 삼계탕 먼저 살코기 타입 발골 작업 소금 후추 살짝 촉촉 살코기 몽실몽실 정말 녹두 삼계탕 신내동 맛집 골짝 마을 사장 직접 김치 반찬 배추김치 저가 중국산 김치 발골 작업 녹두 삼계탕 고기 녹두 녹두 삼계탕 처음 원래 녹두 건가 신내동 맛집 골짝 마을 녹두 삼계탕 녹두 듬뿍 삼계탕 반찬 클리어 뚝배기 마무리 맛집 테이블 한편 사장 직접 판이 식힘 쓰시 재료 대한 사장 마음 굿굿 계산 마무리 커피 한잔 공원 공원 티타임 살결 세월 한갓 보이지 무늬 항아리 티끌 불멸 윤곽 지니 항시 우러른 아무 길이 시인 박희진 항아리,
56,중랑 구청 맛집 신내동 맛집 골짝 마을 마리,오늘 중랑 구청 맛집 신내동 맛집 골짝 마을 마리 근처 찜닭 중랑 구청 맛집 신내동 맛집 골짝 마을 마리 매일 첫째 월요일 휴무 먼저 골짝 마을 주차장 참고 참고 건물 좌측 간판 계단 한식 메인 메뉴 메뉴 간판 계단 신발 신고 내부 화로 테이블 사람 얼른 후다닥 블로그 생각 찜닭 매운 매운 고민 사장 김치 반찬 직접 수저 메뉴판 매장 구석구석 앞치마 구비 김치 직접 김치찌개 오픈 메뉴 김치 래서 오늘 친구 찜닭 먹기 지금 다시 생각 추가 기본 반찬 준비 반찬 보고 반찬 진짜 김치 직접 진짜 상추 샐러드 매운 상큼 샐러드 당면 소리 찜닭 보통 접시 불판 준비 국물 중랑 구청 맛집 신내동 맛집 골짝 마을 마리 재생 접기 중랑 구청 맛집 신내동 맛집 골짝 마을 마리 동영상 냄새 다시 국물 다리 당면 진짜 반찬 맛날 간도 매콤 달달 사장 추천 주신 대로 살짝 매콤 진짜 감자 간이 감자 옵션 볶음밥 위장 중랑 구청 맛집 신내동 맛집 골짝 마을 마리 사장 참고 개선 사항 진짜 음식 진심 시구 음식 정말 메뉴 보고 정도 직접 묵은지 한식 추천 골짝 마을 마리 서울특별시 중랑구 신내 해성 빌딩 존재 이미지,
