,title_pos,content_pos,hash_tag
0,중랑 구청 신내동 칼칼담 닭볶음탕 맛집 골짝 마을 마리,점심 친구 닭볶음탕 중랑 구청 맛집 골짝 마을 마리 골짝 마을 마리 식당 위치 골짝 마을 마리 서울특별시 중랑구 신내 해성 빌딩 블로그 체크 장소 위치 신내 지하차도 신내 성원 아파트 상가 고요 근처 중랑 구청 오후 방문 사장 직원 손님 테이블 사장 식당 관리 먼지 거기 창가 화초 푸릇푸릇 착석 지인 메뉴 메뉴 가격 요리 전문점 요리 메뉴 찜닭 볶음밥 마리 사이즈 별로 가격 마리 마리 마리 마리 인용 마리 녹두 삼계탕 녹두 반계 차돌박이 겹살 닭볶음탕 마리 주문 주문 한지 사이드 메뉴 반찬 배추김치 김치 시골 할머니 뭔가 시골 맛말 상추 계속 참깨 참기름 범벅 재료 전반 간이 반찬 다시다 미원 인공 조미료 아기 다리 닭볶음탕 닭볶음탕 재생 접기 닭볶음탕 음마 정도 중불 팔팔팔팔 냄새 진동 국물 어머나 채소 질리 국물 역시 인공 조미료 쫄깃 쫄깃 간이 고기 말씀 사실 닭고기 치킨 이유 부위 편견 때문 닭볶음탕 고기 살이 정말 거기 사장 닭다리 어머나 친구 닭다리 깜짝 살이 평생 처음 계륵 전혀 손질 정말 발골 순삭 둘이서 볶음밥 대식 성인 여성 볶음밥 포기 짐작 추가 반찬 셀프 고요 사장 직원 소량 보충 거기 이집 중랑 구청 표창장 농림축산식품부 안심 식당 서울 중랑 구청 닭볶음탕 맛집 식당 가격 구성 가성 최고 닭볶음탕 고요 닭볶음탕 사장 돈쭐나 식당 골짝 마을 마리,
1,신내동 맛집 중랑 구청 맛집 골짝 마을 마리,신내동 맛집 추천 골짝 마을 마리 후기 골짝 마을 마리 서울특별시 중랑구 신내 해성 빌딩 블로그 체크 장소 네이버 기준 운영 월요일 제외 매일 브레이크 타임 주차 가능 중랑구 신내동 중랑 구청 근처 위치 점심 메뉴 건물 지하 주차 출입문 가게 내부 마리 닭볶음탕 가지 메뉴 인기 저녁 반주 저녁 손님 자리 단체 모임 서빙 로봇 포장 주문 외부 공간 계산 메뉴판 닭볶음탕 마리 라면 사리 볶음밥 메뉴 준비 매콤 달달 양념 닭볶음탕 주문 기본 배추 겉절이 양파 장아찌 백김치 상추 겉절이 심플 닭볶음탕 밑반찬 셀프 배추 겉절이 정말 쌀밥 조리 추가 라면 사리 먼저 닭볶음탕 라면 사리 처음 양념 정말 달달 고추장 라볶이 라면 사리 라볶이 느낌 닭고기 정말 라면 리나 칼국수 사리 추가 직접 고추장 닭볶음탕 시중 텁텁 고추장 감칠맛 양념 양념 진득 감자 닭고기 양념 정말 꿀맛 공기밥 볶음밥 텁텁하 소주 기도 엄마 느낌 마음 마지막 가슴 최고 방안 노릇 노릇 진짜 양념 살짝 볶음밥 정말 신내동 맛집 신내동 닭볶음탕 맛집 골짝 마을 마리 방문 신내동 맛집 중랑 구청 맛집 골짝 마을 마리,신내동맛집 중랑구청맛집 골짝마을닭한마리
2,서울 신내동 맛집 골짝 마을 마리 솔직 후기,골짝 마을 마리 브레이크 타임 월요일 정기 휴무 서울 중랑구 신내 해성 빌딩 단체 이용 가능 주차 가능 오늘 간만 근처 로컬 맛집 골짝 마을 마리 닭볶음탕 뭔가 시골 가면 계곡 근처 보기 맛집 냄새 만발 내부 햇빛 촤르르 완전 맛집 맛집 인증 어르신 손님 금방 자리 가득 닭볶음탕 주문 매콤한 주문 추가 사리 여러가지 테이블 국물 마리 밑반찬 밑반찬 진짜 겉절이 백김치 양파 장아찌 김치 엄마 밑반찬 리필 서울 신내동 맛집 골짝 마을 마리 솔직 후기 재생 접기 서울 신내동 맛집 골짝 마을 마리 솔직 후기 손님 금방 닭볶음탕 말씀 보이지 마리 감자 양념 매콤하니 조미료 그게 계속 감자 대박 살코기 생닭 사용 진짜 깃밥 살코기 포슬 감자 국물 요즘 프랜 차이점 자극 질리 살코기 몇번 감탄 밑반찬 물리 후식 사장 솥채 주시 볶음밥 서울 신내동 맛집 골짝 마을 마리 솔직 후기 재생 접기 서울 신내동 맛집 골짝 마을 마리 솔직 후기 볶음밥 누룽지 별미 숟가락 삭삭 사장 부부 가격 골짝 마을 메뉴 예정 신내 맛집 골짝 마을 마리 재생 접기 신내 맛집 골짝 마을 마리 신내동 힐링 골짝 마을 마리 서울특별시 중랑구 신내 해성 빌딩 블로그 체크 장소 중랑 구청 맛집 신내동 맛집 중랑구 닭볶음탕 신내동 닭볶음탕 신내동 찜닭 신내 맛집 중랑구 회식 장소 신내 회식 장소 중랑 점심 추천 서로 이웃 추가 이웃 추가 환영,중랑구청맛집 신내동맛집 중랑구닭볶음탕 신내동닭볶음탕 신내동찜닭 신내맛집 중랑구회식장소 신내회식장소 중랑점심추천 서로이웃추가 이웃추가환영
3,신내동 맛집 닭볶음탕 맛집 골짝 마을 마리,중랑구 신내동 닭볶음탕 맛집 골짝 마을 마리 골짝 마을 마리 요리 전문 신내동 맛집 닭볶음탕 영업 매일 브레이크 타임 월요일 정기 휴무 전화번호 주소 서울 중랑구 신내 해성 빌딩 정보 주차 가능 예약 가능 포장 가능 배달 가능 골짝 마을 마리 서울특별시 중랑구 신내 해성 빌딩 블로그 체크 장소 신내동 맛집 골짝 마을 마리 중랑구 신내동 중랑 구청 근처 위치 신내동 맛집 골짝 마을 마리 주차장 건물 지하 주차 내부 초록 초록 통창 느낌 식당 저녁 손님 신내동 맛집 골짝 마을 마리 요리 전문점 찜닭 닭볶음탕 마리 메뉴 메뉴 사리 메뉴 때문 추가 메뉴 참고 메뉴 포장 가능 조리 미리 예약 오시 신내동 맛집 골짝 마을 마리 국내 생닭 사용 로봇 서빙 닭볶음탕 라면 사리 미리 예약 착석 음식 라면 사리 추가 주문 뚝배기 닭볶음탕 먹음 국물 사리 추가 해도 닭볶음탕 감자 갖은 야채 기본 신내동 맛집 골짝 마을 마리 밑반찬 백김치 상추 겉절이 양파 장아찌 겉절이 밑반찬 사장 손맛 닭볶음탕 라면 사리 면발 매콤한 도리 양념 베엇어 닭볶음탕 국물 육수 요청 쫄깃 쫄깃 닭다리 닭다리 양보 친구 캬캬캬 미리 살이 야들야들 닭볶음탕 국물 어른 살짝 매콤 살코기 먹기 저절로 맥주 한잔 생각 발라 닭고기 밑반찬 상추 겉절이 백김치 국내 생닭 사용 감자 볶음밥 라면 사리 도리 양념 볶음밥 주문 뚝배기 볶음밥 사장 완전 닭볶음탕 양도 저녁 메뉴 골짝 마을 마리 닭볶음탕,
4,중랑 구청 맛집 신내동 동네 주민 추천 맛집 골짝 마을 마리 닭볶음탕,동네 주민 추천 중랑 구청 맛집 골짝 마을 마리 신내동 자리 요리 문집 계단 골짝 마을 입구 골짝 마을 마리 서울특별시 중랑구 신내 해성 빌딩 블로그 체크 장소 골짝 마을 마리 주소 서울시 중랑구 신내 해성 빌딩 영업 화일 브레이크 타임 월요일 휴무 전화 포장 배달 단체 예약 주차 내부 인테리어 탁트인 통창 테이블 공간 단체 모임 위치 봉화산 등산 요리 먹기 메뉴판 찜닭 닭볶음탕 마리 삼계탕 메뉴 차돌박이 겹살 식사 메뉴 김치찌개 불고기 냉면 판매 추가 메뉴 사리 찌개 찜닭 닭볶음탕 마리 추천 사리 테이블 취향 추가 주문 밑반찬 맛집 밑반찬 사장 손맛 밑반찬 백김치 배추김치 직접 김치 완전 할머니 추억 역시 신내동 맛집 주문 닭도리탕 금방 닭도리탕 인분 닭도리탕 비주 양념 때깔 보이 마리 인분 비주 국물 먼저 진짜 닭도리탕 버터 사장 직접 고추장 닭도리탕 양념장 사용 야채 가득 감자 완전 치즈 골짝 마을 서빙 담당 알바 로봇 똑똑이 배달 신내동 맛집 골짝 마을 국내 생닭 사용 퍽퍽 살이 닭고기 도리 양념장 사리 고민 칼국수 사리 한번 사리 도리 닭도리탕 국물 여주면 코스 요리 안주 완성 칼국수 사리 신의 면발 양념 술술 중랑 구청 맛집 이자 신내동 맛집 양념 반찬 신내동 맛집 골짝 마을 마리 동네 주민 추천 동네 맛집 기분 중랑구맛집 중랑 구청 맛집 신내동 맛집 마리 골짝 마을 마리 일상 소통 답방 서이추 서이추 환영,중랑구맛집 중랑구청맛집 신내동맛집 신내닭한마리 골짝마을닭한마리 일상 소통 답방 서이추 서이추환영
5,신내동 중랑 구청 맛집 골짝 마을 마리 닭볶음탕 먹방 후기,신내동 중랑 구청 맛집 골짝 마을 마리 먹방 후기 볶음 탕얼 오늘 신내동 중랑 구청 근처 국물 골짝 마을 마리 먹방 후기 골짝 마을 마리 생닭 사용 고기 정말 매운 정도 사장 추천 주문 오른쪽 셀프 리필 가능 기본 밑반찬 백김치 배추김치 상추 겉절이 로봇 서빙 기계로 도착 반찬 주방 준비 셀프 리필 살얼음 백김치 닭볶음탕 정말 닭볶음탕 닭볶음탕 닭도리탕 골짝 마을 마리 닭볶음탕 이유 국물 국물 계속 숟가락 퍼먹 정말 사장 추천 신라면 쪼금 정도 음식 안이 애기 가족 라면 닭고기 확대 감자 사리 국물 감자 마지막 육수 잔뜩 금은 감자 감자 사리 추가 감자 추가 감자 덕후 라면 추가 먹기 추천 사리 추가 목록 볶음밥 볶음밥 인분 국물 맛집 볶음밥 마무리 아유 닭볶음탕 자체 양도 포기 볶음밥 추가 볶음밥 꼬슬꼬슬하 신내동 중랑 구청 맛집 골짝 마을 마리 메뉴판 골짝 마을 마리 메뉴 포장 가능 모든 메뉴 생닭 사용 신내동 중랑 구청 맛집 골짝 마을 마리 위치 인테리어 골짝 마을 마리 서울특별시 중랑구 신내 해성 빌딩 블로그 체크 장소 골짝 마을 마리 상봉역 호선 버스 타고 이동 거나 망우역 중앙 도보 버스 타고 이동 버스정류장 내부 테이블 단체 손님 중랑 구청 근처 요리 닭볶음탕 닭도리탕 골짝 마을 마리 먹방 후기,
6,중랑 구청 맛집 골짝 마리 닭볶음탕,갱찌 매콤한 닭볶음탕 남편 중랑 구청 근처 닭볶음탕 맛집 중랑 구청 맛집 골짝 마리 소개 골짝 마을 마리 서울특별시 중랑구 신내 해성 빌딩 블로그 체크 장소 골짝 마을 마리 서울시 중랑구 신내 혜성 빌딩 브레이크 타임 월요일 정기 휴무 골짝 마을 외관 처음 지도 보고 혜성 빌딩 엘리베이터 타고 영어학원 다시 건물 옆쪽 메뉴 골짝 마을 간판 엘리베이터 타지 공원 건물 계단 절대 그냥 골짝 마리 입구 삼계탕 찜닭 마리 삼겹살 차돌박이 메뉴 판매 골짝 매장 내부 중랑 구청 맛집 골짝 매장 내부 정감 분위기 아주 맛집 저녁 식사 점심 중랑 구청 직원 저녁 시간대 추천 한쪽 통창 개방 방문 더욱 창문 화분 화분 정감 분위기 골짝 마리 메뉴 소개 골짝 마리 메뉴 메뉴판 구비 벽면 부착 찜닭 닭볶음탕 녹두 삼계탕 녹두 반계 요리 메인 차돌박이 겹살 고기 식사 메뉴 김치찌개 불도 골짝 마을 제공 김치 직접 김치 어쩐지 테이블 수저 사리 메뉴 라면 두부 만두 칼국수 사리 취향 볶음밥 음식 소개 기본 제공 밑반찬 김치 백김치 양파 상추 상추 아주 김치 직접 아주 닭볶음탕 메인 메뉴 닭볶음탕 일반 냄비 대왕 뚝배기 비주 압도 진짜 골짝 마리 닭볶음탕 재생 접기 닭볶음탕 가성 대박 닭볶음탕 감자 감자 갱찌 감자 킬러 복음 매콤 크기 개인 퍽퍽살 별로 닭볶음탕 퍽퍽 부위 퍽퍽 쫄깃 쫄깃 사리 볶음밥 닭볶음탕 볶음밥 한국인 볶음밥 추가 볶음밥 주문 주방 골짝 마을 마리 볶음밥 재생 접기 닭볶음탕 볶음밥 필수 솔솔 국자 복음 진짜 가성 대박 닭볶음탕 볶음밥 갱찌 골짝 마을 마리 신내동 중랑 구청 맛집 골짝 마리 사장 부부 기분 식사 인분 복음 볶음밥 진짜 매콤한 닭볶음탕 중랑 구청 맛집 골짝 마리 추천,
7,중랑 구청 맛집 골짝 마을 마리 녹두 삼계탕 국물,코코 오입 기운 체기 보신 녹두 삼계탕 중랑 구청 맛집 골짝 마을 마리 상봉동 거주 이제야 삼계탕 종종 지금 다행 중랑 구청 맛집 골짝 마을 마리 서울 중랑구 신내 해성 빌딩 망우역 출구 매일 영업 브레이크 월요일 정기 휴무 상봉역 정도 위치 우림 시장 구경 가도 동선 계단 식당 가게 내부 식물 창밖 푸릇 나무 계곡 근처 삼계탕 착각 골짝 마을 마리 국내 생닭 메뉴 포장 배달 민족 주문 마리 찜닭 녹두 삼계탕 주문 반계 주문 마리 밑반찬 동네 주민 식당 는걸 김치 직접 서울 김치 으뜸 상추 겉절이 물김치 배추김치 녹두 삼계탕 점심 냄새 후각 자극 중랑 구청 맛집 골짝 마을 마리 녹두 삼계탕 재생 중랑 구청 맛집 골짝 마을 마리 녹두 삼계탕 한약재 국물 진해 인삼 먹기 간도 소금 녹두 적지 크기 삼계탕 배달 군데 크기 신선도 제일 나은 살이 기지 분리 살이 소화도 배추김치 김치 소금 김치 도착 어머님 단체 식사 이유 도저히 국물 국물 싹싹 중랑 구청 맛집 골짝 마을 마리 마리 김치 겹살 기대 식당 중랑구 보시 중랑구 청과 망우역 맛집 골짝 마을 마리 이제 현지 맛집 녹두 삼계탕 국물 한약재 밑반찬 김치 직접 정성 녹두 삼계탕 린지 클립 린지 하이라이트 린지 중랑 구청 맛집 신내동 삼계탕 중랑구 삼계탕 골짝 마을 마리 골짝 마을 마리 서울특별시 중랑구 신내 해성 빌딩 블로그 체크 장소,클파원챌린지 클립챌린지 하이라이트챌린지 중랑구청맛집 신내동삼계탕 중랑구삼계탕 골짝마을닭한마리
8,중랑 구청 맛집 골짝 마을 마리 복날 역시 삼계탕 신내동 녹두 삼계탕 맛집 추천,역시 이열치열 복날 삼계탕 중랑 구청 맛집 골짝 마을 마리 서울 중랑구 신내 해성 빌딩 위치 메뉴 전체 계곡 맛집 분위기 내부 어르신 느낌 느낌 내부 신식 시스템 에어컨 빵빵 아우 여름 에어컨 빵빵 중랑 구청 맛집 골짝 마을 마리 김치 직접 김치 메뉴 대부분 메뉴 찜닭 닭볶음탕 마리 복날 먹기 삼계탕 반계 반계 삼계탕 차이 삼계탕 가성 보임 서울 삼계탕 가성 요기 추가 메뉴 삼계탕 관련 계곡 맛집 느낌 정겨운 느낌 삼계탕 부모님 모시 느낌 중랑 구청 맛집 골짝 마을 마리 재생 중랑 구청 맛집 골짝 마을 마리 알바생 로봇 로봇 서빙 중랑 구청 맛집 골짝 마을 마리 밑반찬 요것 직접 김치 도리 삼계탕 슴슴 음식 김치 간도 김치 양파 절임 백김치 요건 삼계탕 삼계탕 등장 마리 살이 아주 생각 간이 그냥 크기 어차피 입장 가격 녹두 잔뜩 육수 탄수화물 개맛 도리 국물 간이 간이 아주 도리 뚝배기 내내 유지 껍질 자체 아주 다리 날개 살이 살이 어도 퍽퍽 소금 느낌 아주 방문 요기 반찬 리필 셀프 코너 가격 대비 퀄리티 메뉴 메뉴인 반신반의 가성 신내동 구석 건가 정도 생각 복날 중랑 구청 맛집 골짝 마을 마리 추천 추천 골짝 마을 마리 서울특별시 중랑구 신내 해성 빌딩 블로그 체크 장소 중랑 구청 맛집 신내동 맛집 상봉 맛집 망우 맛집 망우동 맛집 상봉역 맛집 삼계탕 가성 삼계탕 맛집 삼계탕 추천 서이추 서이추 환영 이웃 환영,중랑구청맛집 신내동맛집 상봉맛집 망우맛집 망우동맛집 상봉역맛집 서을삼계탕 가성비삼계탕맛집 삼계탕추천 서이추 서이추환영 이웃환영
9,신내동 맛집 로컬 식당 골짝 마을 마리,미니 중랑구 제대로 로컬 맛집 며칠 중랑구 주민 신내동 맛집 남편 호다닥 로컬 감성 가득 요리 맛집 골짝 마을 마리 주차장 주차장 협소할 저녁 주차장 마감 대요 점심식사 차로 저녁 어차피 마리 닭볶음탕 생각 절로 도보 추천 망우역 중랑 구청 근처 맛집 접근성 건물 외부 골짝 마을 마리 전용 계단 남편 버스 타고 버스 정류장 데이트 감성 제대로 충전 입장 내부 세월 흔적 살짝 사이드 올드 느낌 별로 초록 초록 식물 보이 바깥 풍경 구경 재미 메뉴 특성 단체 내부 중간 앞치마 출근 칠칠이 백퍼 메뉴판 대표 메뉴 찜닭 닭볶음탕 야채 마리 칼국수 사리 메뉴 닭볶음탕 최애 닭볶음탕 마리 공기밥 콜라 주문 밑반찬 닭볶음탕 등장 조리 때문 뚝배기 신내동 로컬 맛집 골짝 마을 마리 닭볶음탕 재생 접기 신내동 로컬 맛집 골짝 마을 마리 닭볶음탕 비주 닭볶음탕 사장 직접 음식 해주시 국물 스타일 국물 쪼아 남편 허버허버 입천장 데이 참사 사리 감자 마리 매콤 양념 닭볶음탕 매운 편이 어르신 입맛 느낌 텁텁하 퍽살 러버 퍽살 거덜 내기 시전 국내 퍽살 남편 다리 날개 양보 인젤 와이프 마리 둘이서 먹기 정말 국물 살짝 적신 숟가락 닭고기 야채 허버허버 닭볶음탕 치트키 포근포근 감자 국물 먹어쥬기 국물 퍼먹어 부담 쫀득하 밀떡 사리 남녀 노소 호불호 메뉴 닭볶음탕 접시 닭고기 발라 무한 흡입 매콤 콧물 파티 숟가락 현장 닭볶음탕 국물 칼국수 사리 추가 정말 후기 국물 걸쭉 텁텁 칼국수 사리 칼국수 재질 둘이서 공기 마리 순삭 동네 요리 맛집 닭볶음탕 마리 이제 전통 요리 맛집 골짝 마을 마리 추천 골짝 마을 마리 서울특별시 중랑구 신내 해성 빌딩 블로그 체크 장소 망우역 출구 매일 월요일 휴무 브레이크 타임 제로 페이 가능 포장 배달 예약 단체 가능 주차 건물 주차장 보유 주차장 마감,
10,중랑 신내동 맛집 골짝 마을 마리 삼계탕 백숙,골짝 마을 마리 중랑 구청 맛집 중랑 백숙 삼계탕 신내동 맛집 리얼 팩트 삼계탕 월요일 정기 휴무 초복 중복 말복 영업 매장 문의 화일 영업 브레이크 타임 주차 가능 중랑 신내동 맛집 골짝 마을 마리 외부 단독 계단 지하 주차장 무료 주차장 저녁 참고 골짝 마을 마리 서울특별시 중랑구 신내 해성 빌딩 블로그 체크 장소 여름 여름 이벤트 초복 중복 말복 보신 데이 보신 초복 보신 메뉴 무조건 삼계탕 평일 저녁 손님 삼계탕 닭볶음탕 맛집 가보 신내동 백숙 삼계탕 맛집 골짝 마을 마리 메뉴 찜닭 닭볶음탕 녹두 삼계탕 요리 전문점 국내 생닭 사용 서빙 로봇 사장 진짜진짜 여자 사장 요리 음식 개선 피드백 달라 감동 바다 요식업 피드백 겸허 진짜 마리 완전 보신 제대로 삼계탕 살이 그냥 젓가락 대면 발라 수준 녹두 삼계탕 국물 맑은 국물 삼계탕 진짜 전날 회사 단체 삼계탕 쩡히 정말 신내동 사람 삼계탕 음식 기회비용 그냥 삼계탕 녹두 삼계탕 알알이 녹두 이나고 먹기 위해 녹두 삼계탕 단점 보신 삼계탕 남친 한참 삼계탕 분리 그냥 천사 정리 먼저 감동 삼계탕 감동 골짝 마을 마리 닭고기 최고 고급 지게 영양가 음식 도리 김치 마늘 매콤 그게 삼계탕 김치 삼계탕 완뚝 중랑 구청 근처 참고 바람 중랑 신내동 맛집 골짝 마을 마리 삼계탕 백숙 재생 중랑 신내동 맛집 골짝 마을 마리 삼계탕 백숙 중랑 구청 맛집 신내동 맛집 중랑구 삼계탕 중랑구 백숙,중랑구청맛집 신내동맛집 중랑구삼계탕 중랑구백숙
11,신내동 요리 전문점 골짝 마을 마리,신내동 마리 요리 맛집 골짝 마을 마리 사진 뚝딱 신내동 맛집 중랑구 청사 거리 맛집 골짝 마을 마리 신내동 마리 신내동 닭집 신내동 요리 전문점 골짝 마을 마리 닭볶음탕 직접 맛집 대한 후기 공유 푸드 블로거 뚝딱 오늘 소개 드릴 신내동 중랑 구청 사거리 위치 골짝 마을 마리 닭볶음탕 찜닭 마리 판매 요리 전문점 요리 삼겹살 육류 판매 가족 주로 닭볶음탕 마리 먹기 위해 방문 위치 주차 주소 서울시 중랑구 신내 해성 빌딩 영업 연락처 별도 주차 시설 자차 이용 경우 경춘선 굴다리 주변 위치 공용 주차장 이용 가게 공용 주차장 도보 거리 처음 방문 위치 파악 방문 위치 두시 골짝 마을 마리 골짝 마을 마리 신내동 토박이 라면 정도 노포 체인점 비교 내부 세월 흔적 기도 노포 특유 정감 분위기 불편 요소 내부 마리 전문점 소용 인용 테이블 단체 정도 이용 컨디션 중앙 가스레인지 식사 주문 음식 테이블 후드 살짝 고개 겹살 차돌박이 연기 메뉴 메인 메뉴 찜닭 닭볶음탕 마리 야채 고요 가금류 차돌박이 겹살 닭볶음탕 마리 마리 주문 보통 선택 조절 보통 신라면 매운 수준 먹기 보통 아래 단계 주문 기본 반찬 김치 백김치 상추 양파 절임 그냥 가짓수 용도 엄지 정도 김치 국산 재료 직접 보시 정도 생각 셀프 백김치 리필 주문 음식 도착 사이즈 조리 때문 조리 음식 테이블 도착 국물 닭고기 감자 살짝 간도 사리 추가 살짝 추가 고기 칼국수 사리 인분 추가 면도 신내동 요리 맛집 골짝 마을 마리 호불호 정도 점포 부부 이서 음식 서빙 항상 기분 식사 고기 전반 양도 서빙 사장 기분 식사 오늘 푸드 블로거 뚝딱 블로그 후기 정보 골짝 마을 마리 서울특별시 중랑구 신내 해성 빌딩 블로그 체크 장소,신내동맛집 중랑구청사거리맛집 골짝마을닭한마리 신내동닭한마리 신내동닭집
12,중랑구 신내동 맛집 골짝 마을 마리 닭볶음탕,주말 내내 음식 신내동 요리 맛집 골짝 마을 마리 국물 매콤 흰밥 아주 닭볶음탕 리뷰 시작 골짝 마을 마리 서울 중랑구 신내 해성 빌딩 화일 휴무 브레이크 타임 주차 배달 포장 가능 단체 이용 가능 신내동 닭볶음탕 맛집 골짝 마을 마리 중랑 구청 사거리 신내 지하차도 방향 길가 위치 해성 빌딩 건물 바깥 계단 슬슬 건물 지하 주차장 주차 내부 공간 생각 단체 모임 크기 맛집 포스 국내 생닭 사용 직접 김치 요리 전문 골짝 마을 마리 찜닭 닭볶음탕 마리 삼계탕 메뉴 준비 요리 점심 식사 메뉴 김치찌개 불고기 냉면 근처 중랑 구청 직원 점심시간 자주 방문 맛집 닭볶음탕 깃밥 소주 음료수 주문 주문 밑반찬 상추 백김치 배추김치 양파 절임 상추 백김치 반찬 셀프 코너 리필 소주 주방 닭볶음탕 등장 빛깔 냄새 도리 행복 남편 감자 가슴 살로 접시 가슴 국물 주문 조리 양념 매콤 국물 국물 양념 쫄깃 밀떡 밀떡 파라 취향 저격 사리 추가 이따 볶음밥 감자 국물 쫄깃 닭고기 백김치 쌈무 닭볶음탕 볶음밥 칼국수 사리 라면 사리 감자 사리 만두 사리 추가 깃밥 볶음밥 추가 양념 볶음밥 같았쟈 볶음밥 추가 주문 냄비 주방 가루 부추 꿀맛 볶음밥 국자 퍼묵퍼묵함 볶음밥 밑반찬 완밥 매콤한 감기 신내동 맛집 골짝 마을 마리 닭볶음탕 동네 맛집 보장 담번 보신 삼계탕 가기 골짝 마을 마리 서울특별시 중랑구 신내 해성 빌딩 블로그 체크 장소,
13,신내동 맛집 닭볶음탕 정석 골짝 마을 마리,닭도리탕 주변 신내동 맛집 이름 상치 정감 발견 방문 신내동 맛집 골짝 마을 마리 계곡 골짜기 비주 신내동 도심 한가운데 위로 골목 맛집 외관 테이블 의자 뭔가 반전 미가 창문 분위기 창가 메뉴 완전 요리 전문점 닭도리탕 닭볶음탕 마리 중간 정도 매운 주문 뭔가 추가 메뉴 사리 보고 라면 사리 추가 기본 반찬 세팅 먹기 구성 이중 샐러드 완전 도둑 순식간 추가 반찬 셀프 양파 직접 샐러드 거저 닭볶음탕 마리 도착 먼저 예약 도착 동시 국물 신내동 맛집 닭볶음탕 정석 골짝 마을 마리 재생 신내동 맛집 닭볶음탕 정석 골짝 마을 마리 라면 사리 추가 거저 국물 핬는데 라면 사리 금방 잔뜩퍼 다리 사리 생각 국물 진국 감자 진짜 진짜 순식간 칼국수 볶음밥 계속 진짜 거저 추가 진짜 닭볶음탕 기본 메인 메뉴 주문 국물 점점 욕심 이나 고민 골짝 마을 마리 서울특별시 중랑구 신내 해성 빌딩 블로그 체크 장소 신내동 맛집 닭볶음탕 정석 골짝 마을 마리 중랑구 신내 중랑 구청 근방 영업 월요일 정기 휴무 오전 브레이크 타임 오후 닭도리탕 방문 그냥 정도 국물 달라 완전 진짜 인생 닭도리탕 기분 중랑 구청 맛집 신내동 맛집 망우역 닭도리탕 닭도리탕 중랑구 닭볶음탕,중랑구청맛집 신내동맛집 망우역닭도리탕 신내닭도리탕 중랑구닭볶음탕
