,title_pos,content_pos,hash_tag
86,오목교역 목동 봉골 레나 닭목 간장 구이 오목교역 술집 목교 데이트 목교 별장,오늘 오목교역 완전 분위기 인테리어 음식 지금 소개 목교 별장 외부 목교 별장 오목교역 출구 위치 바깥 메뉴판 메뉴 구경 목교 별장 내부 목교 별장 내부 분위기 인석 단체 준비 형태 분리 공간 친구 끼리 오거 목교 데이트 네이버 리뷰 이벤트 진행 어요 목교 별장 단골 혜택 직원 얼굴 고객 은밀 단골 카드 이벤트 이벤트 예약 요런 디테 일이 기분 목교 별장 혼술 고객 전용 인분 메뉴 목교 혼술 목교 별장 스페셔 주류 사케 오크 소주 준비 테이블 뽑기 제공 폴라로이드 사진 이벤트 준비 목교 술집 목교 별장 메뉴 목교 별장 메뉴 거제 바다 봉골 레나 카라 나베 맑은 치킨 나베 목교 별장 에그인헬 새우 관자 부채살 스테이크 닭목 간장 구이 먹물 아란치니 마레 란차 일품 파전 목교 별장 바스 스파이 치킨 별장 튀김 플래터 샐러드 수제 오븐 파스타 크림 토마토 파스타 베이컨 치즈 카츠 별장 땅콩 홍합 스튜 별장 칠리 오일 만두 별장 소세지 감자 튀김 아이스 포도 샤베트 바닐라 아이스크림 초코 아이스크림 슈가 토마토 아이스 홍시 나베 메뉴 파스타 스테이크 닭고기 요리 준비 하이 맥주 소주 사케 판매 기본 안주 참깨 크래커 달달 무려 리필 계속 먼저 완전 섬세 카스 카스 주문 맥주 가장 무려 목교 술집 말씀 거제 바다 봉골 레나 닭목 간장 구이 나머지 메뉴 주문 맥주 거제 바다 봉골 레나 거제도 조개류 국물 파스타 기본 팽이버섯 느타리버섯 청경채 감태 새우 백합 조개 홍합 가리비 재료 봉골레 컨셉 나베 파스타 베가 팔팔 불지 나베 육수 찰떡 쫀득하 면도 국물 청경채 버섯 야채 당일 아침 사용 가리비 홍합 백합 조개 왕창 홍합 정말 국물 정말 껍질 조개 진짜 최고 감칠맛 육수 가득 머금 감칠맛 나베 육수 당일 아침 직접 진짜 완전 진짜 완전 중독 닭목 간장 구이 특제 간장 소스 닭목 조려 요리 여요 대파 버섯 마늘 양배추 락교 대파 버섯 마늘 양배추 간장 양념 닭목 상큼 먹기 닭목 살이 가득 특제 간장 소스 왕창 간장 소스 냄새 정말 최고 중간 중간 락교 완전 상큼 아악 완전 모양 그대로 닭목 완전 쫄깃 쫄깃 극치 여요 양배추 식감 대파 완전 달달 대파 짭쪼름 닭목 조합 진짜 맥주 마늘 달달 목교 별장 정보 목교 별장 영업 월요일 토요일 일요일 정기 휴무 목교 별장 오목교맛집 오목교술집 목동술집 목동 요리 주점 사진 동영상 팔로워 팔로잉 게시 목교 별장 오목교맛집 오목교술집 목동술집 목동 요리 주점 사진 동영상 보기 목교 별장 인스타그램 목교 별장 서울특별시 양천구 목로 목교 별장 예약 블로그 체크 장소 목교 술집 오목교역 술집 목교 맛집 오목교역 맛집 오목교역 데이트 목교 데이트 오목교역 혼술 목교 혼술 목동 맛집 목동 혼술 목동 술집 완전 강추,
87,오목교술집 추천 목교 별장,아이폰 빛번짐 목교 별장 오목교역 근처 몇번 장소 결정 위치 영업 일요일 휴무 일요일 원래 일요일 제일 예약 웰컴 메모 테이블 보고 입장 기분 테이블 개정 나름 프라이 공간 몇개 혼술 찌석 혼술러들 공간 마련 있다닝 한번 도전 수제 요리 주점 목교 별장 원칙 손님 생각 사장 마음 당일 육수 요리 재료 제공 불만족 식자 재는 폐기 고객 피드백 목교 별장 나베 거제 도산 봉골레 나베 매콤 카라 나베 맑은 치킨 나베 매콤 새우 관자 목교 별장 부채살 스테이크 닭목 간장 구이 별장 튀김 레터 목교 별장 바스 마레 란차 일품 파전 스파이 치킨 메뉴 출시 준비 메뉴 메인 사이드 주문 주문 메인 메뉴 단골 이벤트 진행 단골 주류 소주 맥주 하이 사케 종류 인테리어 소개 자꾸 간다 기본 스낵 목교 별장 새우 관자 주문 음식 주문 조리 특재 소스 관자 새우 야채 요리 음식 관자 새우 가지 양배추 샐러드 한잔 잔해 추가 주문 치즈 오븐 파스타 치즈 소주 파스타 화장실 위층 직원 안주 성공 친구 추억 목교 별장 서울특별시 양천구 목로 목교 별장 예약 블로그 체크 장소 오목교역술집 오목교술집 오목교회식 오목교역맛집 오목교맛집 조용한술집,오목교역술집 오목교술집 오목교회식 오목교역맛집 오목교맛집 조용한술집
88,목동맛집 수제 퓨전 양식 목교 별장 추천,목동맛집 수제 퓨전 양식 목교 별장 추천 목교 별장 서울특별시 양천구 목로 목교 별장 예약 블로그 체크 장소 오목교맛집 오목교술집 오목교역맛집 오목교역술집 목동맛집 목동술집 목교 목교 데이트 양천구 맛집 양천구 술집 리뷰 퓨전 양식 가득 오목교역 맛집 목교 별장 비주 가성 모든 정말 먼저 부채살 스테이크 고기 매쉬 포테이토 스테이크 조화 포테이토 완전 최고 일품 파전 완전 바삭 닭고기 쫄깃 일품 바삭 쫄깃 식감 노릇 전의 간도 겉절이 진짜 존맛 목교 별장 한정 수량 판매 스페셜 메뉴 별장 연어 그라브락스 비주 연어 빛깔 비트 숙성 때문 두툼 연어 연어 자체 숙성 숙성 살살 와인 정말 연어 그라브락스 수제 안주 퀄리티 메뉴 예정 술자리,오목교맛집 오목교술집 오목교역맛집 오목교역술집 목동맛집 목동술집 오목교핫플 오목교데이트 양천구맛집 양천구술집
89,분위기 안주 퓨전 양식 주점 오목교술집 목교 별장,목교 별장 서울 양천구 목로 화일 월요일 휴무 금요일 오늘 퇴근 목교 퓨전 양식 주점 목교 별장 오목교역 출구 도보 버스정류장 접근성 간과 간판 찾기 판이 건물 입구 식당 내부 블랙 인테리어 오목교술집 정말 모던 느낌 술집 간만 중앙 다인 블랙 테이블 창가 찌석 술병 분위기 찌석 반대편 프라이 커튼 가려진 좌석 데이트 모임 방문 프라이 좌석 예약 찌석 미리 예약 방문 창가 분위기 의자 예약 방문 인원 웰컴 메시지 팻말 에그인헬 일품 파전 기린 생맥주 메뉴판 퓨전 양식 주점 치킨 베이컨 카츠 아란치니 퓨전 요리 목교 별장 대표 메뉴 고민 에그인헬 주문 요리 품닭 파전 추가 메뉴판 마지막 단골 혜택 직원 얼굴 고객 은밀 단골 카드 단골 손님 센스 메뉴판 뒷쪽 주류 전통주 사케 와인 생맥주 소주 하이 퓨전 요리 준비 퇴근 생맥주 떙겨 기린 생맥주 주문 안주 생맥주 등장 양도 정말 요즘 날씨 진짜 극락 기본 안주 맥주 조합 맥주 감탄 에그인헬 에그인헬 소시지 먹기 본격 먹기 시작 소시지 치즈 달짝 매콤한 토마토소스 바케트 소스 매콤 물리 마지막 요리 일품 파전 조치원 유행 메뉴 목교 별장 스타일 각색 재창 파전 바삭 살코기 간장 파전 간장 살짝 미가 그냥 간장 짭쪼롬하 퓨전 요리 맥주 순삭 카운터 센스 후식 찾기 세심 감동 까치 목교 별장 분위기 모임 데이트 오목교술집 수제 퓨전 양식 요리 선호 직원 목교 근처 안주 분위기 술집 추천 리뷰 목교 별장 서울특별시 양천구 목로 목교 별장 예약 블로그 체크 장소,
90,목교 치킨 베가 목교 별장,오늘 나베 맛집 목교 별장 방문 맑은 치킨 베가 목교 별장 솔직 리뷰 시작 목교 별장 서울 양천구 목로 영업 매일 오후 새벽 정기 휴무 월요일 접근성 오목교역 출구 도보 주차장 목교 별장 서울특별시 양천구 목로 목교 별장 예약 블로그 체크 장소 목교 별장 메뉴 주문 메뉴 맑은 치킨 나베 우동 추가 브램블 베리 헤이리 네이블 목교 별장 오목교역 출구 정말 접근성 위치 내부 분위기 한번 느낌 분위기 실내 정말 구분 약속 미리 예약 방문 테이블 목교 사람 구경 메뉴 전시 술병 이용 조명도 뭔가 느낌 별장 인테리어 조명도 메뉴 고민 기본 안주 과자 먼저 주문 하이 브램블 베리 헤이리 네이블 처음 하이 한번 주문 짜쟌 메인 메뉴인 맑은 치킨 나베 치킨 그대로 전골 뭔가 봉골레 나베 육수 고민 주문 맑은 치킨 국물 진국 닭개장 느낌 마리 느낌 맑은 육수 입맛 전골 목이버섯 팽이버섯 표고버섯 감자 내용물 알캉 알캉 버섯 감자 도리 닭고기 버섯 육수 최고 술안주 달달 하이 술술 치킨 나베 선택 필수 우동 추가 추가 국물 자체 거기 우동 이면 수가 쫄깃 국물 봉골레 나베 카라 나베 우동 추가 완전 추천 투하 드가쟈 건더기 정도 전골 우동 술집 안주 그냥 식사 요요 개인 접시 그냥 국물 목교 나베 맛집 목교 별장 방문,
91,목교 비주 조화 수제 퓨전 양식 목교 별장 추천,목교 비주 조화 수제 퓨전 양식 목교 별장 추천 오목교맛집 오목교술집 오목교역맛집 오목교역술집 목동맛집 목동술집 목교 목교 데이트 양천구 맛집 양천구 술집 소개 드릴 목교 별장 진짜 비주 퀄리티 수제 퓨전 양식 요리 술안주 최고 목교 별장 서울특별시 양천구 목로 목교 별장 예약 블로그 체크 장소 목교 별장 메뉴판 소개 정말 퓨전 요리 처음 메뉴 조합 이색 퓨전 메뉴 먹음 정말 그릇 최고 바삭 비주 파전 일품 파전 파전 닭고기 퓨전 파전 처음 닭고기 파전 조화 세상 바삭 쫄깃 완전 이건 별장 연어 그라브락스 이색 메뉴 연어 식감 예술 비트 연어 숙성 감칠맛 쫄깃 오일 소스 새우 게임 목교 별장 바스 완전 도리 정말 비주 최고,오목교맛집 오목교술집 오목교역맛집 오목교역술집 목동맛집 목동술집 오목교핫플 오목교데이트 양천구맛집 양천구술집
92,오목교술집 추천 목교 별장 치킨 하이 후기,특색 요리 주점 목교 별장 오목교역 출구 거리 출구 곱창 건물 목교 별장 서울특별시 양천구 목로 목교 별장 예약 블로그 체크 장소 목교 술집 목교 별장 영업 월요일 휴무 화일 요일 오후 라스트 이용 전화번호 네이버 레이스 목교 별장 네이버 방문자 리뷰 블로그 리뷰 입구 메뉴판 목교 별장 입구 화장실 예약 예약 표시 기분 조명 맛집 목교 별장 내부 사진 인테리어 소품 조명 강아지 인형 오픈 주방 요리 모습 형식 오목교회식 목교 모임 소로 추천 테이블 창밖 하이 직원 겉옷 거도 직접 기본 안주 모형 이름 가격 전시 추억 뽑기 판도 마지막 규어 친구 달라 폴라로이드 사진 인화 오목교술집 목교 별장 메뉴판 목교 별장 철칙 모든 나베 육수 당일 아침 직접 육수 음식 모든 소스 직접 제공 계절 자재 사용 계절 재료 상이 야채 당일 아침 사용 나베 국물 메뉴 선별 종류 사케 와인 종류 준비 맑은 치킨 정육 팽이버섯 목이버섯 대파 양파 표고버섯 감자 청양고추 당일 육수 브렘블 베리 피치 트리 주문 브렘블 베리 봄베이 브램블 토닉 워터 피치 트리 복숭아 기본 하이 맑은 치킨 정육 팽이버섯 목이버섯 대파 양파 표고버섯 감자 청양고추 당일 육수 설명 종류 야채 닭고기 당일 육수 사용 육수 목교 분위기 술집 추천 목교 별장 맑은 치킨 정육 팽이버섯 목이버섯 대파 양파 표고버섯 감자 청양고추 당일 육수 브렘블 베리 피치 트리 야채 닭고기 오목교술집 목교 별장 하이 후기 재생 접기 오목교술집 목교 별장 하이 후기 하이 주문 화요 하이 화요 토닉 워터 보드카 선라이즈 보드카 오렌지 목교 맛집 목교 별장 하이 도수 배합 계속 전골 정육 팽이버섯 목이버섯 대파 양파 표고버섯 감자 청양고추 당일 육수 우동 사리 추가 육수 우동 주문 느낌 전골 하이 오목교술집 추천 목교 별장 스타 그램 오목교술집 데이트 맛집 분위기 서울 술집,술스타그램 오목교술집 데이트맛집 분위기좋은 서울술집
93,목교 분위기 술집 퓨전 양식 요리 주점 목교 별장,광복절 휴일 전날 용산 막창 근처 여행 운동 떄문 오늘 소개 목교 분위기 술집 목교 별장 분위기 데이트 대부분 커플 방문 퓨전 양식 요리 주점 목교 별장 서울시 양천구 목로 오목교역 출구 월요일 정기 휴무 네이버 예약 가능 주차 불가 근처 공영 주차장 이용 오목교역 출구 왼쪽 도보 위치 자주 때문 찾기 건물 배너 판이 건물 계단 목교 별장 화장실 건물 화장실 목교 별장 전용 화장실 관리 마지막 사탕 내부 내부 두운 검정 브라운 통일 인테리어 느낌 느낌 가득 창가 좌석 마련 술병 인테리어 사진 찍기 좌석 커플 끼리 꽁냥꽁 데이트 좌석 창가 창밖 혼술 요리 주방 석도 마련 룸공간 마련 방문 룸공간 만석 네이버 예약 공간 예약 예약 방문 프라이 퓨전 양식 대화 장고 전통주 와인 사케 여러가지 주류 메뉴 목교 분위기 술집 목교 별장 퓨전 양식 요리 주점 봉골 레나 에그인헬 우관 먹물 아란치니 종류 안주 마련 메뉴 구경 지니 선택 장애 메뉴 정말 파스타 샐러드 와인 정말 가성 차로 소주 주문 메뉴 에그인헬 베이컨 치즈 카츠 진로 토닉 워터 기본 안주 과자 토닉 워터 얼음 바스켓 에그인헬 에그인헬 과자 제공 목교 분위기 술집 목교 별장 재생 접기 목교 분위기 술집 목교 별장 소시지 사장 물티슈 계속 최근 방문 음식점 가장 소스 달달 매콤한 토마토소스 입맛 치즈 살짝 수향 멕시칸 매콤 치즈 미가 요리 오른쪽 움짤 계란 베이컨 치즈 카츠 뭔가 요리 느낌 남아 베이컨 치즈 카츠 바삭 튀김 안쪽 베이컨 치즈 먹기 크기 치즈 가위 바베큐 소스 여느 돈가스 저리 지니 계속 요리 지니 음식 자고 절제 목교 분위기 술집 목교 별장 방문 사장 정말 정말 기분 기분 분위기 두운 분위기 뭔가 손님 데이트 창가 좌석 혼술 기도 여러가지 메뉴 퓨전 양식 요리 주점 이기 때문 입맛 취향 주문 목교 별장 서울특별시 양천구 목로 목교 별장 예약 블로그 체크 장소,
94,보도자료 골목 별난 장터 신정 별장 오픈 강서 양천 신문 신정 생활 상권,컬트 랜드 선도 신정 생활 상권 지역 사회 신정 생활 상권 보도자료 골목 별난 장터 신정 별장 오픈 강서 양천 신문 오후 체험 프로그램 마련 신정 생활 상권 추진 위원회 위원장 오후 신정 위치 신세계 어린이 공원 신정 별장 개최 신정 별장 신정 주택가 소상 공인 가게 목교 중앙시장 상인 주민 플리 마켓 플리 마켓 액세서리 카네이션 핸드 메이드 과자 원두 커피 음료 동네 소상 공인 가게 품질 물품 평상시 구매 커피 방향 만들기 이북 인절미 만들기 두더지 잡기 게임 가족 친구 참여 체험 프로그램 생활 상권 퀴즈 풀기 인증샷 리기 이벤트 마련 신정 별장 플리 마켓 이용 주민 현장 사용 상당 할인 쿠폰 제공 부스 물건 구매 거나 구매 주민 상품 준비 체험 프로그램 신정 생활 상권 사전 신청 진행 송정 기사 원문 보기 강서 양천 신문 골목 별난 장터 신정 별장 오픈 북부 뉴스 신정 생활 상권 추진 위원회 위원장 오후 신정 위치 신세계 어린이 공원 신정 별장 개최 신정 생활 상권 추진 위원회 생활 상권 골목 경제 불어 넣기 위해 소상 공인 주민 신정 생활 상권 밴드 신정 생활 상권 추진 위원회 주소 서울시 양천구 목동동로 성지 빌딩 전화 팩스,
95,오목교역 술집 이색 수제 퓨전 양식 목교 별장 추천,오목교역 술집 이색 수제 퓨전 양식 목교 별장 추천 목교 별장 서울특별시 양천구 목로 목교 별장 예약 블로그 체크 장소 오목교맛집 오목교술집 오목교역맛집 오목교역술집 목동맛집 목동술집 목교 목교 데이트 양천구 맛집 양천구 술집 오목교역 근처 술집 목교 별장 수제 퓨전 양식 전문 메뉴 정말 처음 메뉴 이색 요리 퓨전 음식 먹음 메뉴판 소개 보고 무리 대신 기약 먼저 술집 종류 상술 전통주 안주 주문 정말 잔뜩 기분 취취 퓨전 메뉴인 일품 파전 평소 파전 완전 업그레이드 느낌 파전 닭고기 추가 아이디어 덕분 바삭 파전 쫄깃 식감 스칸디나비아 요리 별장 연어 그라브락스 완전 이색 연어 빛깔 기존 연어 비트 숙성 연어 래서 연어 자체 감칠맛 미가 정말 완전 감탄 진짜 기억 정도 제대로,오목교맛집 오목교술집 오목교역맛집 오목교역술집 목동맛집 목동술집 오목교핫플 오목교데이트 양천구맛집 양천구술집
96,오목교역맛집 퀄리티 퓨전 양식 안주 목교 별장 추천,오목교역맛집 퀄리티 퓨전 양식 안주 목교 별장 추천 오목교역 근처 술집 제일 퀄리티 목교 별장 소개 수제 퓨전 양식 안주 맛집 진짜 모든 메뉴 퀄리티 목교 별장 서울특별시 양천구 목로 목교 별장 예약 블로그 체크 장소 위치 술병 진열 메뉴판 인테리어 정말 와인 판매 먹음 퓨전 메뉴 욕심 잔뜩 주문 저녁 저녁 안주 방문 추천 안주 존맛 도리 부채살 스테이크 수제 소스 진짜 도리 육즙 가득 부채살 거기 매쉬 포테이토 고기랑 이건 별장 연어 그라브락스 스페셜 메뉴 연어 빛깔 이유 비트 저온 숙성 때문 숙성 연어 감칠맛 미가 정말 개꿀맛 올리브 오일 소스 미가 목교 별장 바스 진짜 도리 모든 안주 와인 한잔,
97,목교 데이트 분위기 수제 퓨전 양식 목교 별장,목교 데이트 분위기 수제 퓨전 양식 목교 별장 며칠 오빠 목교 데이트 정말 술집 발견 후기 방문 내부 분위기 정말 정말 연어 목교 별장 연어 더욱 비주 연어 비트 저온 숙성 먹음 빛깔 비주 목교 별장 서울특별시 양천구 목로 목교 별장 예약 블로그 체크 장소 스칸디나비아 요리 연어 그라브락스 처음 연어 감칠맛 연어 식감 살살 이건 오빠 정말 퓨전 메뉴인 일품 파전 이름 그대로 식감 정말 일품 쫄깃 닭고기 바삭 파전 더욱 식감 매콤 카라 국물 안주 완전 내용물 매콤 고기 듬뿍 국물 목교 별장 바스 완전 존맛 마늘 듬뿍 오일 소스 정말 감칠맛 최고 오빠 완전 데이트 맛집 강력 추천,
98,목교 분위기 술집 데이트 혼술 목교 별장,남자친구 오목교역 근처 데이트 평소 자주 데이트 분위기 분위기 술집 방문 목교 별장 목교 별장 서울특별시 양천구 목로 목교 별장 예약 블로그 체크 장소 서울 양천구 목로 목교 별장 운영 월요일 휴무 술집 저녁 새벽 운영 통창 찌석 안내 내부 생각 테이블 석도 프라이 식사 천막 공간 분리 테이블 분위기 모임 가지 선호 요즘 갈수록 인간 술집 친구 술집 선호 위치 초록 초록 방문 분위기 데이트 목적 사람 혼술 오신 분위기 기분 오기 목교 별장 메뉴 목교 별장 수제 퓨전 다이닝 맛집 메뉴 종류 대표 메뉴 봉골 레나 에그인헬 봉골레 나베 부채살 스테이크 주문 주문 안주 쿠키 메뉴 양식 위주 하드 하이 생각 하이 종류 요즘 사람 취할때 하이 분위기 요즘 트렌드 반영 술집 종류 봉골레 베가 먼저 봉골레 재료 자리 조리 방식 금방 버너 해산물 비주 정말 스테이크 스테이크 요리 달달 소스 베이스 감자 샐러드 최고 봉골레 국물 정말 대표 메뉴 목교 별장 방문 봉골레 우동 사리 추가 나베 면도 추가 존맛 스테이크 고기 안질 기고 버섯 진짜 야채 인간 야채 버섯 고기 술집 안주 식사 가게 별도 관리 화장실 화장실 술집 화장실 완전 아시 화장실 무조건 상가 가게 화장실 편이 크게 기대 만족 목교 별장 재생 접기 목교 별장 분위기 술집 데이트 오목교역 근처 술집 목교 별장 추천 목교 데이트 목교 프라이 빗룸 목교 조용한술집,오목교 오목교 오목교
99,오목교맛집 안주 성비 목교 별장,오목교맛집 안주 성비 목교 별장 오늘 드릴 목교 별장 퓨전 안주 성비 가격 진짜 완전 최고 퓨전 양식 안주 맛집 정말 메뉴 안주 모든 아주 찰떡 목교 별장 바스 파스타 추가 미가 굿굿 매콤 카라 국물 진짜 도리 건더기 성비 술술 이건 일품 파전 보통 파전 퓨전 메뉴 파전 닭고기 먹기 의문 쫄깃 식감 목교 별장 스페셜 메뉴 별장 연어 그라브락스 이건 연어 비트 저온 숙성 비주 완전 빛깔 연어 윤기 자르르 두툼 연어 사르르 가격 퀄리티 메뉴 진짜 성비 대박 덕분 마음껏 잔뜩 안주 성비 맛집 목교 별장 추천 목교 별장 서울특별시 양천구 목로 목교 별장 예약 블로그 체크 장소,
100,양천구 술집 수제 음식 퀄리티 넘사벽 퓨전 양식 목교 별장,양천구 술집 수제 음식 퀄리티 넘사벽 퓨전 양식 목교 별장 며칠 친구 추천 퓨전 양식 요리 주점 목교 별장 건물 위치 목교 별장 분위기 술집 좌석 술자리 테이블 가득 안주 진짜 안주 비주 정말 예술 비주 비주 정말 최고 이건 연어 그라브락스 직접 비트 연어 숙성 연어 살살 연어 감칠맛 예술 자체 부채살 스테이크 부채살 쫄깃 식감 수제 스테이크 소스 매쉬 포테이토 부채살 아주 일품 파전 파전 닭고기 퓨전 메뉴 조합 반신반의 직접 퓨전 생각 완전 쫄깃 바삭 올리브 소스 바스 파스타 추가 완전 신의 한수 모든 수제 정말 정말 자주 방문 목교 별장 서울특별시 양천구 목로 목교 별장 예약 블로그 체크 장소,
