,title_pos,content_pos,hash_tag
0,서울 양천 목교 현대 백화점 맛집 데이트 코스 추천 목교 곱창 목동 본점,목교 현대 백화점 맛집 데이트 코스 추천 목교 곱창 목동 본점 영업 평일 라스트 라스트 단체 네이버 예약 가능 목교 곱창 목동 본점 네이버 방문자 리뷰 블로그 리뷰 오목교역 현대 백화점 맛집 골목 거리 목교 곱창 목동 본점 방문 웨이팅 맛집 웨이 석도 마련 이전 주말 웨이팅 곱창 인테리어 실제 커플 와인 곱창 진짜 요즘 곱창 달라 곱창 와인 한잔 데이트 가요 대신 좌석 널널 섹션 살짝 분리 데이트 단체 회식 국내 곱창 회식 회사 라면 회식 매우 감사 네이버 참고 곳곳 생방송투데이 방영 예약 마늘 곱창 맛집 방영 맛집 마늘 곱창 인분 한정 판매 일찍 추천 마늘 곱창 곱창 마늘 곱창 황소 곱창 막창 대창 염통 벌집 가지 부위 처음 모듬 먹기 곱창 인분 전통 곱창 장인 레시피 원조 국내 곱창 전문점 가격 이면 합리 커플 커플 패밀리 로열 세트 할인 메뉴 곱창 기도 미리 세팅 두부김치 콩나물국 일반 선짓국 김치 콩나물국 김치 콩나물국 소주 파다 저런 김칫국 순두부 생각 홍성 할머니 직접 존맛 파김치 등장 궁서체 곳곳 파김치 이제 파김치 입가심 냐미 천엽 기름 그릇 순삭 꼬들꼬들 곱창 정독 김치 콩나물국 소주 한잔 염통 구이 먼저 먹기 곱창 표고버섯 와사비 존맛 파김치 먹기 부추 콩나물 먹기 마지막 볶음밥 먹기 치즈 추가 포인트 곱창 바닥 염통 제외 초벌 구이 가지 부위 진짜 버섯 감자 양파 파김치 철판 자리 부족 사태 촤악 퍼포먼스 인스타그램 리기 데이트 코스 오시 염통 핏기 안보 이면 몇번 금방 표고버섯 와사비 먼저 표고버섯 와사비 염통 부추 파김치 원래 모듬 염통 경우 국내 산이 안질 기고 곱창 이의 스타트 기름 한번 본격 이건 기본 황소 곱창 진짜 완전 사진 순삭 얘기 표고버섯 와사비 궁합 치트키 벌집 양도 별미 쫀득쫀득해 식감 천재 감자 주인공 영접 마늘 곱창 만남 진짜 마늘 곱창 어케했 한국인 마늘 민족 곱창 마늘 느낌 달달 파김치 한국인 막창 파김치 부추 양파 식구 빠삭하 대망 대창 대창 대창 두께 진짜 실제 육즙 한국인 디저트 볶음밥 콩나물 달라 요청 직원 볶음밥 인내 철판 치즈 김치볶음밥 술술 치즈 볶음밥 순삭 지인 곱창 원래 처음 곱창 역사 목교 곱창 물리 간만 곱창 매우 목교 현대 백화점 맛집 목교 곱창 목동 본점 추천 목교 곱창 목동 본점 서울특별시 양천구 목동동로 목교 곱창 예약 블로그 체크 장소,
1,서울 양천 마늘 곱창 맛집 목교 곱창 목동 본점 목동맛집 강추,오늘 포스팅 목동맛집 마늘 곱창 맛집 목교 곱창 마침 목동 백화점 본점 목동 목교 곱창 목동 본점 월목 주말 목교 곱창 목동 본점 서울특별시 양천구 목동동로 목교 곱창 예약 블로그 체크 장소 출구 도보 도착 내부 화장실 이용 마늘 곱창 하루 인분 한정 판매 저녁 커플 세트 주문 커플 셋트 곱창 마늘 곱창 황소 곱창 대창 막창 염통 벌집 곱창 뚝배기 볶음밥 기본 반찬 순두부찌개 생각 곱창 뚝배기 진짜 도둑 공기 뚝딱 세트 메뉴 볶음밥 인분 포함 공기밥 주문 마려워 건더기 곱창 뚝배기 추천 목교 곱창 이유 마늘 곱창 한국인 마늘 킹왕짱 사랑 곱창 마늘 조합 고요 고요 하루 인분 한정 판매 개인 막창 나머지 벌집 대창 염통 무난 볶음밥 인분 생각 콩나물 부추 볶음밥 마늘 곱창 곱창 뚝배기 무난 편이 가면 마늘 곱창 뿌실 예정 세트 메뉴 주문 볶음밥 먹기 마늘 곱창 진짜 목교 곱창 마늘 곱창,목동맛집 마늘곱창 오목교곱창
2,목교 목동 목교 곱창 목동 본점,곱창 맛집 목교 곱창 목동 본점 서울 양천구 목동동로 월목 매일 라스트 일요일 저녁 요리사 곱창 곱창 정말 간만 곱창 맛집 목교 곱창 방문 맛집 골목 안쪽 위치 지도 보고 추천 맛집 기운 레트로 분위기 목교 곱창 내부 레트로 분위기 파김치 마늘 곱창 메인 가족 위로 맛집 전통 곱창 전문점 베스트 메뉴인 마늘 곱창 막창구이 주문 곱창 맛집 도장 마늘 곱창 처음 도장 상이 곱창 막창 반찬 절임 천엽 양파 표고버섯 와사비 게살콘마 샌드위치 해도 파김치 순두부 김치찌개 곱창 반찬 세팅 불쇼 재생 접기 불쇼 곱창 불쇼 곱창 불쇼 불쇼 막창 곱창 금세 핏기 구우 젓가락 분주 막창 곱창 곱창 어서 파김치 막창 미가 마늘 곱창 반찬 요리조리 설거지 그냥 가면 한국인 섭섭 볶음밥 식사 완료 볶음밥 재생 볶음밥 수가 집중 공부 널리 널리 누룽지 작업 바닥 소리 노래 샤잠 이용 노래 샤크라 노래 시절 추억 방울방울 사람 인증 레트로 분위기 찰떡 맛집 인정 목교 곱창 음료 한잔 에어컨 마무리 만족 목교 곱창 목동 본점 서울특별시 양천구 목동동로 목교 곱창 예약 블로그 체크 장소 목교 곱창 목동 본점 목교 곱창 목교 곱창 목동 본점 맛집 오목교맛집 목동맛집 곱창 맛집 마늘 곱창 곱창 곱창 곱창 맛집 레트로 맛집 레트로 샤크라 양천구 맛집 양천구 회식 목동회식 장소 오목교회식 장소 회식 장소,오목교곱창목동본점 오목교곱창 오목교곱창목동본점22613맛집 오목교맛집 목동맛집 곱창맛집 통마늘곱창 곱창 소곱창 소곱창맛집 레트로맛집 레트로 샤크라 양천구맛집 양천구회식 목동회식장소 오목교회식장소 회식장소
3,목동현대백화점맛집 목교 곱창 목동 본점 마늘 곱창 취향 저격,목동현대백화점맛집 목교 곱창 목동 본점 마늘 곱창 취향 저격 오늘 목교 최애 곱창 목동현대백화점맛집 목교 곱창 목동 본점 소개 목교 곱창 전통 곱창 장인 레시피 그대로 마늘 곱창 전문점 당일 도축 최상 국내 육우 사용 목동 곱창 맛집 방문 후기 영업 라스트 목교 곱창 목동 본점 서울특별시 양천구 목동동로 목교 곱창 예약 블로그 체크 장소 외관 목동현대백화점맛집 목교 곱창 목동 본점 외관 근처 위치 근처 술집 해결 골목길 위치 주차 지원이 인근 목동 공영 주차장 이마트 목동 주차장 이용 토요일 저녁 시간대 방문 정도 대기 워낙 인지도 맛집 가족 외식 단체 모임 한창 진행중 테이블 시스템 대기 주변 골목 구경 자리 내부 인테리어 내부 모습 내부 원형 테이블 테이블 두루 배치 공간 자체 테이블 끼리 붙이 단체 모임 직장 회식 네이버 최대 예약 참고 예상 생방송투데이 티비 매스컴 소개 유명인사 마늘 곱창 효능 메뉴판 목동현대백화점맛집 목교 곱창 목동 본점 메뉴판 베스트 이자 대표 메뉴인 전통 마늘 곱창 일반 곱창 모듬 갈비살 우삼겹 메뉴 준비 마늘 곱창 전문점 마늘 곱창 하루 인분 한정 판매 메뉴 기소진 걱정 인원 준비 세트 메뉴 메뉴 인기 전통 수제 마늘 곱창 인분 인분 기준 주문 리뷰 이벤트 진행중 참여 혜택 주문 차려 밑반찬 곱창 기름 소스 매장 직접 원조 파김치 부추 천엽 목동 백화점 맛집 밑반찬 달라 매콤 순두부찌개 무료 제공 찌개 진짜 국물 순두부 완전 안주 제격 목동현대백화점맛집 목교 곱창 목동 본점 마늘 곱창 취향 저격 재생 접기 목동현대백화점맛집 목교 곱창 목동 본점 마늘 곱창 취향 저격 등장 동시 불쇼 볼거리 제공 수제 마늘 곱창 인분 보이 플레이 더욱 기대 염통 숙주 부추 마늘 감자 화룡 점정 버섯 정도 타지 자주 사이드 파김치 곱창 궁합 정말 직접 곱창 특유 기름기 가장 먼저 염통 먹기 쫄깃 재료 사용 안나 마늘 곱창 곱창 마늘 아주 덕분 식감 느낌 그게 일반 곱창 단점 마늘 곱창 일반 곱창 단점 보완 메뉴 서산 농장 공수 마늘 국내 육우 직접 손질 곱창 궁합 한번 사람 계속 다시 볶음밥 소주 기약 정말 목교 곱창 방문 만족 방문 만족 목동현대백화점맛집 목교 곱창 목동 본점 곱창 퀄리티 밑반찬 사이드 메뉴 직원 대해 덕분 곱창 수제 마늘 곱창 다시 오목교역 맛집 타워 현대 백화점 근처 방문 추천 오늘 포스팅,
4,오목교맛집 강서 양천 통틀어 최고 곱창 목교 곱창 목동 본점,여름 오늘 여름 소개 드릴 맛집 목교 곱창 목동 본점 이웃 공유 포스팅 소개 전통 곱창 장인 레시피 원조 국내 곱창 전문점 매우 기대 매일 당일 도축 최상 국내 육우 한우 기름 초벌 준비 불쇼 노릇 노릇 곱창 정말 극락 곱창 완전 흡입 마늘 곱창 매우 한정 수량 판매 고해 왜냐면 사장 부모님 직접 농사 지은 마늘 알알이 곱창 부추 상큼 상큼 파김치 대파 부모님 직접 농사 지은 대요 정성 밥상 아래 지도 링크 첨부 참고 헛걸음 에너지 낭비 방문 무조건 맛집 추천 꾸욱 방문 공감 가시 공감 업체 목교 곱창 목동 본점 주소 서울 양천구 목동동로 목교 곱창 연락처 목교 곱창 목동 본점 서울특별시 양천구 목동동로 목교 곱창 예약 블로그 체크 장소 목교 곱창 목동 본점 네이버 방문자 리뷰 블로그 리뷰 소정 원고료 작성 목교 곱창 목동 본점 곱창 맛집 목동 곱창 오목교술집 목동술집 목동맛집 추천,오목교곱창목동본점 곱창맛집 목동소곱창 오목교술집 목동술집 목동맛집추천
5,목교 목동 곱창 목교 곱창 목동 본점 솔직 후기,곱창 오늘 목동 목교 곱창 맛집 목교 곱창 목동 본점 후기 목교 곱창 이름 오목교역 도보 거리 위치 접근성 골목 안쪽 보이 지도 검색 조명 간판 금방 주차장 마련 근처 주차장 이용 대중교통 이용 추천 생방송투데이 방송 정도 곱창 싸인 연예인 먹방 유튜버 방문 래서 평일 방문 사람 정말 평일 저녁 주말 웨이팅 웨이 사람 대기 석도 마련 자리 비타민 비타민 식당 세심 포인트 먹기 기분 베스트 메뉴인 전통 마늘 곱창 품절 하루 인분 한정 판매 전통 수제 마늘 곱창 방문 대신 황소 곱창 주문 곱창 밑반찬 간이 천엽 찌개 매콤 중독 계속 곱창 밑반찬 목교 목동 곱창 목교 곱창 목동 본점 솔직 후기 재생 접기 목교 목동 곱창 목교 곱창 목동 본점 솔직 후기 곱창 불쇼 영상 곱창 숙주 양파 부추 염통 소량 염통 먼저 곱창 반찬 파김치 불판 정말 비주 곱창 크기 곱창 특유 냄새 남지 곱창 부추 곱창 더욱 양도 불리 목교 곱창 목동 본점 서울특별시 양천구 목동동로 목교 곱창 예약 블로그 체크 장소 목교 목동 근처 곱창 목교 곱창 목동 본점 추천 전통 마늘 곱창 보고 오늘 후기,
6,목교 본점 오목교역 해장국 맛집 동네 주민 추천 목동 현대 백화점 근처 맛집,업체 등록 사진 본점 서울특별시 양천구 목동동로 블로그 체크 장소 본점 목교 진짜 맛집 초딩 양천구 맛집 오목교맛집 목동맛집 맛집 목동 맛집 오목 교현 맛집 본점 해장국 맛집 목동 현대 백화점 코앞 때문 목동 방문 먹기 주차공간 가게 공간 자리 비유 동네 맛집 대부분 도보 이동 주차 해도 자리 생각 목동 공영 주차장 서울특별시 양천구 안양천로 블로그 체크 장소 목동 주차 도보 고려 캬캬 추가 요금 본점 네이버 방문자 리뷰 블로그 리뷰 종로 계림 닭도리탕 원조 오목 교점 영업 매일 브레이크 타임 문의 메뉴판 해장국 사실 해장국 가격 진짜 기억 음식 지불 가치 생각 한당 캬컄 최근 해장국 보통 전골 가장 방문 이면 소자 매우 보통 보통 가야 된닼 밑반찬 회전 진짜 입장 자리 세팅 완료 간단 간단 직원 맛집 싶넼 깍두기 진짜 킥임 진짜 해장국 김치 진짜 고추 쌈장 고추 매운 그렇더랔 겨자 소스 완전 고기 진짜 존맛 테이블 두둥 해장국 등장 메뉴 내외 국물 들깨 가루 촤르륵 더영 해장국 개수 대략 느낌 필요 조닌 개임 고추 고기 겨자 소스 오목교역 해장국 맛집 본점 항상 장사 가도 사람 계속 혼밥 실제 가족 식사 실제 회식 동네 주민 맛집 인정 총총,양천구맛집 오목교맛집 목동맛집 현백맛집 목동현백맛집 오목교현백맛집 양천뼈다귀본점 뼈다귀해장국맛집 양천뼈다귀 메뉴판
7,목교 현대 백화점 맛집 목교 곱창 목동 본점,목교 현대 백화점 맛집 목교 곱창 목동 본점 목교 곱창 목교 곱창 목동 본점 목교 현대 백화점 맛집 오목 교현 맛집 오목 교현 근처 곱창 목동 곱창 맛집 마늘 곱창 파김치 마늘 곱창 주소 양천구 목동동로 목교 근처 영업 평일 오후 금요일 오후 토일 저녁 라스트 오픈 매일 달라 주차 근처 공영 자리 목교 다운 무료 주차 특징 하루 인분 한정 마늘 곱창 인기 직접 파김치 음청 인상 천엽 최고 생방송 투데이 방영 맛집 전통 그대로 원조 국내 곱창 전문 회식 데이트 레트로 느낌 물씬 골목 위치 남편 데이트 오늘이 간다 목교 곱창 목교 현대 백화점 맛집 목교 곱창 목동 본점 아주 워낙 인기 인지 대기 금요일 오픈 오후 레트로 느낌 관리 데이트 회식 사실 회식 마늘 관련 내용 기본 반찬 제공 파김치 집의 자랑거리 하루 인분 한정 마늘 곱창 집의 특색 오픈 가지 파김치 한정 때문 가격 인분 그람 수도 그램 원대 가격 생각 먼저 매우 밑반찬 순두부찌개 수가 원래 밑반찬 곱창 파김치 진짜 정말 보고 파김치 진짜 자랑 버섯 장아찌 천엽 곱창 찰떡 부추 정말 최고 순두부 곱창 술안주 곱창 오시 버너 목교 곱창 목동 본점 재생 접기 목교 현대 백화점 맛집 목교 곱창 곱창 마늘 곱창 인분 주문 비주 그냥 파김치 곱창 기름 구우 파김치 난리 정말 다시 상이 곱창 마늘 파김치 정말 대박 진짜 조합 곱창 와인 와인 가격 역시 한국인 인지 마지막 볶음밥 곱창 기름 값어치 매우 볶음밥 목교 현대 백화점 맛집 목교 곱창 목동 본점 진짜 목교 곱창 목동 본점 서울특별시 양천구 목동동로 목교 곱창 예약 블로그 체크 장소,오목교곱창 오목교곱창목동본점 오목교현대백화점맛집 오목교현백맛집 오목교현백근처곱창집 목동곱창맛집 마늘곱창 파김치마늘곱창
8,목교 곱창 목동 본점 곱창 장인 티어 곱창,여자 호르몬 그동안 돼지 기록 기억 주마등 가장 한가지 음식 곱창 목동 토박이 박령 친구 소개 목교 곱창 목교 곱창 목동 본점 위치 찾기 목동 현대 백화점 근처 빈티 기석 기분 오후 대기 전혀 맛집 싸인 어마 무시 먹방 유투 사인 목교 곱창 곱창 특유 냄새 환기 프로 좌석 고기 냄새 오빠 덕분 연기자 냄새 번가 곱창 팅팅 얼굴 모자 집념 허리 거좀 곱창 돼지 곱창 목교 곱창 메뉴 주문 전통 수제 마늘 곱창 곱창 처가 전통 수제 마늘 곱창 꼭꼭 추천 이용 상태 매우 하이 말러 전통 곱창 장인 레시피 그대로 레시피 곱창 전문점 당일 도축 최상 국내 육우 곱창 정수 손질 제공 매장 직접 반찬 파김치 가지 포인트 가장 파김치 김치 어른 말씀 대기 곱창 정독 정말 순두부찌개 셋팅 식사 시작 곱창전골 순두부찌개 고기 양념장 이유 고기 아주 밑반찬 셋팅되구 건강 식당 처음 비타민 주시 진짜 사장 반찬 그냥 식당 마요네즈 버무린 진짜 진짜 반찬 진짜 기름 비법 소스 파김치 파김치 고깃집 정말 말이죵 파김치 비밀 곱창 등장 수술 자의 콜라 타임 쇼타임 불쇼 미리 말씀 사진 입맛 다시 이제 모든 준비 출전 뎀벼 사장 부위 별로 설명 오빠 이건 호르몬 왼쪽 가득 대창 오른쪽 마늘 곱창 마늘 곱창 진짜 요물 처가 벌집 황소 곱창 비주 파김치 부추 먹기 손해 손해 진짜 음식 계속 기술 장담 컨데 세상 여자 절반 정독 고온 방법 실천 키키킼 정말 냄새 곱창 자체 기교 곱창 교과서 느낌 오빠 구경 여자 피죤 준비 여자 윰찌 수고 오라버니 기도 키즈 노트 말투 기출 문제 여자친구 자꾸 짜증 심술 부린다 목교 곱창 수혈 타이밍 목교 곱창 목동 본점 서울특별시 양천구 목동동로 목교 곱창 예약 블로그 체크 장소 목교 곱창 오목교맛집 목동맛집 목동맛집 목동 타워 맛집 목동 맛집 목동 곱창 서울곱창 전국 마늘 곱창 오목교역맛집 목동현대백화점맛집 목동회식 오목교회식 오목교맛집 목동술집 오목교술집 옴교 술집 생방송투데이 생방송투데이 맛집,오목교곱창 오목교맛집 목동맛집 신목동맛집 목동41타워맛집 목동현백맛집 목동소곱창 서울곱창 전국3대마늘곱창 오목교역맛집 목동현대백화점맛집 목동회식 오목교회식 오목교맛집 목동술집 오목교술집 옴교술집 생방송투데이 생방송투데이맛집
9,마늘 곱창 파김치 매력 오목교역 맛집 목교 곱창 목동 본점,오늘 내일 정이 간술 갈팡질팡 갈팡질팡 곱창 먹기 결정 평소 결정 한번 퇴근 약속 고민 금주 다이어트 이슈 때문 그게 과정 리치 저리 내사 뚱이뿐 오늘 곱창 고민 이전 친구 마늘 곱창 메뉴인 오목교역 맛집 목교 곱창 목동 본점 퇴근 방문 목교 곱창 목동 본점 위치 서울 양천구 목동동로 목교 곱창 영업 월목 전화 목교 곱창 목동 본점 서울특별시 양천구 목동동로 목교 곱창 예약 블로그 체크 장소 서울곱창 맛집 목동맛집 오목교맛집 목교 곱창 사진 동영상 팔로워 팔로잉 게시 서울곱창 맛집 목동맛집 오목교맛집 목교 곱창 사진 동영상 보기 호선 오목교역 출구 출구 도보 위치 오목교역 맛집 목교 곱창 목동 본점 주차 목동 주차 위치 주차 외관 내부 레트로 느낌 목교 곱창 목동 본점 곱창 장인 레시피 그대로 외관 믿음 생방송투데이 방영 마늘 곱창 맛집 던데 역시 간판 포스 오후 방문 퇴근 방문 불구 가게 절반 예약 석도 군데 메뉴판 베스트 메뉴 전통 수제 마늘 곱창 랜드 유튜브 방영 채널 뭔가 마음 전통 마늘 곱창 인분 주문 곱창 인분 주문 부림 목교 곱창 목동 본점 비주 장난 곱창 주문 마늘 곱창 막창 염통 대창 여러 부위 숙주 부추 대망 파김치 정말 리더 고용 파김치 리필 접시 순두부찌개 정말 요물 순두부찌개 뚝배기 한잔 개눈 정도 칼칼 매콤하니 안주 제격 고용 주문 고민 정도 파김치 표고버섯 와사비 감자 부추 사이드 반찬 곱창 마지막 원조 국내 곱창 전문점 데이트 회식 소로 적합 예약 목교 곱창 불쇼 재생 목교 곱창 불쇼 마지막 불쇼 보고 가시 예약 회식 소로 손색 오목교역 맛집 목교 곱창 목동 본점 곱창 요즘 한번 추천 서울곱창 전국 마늘 곱창 오목교역맛집 목동 타워 맛집 목동현대백화점맛집 목동회식 오목교회식 오목교맛집 목동맛집,서울곱창 전국3대마늘곱창 오목교역맛집 목동41타워맛집 목동현대백화점맛집 목동회식 오목교회식 오목교맛집 목동맛집
10,목동맛집 목교 곱창 목동 본점,목교 곱창 목동 본점 주소 서울 양천구 목동동로 영업 라스트 금요일 라스트 라스트 전화번호 편의 시설 서비스 단체 이용 가능 무선 인터넷 남여 화장실 구분 예약 포장 배달 생방송투데이 방영 목교 곱창 목동 본점 서울특별시 양천구 목동동로 목교 곱창 예약 블로그 체크 장소 오늘 목교 곱창 목동 본점 골목 구석 손님 맛집 오목교역 곱창 월요일 벌써 이후 골목 구석 회식 오신 단체 손님 목교 곱창 목동 본점 파김치 마늘 곱창 사장 부모님 농사 고춧가루 마늘 음식 목동역 곱창 메뉴 전통 곱창 장인 레시피 그대로 원조 국내 곱창 전문점 인상 마늘 곱창 주문 주문 완료 목동데이트맛집 기본 반찬 준비 곱창 천엽 천엽 전혀 남편 김치 콩나물국 시원 대요 목동맛집 여럿 가성 목교 추천 무료 회식 테이블 주문 곱창 와인 그것 종류 별로 설명 와인 곱창 목동 곱창 네이버 영수증 리뷰 이벤트 참여 음료수 소주 무료 구글 리뷰 볶음밥 인분 추가 무료 카카오 플러스 친구 이벤트 참여 치즈 무료 오목교맛집 먼저 한잔 마늘 곱창 곱창 맥주 소주 초벌 곱창 친환경 농약 마늘 마늘 곱창 사이드 염통 목교 곱창 목동 본점 당일 도축 국내 육우 한우 곱창 기름 초벌 때문 곱창 목교 막창 목교 곱창 목동 본점 재생 접기 마늘 곱창 맛내기 눈앞 불쇼 느낌 느낌 불쇼 직원 파김치 부추 불판 목교 곱창 곱창 마늘 쏙쏙 바삭 바삭 가장 조합 기름 두번째 조합 양념장 기름 마늘 쫄깃 곱창 마늘 덕분 곱창 타이밍 소주 곱창 제대로 안나 핏기 가신 염통 쫄깃 전혀 주의 한가지 파김치 부추 양파 곱창 마늘 덕분 입냄새 썸남썸녀 가시 용서 수도 오목교역맛집 목교 볶음밥 국수 추가 주문 곱창 불쇼 볶음밥 때문 재미 볶음밥 자꾸 볶음밥 마지막 숟갈 곱창 주문 국수 비주 곱창 세상 바삭 고소 시원 육수,오목교역곱창 목동역곱창 목동데이트맛집 목동맛집 목동곱창 오목교맛집 오목교막창 오목교곱창 오목교역맛집
11,오목교맛집 오목교역맛집 목교 곱창 목동 본점,오목교맛집 목교 곱창 목동 본점 쿨타임 일주일 메뉴 곱창 곱창 질리 포스팅 사진 중천 대낮 오늘 곱창 목동 주민 목동역 비슷 목동역 오목교역 외식 오목교역 맛집 오목교역 곱창 맛집 부수 목교 곱창 목동 본점 목교 곱창 목동 본점 서울특별시 양천구 목동동로 목교 곱창 예약 블로그 체크 장소 주소 서울특별시 양천구 목동동로 목교 곱창 영업 월목 라스트 금요일 라스트 주말 라스트 목교 곱창 오목교역 도보 접근성 식당 오목교역 맛집 골목 고개 어보 곱창 간판 레트로 분위기 목교 곱창 도착 생방송 투데이 방송 전통 수제 마늘 곱창 맛집 하루 인분 준비 때문 마늘 곱창 일찍 소주 분위기 테이블 중간 자리 회식 장소 추천 벽면 소파 사각 테이블 방송 연예인 맛집 이벤트 진행 리뷰 쓰시 할인 목교 곱창 메뉴판 곱창 인분 전통 수제 마늘 곱창 인분 깃밥 하이 이벤트 목교 곱창 밑반찬 대파 김치 부추 양파 절임 샐러드 천엽 기본 안주 순두부찌개 후식 찌개 소고기 가야 천엽 기본 반찬 먼저 주문 곱창 인분 오목교맛집 오목교역맛집 목교 곱창 목동 본점 재생 오목교맛집 오목교역맛집 목교 곱창 목동 본점 직원 오일 라이터 보고 단짝 이건 불쇼 동영상 대기 오감 만족 불쇼 오목교맛집 오목교역맛집 목교 곱창 목동 본점 재생 오목교맛집 오목교역맛집 목교 곱창 목동 본점 오목교맛집 목교 곱창 곱창 국내 육우 사용 마늘 곱창 황소 곱창 막창 대창 염통 벌집 여러가지 부위 메뉴 취향 메뉴 추가 주문 추천 고기 우시 다가 중앙 파김치 곱창 오목교맛집 오목교역맛집 목교 곱창 목동 본점 재생 오목교맛집 오목교역맛집 목교 곱창 목동 본점 제일 먼저 염통 나머지 고기 곱창 아주 하이 이벤트 중이 단짝 하이 주문 먼저 때문 차례대로 단짝 벌집 이집 아주 제대로 라면 양보 인분 살짝 정통 수제 마늘 곱창 인분 곱창 마늘 향기 오목교역 맛집 목교 곱창 목동 본점 추천 오목교맛집 목동 곱창 오목교역맛집 목동맛집 목교 고기 목동고 오목교회식 오목교역 회식 서울곱창 맛집,오목교맛집 목동곱창 오목교역맛집 목동맛집 오목교고기집 목동고기집 오목교회식 오목교역회식 서울곱창맛집
