,title_pos,content_pos,hash_tag
165,목동 직화 이집 목동 꼼장어 목동고 추천,직화 이집 목동 서울특별시 양천구 은행 정로 블로그 체크 장소 직화 이집 목동 영업 일요일 정기 휴무 월토 브레이크 타임 목동 꼼장어 직화 이집 직화 이집 메뉴판 꼼장어 도전 위해 퇴근 근처 직화 이집 방문 점심 특선 주변 직장인 점심식사 메뉴 먹기 안주 잔치국수 냉면 라면 누룽지 매장 전체 꼼장어 처음 꼼장어 양념 소금 인분 밑반찬 김치 밑반찬 콩나물국 어묵 국물 베이스 콩나물 나름 별미 꼼장어 재생 꼼장어 목동 꼼장어 직화 이집 꼼장어 먹기 위해 테이블 테이블 사이 공간 아마 초벌 꼼장어 식지 역할 목동 꼼장어 직화 이집 꼼장어 구이 소금 양념 가지 소금 소금 양념장 양념 매콤 매운 꼼장어 이제 꼼장어 꼼장어 어묵 달걀 통째 무려 덕분 중화 용도 사용 소금 양념장 일반 양념 처음 양념 양념 중간 슬슬 매운 소금 후식 비빔밥 야채 식이섬유 섭취 비빔밥 달달 매콤 꼼장어 처음 꼼장어 생각 친구 여러가지 꼼장어 배달 생각,
166,목동 로데오 맛집 직화 이집 목동 숯불 이집 돼지 꼼장어 오징어,직화 이집 목동 서울특별시 양천구 은행 정로 블로그 체크 장소 안뇽 블로거 오늘 정말 목동역 숯불 이집 직화 이집 목동 목동 로데오 맛집 리뷰 그냥 고기 프라이팬 전혀 때문 숯불 이집 동네 항상 고기 북적 북적 목동 로데오 맛집 목동역 신정역 사이 접근성 한잔 지하철 이용 슬슬 오시 목동 로데오 반대편 골목 골목 주차 주차장 이용 주차 방문 주차장 이용 때문 차로 직화 이집 목동 재생 접기 직화 이집 목동 메뉴 돼지 살구 꼼장어 구이 오징어 양념 구이 가지 돼지 살구 양념 그냥 선택 양념 인분 주문 주문 한쪽 코너 직접 메뉴 때문 정말 먼저 콩나물국 밑반찬 콩나물 그릇 반찬 달라 부탁 요즘 상추 대신 양배추 양배추 개인 마음 직화 이집 목동 재생 접기 목동역 숯불 돼지고기 숯불 가득 돼지 살구 테이블 가운데 철망 식지 테이블 사이즈 숯불 세팅 신기 신기 콩나물국 오뎅 기본 서비스 정말 타이밍 숯불 양념 돼지 살구 매운 양념 궁합 매운 매운 양념 소스 추가 그냥 고기 양념 느낌 소스 일행 소스 겯들 개인 절대 불맛 돼지 숯불 양배추 그냥 양념 돼지 살구 목동 로데오 맛집 한번 존재 이미지,
167,강서구 목동맛집 직화 이집 목동 돼지 살구 목동 로데오 맛집,직화 이집 목동 서울특별시 양천구 은행 정로 블로그 체크 장소 위치 서울 양천구 은행 정로 전화번호 영업 월일 사항 정기 휴무 일요일 오늘 목동 고기 직화 이집 방문 위치 목동역 출구 위치 지도 보고 목동 고기 직화 이집 메뉴판 메뉴 돼지 살구 꼼장어 구이 오징어 양념 구이 메뉴 진짜 맛집 아시 거기 식사 식사 추가 목동 고기 직화 이집 내부 내부 은근 테이블 목동 고기 직화 이집 개인 처음 테이블 부분 계속 구조 목동 고기 직화 이집 밑반찬 밑반찬 종류 이따 주문 메뉴 잔치국수 주문 처음 잔치국수 기본 콩나물국 살짝 기본 제공 계란 오뎅 계란 오뎅 진짜 소주 소주 주문 메인 메뉴 강서구 목동맛집 직화 이집 목동 돼지 살구 맛집 재생 접기 강서구 목동맛집 직화 이집 목동 돼지 살구 맛집 목동 로데오 맛집 직화 이집 주문 메뉴 주문 메뉴 돼지 살구 인분 후기 미리 꼼장어 구이 고기 때문 돼지 살구 직화 미리 색깔 직화 구이 비주 이제 얼른 진짜 무조건 방문 진짜 사이드 주문 잔치국수 깜짝 고기 주먹밥 주문 비빔밥 고민 주먹밥 비빔밥 기본 밑반찬 돼지 살구 인분 잔치국수 주먹밥 계란 오뎅 고기 한쪽 위로 목동 로데오 맛집 직화 이집 사람 제격 계란 오뎅 소주 뚝딱 가능 주량 메인 메뉴인 돼지 살구 사이드 주문 잔치국수 기본 계란 오뎅 콩나물국 목동 로데오 맛집 직화 이집 방문 존재 이미지,
168,직화 이집 목동 꼼장어 직화 구이 소금 양념 구이 후기,제일 온도 도로 목살 꼼장어 오징어 직화 직화 이집 제일 도로 직화 구이 제공 목살 꼼장어 오징어 맛집 목동 마음 직화 구이 맛집 직화 이집 소개 직화 이집 목동 영업 월토 일요일 정기 휴무 호선 목동역 출구 미터 직화 이집 목동 서울특별시 양천구 은행 정로 블로그 체크 장소 외관 직화 이집 가게 주차공간 목동역 출구 거리 대중교통 이용 직화 구이 직화 이집 목동 메뉴 돼지 살구 꼼장어 구이 오징어 양념 구이 직화 사이드 메뉴 점심 특선 직화 구이 정식 주변 근무 들기름 계란후라이 두부김치 주문 반찬 솜씨 테이블 불판 콩나물국 동시 해장 배추 열무 겉절이 진짜 엄마 반찬 노각 콩나물국 오뎅 달걀 오뎅 칼칼 진짜 술안주 꼼장어 직화 구이 금구 양념 고민 사장 인기 진짜 테이블 정체 공간 직화 구이 유지 위해 테이블 아래 신기 방기 사장 직접 도의 온도 꼼장어 진짜 직업 지경 소맥 양념 금구 양념장 기름 정말 우열 수가 오징어 직화 구이 주문 오징어 제일 온도 도로 목살 꼼장어 오징어 직화 직화 이집 전통 검증 맛집 대전 송촌동 원조 황소 집의 그대로 사장 음식 솜씨 음식 추천 직화 이집 목동 재생 접기 직화 이집 목동 존재 이미지 직화 이집 꼼장어 직화 구이 목동고 목동 로데오 맛집 목동 꼼장어 꼼장어 맛집 목동 직화 구이 맛집 목동역맛집 목동역꼼장어 목동 고기,1530도직화구이집 꼼장어직화구이 목동고기집 목동로데오맛집 목동꼼장어 꼼장어맛집 목동직화구이맛집 목동역맛집 목동역꼼장어 목동고기구워주는집
169,마자 목동 고기 직화 이집 목동,오늘 목동 위치 목동 고기 직화 이집 목동 이야기 고기 정말 매력 고기 기본 정보 네이버 지도 직화 이집 목동 서울특별시 양천구 은행 정로 블로그 체크 장소 위치 서울 양천구 은행 정로 영업 일요일 정기 휴무 전화 번호 단체 이용 가능 예약 가능 오뎅 서비스 직화 마자 고기 위치 접근성 직화 이집 목동 서울 양천구 은행 정로 위치 목동역 출구 직진 세븐일레븐 좌회전 갈림길 우회 전해 직진 도착 위치 설명 가게 주차 공간 마련 주변 상점 카페 식사 산책 저녁 사람 사람 타고 도착 첫인상 매장 개방 내부 실내 통풍 연기 냄새 식사 대부분 연기 냄새 화분 여기저기 분위기 손님 도착 사진 사진 찍기 타이밍 내부 화장실 상세 정보 주요 메뉴 돼지 살구 꼼장어 구이 오징어 양념 구이 요즘 고기 인분 가성 생각 대표 메뉴 돼지 살구 소금 양념 꼼장어 구이 소금 인분 감동 순간 방문 당일 콩나물국 먼저 살짝 식전 반찬 상추 깻잎 샐러드 고추 마늘 쌈장 고기 조화 메뉴 모습 고기 그냥 사장 직화 주시 그냥 먹기 고기 돼지 그냥 먹기 정말 목동 돼지 고기 꼼장어 쫄깃 목살 양념 구이 불맛 일품 숯불 냄새 전혀 걱정 필요 정말 목살 양념 구이 목살 양념 구이만 주문 다시 생각 서비스 오뎅 서비스 무려 계란 오뎅 수가 사장 배려 부모님 인원 별로 계란 어린이 고객 위해 고추 가루 세심 정말 감동 후식 라면 잔치국수 양도 고기 마무리 굳이 생각 먹기 숯불 매운 매운 숯불 생각 얼른 방문 의사 종합 직화 이집 목동 추천 드릴 고기 퀄리티 모든 메뉴 직접 때문 정말 식사 목동 고기 서비스 반찬 다시 한번 방문 마음 정말 목동 근처 방문 가기 전화 예약 거나 미리 확인 직화 구이 목동 클립 재생 접기 직화 구이 목동 클립 직화 이집 목동 고기 서비스 반찬 덕분 정말 식사 경험 제공 목동 맛집 하나로 가족 친구 가격 고기 장점 한번 방문 후회 목동고 목동 로데오 맛집 목동 꼼장어 직화 구이 직화 이목 동점 직화 구이 직화 이목 동점 목동고 맛집 목동 고깃집 목동 목살 고기 맛집 목동 로데오 고기 꼼장어 맛집 목동 꼼장어 맛집 목동 꼼장어 직화 구이 목동 목살 직화 구이 목살 직화 구이 오뎅 서비스 존재 이미지,목동고기집 목동로데오맛집 목동꼼장어 1530직화구이 1530직화구이목동점 1530도직화구이 1530도직화구이목동점 목동고기맛집 목동고깃집 목동목살 고기맛집 목동로데오고기집 꼼장어맛집 목동꼼장어맛집 목동꼼장어직화구이 목동목살직화구이 목살직화구이 오뎅탕서비스
170,불타 목동 꼼장어 직화 이집 목동,띠띠 오늘 목동 꼼장어 직화 이집 목동 직화 이집 목동 서울특별시 양천구 은행 정로 블로그 체크 장소 영업 일요일 정기 휴무 주차 가능 매장 정도 거주 노상 주차장 추천 서울 양천구 은행 정로 아침 세상 겨울 덕분 똥글 인생 오늘 목동 꼼장어 직화 이집 목동 가기 목동 로데오거리 위치 목동 꼼장어 직화 이집 꼼장어 메뉴 오징어 보고 매장 테이블 이유 실내 캠핑 기분 곳곳 화분 캠핑 기분 메뉴 주력 오늘 목적 꼼장어 구이 오징어 양념 구이 금구 인분 주문 꼼장어 양념 인분 오징어 양념 구이 인분 추가 주문 주문 기본 세팅 먼저 콩나물국 바람 살짝 콩나물국 똥글 주신 아기 천사 아기 의자 주로 저녁 장사 생각 유모차 공간 다행 소금 구이 먼저 그다음 양념 꼼장어 오징어 구이 때문 식지 테이블 아래 직화 이집 목동 재생 직화 이집 목동 사장 숯불 활활 금구 기름 양념장 양념 구이 마요네즈 양념 구이 처음 매운 기본 어묵 별미 계란 이서 오늘 남편 패스 양념 구이 나니 싹싹 곰장어 목동 꼼장어 직화 이집 목동 오늘 목동고 목동 로데오 맛집 목동 꼼장어 목동 오징어 구이 직화 이집 목동 로데오 꼼장어 목동 직화 구이 목동 숯불 꼼장어 존재 이미지,목동고기집 목동로데오맛집 목동꼼장어 목동오징어구이 1530도직화구이집 목동로데오꼼장어 목동직화구이 목동숯불꼼장어
171,목동 로데오 맛집 한잔 목동 고기,고기 한잔 목동 로데오 맛집 직화 이집 목동 도로 목살 양념 구이 꼼장어 구이 오징어 양념 구이 직접 목동 고기 직화 이집 저녁 한잔 점심 특선 잔치국수 잔치국수 주먹밥 잔치국수 양념 목살 직화 구이 정식 준비 점심 식사 한잔 목동 꼼장어 직화 이집 돼지 살구 꼼장어 구이 오징어 양념 구이 메뉴 열무 국수 두부김치 콩기름 계란후라이 냉면 라면 비빔밥 주먹밥 식사 가성 목동 로데오 맛집 직화 이집 직화 구이 아래 고기 주방 열기 매력 직화 구이 직화 구이 장면 재생 직화 구이 직화 구이 장면 사장 화분 가게 곳곳 화분 분위기 공기 음식 먼저 콩나물국 살짝 고춧가루 처음 의자 뚜껑 가방 외투 고기 냄새 관할 상차림 상추 깻잎 샐러드 열무김치 배추김치 양파 절임 고추 마늘 쌈장 초고추장 고기 온도 유지 위해 불판 아래 반찬 직접 고기 여름 고깃집 숯불 나오니 정말 아래 숯불 온도 유지 고기 불맛 매콤한 목살 양념 구이 고추 마늘 상추 깻잎 수도 그냥 고기만 양파 절임 고기 특유 서비스 오뎅 무려 계란 살구 계란 서비스 매우 가성 비빔밥 주문 상추 들깨 콩나물 먹기 비빔밥 김치 반찬 나위 친구 둘이서 소주 목동 가성 맛집 제로 페이 이용 국민카드 포인트 적립 사용 직화 이집 목동 영업 월토 브레이크 타임 일요일 정기 휴무 전화번호 위치 서울 양천구 은행 정로 목동역 출구 직진 세븐일레븐 좌회전 갈림길 우회 전해 직진 직화 이집 도착 직화 이집 목동 서울특별시 양천구 은행 정로 블로그 체크 장소 존재 이미지 목동고 목동 로데오 맛집 목동 꼼장어 목동 고깃집 직화 구이 목동 직화 구이 목동술집 목동 안주 맛집 목동가 성비 술집,목동고기집 목동로데오맛집 목동꼼장어 목동고깃집 직화구이 목동직화구이 목동술집 목동안주맛집 목동가성비술집
172,서울 목동 목동 고기 직화 이집,사계절 소녀 오늘 목동 로데오거리 위치 목동 고기 직화 이집 방문 목동 고기 직화 이집 직화 이집 목동 서울특별시 양천구 은행 정로 블로그 체크 장소 위치 직화 이집 정보 일요일 정기 휴무 월토 주차 불가 매장 목동역 근처 로데오거리 위치 목동 고기 직화 이집 운치 비어 주차 주차 노상 주차장 영업 매장 미리 직접 직화 구이 매장 테이블 정말 사람 저녁 피크 타임 사람 테이블 단체 회식 테이블 철제 로코 세상 테이블 연탄 대박 구조 방문 고기 처음 반찬 신선도 최고 깍두기 일품 직접 존맛 무르 밑반찬 콩나물 진국 콩나물 진짜 그냥 오뎅 대박 계란 인원 대로 인지 계란 처음 메추리 그냥 계란 오뎅 양도 실화 메인 메뉴 숯불 목살 양념 소금 양념 매운 편이 정도 매운 그냥 살짝 매콤 정도 소금 양념 소금 번갈아 가면 한텐 양념 매운 편이 공기 뚝딱 크흐 진짜루 건가 대식 사장 인심 고기 탄산 제로 팹시 고기 오늘 콜라 재생 이건 완숯 오늘 오늘 존재 이미지,
173,목동 꼼장어 직화 이집 목동,목동고 목동 꼼장어 직화 이집 목동 초반 대고 떡볶이 장창 술안주 이미지 꼼장어 아예 적도 음식 신랑 기회 목동 꼼장어 맛집 신랑 데리 아마 맛집 가장 목동 꼼장어 맛집 직화 이집 애기 만화 채널 사장 요즘 만원 이하 점심 식사 맛집 직화 이집 목동 가격 점심 식사 거기 매장 목동 회식 단체 모임 화장실 실내 콩나물국 청양고추 매콤한 국물 자꾸 샐러드 밑반찬 여러가지 고기 계속 고기 가면 기본 인분 인분 주문 돼지 살구 꼼장어 인분 주문 잔치국수 주문 고기 꼼장어 금구 양념 구이 선택 주문 때문 매운 어른 목동 꼼장어 사장 직화 직접 고기 불맛 일반 목동 고기 추천 직화 이집 목동 재생 목동 고기 추천 직화 이집 목동 고기 꼼장어 테이블 내내 고기 식지 테이블 아래 숯불 살구 보기 직화 돼지 목살 전혀 고기 절대 종종 목동 고기 맛집 처음 꼼장어 신랑 얘기 쫄깃 생선 전혀 안나 연한 오징어 사실 이건 어른 애기 고기 려고 살구 살짝 매콤 꼼장어 서로 경쟁 꼼장어 첫째 꼼장어 자주 목동 꼼장어 맛집 직화 이집 목동 재생 목동 꼼장어 맛집 직화 이집 목동 잔치국수 둘째 고기 국수 파라 잔치국수 신랑 첫째 고기랑 꼼장어 둘째 잔치국수 흡입 식성 잔치국수 김치 맵진 서비스 오뎅 메뉴판 오뎅 추가 원래 기본 계란 중간 중간 점심 반찬 테이블 신경 느낌 마음 식사 원래 데리 식당 가면 자꾸 눈치 불안 목동 꼼장어 맛집 직화 이집 목동 배려 기분 한번 맛집 방문 직화 이집 목동 꼼장어 입맛 신랑 사랑 목동 꼼장어 맛집 무조건 방문 나오니 갑자기 데리 주차장 가나 걱정 사장 우산 반납 안해 방문 양도 목동 꼼장어 맛집 완전 강추 정보 주차 지원이 근처 유료 주차장 이용 영업일 토요일 오전 오전 오후 브레이크 타임 직화 이집 목동 서울특별시 양천구 은행 정로 블로그 체크 장소 존재 이미지,
174,등촌역 점심 맛집 낙지 보쌈 칼국수 맛집 오봉 등촌,강서 양천 맛집 가족 분위기 맛집 목동 비시 서울특별시 양천구 목동 중앙 북로 블로그 체크 장소 요즘 고물 시대 마트 가기 동네 시장 자주 호선 등촌역 비시 노포 맛집 발견 방문 오봉 주차 정보 영업 메뉴 방문 맛집 목동 비시 초입 상가 오봉 등촌 주차 상가 무료 지원이 이용 오봉 운영 휴무 일도 주말 브레이크 타임 영업 점심 주말 나들이 토요일 입장 손님 별로 금방 손님 맛집 매장 포차 느낌 연애 데이트 생각 등촌역 점심 맛집 이기 식사 메뉴 안주 메뉴 평일 점심 할인 주위 평일 점심 방문 등촌역 점심 맛집 고민 나중 포장 낙지 오봉 스페셜 바지락 칼국수 몽땅 주문 볶음 요리 맵기 취향 선택 기본 기준 신라면 기본 주문 매운 매운 지옥 도전 낙지 오봉 스페셜 바지락 칼국수 주문 양은 쟁반 밑반찬 준비 밑반찬 한번 접시 가지 반찬 셀프 미역국 숭늉 셀프 낙지 오봉 스페셜 낙지 볶음 브리 보쌈 막국수 구성 가격 메인 가지 보시 상이 정도 낙지 마리 정말 식감 최고 불향 진짜 직화 구이 정말 매운 신라면 진라면 매운 정도 매운 매운 지옥 추천 보쌈 일반 앞다리 뒷다리 브리 살로 정말 삼겹살 수육 앞다리 수육 브리 조화 진짜 막국수 고명 진짜 야채 식감 국수 조화 양념장 매콤한 정말 보쌈 김치 진짜 시원 김치 추가 불향 낙지 볶음 브리 수육 마지막 매콤한 막국수 진짜 조합 최고 구성 바지락 칼국수 진짜 무마 시합 메뉴 분위기 위해 원형 테이블 음식 테이블 자리 정도 진짜 바지락 가득 발도 바지락 칼국수 진가 국물 고요 진짜 아들 인분 요즘 겨울철 등촌 점심 칼국수 진짜 바지락 아보 그릇 바지락 수가 거기 다가 바지락 황태 해장 정말 최고 바지락 칼국수 진짜 메뉴 서로 고민 주문 강력 추천 편이 진짜 포장,
175,맛집 평양 냉면 전문점 면옥,지난 평양 냉면 포스팅 길목 관심 보이 방문 멀리 교대 시작 평양 냉면 시장 제대로 공략 서관 면옥 면옥 서관 면옥 벤치마킹 오해 강호동 육칠팔 브랜드 근처 우암 이식 운영 와우 외관 운치 연식 익스 테리어 기존 건물 살짝 터치 매장 정보 위치 서울특별시 강서구 영업 매일 브레이크 타임 주차 매장 주차 가능 근처 주차장 이용 가능 연락처 입구 비치 기계 메밀 자가 분해 제대로 증거 사진 대충 평냉집 보기 오픈 주방 모든 사진 주방 고기 직화 구이 기계 주방 투자 매장 인테리어 분위기 보통 자본 천장 오픈 공사 보이 레트로 바닥 노출 콘크리트 천장 직접 제작 테이블 생각 보이 전체 보임 테이블 의자 사이즈 먹기 돈좀 음악 펑키 데시벨 매장 테이블 식이 주문 장안 공기 분위기 굿굿 준비 갈수록 고기 기계 안보 남자 세분 기계 대한 얘기 관계자 직화 구이 기계 공부 사람 백김치 김치 셀프 평양 냉면 스텐면기 클래식 모습 국물 이름 서관 면옥 면도 능라도 평냉 국물 메밀 역시 비빔냉면 평냉 집들이 체적 비빔 면옥 비빔냉면 기분 함흥 냉면집 쨍한맛 와이프 녹두 지짐 한잔 녹두 지짐 평냉 육수 세상 메뉴 직화 돼지갈비 들기름 메밀 만두 곰탕 준수 보장 메뉴 준비 평냉 소식 평냉 항상 메뉴 거주지 근처 정말 면옥 서울특별시 강서구 블로그 체크 장소,소곤면옥 소곤이라는
176,발산역 맛집 정통 돼지 김치 구이 볶음밥 후기,발산 신상 맛집 발산역 데이트 방문 매장 브레이크 타임 도착 지라 사람 사람 요즘 활짝 야장 선선 레트로 인테리어 특징 정통 할머니 발산역 데이트 맛집 정통 발산 메뉴 돼지 김치 구이 특미 볶음밥 치즈 추가 점심 메뉴 팔고 이상만 혼밥 돼지 김치 구이 점심 볶음밥 공기밥 대신 미니 돼지 김치 구이 세트 비빔국수 국수 세트 점심 모로 이득 이서 점심 발산역 데이트 추천 운영 가게 기본 반찬 유부 동동 깻잎 옥수수 쌈무 마늘 마요네즈 쌈장 돼지 김치 구이 시너지 재료 리뷰 이벤트 음료 주류 영수증 리뷰 음료 주류 리뷰 이벤트 제로 콜라 콜라 펩시 보유 돼지 김치 구이 메인 요리 돼지 김치 구이 메인 메뉴 가지 선택 장애 매우 편안 돼지 김치 구이 법도 깻잎 돼지 김치 마요네즈 옥수수 쌈장 마늘 고추 주신 정통 먹기 재생 접기 정통 먹기 습관 고기만 김치 돼지고기 조합 김치 가게 김치 김치 돼지고기 매력 매니아 김치 삼겹살 전혀 느낌 기름 지지도 청양고추 양파 김치 돼지고기 매운 가정식 느낌 마늘 간이 마늘 오픈 재료 과정 매우 인상 유부 동동 어묵 돼지 김치 구이 입가심 볶음밥 볶음밥 주문 돼지 김치 구이 달라 살짝 볶음밥 옥수수 달라 주인 아주머니 볶음밥 고추장 베이스 살짝 달달 중독 매력 철판 볶음밥 바삭 보이 바삭 느낌 비빔밥 느낌 전주 비빔밥 볶음밥 고기 살짝 유레카 기분 헤비 정통 선택 정통 발산 서울특별시 강서구 마곡 중앙 블로그 체크 장소 위치 서울 강서구 마곡 중앙 곡동 마곡사 스파크 교통 호선 발산역 도보 호선 양천향교역 도보 대표 메뉴 돼지 김치 구이 영업 평일 브레이크 타임 토요일 일요일 전화번호 정통 발산 사진 동영상 팔로워 팔로잉 게시 정통 발산 사진 동영상 보기,
177,목동역 맛집 갈비 목동 숯불 돼지갈비 저녁 메뉴 추천,오늘 저녁 메뉴 숯불 돼지갈비 목동역 맛집 갈비 방문 체인점 목동 점도 고해 목동역 이동 목동역 출구 정도 금방 도착 주차장 뒷문 연결 주차장 아래 매장 평일 저녁 단체 손님 단위 회식 모임 소로 돼지갈비 수제 돼지갈비 인분 소주 인분 양은 요정 고기 두께 양념 먹음 숯불 기본 반찬 반찬 파채 야채 샐러드 김치 감자 샐러드 마늘 쌈장 채소 돼지갈비 양파 절임 간통 간장 양념 양파 간장 양념 돼지갈비 이제 고기 양념 고기 자주 금방 관심 계속 한당 접기 목동역 모임 장소 돼지갈비 갈비 추천 굽기 된장찌개 국물 매콤 고기 소주 한잔 국물 끝장 나용 타지 집게 남자친구 계속 두툼 부위 양파 절임 양파 미리 간장 간장 양념 머금 도록 양념 가끔 돼지고기 양념 양심 목동역 맛집 갈비 양념 자체 자극 양념 양념 짭쪼롬하 지도 최고 양념 자극 거나 돼지갈비 금방 느낌 계속 채소 입맛 대식 가도 돼지갈비 인분 공기밥 된장찌개 소주 깔꼼하 클리어 돼지갈비 목동역 맛집 직원 사장 기분 추천 추천 갈비 목동 주차장 갈비 가면 정문 안내 주차장 안보 직화 이집 목동 장어 주차장 보이 주차 뒷문 통해 갈비 목동 서울특별시 양천구 신정 중앙 블로그 체크 장소 영업 월금 토일 단체 이용 가능 포장 예약 가능 주차 가능 무료 화장실 매장 옆쪽 건물 화장실 이용 남녀 구분 유아 의자 테라스,
178,목동 꼼장어 먹기 직화 이집 목동 리뷰,목동 꼼장어 맛집 리뷰 위드 오늘 서울 양천구 은행 정로 위치 직화 이집 리뷰 직화 이집 목동 외관 목동 꼼장어 직화 이집 식당 대정 주차 공간 토욜 저녁 방문 한자리 주차 성공 자차 이용 방문 미리 전화 확인 자리 공영 주차장 이용 직화 이집 목동 내부 식당 내부 널널 통창 활짝 고기 냄새 식사 통풍 고깃집 아시 목동 꼼장어 맛집 식당 푸릇푸릇 식물 배치 공기 일석이조 반찬 접시 채소 샐러드 계속 리필 직화 이집 목동 메뉴판 노래 오늘 뿌셔볼 메뉴 메뉴판 심플 맛집 아시 위드 주문 꼼장어 구이 소금 양념 돼지 살구 주먹밥 공기밥 채소 가득 소스 메뉴 주문 콩나물 먼저 콩나물 살짝 매콤 해장 분할 그릇 시기 때문 두둥 꼼장어 구이 꼼장어 구이 아주 먹기 장점 자칫하면 음식 꼼장어 구이 아주 양념 소금 간이 쫄깃 탱탱 꼼장어 구이 스트레스 깜짝 서비스 오뎅 계란 센스 만점 직화 이집 먹음 깻잎 주먹밥 꼼장어 보고 가루 비주 주먹밥 요런 쫀득쫀득 주먹밥 동글동글 아시 비닐 장갑 제공 대식 가가 차지 돼지 살구 추가 간간 부담 직화 구이 간이 직화 이집 목동 재생 직화 이집 목동 모음 직화 이집 목동 목동 꼼장어 직화 이집 목동 목동 잇님들 추천 직화 이집 목동 서울특별시 양천구 은행 정로 블로그 체크 장소 매일 일요일 정기 휴무 존재 이미지,
