,title_pos,content_pos,hash_tag
41,오목교역 목동 맛집 목교 곱창 목동 본점 수제 마늘 곱창 후기,목교 곱창 목동 본점 서울 양천구 목동동로 목교 곱창 오목교역 출구 주차 불가 근처 공영 주차장 이용 콜키 가능 무료 단체 이용 가능 며칠 곱창 전통 마늘 곱창 목교 맛집 목교 곱창 본점 목동 곱창 맛집 목교 곱창 작년 생방송투데이 방영 목교 마늘 곱창 맛집 목교 하이 이벤트 인분 포장 주문 할인 이벤트 리뷰 이벤트 이벤트 참여 보라 전통 수제 마늘 곱창 인분 곱창 인분 국수 둘이서 전통 마늘 곱창 때문 처음 전통 수제 마을 곱창 인분 주문 추가 곱창 인분 국수 주문 세트 메뉴 선택 장애 세트 메뉴 주문 오케이 기본 반찬 순두부찌개 파김치 부추 양파 장아찌 천엽 순두부찌개 자극 곱창 파김치 곱창 파김치 진짜 천엽 소금 냠냠냠 오목교역 목동 맛집 목교 곱창 목동 본점 수제 마늘 곱창 후기 재생 접기 오목교역 목동 맛집 목교 곱창 목동 본점 수제 마늘 곱창 후기 전통 수제 마늘 곱창 마늘 전통 수제 마늘 곱창 하루 인분 한정 판매 가면 오픈 곱창 마늘 진짜 마늘 단백 친구 정말 염통 살짝 파랑 부추 마늘 곱창 파김치 부추 숙주 오목교역 목동 맛집 목교 곱창 목동 본점 수제 마늘 곱창 후기 재생 접기 오목교역 목동 맛집 목교 곱창 목동 본점 수제 마늘 곱창 후기 곱창 전통 수제 마늘 곱창 인분 인분 추가 곱창 추가 곱창 마늘 곱창 황소 곱창 막창 대창 염통 벌집 구성 곱창 추천 국수 마지막 후식 볶음밥 볶음밥 인분 기분 국수 주문 고깃집 국수 쫄깃 쫄깃 국물 마지막 국수 클리어 금요일 사장 어머니 파김치 김치 두툼해 곱창 먹기 이유 어머니 손맛 마늘 서산 마늘 수제 직접 일정 마늘 곱창 나니 마늘 냄새 신경 곱창 냄새 신경 화장실 가글 마련 피죤 고깃집 피죤 구비 가글 진짜 처음 센스 사장 마무리 기분 목교 목동 회식 소로 오목교역 곱창 목교 곱창 본점 마늘 곱창 목교 곱창 목동 본점 서울특별시 양천구 목동동로 목교 곱창 예약 블로그 체크 장소 목교 곱창 서울곱창 목동 곱창 목동회식 오목교역맛집 오목교회식 목동맛집 오목교맛집 목동현대백화점맛집,오목교곱창 서울곱창 목동곱창 목동회식 오목교역맛집 오목교회식 목동맛집 오목교맛집 목동현대백화점맛집
42,서울곱창 맛집 곱창전골 목교 곱창 목동 본점 오목교맛집 주차 정보,서울곱창 맛집 곱창전골 오목교맛집 목교 곱창 목동 본점 포스팅 시작 위치 서울 양천구 목동동로 전화번호 단체 이용 가능 무선 인터넷 남녀 화장실 구분 예약 포장 가능 주차 불가 인근 공영 주차장 이용 서울곱창 맛집 목교 곱창 매장 테이블 오목교회식 장소 데이트 장소 이제 메뉴판 소개 마늘 곱창 마늘 곱창 생방송투데이 방영 오목교맛집 랍니 이외 곱창 대창 마늘 갈비살 국수 쇠고기 된장 솔밥 판매 밑반찬 부추 양파 장아찌 천엽 표고 와사비 샐러드 파김치 가장 반찬 파김치 매장 직접 숙성 전통 파김치 전혀 거나 김치 콩나물 부국 기본 순두부 콩나물 김치 조합 국물 술안주 곱창전골 주문 때문 야채 비주 매콤 국물 건더기 가득 먹음 곱창 대창 때문 국물 매우 들깨 가루 듬뿍 국물 몇번 간이 편이 국물 서울곱창 맛집 곱창 야채 가득 국물 매콤한 곱창전골 제공 간장 곱창 곱창전골 상태 우동 사리 우동 기본 제공 추가 주문 전골 국물 우동 사리 조합 안해 아시 우동 면발 국물 쏙쏙 오늘 서울곱창 맛집 대해 소개 직원 파김치 곱창전골 정말 곱창 구이 방문 오목교맛집 목교 곱창 목동 본점 포스팅 목교 곱창 목동 본점 서울특별시 양천구 목동동로 목교 곱창 예약 블로그 체크 장소,
43,목동 곱창 맛집 목교 곱창 목동 본점,곱창 데이트 인스타 마늘 곱창 목동 곱창 맛집 목교 곱창 목동 본점 목교 곱창 목동 본점 서울 양천구 목동동로 목교 곱창 평일 금요일 라스트 주말 라스트 양천구 목동 공영 주차장 이용 레트로 정석 외부 인테리어 아주 웨이 자리 빨초파 색깔 알록달록 목교 데이트 내부 네온사인 내부 자리 테이블 수가 목교 회식 단체 모임 나위 생방송투데이 방영 목동 곱창 맛집 가게 곳곳 메뉴인 마늘 곱창 파김치 대한 자부심 전통 곱창 장인 레시피 당일 도착 최상급 곱창 프로 정수 손질 제공 파김치 직접 하니 네이버 영수증 리뷰 이벤트 하이 이벤트 진행중 참여 메뉴 마늘 곱창 곱창 볶음밥 한라 토닉 세트 곱창 법도 참고 곱창 자주 타지 밑반찬 정성 김치 콩나물 찌개 국물 라면 사리 샐러드 장아찌 수제 반찬 한라 토닉 한라산 소주 토닉 워터 레몬 라이스 얼음 한라산 토닉 워터 정도 비율 상큼 알딸딸 하니 곱창 기름기 궁합 곱창 사장 불쇼 비주 최고 직접 파김치 음식 사장 판도 체크 염통 살짝 꿀꿀 마늘 통째 마늘 곱창 메뉴인 일반 곱창 기지 쫄깃 모듬 대창 막창 마늘 곱창 기본 곱창 정말 곱창 무조건 볶음밥 사랑 날치 목동 곱창 맛집 목교 곱창 볶음밥 맛집 역시 날치 신의 부추 콩나물 볶음밥 목동 곱창 맛집 좀더 메뉴 목교 곱창 목동 본점 분위기 친절 목교 곱창 목동 본점 서울특별시 양천구 목동동로 목교 곱창 예약 블로그 체크 장소,
44,목동회식 소로 목교 곱창 목동 본점,오늘 최근 방문 목교 곱창 목동 본점 후기 공유 한우 곱창 마늘 곱창 경험 소개 목교 곱창 전통 곱창 장인 레시피 원조 국내 곱창 전문점 곱창 본질 곱창 매일 당일 도축 최상 국내 육우 한우 기름 초벌 목교 곱창 목동 본점 서울 양천구 목동동로 목교 곱창 운영 월목 토일 라스트 매일 정기 휴무 목교 곱창 목동 본점 서울 오목교역 도보 레트로 느낌 인테리어 식당 내부 느낌 테이블 간격 간격 식사 마음 자리 목동회식 장소 오목교회식 장소 방문 방문 창가 자리 자리 옆쪽 여러 벽면 연예인 싸인 생방송투데이 방영 맛집 영수증 네이버 리뷰 구글 리뷰 카카오 채널 추가 이벤트 진행중 참여 혜택 추천 네이버 예약 방문 우삼겹 서비스 증정 이벤트 진행중 먼저 기본 밑반찬 세팅해 순두부 찌개 양념장 양파 절임 파김치 천엽 부추 곱창 먹기 반찬 구성 마늘 곱창 인분 황소 곱창 인분 주문 마늘 곱창 비법 메뉴 하루 인분 한정 판매 목교 곱창 목동 본점 와인 준비 와인 가격 순간 금주 패스 목교 곱창 목동 본점 와인 콜키 프리 혜택 목교 곱창 재생 목교 곱창 곱창 불쇼 눈앞 불쇼 곱창 진짜 감동 비주 목교 곱창 곱창 초벌 기다림 먼저 염통 염통 먹기 시작 역시 염통 염통 구우 질겨 지기 때문 핏기 목교 곱창 마늘 곱창 홍성 농장 운영 곱창 사장 부모님 직접 농사 친환경 농약 마늘 이용 곱창 마늘 정성 메뉴 한정 수량 판매 마늘 곱창 마늘 느낌 곱창 곱창 사랑 목교 곱창 파김치 진짜 곱창 완젼 파김치 사장 부모님 농사 대파 어머니 레시피 그대로 매장 직접 숙성 비법 정도 파김치 마지막 볶음밥 볶음밥 곱창 판이 준비 볶음밥 자리 계란 볶음밥 계란 목교 곱창 마늘 곱창 곱창 매력 곱창 방문 목교 곱창 목동 본점 서울특별시 양천구 목동동로 목교 곱창 예약 블로그 체크 장소 목교 곱창 오목교역 곱창 오목교맛집 오목교역맛집 오목교회식 장소 목동회식 장소 목동 곱창 양천구 곱창 강서구 곱창 목동맛집 목동역맛집 양천구 맛집 강서구 맛집,목동회식장소 오목교회식장소 오목교곱창 오목교역곱창 오목교맛집 오목교역맛집 오목교회식장소 목동회식장소 목동곱창 양천구곱창 강서구곱창 목동맛집 목동역맛집 양천구맛집 강서구맛집
45,맛집 레트로 분위기 목동 맛집 목교 곱창 목동 본점,독일 여행 한국 효언니 접선 위해 목교 출동 기력 내장 목동 맛집 슝슝 예전 대문 연상 레트로 분위기 골목 위치 의자 얼른 쟈쟈쟈 매장 내부 시원 뿜뿜 원산지 표시 목교 곱창 전통 장인 레시피 원조 국내 곱창 전문점 당일 도축 최상 국내 육우 한우 공수 손질 신선도 곱창 소주 맥주 주문 듬안에특 마늘 곱창 황소 곱창 대창 막창 염통 벌집 이외 메뉴 가성 세트 이색 와인 목동 데이트 맛집 손색 영수증 리뷰 네이버 쿠폰 빵빵 벽면 가득 채운 유명 사인 박성광 오나미 남희석 개그맨 먹방 유튜버 생방송 투데이 방송 진짜 목동 맛집 맛집 레트로 분위기 목동 맛집 목교 곱창 목동 본점 재생 맛집 레트로 분위기 목동 맛집 목교 곱창 목동 본점 세팅되 기본 순두부찌개 비롯 맛집 레트로 분위기 목동 맛집 목교 곱창 목동 본점 재생 맛집 레트로 분위기 목동 맛집 목교 곱창 목동 본점 부추 전복 샐러드 파김치 천엽 파김치 금요일 프리미엄 대파 김치 정성 가득 야들야들 순두부 한잔 나니 맛집 레트로 분위기 목동 맛집 목교 곱창 목동 본점 재생 맛집 레트로 분위기 목동 맛집 목교 곱창 목동 본점 감자 부추 양파 숙주 싸인 곱창 등장 주심 불타 본격 핏기 가신 염통 몰캉 흡입 정말 기대 마늘 곱창 앞뒤 양념장 곱창 마늘 질리 계속 흡입 안주 쭉쭉 전복장 조합 맛있쟈 파김치 부추 무아 지경 대창 벌집 막창 아주 국수 주문 쫄깃 면발 보기 해도 살얼음 동치미 육수 쫄면 면발 더욱 후루루 흡입 마지막 볶음밥 수가 콩나물 부추 계란 가루 보기 먹기 하모하모 이모 손길 볶음밥 돌진 그냥 대창 목동 맛집 목교 곱창 목동 본점 곱창 코스 곱창 소주 미리 생일 선물 데헷 목교 곱창 목동 본점 서울특별시 양천구 목동동로 목교 곱창 예약 블로그 체크 장소 서울 양천구 목동동로 목교 곱창 라스트 라스트 라스트 매장 남여 분리 단체 무선 인터넷 예약 포장 배달 제로 페이 지니 양천구 맛집 양천구 회식 강서구 회식 오목교역 곱창 목동역 곱창 목동데이트맛집 목동맛집 목동 곱창 오목교맛집 목교 막창 목교 곱창 오목교역맛집 목동 곱창 추천 서울곱창 블로그 블로그 지도 맛집 서울맛집 이색 맛집 곱창 일상생활 일상 공감 일상 일상 이야기 일상 블로그 저녁 추천 비올 음식 강서 이색 맛집 목교 골목 목동 골목 와인 와인 곱창 생방송투데이 맛집 생방송투데이 오늘 방송 맛집 유명 연예인 맛집 목동 연예인 맛집 맛집 방송 맛집 유투 맛집 곱창 맛집 개그맨 맛집 목동 개그맨 곱창 곱창 맛집 양천구 곱창 양천구 곱창,지니S2 양천구맛집 양천구회식 강서구회식 오목교역곱창 목동역곱창 목동데이트맛집 목동맛집 목동곱창 오목교맛집 오목교막창 오목교곱창 오목교역맛집 목동곱창추천 서울곱창 맛블로그 먹블로그 맛지도 먹지도 맛집 서울맛집 이색맛집 모듬곱창 일상생활 일상공감 일상 일상이야기 일상블로그 저녁추천 비오는날 비올때먹는음식 강서이색맛집 오목교먹자골목 목동먹자골목 와인파는곳 와인곱창 생방송투데이맛집 생방송투데이오늘방송맛집 유명연예인맛집 목동연예인맛집 tv나온맛집 방송나온맛집 유투버맛집 히밥곱창 히밥맛집 개그맨맛집 목동개그맨다녀간곳 소곱창 소곱창맛집 양천구소곱창 양천구곱창
46,파김치 마늘 곱창 진짜 최고 목동 맛집 최근 국내 곱창 손가락 맛집 목교 곱창 목동 본점,목교 곱창 목동 본점 서울특별시 양천구 목동동로 목교 곱창 예약 블로그 체크 장소 곱창 곱창 러버 한량 랍니 아아 아아 오늘 곱창 포스팅 목교 항상 기회 가게 골프 대감 안고 서울곱창 맛집 목동 곱창 맛집 목동 곱창 목교 고기 목동고 오목교회식 목동회식 목동현대백화점맛집 목교 곱창 목동 곱창 오목교역 회식 오목교회식 맛집 목동회식 맛집 목교 곱창 목동 본점 목교 곱창 목동 본점 서울특별시 양천구 목동동로 목교 곱창 예약 블로그 체크 장소 위치 오목교역 출구 진도 아파트 보고 안쪽 골목 오심 오목교역 고깃집 골목 안쪽 목교 곱창 목동 본점 목교 곱창 목동 본점 서울 양천구 목동동로 목교 곱창 월목 라스트 라스트 라스트 라스트 단체 이용 가능 무선 인터넷 남녀 화장실 구분 예약 포장 배달 외부 두꺼비 그림 빨강 파랑 예전 안쪽 진짜 외관 누가 곱창 내부 생방송투데이 방영 마늘 곱창 맛집 전통 그대로 원조 파김치 마늘 곱창 전문점 국내 곱창 전문점 데이트 회식 장소 내부 정말 회식 장소 회사 곱창 회식 정말 회식 소로 추천 원조 파김치 마늘 곱창 전문점 제일 대표 메뉴인 마늘 곱창 진짜 곳곳 메뉴판 한번 사실 찍기 메뉴 집중 나머지 추천 메뉴 보기 대표 메뉴 셋트메뉴 사실 방문 직원 제일 와중 직원 정말 사실 체험 설명 체험 세번 덕분 호기롭 정말 보아 이벤트 이벤트 참여 기본 곱창 기본 클라스 완전 도리 천국 소주 뚝딱 곱창 위해 지유 김치 콩나물국 순두부 소주 한잔 정말 부추 파김치 살짝 달달 구리 정말 쵝오 사진 표고버섯 와사비 염통 진짜 별미 샐러드 기본 찌개 건더기 국물 정말 오시 마늘 곱창 곱창 파김치 마늘 곱창 진짜 최고 목동 맛집 최근 재생 파김치 마늘 곱창 진짜 최고 목동 맛집 최근 메뉴 보통 가면 모듬 인원 대표 메뉴 마늘 곱창 마늘 곱창 개시 고민 직원 인분 냉큼 모듬 마늘 곱창 메인 메뉴 등장 불쇼 뭔가 불향 금은 곱창 더욱 기대 한번 살짝 면서 음식 설명 곱창 마늘 설명 음식점 진짜 감동 음식 그냥 아시 음식 대한 파김치 꿀맛 진짜 꿀맛 캬캬캬 쟈글쟈글 얼른 사이드 양파 버섯 부추 감자 진짜 존맛 핏기 염통 구이 살짝 곧바로 슬라이드 감자 질겨 지기 때문 살짝 기름 양념장 제일 오른쪽 마늘 곱창 마늘 아주 진짜 마늘 단맛 최애 파김치 곱창 대파 달달 고춧가루 양념 진짜 찰떡 포스팅 하트 남발 이해 파김치 남편 부추 모듬 막창 대창 곱창 진짜 완전 강추 국수 위장 기름 잔뜩 도중 국수 노랑 진짜 쫄깃 곱창 기름 칠이 다시 곱창 폭풍 흡입 매직 경험 목교 볶음밥 곱창 볶음밥 불판위 곱창 볶음밥 재료 가끔 곱창 곱창 경험 볶음밥 주시 파김치 마늘 곱창 진짜 최고 목동 맛집 최근 재생 파김치 마늘 곱창 진짜 최고 목동 맛집 최근 슥샥슥샥 눈앞 직원 콩나물 부추 가루 계란 샥샥샥 벌써 스메에에에 설명 개인 자극 볶음밥 계란 야채 쵝오 원래 기본 곱창 소스 살짝 한번 치즈 진짜 기본 기본 양념 소스 양념 그냥 기본 이건 본인 취향 정말 곱창 러버 한량 추천 방문 예정 목동 근방 목동역 오목교역 목동 곱창 진짜 최고 마늘 곱창 파김치 조합 츄릅,서울곱창맛집 목동곱창맛집 목동곱창집 오목교고기집 목동고기집 오목교회식 목동회식 목동현대백화점맛집 오목교곱창 목동곱창 오목교역회식 오목교회식맛집 목동회식맛집 오목교곱창목동본점
47,오목교맛집 목교 곱창 목동 본점,목교 곱창 목동 본점 서울특별시 양천구 목동동로 목교 곱창 예약 블로그 체크 장소 주소 서울특별시 양천구 목동동로 목교 곱창 영업 오목교역 위치 목교 곱창 목동 본점 골목 주말 앞뒤 사람 사람 분위기 매장 가로 미닫이문 바람 솔솔 지인 곱창 대화 나누기 저녁 피크 피해 사람 대기 명단 자리 창가 거기 목교 곱창 목동 본점 메뉴판 곱창 인분 주문 볶음밥 인분 때문 곱창전골 주문 세트 메뉴 준비 밑반찬 양파 절임 부추 옥수수 샐러드 파김치 버섯 와사비 천엽 순두부 김치찌개 옵션 매콤하니 곱창 천엽 소스 참기름 소스 매콤 소스 참기름 소스 천엽 곱창 매콤 소스 파김치 그냥 순두부 김치찌개 아래 곱창 곱창 부추 감자 숙주 양파 버섯 여러가지 채소 순서도 순서대로 겉바 다먹었죵 볶음밥 인분 주문 불판 볶음밥 좀더 매콤 바램 목교 곱창 목동 본점 오목교맛집 목동맛집,오목교곱창목동본점 오목교맛집 목동맛집
48,목교 맛집 목교 곱창 목동 본점 곱창 맛집 한정 마늘 곱창 후기,오늘 금요일 금요일 짝꿍 한잔 회포 매일 데이트 금요일 저녁 목교 곱창 곱창 맛집 위치 목교 곱창 목동 본점 서울특별시 양천구 목동동로 목교 곱창 예약 블로그 체크 장소 상세 정보 주소 서울 양천구 목동동로 영업 평일 주말 전화 단체 이용 가능 무선 인터넷 남녀 화장실 구분 예약 포장 배달 외관 목교 곱창 전통 곱창 장인 레시피 그대로 원조 파김치 마늘 곱창 전문 곱창 맛집 오목교맛집 오목교술집 목동술집 목교 곱창 마늘 곱창 매일 당일 도축 최상 국내 육우 한우 공수 초벌 제공 내부 분위기 금요일 방문 정도 테이블 웨이팅 맛집 느꼇습니 목교 곱창 목동 본점 재생 접기 목교 곱창 목동 본점 화장실 센스 가글 비치 메뉴 가격 메뉴 전통 수제 마늘 곱창 인분 한정 황소 곱창 곱창 창구 막창구이 마늘 갈비살 우삼겹 전골 메뉴 사진 참고 메뉴 마늘 곱창 전통 수제 마늘 곱창 인분 곱창 인분 소주 맥주 솔직 후기 비타민 센스 비타민 술자리 시작 기본 밑반찬 간과 천엽 밑반찬 아시 간이 천엽 정말 곱창 맛집 확률 순두부찌개 먹기 곱창 달달 술술 곱창 곱창 진짜 근래 곱창 요건 마늘 곱창 정말 마늘 마늘 막창 가게 자체 포차 분위기 곱창 오목교맛집 오목교술집 목동술집 목교 곱창 마늘 곱창 서서 이해 그냥 목교 목동 곱창 맛집 오목교맛집 오목교술집 목동술집 목교 곱창 마늘 곱창 지금 목교 곱창 목동 본점 리뷰 안녕 오목교맛집 오목교술집 목동술집 목교 곱창 마늘 곱창 오목교맛집 오목교술집 목동술집 목교 곱창 마늘 곱창,
49,목동 곱창 목동 본점 목교 곱창,지난 대창 막창 곱창 수혈 동네 곱창 목교 곱창 목동 본점 목동 곱창 목교 곱창 외부 내부 목교 곱창 네온사인 간판 서울 양천구 목동동로 목교 곱창 호선 오목교역 출구 영업 월목 라스트 목동 곱창 목교 곱창 메뉴판 메뉴판 테이블 막창구이 장류 제일 부위 막창 모듬 베스트 메뉴인 마늘 곱창 인분 주문 세트 간다 곱창전골 베스트 메뉴 눈길 목동 곱창 목교 곱창 내부 목동회식 장소 손색 목교 곱창 파김치 마늘 곱창 내부 테이블 파김치 특징 먼저 순두부찌개 세팅 마늘 곱창 생방송투데이 방영 더욱 막걸리 와이파이 이용 가능 목동 곱창 목교 곱창 마늘 곱창 곱창 곱창 때문 직원 감자 콩나물 부추 염통 바싹 염통 먼저 염통 밑반찬 부추 겉절이 쫄깃 쫄깃 상태 염통 금세 마늘 곱창 전통 그대로 원조 파김치 목교 곱창 곱창 순두부찌개 대기 냄비 받침 곱창 한번 불쇼 목동 곱창 목교 곱창 재생 접기 마늘 곱창 불쇼 시선 불쇼 감자 조각 감자 바싹 음식 편이 생각 마늘 곱창 그냥 마늘 매우 당황 테이블 가위 집게 사용 곱창 한번 목교 이벤트 동시 여러 이벤트 곱창 참고 맥주 맥주 곱창 더욱 최고 처음 마늘 곱창 신세계 포스팅 도움 공감 목교 곱창 목동 본점 서울특별시 양천구 목동동로 목교 곱창 예약 블로그 체크 장소,
50,목동 맛집 전국 마늘 곱창 목교 곱창 목동 본점 진짜 회식 장소 추천,오늘 잇님들 소주 곱창 가가 추천 목동 맛집 목교 곱창 목동 본점 전국 마늘 곱창 회식 장소 추천 드림 이건 진짜 비밀 목교 성지 곱창 최고 맛집 서울곱창 전국 마늘 곱창 오목교역맛집 목동 타워 맛집 목동현대백화점맛집 목동회식 오목교회식 오목교맛집 목동맛집 목교 곱창 목동 본점 서울특별시 양천구 목동동로 목교 곱창 예약 블로그 체크 장소 목교 곱창 목동 본점 곱창 막창 네이버 지도 확인 제로 페이 가능 영업 라스트 라스트 라스트 라스트 라스트 라스트 라스트 접기 가장 오목교역 출구 도보 이내 생방송투데이 방영 마늘 곱창 맛집 전통 그대로 원조 파김치 마늘 곱창 전문점 원조 국내 곱창 전문점 데이트 회식 장소 적합 주차 주차 장소 자가 이용 골목 협소하 주차 지원이 양해 부탁 근처 목동 주차장 이마트 목동 주차장 이용 도보 이내 목교 곱창 목동 본점 네이버 방문자 리뷰 블로그 리뷰 진짜 곱창 진심 이건 진짜 추천 외관 느낌 다가 디자인 만빵 곱창 황소 곱창 통통 잡채 이비 쥬얼 마늘 곱창 목교 맛집 거리 진짜 많음여깅 전통 수제 마늘 곱창 하루 인분 한정 판매 오늘 주심 웨이 팅석 드가자 메뉴 요즘 물가 곱창 생각 합리 진짜 메뉴 오메 이징 셋트 메뉴 추천 추천 저번 셋트 헤비 장인 기본 셋팅 천엽 워메 구마 곱창 마늘 효능 좀더 불쇼 재생 접기 불쇼 불쇼 이거졔 너무맛잇곘다 그죠잉 소주 순삭 재생 접기 곱곱곱 다시 할인 이벤트 네이버 리뷰 이벤트 야채 보기 만해 신선 이집 보석 소나 동물 위벽 요리 내장 마늘 종종 잠재 건강 상의 이점 건강 가지 이유 영양 삼겹살 단백질 공급원 전반 건강 에너지 생산 비타민 아연 철분 비롯 필수 비타민 미네랄 함유 소화 건강 삼겹살 소화 도움 콜라겐 젤라틴 함유 내막 촉진 건강 지원 지방 함량 고기 부위 삼겹살 일반 지방 함량 단백질 공급원 마늘 효능 마늘 항균 효과 잠재 심장 건강 상의 이점 면역체계 지원 능력 건강 특성 삼겹살 사용 요리 전반 건강 상의 이점 향상 요리 다양성 삼겹살 방법 준비 야채 허브 향신료 재료 혼합 영양 프로필 더욱 향상 균형 식단 일부 마늘 곱창 건강 선택 서울곱창 전국 마늘 곱창 오목교역맛집 목동 타워 맛집 목동현대백화점맛집 목동회식 오목교회식 오목교맛집 목동맛집,서울곱창 전국3대마늘곱창 오목교역맛집 목동41타워맛집 목동현대백화점맛집 목동회식 오목교회식 오목교맛집 목동맛집
